_id,title,release,duration,gerne,IMDB_Rating,rating,overview,metaScore,director,stars,noOfVotes,createdAt,updatedAt
625c2dfdf0a5bc6c426c0d48,The Dirty Dozen,1967,150 min,"Action, Adventure, War",7.7,3.629014784293446,"During World War II, a rebellious U.S. Army Major is assigned a dozen convicted murderers to train and lead them into a mass assassination mission of German officers.",73.0,Robert Aldrich,"['Lee Marvin', 'Ernest Borgnine', 'Charles Bronson', 'John Cassavetes']",67183,2022-04-17 15:10:53.733,2022-04-17 15:10:53.733
625c2b59f0a5bc6c426c06b8,Star Wars: Episode V - The Empire Strikes Back,1980,124 min,"Action, Adventure, Fantasy",8.7,4.803374457188991,"After the Rebels are brutally overpowered by the Empire on the ice planet Hoth, Luke Skywalker begins Jedi training with Yoda, while his friends are pursued by Darth Vader and a bounty hunter named Boba Fett all over the galaxy.",82.0,Irvin Kershner,"['Mark Hamill', 'Harrison Ford', 'Carrie Fisher', 'Billy Dee Williams']",1159315,2022-04-17 14:59:37.063,2022-04-17 14:59:37.063
625c2bacf0a5bc6c426c0716,The Dark Knight Rises,2012,164 min,"Action, Adventure",8.4,4.7587097916708245,"Eight years after the Joker's reign of anarchy, Batman, with the help of the enigmatic Catwoman, is forced from his exile to save Gotham City from the brutal guerrilla terrorist Bane.",78.0,Christopher Nolan,"['Christian Bale', 'Tom Hardy', 'Anne Hathaway', 'Gary Oldman']",1516346,2022-04-17 15:01:00.313,2022-04-17 15:01:00.313
625c2d22f0a5bc6c426c0a84,Iron Man,2008,126 min,"Action, Adventure, Sci-Fi",7.9,0.33870228928470136,"After being held captive in an Afghan cave, billionaire engineer Tony Stark creates a unique weaponized suit of armor to fight evil.",79.0,Jon Favreau,"['Robert Downey Jr.', 'Gwyneth Paltrow', 'Terrence Howard', 'Jeff Bridges']",939644,2022-04-17 15:07:14.806,2022-04-17 15:07:14.806
625c2df5f0a5bc6c426c0d28,First Blood,1982,93 min,"Action, Adventure",7.7,1.6491267768528672,A veteran Green Beret is forced by a cruel Sheriff and his deputies to flee into the mountains and wage an escalating one-man war against his pursuers.,61.0,Ted Kotcheff,"['Sylvester Stallone', 'Brian Dennehy', 'Richard Crenna', 'Bill McKinney']",226541,2022-04-17 15:10:45.326,2022-04-17 15:10:45.326
625c2d25f0a5bc6c426c0a8e,Ying xiong,2002,120 min,"Action, Adventure, History",7.9,2.789708362327082,"A defense officer, Nameless, was summoned by the King of Qin regarding his success of terminating three warriors.",85.0,Yimou Zhang,"['Jet Li', 'Tony Chiu-Wai Leung', 'Maggie Cheung', 'Ziyi Zhang']",173999,2022-04-17 15:07:17.487,2022-04-17 15:07:17.487
625c2db2f0a5bc6c426c0c22,Red River,1948,133 min,"Action, Adventure, Drama",7.8,0.0056356934111223556,"Dunson leads a cattle drive, the culmination of over 14 years of work, to its destination in Missouri. But his tyrannical behavior along the way causes a mutiny, led by his adopted son.",,Howard Hawks,"['Arthur Rosson', 'John Wayne', 'Montgomery Clift', 'Joanne Dru']",28167,2022-04-17 15:09:38.194,2022-04-17 15:09:38.194
625c2dc8f0a5bc6c426c0c5a,Captain America: The Winter Soldier,2014,136 min,"Action, Adventure, Sci-Fi",7.7,2.0318290997880184,"As Steve Rogers struggles to embrace his role in the modern world, he teams up with a fellow Avenger and S.H.I.E.L.D agent, Black Widow, to battle a new threat from history: an assassin known as the Winter Soldier.",70.0,Anthony Russo,"['Joe Russo', 'Chris Evans', 'Samuel L. Jackson', 'Scarlett Johansson']",736182,2022-04-17 15:10:00.342,2022-04-17 15:10:00.342
625c2dc1f0a5bc6c426c0c4c,Kingsman: The Secret Service,2014,129 min,"Action, Adventure, Comedy",7.7,2.5981185253792383,"A spy organisation recruits a promising street kid into the agency's training program, while a global threat emerges from a twisted tech genius.",60.0,Matthew Vaughn,"['Colin Firth', 'Taron Egerton', 'Samuel L. Jackson', 'Michael Caine']",590440,2022-04-17 15:09:53.456,2022-04-17 15:09:53.456
625c2de4f0a5bc6c426c0ce6,The Fifth Element,1997,126 min,"Action, Adventure, Sci-Fi",7.7,2.433415548516822,"In the colorful future, a cab driver unwittingly becomes the central figure in the search for a legendary cosmic weapon to keep Evil and Mr. Zorg at bay.",52.0,Luc Besson,"['Bruce Willis', 'Milla Jovovich', 'Gary Oldman', 'Ian Holm']",434125,2022-04-17 15:10:28.716,2022-04-17 15:10:28.716
625c2cc6f0a5bc6c426c0978,Casino Royale,2006,144 min,"Action, Adventure, Thriller",8.0,3.7507263564760818,"After earning 00 status and a licence to kill, Secret Agent James Bond sets out on his first mission as 007. Bond must defeat a private banker funding terrorists in a high-stakes game of poker at Casino Royale, Montenegro.",80.0,Martin Campbell,"['Daniel Craig', 'Eva Green', 'Judi Dench', 'Jeffrey Wright']",582239,2022-04-17 15:05:42.357,2022-04-17 15:05:42.357
625c2d4af0a5bc6c426c0b00,The Adventures of Robin Hood,1938,102 min,"Action, Adventure, Romance",7.9,3.9900284626982465,"When Prince John and the Norman Lords begin oppressing the Saxon masses in King Richard's absence, a Saxon lord fights back as the outlaw leader of a rebel guerrilla army.",97.0,Michael Curtiz,"['William Keighley', 'Errol Flynn', 'Olivia de Havilland', 'Basil Rathbone']",47175,2022-04-17 15:07:54.336,2022-04-17 15:07:54.336
625c2df5f0a5bc6c426c0d26,Star Trek II: The Wrath of Khan,1982,113 min,"Action, Adventure, Sci-Fi",7.7,0.5026481135816119,"With the assistance of the Enterprise crew, Admiral Kirk must stop an old nemesis, Khan Noonien Singh, from using the life-generating Genesis Device as the ultimate weapon.",67.0,Nicholas Meyer,"['William Shatner', 'Leonard Nimoy', 'DeForest Kelley', 'James Doohan']",112704,2022-04-17 15:10:45.133,2022-04-17 15:10:45.133
625c2e18f0a5bc6c426c0dbc,Sherlock Holmes,2009,128 min,"Action, Adventure, Mystery",7.6,4.921940408362352,Detective Sherlock Holmes and his stalwart partner Watson engage in a battle of wits and brawn with a nemesis whose plot is a threat to all of England.,57.0,Guy Ritchie,"['Robert Downey Jr.', 'Jude Law', 'Rachel McAdams', 'Mark Strong']",583158,2022-04-17 15:11:20.269,2022-04-17 15:11:20.269
625c2d3af0a5bc6c426c0ad6,The Wild Bunch,1969,145 min,"Action, Adventure, Western",7.9,0.6223914913764106,"An aging group of outlaws look for one last big score as the ""traditional"" American West is disappearing around them.",97.0,Sam Peckinpah,"['William Holden', 'Ernest Borgnine', 'Robert Ryan', ""Edmond O'Brien""]",77401,2022-04-17 15:07:38.516,2022-04-17 15:07:38.516
625c2c53f0a5bc6c426c08a4,Jurassic Park,1993,127 min,"Action, Adventure, Sci-Fi",8.1,2.97622520078653,A pragmatic paleontologist visiting an almost complete theme park is tasked with protecting a couple of kids after a power failure causes the park's cloned dinosaurs to run loose.,68.0,Steven Spielberg,"['Sam Neill', 'Laura Dern', 'Jeff Goldblum', 'Richard Attenborough']",867615,2022-04-17 15:03:47.740,2022-04-17 15:03:47.740
625c2d56f0a5bc6c426c0b24,Rogue One,2016,133 min,"Action, Adventure, Sci-Fi",7.8,4.539542494135893,The daughter of an Imperial scientist joins the Rebel Alliance in a risky move to steal the plans for the Death Star.,65.0,Gareth Edwards,"['Felicity Jones', 'Diego Luna', 'Alan Tudyk', 'Donnie Yen']",556608,2022-04-17 15:08:06.791,2022-04-17 15:08:06.791
625c2bdef0a5bc6c426c079a,Uri: The Surgical Strike,2018,138 min,"Action, Drama, War",8.2,1.945032388442085,"Indian army special forces execute a covert operation, avenging the killing of fellow army men at their base by a terrorist group.",,Aditya Dhar,"['Vicky Kaushal', 'Paresh Rawal', 'Mohit Raina', 'Yami Gautam']",43444,2022-04-17 15:01:50.445,2022-04-17 15:01:50.445
625c2dcbf0a5bc6c426c0c6c,Star Trek Into Darkness,2013,132 min,"Action, Adventure, Sci-Fi",7.7,4.597755901762404,"After the crew of the Enterprise find an unstoppable force of terror from within their own organization, Captain Kirk leads a manhunt to a war-zone world to capture a one-man weapon of mass destruction.",72.0,J.J. Abrams,"['Chris Pine', 'Zachary Quinto', 'Zoe Saldana', 'Benedict Cumberbatch']",463188,2022-04-17 15:10:03.478,2022-04-17 15:10:03.478
625c2e2ff0a5bc6c426c0e1e,Die Hard: With a Vengeance,1995,128 min,"Action, Adventure, Thriller",7.6,2.9453746436069683,"John McClane and a Harlem store owner are targeted by German terrorist Simon in New York City, where he plans to rob the Federal Reserve Building.",58.0,John McTiernan,"['Bruce Willis', 'Jeremy Irons', 'Samuel L. Jackson', 'Graham Greene']",364420,2022-04-17 15:11:43.918,2022-04-17 15:11:43.918
