_id,title,release,duration,gerne,IMDB_Rating,rating,overview,metaScore,director,stars,noOfVotes,createdAt,updatedAt
625c2ddbf0a5bc6c426c0cb6,Coraline,2009,100 min,"Animation, Drama, Family",7.7,2.54184810758441,"An adventurous 11-year-old girl finds another world that is a strangely idealized version of her frustrating home, but it has sinister secrets.",80.0,Henry Selick,"['Dakota Fanning', 'Teri Hatcher', 'John Hodgman', 'Jennifer Saunders']",197761,2022-04-17 15:10:19.390,2022-04-17 15:10:19.390
625c2c15f0a5bc6c426c0822,Koe no katachi,2016,130 min,"Animation, Drama, Family",8.1,2.693217650579175,"A young man is ostracized by his classmates after he bullies a deaf girl to the point where she moves away. Years later, he sets off on a path for redemption.",78.0,Naoko Yamada,"['Miyu Irino', 'Saori Hayami', 'Aoi Yûki', 'Kenshô Ono']",47708,2022-04-17 15:02:45.239,2022-04-17 15:02:45.239
625c2dbff0a5bc6c426c0c48,Omoide no Mânî,2014,103 min,"Animation, Drama, Family",7.7,0.8574170177985396,"Due to 12 y.o. Anna's asthma, she's sent to stay with relatives of her guardian in the Japanese countryside. She likes to be alone, sketching. She befriends Marnie. Who is the mysterious, blonde Marnie.",72.0,James Simone,"['Hiromasa Yonebayashi', 'Sara Takatsuki', 'Kasumi Arimura', 'Nanako Matsushima']",32798,2022-04-17 15:09:51.604,2022-04-17 15:09:51.604
625c2d5df0a5bc6c426c0b3e,Kaze tachinu,2013,126 min,"Animation, Biography, Drama",7.8,2.8439164302287034,"A look at the life of Jiro Horikoshi, the man who designed Japanese fighter planes during World War II.",83.0,Hayao Miyazaki,"['Hideaki Anno', 'Hidetoshi Nishijima', 'Miori Takimoto', 'Masahiko Nishimura']",73690,2022-04-17 15:08:13.686,2022-04-17 15:08:13.686
625c2bdaf0a5bc6c426c0796,The Kid,1921,68 min,"Comedy, Drama, Family",8.3,2.300001432028865,"The Tramp cares for an abandoned child, but events put that relationship in jeopardy.",,Charles Chaplin,"['Charles Chaplin', 'Edna Purviance', 'Jackie Coogan', 'Carl Miller']",113314,2022-04-17 15:01:46.833,2022-04-17 15:01:46.833
625c2b7bf0a5bc6c426c0708,Kimi no na wa.,2016,106 min,"Animation, Drama, Fantasy",8.4,1.0761842316770842,"Two strangers find themselves linked in a bizarre way. When a connection forms, will distance be the only thing to keep them apart?",79.0,Makoto Shinkai,"['Ryûnosuke Kamiki', 'Mone Kamishiraishi', 'Ryô Narita', 'Aoi Yûki']",194838,2022-04-17 15:00:11.131,2022-04-17 15:00:11.131
625c2df6f0a5bc6c426c0d2e,Rupan sansei: Kariosutoro no shiro,1979,100 min,"Animation, Adventure, Family",7.7,4.264036475891585,"A dashing thief, his gang of desperadoes and an intrepid policeman struggle to free a princess from an evil count's clutches, and learn the hidden secret to a fabulous treasure that she holds part of a key to.",71.0,Hayao Miyazaki,"['Yasuo Yamada', 'Eiko Masuyama', 'Kiyoshi Kobayashi', 'Makio Inoue']",27014,2022-04-17 15:10:46.567,2022-04-17 15:10:46.567
625c2bb1f0a5bc6c426c071c,WALL·E,2008,98 min,"Animation, Adventure, Family",8.4,3.999722658289996,"In the distant future, a small waste-collecting robot inadvertently embarks on a space journey that will ultimately decide the fate of mankind.",95.0,Andrew Stanton,"['Ben Burtt', 'Elissa Knight', 'Jeff Garlin', 'Fred Willard']",999790,2022-04-17 15:01:05.218,2022-04-17 15:01:05.218
625c2c20f0a5bc6c426c083e,Ôkami kodomo no Ame to Yuki,2012,117 min,"Animation, Drama, Fantasy",8.1,2.503668080502713,"After her werewolf lover unexpectedly dies in an accident while hunting for food for their children, a young woman must find ways to raise the werewolf son and daughter that she had with him while keeping their trait hidden from society.",71.0,Mamoru Hosoda,"['Aoi Miyazaki', 'Takao Osawa', 'Haru Kuroki', 'Yukito Nishii']",38803,2022-04-17 15:02:56.221,2022-04-17 15:02:56.221
625c2dc9f0a5bc6c426c0c62,Le Petit Prince,2015,108 min,"Animation, Adventure, Drama",7.7,0.09538220839389266,"A little girl lives in a very grown-up world with her mother, who tries to prepare her for it. Her neighbor, the Aviator, introduces the girl to an extraordinary world where anything is possible, the world of the Little Prince.",70.0,Mark Osborne,"['Jeff Bridges', 'Mackenzie Foy', 'Rachel McAdams', 'Marion Cotillard']",56720,2022-04-17 15:10:01.801,2022-04-17 15:10:01.801
625c2cd8f0a5bc6c426c09ca,Tenkû no shiro Rapyuta,1986,125 min,"Animation, Adventure, Drama",8.0,4.904960791004481,A young boy and a girl with a magic crystal must race against pirates and foreign agents in a search for a legendary floating castle.,78.0,Hayao Miyazaki,"['Mayumi Tanaka', 'Keiko Yokozawa', 'Kotoe Hatsui', 'Minori Terada']",150140,2022-04-17 15:06:00.298,2022-04-17 15:06:00.298
625c2c02f0a5bc6c426c07ec,Tonari no Totoro,1988,86 min,"Animation, Family, Fantasy",8.2,4.553388014379108,"When two girls move to the country to be near their ailing mother, they have adventures with the wondrous forest spirits who live nearby.",86.0,Hayao Miyazaki,"['Hitoshi Takagi', 'Noriko Hidaka', 'Chika Sakamoto', 'Shigesato Itoi']",291180,2022-04-17 15:02:26.521,2022-04-17 15:02:26.521
625c2d8af0a5bc6c426c0bac,October Sky,1999,108 min,"Biography, Drama, Family",7.8,1.4756045304490895,"The true story of Homer Hickam, a coal miner's son who was inspired by the first Sputnik launch to take up rocketry against his father's wishes.",71.0,Joe Johnston,"['Jake Gyllenhaal', 'Chris Cooper', 'Laura Dern', 'Chris Owen']",82855,2022-04-17 15:08:58.712,2022-04-17 15:08:58.712
625c2d89f0a5bc6c426c0b9e,Waking Life,2001,99 min,"Animation, Drama, Fantasy",7.8,4.9524967135366404,A man shuffles through a dream meeting various people and discussing the meanings and purposes of the universe.,83.0,Richard Linklater,"['Ethan Hawke', 'Trevor Jack Brooks', 'Lorelei Linklater', 'Wiley Wiggins']",60684,2022-04-17 15:08:57.262,2022-04-17 15:08:57.262
625c2c39f0a5bc6c426c0860,Hachi: A Dog's Tale,2009,93 min,"Biography, Drama, Family",8.1,0.5833799169000464,A college professor bonds with an abandoned dog he takes into his home.,,Lasse Hallström,"['Richard Gere', 'Joan Allen', 'Cary-Hiroyuki Tagawa', 'Sarah Roemer']",253575,2022-04-17 15:03:21.939,2022-04-17 15:03:21.939
625c2e33f0a5bc6c426c0e38,The Little Mermaid,1989,83 min,"Animation, Family, Fantasy",7.6,3.783456984683742,A mermaid princess makes a Faustian bargain in an attempt to become human and win a prince's love.,88.0,Ron Clements,"['John Musker', 'Jodi Benson', 'Samuel E. Wright', 'Rene Auberjonois']",237696,2022-04-17 15:11:47.627,2022-04-17 15:11:47.627
625c2b6ff0a5bc6c426c06ee,The Lion King,1994,88 min,"Animation, Adventure, Drama",8.5,4.493475427737119,"Lion prince Simba and his father are targeted by his bitter uncle, who wants to ascend the throne himself.",88.0,Roger Allers,"['Rob Minkoff', 'Matthew Broderick', 'Jeremy Irons', 'James Earl Jones']",942045,2022-04-17 14:59:59.712,2022-04-17 14:59:59.712
625c2b5ff0a5bc6c426c06c6,Sen to Chihiro no kamikakushi,2001,125 min,"Animation, Adventure, Family",8.6,2.3795784327905833,"During her family's move to the suburbs, a sullen 10-year-old girl wanders into a world ruled by gods, witches, and spirits, and where humans are changed into beasts.",96.0,Hayao Miyazaki,"['Daveigh Chase', 'Suzanne Pleshette', 'Miyu Irino', 'Rumi Hiiragi']",651376,2022-04-17 14:59:43.906,2022-04-17 14:59:43.906
625c2decf0a5bc6c426c0cfe,The Muppet Christmas Carol,1992,85 min,"Comedy, Drama, Family",7.7,4.436602821247333,The Muppet characters tell their version of the classic tale of an old and bitter miser's redemption on Christmas Eve.,64.0,Brian Henson,"['Michael Caine', 'Kermit the Frog', 'Dave Goelz', 'Miss Piggy']",50298,2022-04-17 15:10:36.560,2022-04-17 15:10:36.560
625c2d96f0a5bc6c426c0bd8,Majo no takkyûbin,1989,103 min,"Animation, Adventure, Drama",7.8,3.5753197990935948,"A young witch, on her mandatory year of independent life, finds fitting into a new community difficult while she supports herself by running an air courier service.",83.0,Hayao Miyazaki,"['Kirsten Dunst', 'Minami Takayama', 'Rei Sakuma', 'Kappei Yamaguchi']",124193,2022-04-17 15:09:10.642,2022-04-17 15:09:10.642
