_id,title,release,duration,gerne,IMDB_Rating,rating,overview,metaScore,director,stars,noOfVotes,createdAt,updatedAt
625c2cc3f0a5bc6c426c096e,Bin-jip,2004,88 min,"Crime, Drama, Romance",8.0,2.974549743345433,A transient young man breaks into empty homes to partake of the vacationing residents' lives for a few days.,72.0,Ki-duk Kim,"['Seung-Yun Lee', 'Hee Jae', 'Hyuk-ho Kwon', 'Jin-mo Joo']",50610,2022-04-17 15:05:39.138,2022-04-17 15:05:39.138
625c2e0af0a5bc6c426c0d82,Victoria,2015,138 min,"Crime, Drama, Romance",7.6,0.6496112250353636,A young Spanish woman who has recently moved to Berlin finds her flirtation with a local guy turn potentially deadly as their night out with his friends reveals a dangerous secret.,77.0,Sebastian Schipper,"['Laia Costa', 'Frederick Lau', 'Franz Rogowski', 'Burak Yigit']",52903,2022-04-17 15:11:06.030,2022-04-17 15:11:06.030
625c2d92f0a5bc6c426c0bc8,A Bronx Tale,1993,121 min,"Crime, Drama, Romance",7.8,2.882802386450697,A father becomes worried when a local gangster befriends his son in the Bronx in the 1960s.,80.0,Robert De Niro,"['Robert De Niro', 'Chazz Palminteri', 'Lillo Brancato', 'Francis Capra']",128171,2022-04-17 15:09:06.724,2022-04-17 15:09:06.724
625c2d30f0a5bc6c426c0aa8,True Romance,1993,119 min,"Crime, Drama, Romance",7.9,3.308716759727389,"In Detroit, a lonely pop culture geek marries a call girl, steals cocaine from her pimp, and tries to sell it in Hollywood. Meanwhile, the owners of the cocaine, the Mob, track them down in an attempt to reclaim it.",59.0,Tony Scott,"['Christian Slater', 'Patricia Arquette', 'Dennis Hopper', 'Val Kilmer']",206918,2022-04-17 15:07:28.451,2022-04-17 15:07:28.451
625c2db1f0a5bc6c426c0c20,À bout de souffle,1960,90 min,"Crime, Drama",7.8,2.366142130639084,"A small-time thief steals a car and impulsively murders a motorcycle policeman. Wanted by the authorities, he reunites with a hip American journalism student and attempts to persuade her to run away with him to Italy.",,Jean-Luc Godard,"['Jean-Paul Belmondo', 'Jean Seberg', 'Daniel Boulanger', 'Henri-Jacques Huet']",73251,2022-04-17 15:09:37.990,2022-04-17 15:09:37.990
625c2d85f0a5bc6c426c0b96,Lilja 4-ever,2002,109 min,"Crime, Drama",7.8,2.1473410970935047,"Sixteen-year-old Lilja and her only friend, the young boy Volodja, live in Russia, fantasizing about a better life. One day, Lilja falls in love with Andrej, who is going to Sweden, and invites Lilja to come along and start a new life.",82.0,Lukas Moodysson,"['Oksana Akinshina', 'Artyom Bogucharskiy', 'Pavel Ponomaryov', 'Lyubov Agapova']",42673,2022-04-17 15:08:53.545,2022-04-17 15:08:53.545
625c2d09f0a5bc6c426c0a58,Bir Zamanlar Anadolu'da,2011,157 min,"Crime, Drama",7.9,4.488120834276128,A group of men set out in search of a dead body in the Anatolian steppes.,82.0,Nuri Bilge Ceylan,"['Muhammet Uzuner', 'Yilmaz Erdogan', 'Taner Birsel', 'Ahmet Mümtaz Taylan']",41995,2022-04-17 15:06:49.711,2022-04-17 15:06:49.711
625c2b5ff0a5bc6c426c06c4,Cidade de Deus,2002,130 min,"Crime, Drama",8.6,2.487574768903338,"In the slums of Rio, two kids' paths diverge as one struggles to become a photographer and the other a kingpin.",79.0,Fernando Meirelles,"['Kátia Lund', 'Alexandre Rodrigues', 'Leandro Firmino', 'Matheus Nachtergaele']",699256,2022-04-17 14:59:43.029,2022-04-17 14:59:43.029
625c2ddcf0a5bc6c426c0cbc,Good Bye Lenin!,2003,121 min,"Comedy, Drama, Romance",7.7,1.5246790747908878,"In 1990, to protect his fragile mother from a fatal shock after a long coma, a young man must keep her from learning that her beloved nation of East Germany as she knew it has disappeared.",68.0,Wolfgang Becker,"['Daniel Brühl', 'Katrin Saß', 'Chulpan Khamatova', 'Florian Lukas']",137981,2022-04-17 15:10:20.492,2022-04-17 15:10:20.492
625c2c42f0a5bc6c426c0878,Dil Chahta Hai,2001,183 min,"Comedy, Drama, Romance",8.1,4.842207160191137,"Three inseparable childhood friends are just out of college. Nothing comes between them - until they each fall in love, and their wildly different approaches to relationships creates tension.",,Farhan Akhtar,"['Aamir Khan', 'Saif Ali Khan', 'Akshaye Khanna', 'Preity Zinta']",66803,2022-04-17 15:03:30.319,2022-04-17 15:03:30.319
625c2d5ef0a5bc6c426c0b42,La migliore offerta,2013,131 min,"Crime, Drama, Mystery",7.8,0.5737262831631318,A lonely art expert working for a mysterious and reclusive heiress finds not only her art worth examining.,49.0,Giuseppe Tornatore,"['Geoffrey Rush', 'Jim Sturgess', 'Sylvia Hoeks', 'Donald Sutherland']",108399,2022-04-17 15:08:14.812,2022-04-17 15:08:14.812
625c2c69f0a5bc6c426c08d8,Cool Hand Luke,1967,127 min,"Crime, Drama",8.1,4.292952800857495,"A laid back Southern man is sentenced to two years in a rural prison, but refuses to conform.",92.0,Stuart Rosenberg,"['Paul Newman', 'George Kennedy', 'Strother Martin', 'J.D. Cannon']",161984,2022-04-17 15:04:09.394,2022-04-17 15:04:09.394
625c2dbdf0a5bc6c426c0c44,En man som heter Ove,2015,116 min,"Comedy, Drama, Romance",7.7,1.3772437051615438,"Ove, an ill-tempered, isolated retiree who spends his days enforcing block association rules and visiting his wife's grave, has finally given up on life just as an unlikely friendship develops with his boisterous new neighbors.",70.0,Hannes Holm,"['Rolf Lassgård', 'Bahar Pars', 'Filip Berg', 'Ida Engvoll']",47444,2022-04-17 15:09:49.326,2022-04-17 15:09:49.326
625c2d95f0a5bc6c426c0bd2,Boyz n the Hood,1991,112 min,"Crime, Drama",7.8,2.2531176555395604,"Follows the lives of three young males living in the Crenshaw ghetto of Los Angeles, dissecting questions of race, relationships, violence, and future prospects.",76.0,John Singleton,"['Cuba Gooding Jr.', 'Laurence Fishburne', 'Hudhail Al-Amir', 'Lloyd Avery II']",126082,2022-04-17 15:09:09.508,2022-04-17 15:09:09.508
625c2df3f0a5bc6c426c0d1a,Der Name der Rose,1986,130 min,"Crime, Drama, Mystery",7.7,4.433988159634847,An intellectually nonconformist friar investigates a series of mysterious deaths in an isolated abbey.,54.0,Jean-Jacques Annaud,"['Sean Connery', 'Christian Slater', 'Helmut Qualtinger', 'Elya Baskin']",102031,2022-04-17 15:10:43.316,2022-04-17 15:10:43.316
625c2ccdf0a5bc6c426c0990,Dogville,2003,178 min,"Crime, Drama",8.0,4.596795647818935,"A woman on the run from the mob is reluctantly accepted in a small Colorado community in exchange for labor, but when a search visits the town she finds out that their support has a price.",60.0,Lars von Trier,"['Nicole Kidman', 'Paul Bettany', 'Lauren Bacall', 'Harriet Andersson']",137963,2022-04-17 15:05:49.180,2022-04-17 15:05:49.180
625c2deef0a5bc6c426c0d06,Glengarry Glen Ross,1992,100 min,"Crime, Drama, Mystery",7.7,0.002808918853294262,An examination of the machinations behind the scenes at a real estate office.,82.0,James Foley,"['Al Pacino', 'Jack Lemmon', 'Alec Baldwin', 'Alan Arkin']",95826,2022-04-17 15:10:38.259,2022-04-17 15:10:38.259
625c2e27f0a5bc6c426c0de6,Jeux d'enfants,2003,93 min,"Comedy, Drama, Romance",7.6,0.5879204396275739,"As adults, best friends Julien and Sophie continue the odd game they started as children -- a fearless competition to outdo one another with daring and outrageous stunts. While they often act out to relieve one another's pain, their game might be a way to avoid the fact that they are truly meant for one another.",45.0,Yann Samuell,"['Guillaume Canet', 'Marion Cotillard', 'Thibault Verhaeghe', 'Joséphine Lebas-Joly']",67360,2022-04-17 15:11:35.738,2022-04-17 15:11:35.738
625c2c41f0a5bc6c426c0876,Salinui chueok,2003,131 min,"Crime, Drama, Mystery",8.1,0.4382935615425798,"In a small Korean province in 1986, two detectives struggle with the case of multiple young women being found raped and murdered by an unknown culprit.",82.0,Bong Joon Ho,"['Kang-ho Song', 'Kim Sang-kyung', 'Roe-ha Kim', 'Jae-ho Song']",139558,2022-04-17 15:03:29.551,2022-04-17 15:03:29.551
625c2e33f0a5bc6c426c0e36,When Harry Met Sally...,1989,95 min,"Comedy, Drama, Romance",7.6,0.10333681926332994,"Harry and Sally have known each other for years, and are very good friends, but they fear sex would ruin the friendship.",76.0,Rob Reiner,"['Billy Crystal', 'Meg Ryan', 'Carrie Fisher', 'Bruno Kirby']",195663,2022-04-17 15:11:47.421,2022-04-17 15:11:47.421
