_id,title,release,duration,gerne,IMDB_Rating,rating,overview,metaScore,director,stars,noOfVotes,createdAt,updatedAt
625c2b63f0a5bc6c426c06d4,Seppuku,1962,133 min,"Action, Drama, Mystery",8.6,4.043474990787086,"When a ronin requesting seppuku at a feudal lord's palace is told of the brutal suicide of another ronin who previously visited, he reveals how their pasts are intertwined - and in doing so challenges the clan's integrity.",85.0,Masaki Kobayashi,"['Tatsuya Nakadai', 'Akira Ishihama', 'Shima Iwashita', 'Tetsurô Tanba']",42004,2022-04-17 14:59:47.746,2022-04-17 14:59:47.746
625c2bb1f0a5bc6c426c0720,Oldeuboi,2003,101 min,"Action, Drama, Mystery",8.4,4.455834934427557,"After being kidnapped and imprisoned for fifteen years, Oh Dae-Su is released, only to find that he must find his captor in five days.",77.0,Chan-wook Park,"['Choi Min-sik', 'Yoo Ji-Tae', 'Kang Hye-jeong', 'Kim Byeong-Ok']",515451,2022-04-17 15:01:05.637,2022-04-17 15:01:05.637
625c2d8ef0a5bc6c426c0bb6,The Game,1997,129 min,"Action, Drama, Mystery",7.8,2.68388931315097,"After a wealthy banker is given an opportunity to participate in a mysterious game, his life is turned upside down when he becomes unable to distinguish between the game and reality.",61.0,David Fincher,"['Michael Douglas', 'Deborah Kara Unger', 'Sean Penn', 'James Rebhorn']",345096,2022-04-17 15:09:02.279,2022-04-17 15:09:02.279
625c2beef0a5bc6c426c07b8,Warrior,2011,140 min,"Action, Drama, Sport",8.2,2.1665358942157917,"The youngest son of an alcoholic former boxer returns home, where he's trained by his father for competition in a mixed martial arts tournament - a path that puts the fighter on a collision course with his estranged, older brother.",71.0,Gavin O'Connor,"['Tom Hardy', 'Nick Nolte', 'Joel Edgerton', 'Jennifer Morrison']",435950,2022-04-17 15:02:06.750,2022-04-17 15:02:06.750
625c2cf0f0a5bc6c426c0a1c,Rope,1948,80 min,"Crime, Drama, Mystery",8.0,0.2301731777240401,Two men attempt to prove they committed the perfect crime by hosting a dinner party after strangling their former classmate to death.,73.0,Alfred Hitchcock,"['James Stewart', 'John Dall', 'Farley Granger', 'Dick Hogan']",129783,2022-04-17 15:06:24.816,2022-04-17 15:06:24.816
625c2cb4f0a5bc6c426c0940,Blade Runner 2049,2017,164 min,"Action, Drama, Mystery",8.0,3.718526542970002,"Young Blade Runner K's discovery of a long-buried secret leads him to track down former Blade Runner Rick Deckard, who's been missing for thirty years.",81.0,Denis Villeneuve,"['Harrison Ford', 'Ryan Gosling', 'Ana de Armas', 'Dave Bautista']",461823,2022-04-17 15:05:24.942,2022-04-17 15:05:24.942
625c2be3f0a5bc6c426c07a8,Drishyam,2015,163 min,"Crime, Drama, Mystery",8.2,2.3221049880847544,"Desperate measures are taken by a man who tries to save his family from the dark side of the law, after they commit an unexpected crime.",,Nishikant Kamat,"['Ajay Devgn', 'Shriya Saran', 'Tabu', 'Rajat Kapoor']",70367,2022-04-17 15:01:55.036,2022-04-17 15:01:55.036
625c2b7bf0a5bc6c426c070a,Dangal,2016,161 min,"Action, Biography, Drama",8.4,0.5855129463407616,Former wrestler Mahavir Singh Phogat and his two wrestler daughters struggle towards glory at the Commonwealth Games in the face of societal oppression.,,Nitesh Tiwari,"['Aamir Khan', 'Sakshi Tanwar', 'Fatima Sana Shaikh', 'Sanya Malhotra']",156479,2022-04-17 15:00:11.349,2022-04-17 15:00:11.349
625c2dd5f0a5bc6c426c0c96,Zodiac,2007,157 min,"Crime, Drama, Mystery",7.7,2.868135959493685,"In the late 1960s/early 1970s, a San Francisco cartoonist becomes an amateur detective obsessed with tracking down the Zodiac Killer, an unidentified individual who terrorizes Northern California with a killing spree.",78.0,David Fincher,"['Jake Gyllenhaal', 'Robert Downey Jr.', 'Mark Ruffalo', 'Anthony Edwards']",466080,2022-04-17 15:10:13.871,2022-04-17 15:10:13.871
625c2c02f0a5bc6c426c07f0,Ran,1985,162 min,"Action, Drama, War",8.2,1.775980655148165,"In Medieval Japan, an elderly warlord retires, handing over his empire to his three sons. However, he vastly underestimates how the new-found power will corrupt them and cause them to turn on each other...and him.",96.0,Akira Kurosawa,"['Tatsuya Nakadai', 'Akira Terao', 'Jinpachi Nezu', 'Daisuke Ryû']",112505,2022-04-17 15:02:26.946,2022-04-17 15:02:26.946
625c2d61f0a5bc6c426c0b52,Ajeossi,2010,119 min,"Action, Crime, Drama",7.8,4.377903297457262,A quiet pawnshop keeper with a violent past takes on a drug-and-organ trafficking ring in hope of saving the child who is his only friend.,,Jeong-beom Lee,"['Won Bin', 'Sae-ron Kim', 'Tae-hoon Kim', 'Hee-won Kim']",62848,2022-04-17 15:08:17.680,2022-04-17 15:08:17.680
625c2b6cf0a5bc6c426c06e6,Gladiator,2000,155 min,"Action, Adventure, Drama",8.5,4.66248624777033,A former Roman General sets out to exact vengeance against the corrupt emperor who murdered his family and sent him into slavery.,67.0,Ridley Scott,"['Russell Crowe', 'Joaquin Phoenix', 'Connie Nielsen', 'Oliver Reed']",1341460,2022-04-17 14:59:56.830,2022-04-17 14:59:56.830
625c2c16f0a5bc6c426c082a,Haider,2014,160 min,"Action, Crime, Drama",8.1,2.7322831857962893,"A young man returns to Kashmir after his father's disappearance to confront his uncle, whom he suspects of playing a role in his father's fate.",,Vishal Bhardwaj,"['Shahid Kapoor', 'Tabu', 'Shraddha Kapoor', 'Kay Kay Menon']",50445,2022-04-17 15:02:46.039,2022-04-17 15:02:46.039
625c2dadf0a5bc6c426c0c08,Badlands,1973,94 min,"Action, Crime, Drama",7.8,1.964025686202222,An impressionable teenage girl from a dead-end town and her older greaser boyfriend embark on a killing spree in the South Dakota badlands.,93.0,Terrence Malick,"['Martin Sheen', 'Sissy Spacek', 'Warren Oates', 'Ramon Bieri']",66009,2022-04-17 15:09:33.604,2022-04-17 15:09:33.604
625c2e0df0a5bc6c426c0d92,Sicario,2015,121 min,"Action, Crime, Drama",7.6,1.2943894086814034,An idealistic FBI agent is enlisted by a government task force to aid in the escalating war against drugs at the border area between the U.S. and Mexico.,82.0,Denis Villeneuve,"['Emily Blunt', 'Josh Brolin', 'Benicio Del Toro', 'Jon Bernthal']",371291,2022-04-17 15:11:09.256,2022-04-17 15:11:09.256
625c2c30f0a5bc6c426c0854,Prisoners,2013,153 min,"Crime, Drama, Mystery",8.1,1.4324335580623682,"When Keller Dover's daughter and her friend go missing, he takes matters into his own hands as the police pursue multiple leads and the pressure mounts.",70.0,Denis Villeneuve,"['Hugh Jackman', 'Jake Gyllenhaal', 'Viola Davis', 'Melissa Leo']",601149,2022-04-17 15:03:12.671,2022-04-17 15:03:12.671
625c2d62f0a5bc6c426c0b56,Madeo,2009,129 min,"Crime, Drama, Mystery",7.8,1.77415341722731,A mother desperately searches for the killer who framed her son for a girl's horrific murder.,79.0,Bong Joon Ho,"['Hye-ja Kim', 'Won Bin', 'Jin Goo', 'Je-mun Yun']",52758,2022-04-17 15:08:18.104,2022-04-17 15:08:18.104
625c2c15f0a5bc6c426c0824,Contratiempo,2016,106 min,"Crime, Drama, Mystery",8.1,1.3774072784193292,A successful entrepreneur accused of murder and a witness preparation expert have less than three hours to come up with an impregnable defense.,,Oriol Paulo,"['Mario Casas', 'Ana Wagener', 'Jose Coronado', 'Bárbara Lennie']",141516,2022-04-17 15:02:45.439,2022-04-17 15:02:45.439
625c2b6ef0a5bc6c426c06ec,Léon,1994,110 min,"Action, Crime, Drama",8.5,4.259460920663958,"Mathilda, a 12-year-old girl, is reluctantly taken in by Léon, a professional assassin, after her family is murdered. An unusual relationship forms as she becomes his protégée and learns the assassin's trade.",64.0,Luc Besson,"['Jean Reno', 'Gary Oldman', 'Natalie Portman', 'Danny Aiello']",1035236,2022-04-17 14:59:58.591,2022-04-17 14:59:58.591
625c2d90f0a5bc6c426c0bbe,Tombstone,1993,130 min,"Action, Biography, Drama",7.8,0.15030896987843212,"A successful lawman's plans to retire anonymously in Tombstone, Arizona are disrupted by the kind of outlaws he was famous for eliminating.",50.0,George P. Cosmatos,"['Kevin Jarre', 'Kurt Russell', 'Val Kilmer', 'Sam Elliott']",126871,2022-04-17 15:09:04.158,2022-04-17 15:09:04.158
