_id,title,release,duration,gerne,IMDB_Rating,rating,overview,metaScore,director,stars,noOfVotes,createdAt,updatedAt
625c2c24f0a5bc6c426c0844,Barfi!,2012,151 min,"Comedy, Drama, Romance",8.1,1.453947554900692,Three young people learn that love can neither be defined nor contained by society's definition of normal and abnormal.,,Anurag Basu,"['Ranbir Kapoor', 'Priyanka Chopra', ""Ileana D'Cruz"", 'Saurabh Shukla']",75721,2022-04-17 15:03:00.005,2022-04-17 15:03:00.005
625c2bdbf0a5bc6c426c0798,Chhichhore,2019,143 min,"Comedy, Drama",8.2,4.55227716993183,"A tragic incident forces Anirudh, a middle-aged man, to take a trip down memory lane and reminisce his college days along with his friends, who were labelled as losers.",,Nitesh Tiwari,"['Sushant Singh Rajput', 'Shraddha Kapoor', 'Varun Sharma', 'Prateik']",33893,2022-04-17 15:01:47.492,2022-04-17 15:01:47.492
625c2ddcf0a5bc6c426c0cbc,Good Bye Lenin!,2003,121 min,"Comedy, Drama, Romance",7.7,1.5246790747908878,"In 1990, to protect his fragile mother from a fatal shock after a long coma, a young man must keep her from learning that her beloved nation of East Germany as she knew it has disappeared.",68.0,Wolfgang Becker,"['Daniel Brühl', 'Katrin Saß', 'Chulpan Khamatova', 'Florian Lukas']",137981,2022-04-17 15:10:20.492,2022-04-17 15:10:20.492
625c2c1ef0a5bc6c426c0838,OMG: Oh My God!,2012,125 min,"Comedy, Drama, Fantasy",8.1,4.746396469217041,A shopkeeper takes God to court when his shop is destroyed by an earthquake.,,Umesh Shukla,"['Paresh Rawal', 'Akshay Kumar', 'Mithun Chakraborty', 'Mahesh Manjrekar']",51739,2022-04-17 15:02:54.034,2022-04-17 15:02:54.034
625c2de1f0a5bc6c426c0cda,Happiness,1998,134 min,"Comedy, Drama",7.7,2.1681064599251734,"The lives of several individuals intertwine as they go about their lives in their own unique ways, engaging in acts society as a whole might find disturbing in a desperate search for human connection.",81.0,Todd Solondz,"['Jane Adams', 'Jon Lovitz', 'Philip Seymour Hoffman', 'Dylan Baker']",66408,2022-04-17 15:10:25.629,2022-04-17 15:10:25.629
625c2d22f0a5bc6c426c0a80,C.R.A.Z.Y.,2005,129 min,"Comedy, Drama",7.9,4.813812645866239,"A young French-Canadian, growing up in the 1960s and 1970s, struggles to reconcile his emerging homosexuality with his father's conservative values and his own Catholic beliefs.",81.0,Jean-Marc Vallée,"['Michel Côté', 'Marc-André Grondin', 'Danielle Proulx', 'Émile Vallée']",31476,2022-04-17 15:07:14.361,2022-04-17 15:07:14.361
625c2ccdf0a5bc6c426c0992,Vizontele,2001,110 min,"Comedy, Drama",8.0,1.4120134484560687,Lives of residents in a small Anatolian village change when television is introduced to them,,Yilmaz Erdogan,"['Ömer Faruk Sorak', 'Yilmaz Erdogan', 'Demet Akbag', 'Altan Erkekli']",33592,2022-04-17 15:05:49.380,2022-04-17 15:05:49.380
625c2cf3f0a5bc6c426c0a2e,La règle du jeu,1939,110 min,"Comedy, Drama",8.0,4.752221594103673,"A bourgeois life in France at the onset of World War II, as the rich and their poor servants meet up at a French chateau.",,Jean Renoir,"['Marcel Dalio', 'Nora Gregor', 'Paulette Dubost', 'Mila Parély']",26725,2022-04-17 15:06:27.065,2022-04-17 15:06:27.065
625c2de2f0a5bc6c426c0cde,Rushmore,1998,93 min,"Comedy, Drama, Romance",7.7,2.853612588618496,The extracurricular king of Rushmore Preparatory School is put on academic probation.,86.0,Wes Anderson,"['Jason Schwartzman', 'Bill Murray', 'Olivia Williams', 'Seymour Cassel']",169229,2022-04-17 15:10:26.671,2022-04-17 15:10:26.671
625c2d51f0a5bc6c426c0b14,Perfetti sconosciuti,2016,96 min,"Comedy, Drama",7.8,1.357510889281348,"Seven long-time friends get together for a dinner. When they decide to share with each other the content of every text message, email and phone call they receive, many secrets start to unveil and the equilibrium trembles.",,Paolo Genovese,"['Giuseppe Battiston', 'Anna Foglietta', 'Marco Giallini', 'Edoardo Leo']",57168,2022-04-17 15:08:01.851,2022-04-17 15:08:01.851
625c2c4ef0a5bc6c426c0898,Underground,1995,170 min,"Comedy, Drama, War",8.1,0.6946024045715204,"A group of Serbian socialists prepares for the war in a surreal underground filled by parties, tragedies, love and hate.",,Emir Kusturica,"[""Predrag 'Miki' Manojlovic"", 'Lazar Ristovski', 'Mirjana Jokovic', 'Slavko Stimac']",55220,2022-04-17 15:03:42.590,2022-04-17 15:03:42.590
625c2e08f0a5bc6c426c0d76,Once Upon a Time... in Hollywood,2019,161 min,"Comedy, Drama",7.6,2.0921399892452297,A faded television actor and his stunt double strive to achieve fame and success in the final years of Hollywood's Golden Age in 1969 Los Angeles.,83.0,Quentin Tarantino,"['Leonardo DiCaprio', 'Brad Pitt', 'Margot Robbie', 'Emile Hirsch']",551309,2022-04-17 15:11:04.191,2022-04-17 15:11:04.191
625c2cd4f0a5bc6c426c09be,Do the Right Thing,1989,120 min,"Comedy, Drama",8.0,2.2884021980735714,"On the hottest day of the year on a street in the Bedford-Stuyvesant section of Brooklyn, everyone's hate and bigotry smolders and builds until it explodes into violence.",93.0,Spike Lee,"['Danny Aiello', 'Ossie Davis', 'Ruby Dee', 'Richard Edson']",89429,2022-04-17 15:05:56.493,2022-04-17 15:05:56.493
625c2deef0a5bc6c426c0d0c,Barton Fink,1991,116 min,"Comedy, Drama, Thriller",7.7,4.833752045658408,A renowned New York playwright is enticed to California to write for the movies and discovers the hellish truth of Hollywood.,69.0,Joel Coen,"['Ethan Coen', 'John Turturro', 'John Goodman', 'Judy Davis']",113240,2022-04-17 15:10:38.872,2022-04-17 15:10:38.872
625c2d39f0a5bc6c426c0acc,Amarcord,1973,123 min,"Comedy, Drama, Family",7.9,4.943002010792977,A series of comedic and nostalgic vignettes set in a 1930s Italian coastal town.,,Federico Fellini,"['Magali Noël', 'Bruno Zanin', 'Pupella Maggio', 'Armando Brancia']",39897,2022-04-17 15:07:37.467,2022-04-17 15:07:37.467
625c2d7ff0a5bc6c426c0b84,Adams æbler,2005,94 min,"Comedy, Crime, Drama",7.8,0.9877452106620987,A neo-nazi sentenced to community service at a church clashes with the blindly devotional priest.,51.0,Anders Thomas Jensen,"['Ulrich Thomsen', 'Mads Mikkelsen', 'Nicolas Bro', 'Paprika Steen']",45717,2022-04-17 15:08:47.570,2022-04-17 15:08:47.570
625c2cfbf0a5bc6c426c0a46,Captain Fantastic,2016,118 min,"Comedy, Drama",7.9,3.5701799330001927,"In the forests of the Pacific Northwest, a father devoted to raising his six kids with a rigorous physical and intellectual education is forced to leave his paradise and enter the world, challenging his idea of what it means to be a parent.",72.0,Matt Ross,"['Viggo Mortensen', 'George MacKay', 'Samantha Isler', 'Annalise Basso']",189400,2022-04-17 15:06:35.672,2022-04-17 15:06:35.672
625c2d48f0a5bc6c426c0af2,Harvey,1950,104 min,"Comedy, Drama, Fantasy",7.9,3.672078736620321,"Due to his insistence that he has an invisible six foot-tall rabbit for a best friend, a whimsical middle-aged man is thought by his family to be insane - but he may be wiser than anyone knows.",,Henry Koster,"['James Stewart', 'Wallace Ford', 'William H. Lynn', 'Victoria Horne']",52573,2022-04-17 15:07:52.918,2022-04-17 15:07:52.918
625c2ddaf0a5bc6c426c0cb0,Lost in Translation,2003,102 min,"Comedy, Drama",7.7,4.701286041039832,A faded movie star and a neglected young woman form an unlikely bond after crossing paths in Tokyo.,89.0,Sofia Coppola,"['Bill Murray', 'Scarlett Johansson', 'Giovanni Ribisi', 'Anna Faris']",415074,2022-04-17 15:10:18.781,2022-04-17 15:10:18.781
625c2e28f0a5bc6c426c0dea,The Station Agent,2003,89 min,"Comedy, Drama",7.6,1.6071186781185098,"When his only friend dies, a man born with dwarfism moves to rural New Jersey to live a life of solitude, only to meet a chatty hot dog vendor and a woman dealing with her own personal loss.",81.0,Tom McCarthy,"['Peter Dinklage', 'Patricia Clarkson', 'Bobby Cannavale', 'Paul Benjamin']",67370,2022-04-17 15:11:36.717,2022-04-17 15:11:36.717
