_id,title,release,duration,gerne,IMDB_Rating,rating,overview,metaScore,director,stars,noOfVotes,createdAt,updatedAt
625c2d4cf0a5bc6c426c0b04,King Kong,1933,100 min,"Adventure, Horror, Sci-Fi",7.9,1.6683045711787492,A film crew goes to a tropical island for an exotic location shoot and discovers a colossal ape who takes a shine to their female blonde star. He is then captured and brought back to New York City for public exhibition.,90.0,Merian C. Cooper,"['Ernest B. Schoedsack', 'Fay Wray', 'Robert Armstrong', 'Bruce Cabot']",78991,2022-04-17 15:07:56.378,2022-04-17 15:07:56.378
625c2b5df0a5bc6c426c06c2,Interstellar,2014,169 min,"Adventure, Drama, Sci-Fi",8.6,3.318975522120321,A team of explorers travel through a wormhole in space in an attempt to ensure humanity's survival.,74.0,Christopher Nolan,"['Matthew McConaughey', 'Anne Hathaway', 'Jessica Chastain', 'Mackenzie Foy']",1512360,2022-04-17 14:59:41.354,2022-04-17 14:59:41.354
625c2d97f0a5bc6c426c0bde,Back to the Future Part II,1989,108 min,"Adventure, Comedy, Sci-Fi",7.8,3.066548435013007,"After visiting 2015, Marty McFly must repeat his visit to 1955 to prevent disastrous changes to 1985...without interfering with his first trip.",57.0,Robert Zemeckis,"['Michael J. Fox', 'Christopher Lloyd', 'Lea Thompson', 'Thomas F. Wilson']",481918,2022-04-17 15:09:11.642,2022-04-17 15:09:11.642
625c2cc5f0a5bc6c426c0974,G.O.R.A.,2004,127 min,"Adventure, Comedy, Sci-Fi",8.0,3.560327873604102,A slick young Turk kidnapped by extraterrestrials shows his great « humanitarian spirit » by outwitting the evil commander-in-chief of the planet of G.O.R.A.,,Ömer Faruk Sorak,"['Cem Yilmaz', 'Özge Özberk', 'Ozan Güven', 'Safak Sezer']",56960,2022-04-17 15:05:41.964,2022-04-17 15:05:41.964
625c2c80f0a5bc6c426c092a,The Martian,2015,144 min,"Adventure, Drama, Sci-Fi",8.0,2.5150608424176104,"An astronaut becomes stranded on Mars after his team assume him dead, and must rely on his ingenuity to find a way to signal to Earth that he is alive.",80.0,Ridley Scott,"['Matt Damon', 'Jessica Chastain', 'Kristen Wiig', 'Kate Mara']",760094,2022-04-17 15:04:32.788,2022-04-17 15:04:32.788
625c2d2cf0a5bc6c426c0a9a,Children of Men,2006,109 min,"Adventure, Drama, Sci-Fi",7.9,2.922480744348018,"In 2027, in a chaotic world in which women have become somehow infertile, a former activist agrees to help transport a miraculously pregnant woman to a sanctuary at sea.",84.0,Alfonso Cuarón,"['Julianne Moore', 'Clive Owen', 'Chiwetel Ejiofor', 'Michael Caine']",465113,2022-04-17 15:07:24.536,2022-04-17 15:07:24.536
625c2ce4f0a5bc6c426c09ec,Planet of the Apes,1968,112 min,"Adventure, Sci-Fi",8.0,0.2650958502406908,"An astronaut crew crash-lands on a planet in the distant future where intelligent talking apes are the dominant species, and humans are the oppressed and enslaved.",79.0,Franklin J. Schaffner,"['Charlton Heston', 'Roddy McDowall', 'Kim Hunter', 'Maurice Evans']",165167,2022-04-17 15:06:12.211,2022-04-17 15:06:12.211
625c2b72f0a5bc6c426c06f6,Back to the Future,1985,116 min,"Adventure, Comedy, Sci-Fi",8.5,2.6692363228433003,"Marty McFly, a 17-year-old high school student, is accidentally sent thirty years into the past in a time-traveling DeLorean invented by his close friend, the eccentric scientist Doc Brown.",87.0,Robert Zemeckis,"['Michael J. Fox', 'Christopher Lloyd', 'Lea Thompson', 'Crispin Glover']",1058081,2022-04-17 15:00:02.020,2022-04-17 15:00:02.020
625c2d67f0a5bc6c426c0b6c,The Hobbit: An Unexpected Journey,2012,169 min,"Adventure, Fantasy",7.8,0.09753728796126016,"A reluctant Hobbit, Bilbo Baggins, sets out to the Lonely Mountain with a spirited group of dwarves to reclaim their mountain home, and the gold within it from the dragon Smaug.",58.0,Peter Jackson,"['Martin Freeman', 'Ian McKellen', 'Richard Armitage', 'Andy Serkis']",757377,2022-04-17 15:08:23.618,2022-04-17 15:08:23.618
625c2e31f0a5bc6c426c0e24,Apollo 13,PG,140 min,"Adventure, Drama, History",7.6,3.3259619087699877,NASA must devise a strategy to return Apollo 13 to Earth safely after the spacecraft undergoes massive internal damage putting the lives of the three astronauts on board in jeopardy.,77.0,Ron Howard,"['Tom Hanks', 'Bill Paxton', 'Kevin Bacon', 'Gary Sinise']",269197,2022-04-17 15:11:45.010,2022-04-17 15:11:45.010
625c2b70f0a5bc6c426c06f0,Terminator 2: Judgment Day,1991,137 min,"Action, Sci-Fi",8.5,4.241836289655357,"A cyborg, identical to the one who failed to kill Sarah Connor, must now protect her teenage son, John Connor, from a more advanced and powerful cyborg.",75.0,James Cameron,"['Arnold Schwarzenegger', 'Linda Hamilton', 'Edward Furlong', 'Robert Patrick']",995506,2022-04-17 15:00:00.857,2022-04-17 15:00:00.857
625c2dc8f0a5bc6c426c0c5a,Captain America: The Winter Soldier,2014,136 min,"Action, Adventure, Sci-Fi",7.7,2.0318290997880184,"As Steve Rogers struggles to embrace his role in the modern world, he teams up with a fellow Avenger and S.H.I.E.L.D agent, Black Widow, to battle a new threat from history: an assassin known as the Winter Soldier.",70.0,Anthony Russo,"['Joe Russo', 'Chris Evans', 'Samuel L. Jackson', 'Scarlett Johansson']",736182,2022-04-17 15:10:00.342,2022-04-17 15:10:00.342
625c2c30f0a5bc6c426c0856,Mad Max: Fury Road,2015,120 min,"Action, Adventure, Sci-Fi",8.1,1.7800853979738818,"In a post-apocalyptic wasteland, a woman rebels against a tyrannical ruler in search for her homeland with the aid of a group of female prisoners, a psychotic worshiper, and a drifter named Max.",90.0,George Miller,"['Tom Hardy', 'Charlize Theron', 'Nicholas Hoult', 'Zoë Kravitz']",882316,2022-04-17 15:03:12.895,2022-04-17 15:03:12.895
625c2de0f0a5bc6c426c0cd4,Interstate 60: Episodes of the Road,2002,116 min,"Adventure, Comedy, Drama",7.7,2.8655283255721264,"Neal Oliver, a very confused young man and an artist, takes a journey of a lifetime on a highway I60 that doesn't exist on any of the maps, going to the places he never even heard of, searching for an answer and his dreamgirl.",,Bob Gale,"['James Marsden', 'Gary Oldman', 'Kurt Russell', 'Matthew Edison']",29999,2022-04-17 15:10:24.390,2022-04-17 15:10:24.390
625c2d98f0a5bc6c426c0be2,Predator,1987,107 min,"Action, Adventure, Sci-Fi",7.8,4.434946665068128,A team of commandos on a mission in a Central American jungle find themselves hunted by an extraterrestrial warrior.,45.0,John McTiernan,"['Arnold Schwarzenegger', 'Carl Weathers', 'Kevin Peter Hall', 'Elpidia Carrillo']",371387,2022-04-17 15:09:12.156,2022-04-17 15:09:12.156
625c2c48f0a5bc6c426c0886,Lagaan: Once Upon a Time in India,2001,224 min,"Adventure, Drama, Musical",8.1,1.5804432764643428,The people of a small village in Victorian India stake their future on a game of cricket against their ruthless British rulers.,84.0,Ashutosh Gowariker,"['Aamir Khan', 'Raghuvir Yadav', 'Gracy Singh', 'Rachel Shelley']",105036,2022-04-17 15:03:36.869,2022-04-17 15:03:36.869
625c2d12f0a5bc6c426c0a64,Moon,2009,97 min,"Drama, Mystery, Sci-Fi",7.9,4.986237803631121,"Astronaut Sam Bell has a quintessentially personal encounter toward the end of his three-year stint on the Moon, where he, working alongside his computer, GERTY, sends back to Earth parcels of a resource that has helped diminish our planet's power problems.",67.0,Duncan Jones,"['Sam Rockwell', 'Kevin Spacey', 'Dominique McElligott', 'Rosie Shaw']",335152,2022-04-17 15:06:58.631,2022-04-17 15:06:58.631
625c2ba9f0a5bc6c426c0710,Avengers: Infinity War,2018,149 min,"Action, Adventure, Sci-Fi",8.4,1.6284819178819432,The Avengers and their allies must be willing to sacrifice all in an attempt to defeat the powerful Thanos before his blitz of devastation and ruin puts an end to the universe.,68.0,Anthony Russo,"['Joe Russo', 'Robert Downey Jr.', 'Chris Hemsworth', 'Mark Ruffalo']",834477,2022-04-17 15:00:57.331,2022-04-17 15:00:57.331
625c2df5f0a5bc6c426c0d26,Star Trek II: The Wrath of Khan,1982,113 min,"Action, Adventure, Sci-Fi",7.7,0.5026481135816119,"With the assistance of the Enterprise crew, Admiral Kirk must stop an old nemesis, Khan Noonien Singh, from using the life-generating Genesis Device as the ultimate weapon.",67.0,Nicholas Meyer,"['William Shatner', 'Leonard Nimoy', 'DeForest Kelley', 'James Doohan']",112704,2022-04-17 15:10:45.133,2022-04-17 15:10:45.133
625c2e17f0a5bc6c426c0db8,Zombieland,2009,88 min,"Adventure, Comedy, Fantasy",7.6,4.5,"A shy student trying to reach his family in Ohio, a gun-toting tough guy trying to find the last Twinkie, and a pair of sisters trying to get to an amusement park join forces to travel across a zombie-filled America.",73.0,Ruben Fleischer,"['Jesse Eisenberg', 'Emma Stone', 'Woody Harrelson', 'Abigail Breslin']",520041,2022-04-17 15:11:19.856,2022-05-01 13:46:58.164
