_id,title,release,duration,gerne,IMDB_Rating,rating,overview,metaScore,director,stars,noOfVotes,createdAt,updatedAt
625c2be6f0a5bc6c426c07ae,Bhaag Milkha Bhaag,2013,186 min,"Biography, Drama, Sport",8.2,4.326849623869634,The truth behind the ascension of Milkha Singh who was scarred because of the India-Pakistan partition.,,Rakeysh Omprakash Mehra,"['Farhan Akhtar', 'Sonam Kapoor', 'Pawan Malhotra', 'Art Malik']",61137,2022-04-17 15:01:58.488,2022-04-17 15:01:58.488
625c2d66f0a5bc6c426c0b64,The Fighter,2010,116 min,"Biography, Drama, Sport",7.8,2.228873821022004,"Based on the story of Micky Ward, a fledgling boxer who tries to escape the shadow of his more famous but troubled older boxing brother and get his own shot at greatness.",79.0,David O. Russell,"['Mark Wahlberg', 'Christian Bale', 'Amy Adams', 'Melissa Leo']",340584,2022-04-17 15:08:22.584,2022-04-17 15:08:22.584
625c2d81f0a5bc6c426c0b88,The World's Fastest Indian,2005,127 min,"Biography, Drama, Sport",7.8,2.660029036287007,"The story of New Zealander Burt Munro, who spent years rebuilding a 1920 Indian motorcycle, which helped him set the land speed world record at Utah's Bonneville Salt Flats in 1967.",68.0,Roger Donaldson,"['Anthony Hopkins', 'Diane Ladd', 'Iain Rea', 'Tessa Mitchell']",51980,2022-04-17 15:08:49.391,2022-04-17 15:08:49.391
625c2d89f0a5bc6c426c0ba0,Remember the Titans,2000,113 min,"Biography, Drama, Sport",7.8,4.258543399375703,The true story of a newly appointed African-American coach and his high school team on their first season as a racially integrated unit.,48.0,Boaz Yakin,"['Denzel Washington', 'Will Patton', 'Wood Harris', 'Ryan Hurst']",198089,2022-04-17 15:08:57.463,2022-04-17 15:08:57.463
625c2e2cf0a5bc6c426c0e08,The Hurricane,1999,146 min,"Biography, Drama, Sport",7.6,0.8635636846535011,"The story of Rubin 'Hurricane' Carter, a boxer wrongly imprisoned for murder, and the people who aided in his fight to prove his innocence.",74.0,Norman Jewison,"['Denzel Washington', 'Vicellous Shannon', 'Deborah Kara Unger', 'Liev Schreiber']",91557,2022-04-17 15:11:40.233,2022-04-17 15:11:40.233
625c2e17f0a5bc6c426c0db4,Moneyball,2011,133 min,"Biography, Drama, Sport",7.6,0.7442283167888741,Oakland A's general manager Billy Beane's successful attempt to assemble a baseball team on a lean budget by employing computer-generated analysis to acquire new players.,87.0,Bennett Miller,"['Brad Pitt', 'Robin Wright', 'Jonah Hill', 'Philip Seymour Hoffman']",369529,2022-04-17 15:11:19.337,2022-04-17 15:11:19.337
625c2e19f0a5bc6c426c0dbe,The Blind Side,2009,129 min,"Biography, Drama, Sport",7.6,3.893503320149263,"The story of Michael Oher, a homeless and traumatized boy who became an All-American football player and first-round NFL draft pick with the help of a caring woman and her family.",53.0,John Lee Hancock,"['Quinton Aaron', 'Sandra Bullock', 'Tim McGraw', 'Jae Head']",293266,2022-04-17 15:11:21.099,2022-04-17 15:11:21.099
625c2d54f0a5bc6c426c0b1e,M.S. Dhoni: The Untold Story,2016,184 min,"Biography, Drama, Sport",7.8,2.9895619449027633,The untold story of Mahendra Singh Dhoni's journey from ticket collector to trophy collector - the world-cup-winning captain of the Indian Cricket Team.,,Neeraj Pandey,"['Sushant Singh Rajput', 'Kiara Advani', 'Anupam Kher', 'Disha Patani']",40416,2022-04-17 15:08:04.563,2022-04-17 15:08:04.563
625c2e29f0a5bc6c426c0df0,Finding Neverland,2004,106 min,"Biography, Drama, Family",7.6,4.152872544506428,The story of Sir J.M. Barrie's friendship with a family who inspired him to create Peter Pan.,67.0,Marc Forster,"['Johnny Depp', 'Kate Winslet', 'Julie Christie', 'Radha Mitchell']",198677,2022-04-17 15:11:37.358,2022-04-17 15:11:37.358
625c2dd1f0a5bc6c426c0c86,Changeling,2008,141 min,"Biography, Crime, Drama",7.7,4.032166413721093,Grief-stricken mother Christine Collins (Angelina Jolie) takes on the L.A.P.D. to her own detriment when it tries to pass off an obvious impostor as her missing child.,63.0,Clint Eastwood,"['Angelina Jolie', 'Colm Feore', 'Amy Ryan', 'Gattlin Griffith']",239203,2022-04-17 15:10:09.881,2022-04-17 15:10:09.881
625c2d83f0a5bc6c426c0b8e,Walk the Line,2005,136 min,"Biography, Drama, Music",7.8,4.601924225677906,"A chronicle of country music legend Johnny Cash's life, from his early days on an Arkansas cotton farm to his rise to fame with Sun Records in Memphis, where he recorded alongside Elvis Presley, Jerry Lee Lewis, and Carl Perkins.",72.0,James Mangold,"['Joaquin Phoenix', 'Reese Witherspoon', 'Ginnifer Goodwin', 'Robert Patrick']",234207,2022-04-17 15:08:51.864,2022-04-17 15:08:51.864
625c2e2bf0a5bc6c426c0e02,Blow,2001,124 min,"Biography, Crime, Drama",7.6,0.8605925812212689,"The story of how George Jung, along with the Medellín Cartel headed by Pablo Escobar, established the American cocaine market in the 1970s in the United States.",52.0,Ted Demme,"['Johnny Depp', 'Penélope Cruz', 'Franka Potente', 'Rachel Griffiths']",240714,2022-04-17 15:11:39.193,2022-04-17 15:11:39.193
625c2bc6f0a5bc6c426c0764,Braveheart,1995,178 min,"Biography, Drama, History",8.3,1.3338501328663621,Scottish warrior William Wallace leads his countrymen in a rebellion to free his homeland from the tyranny of King Edward I of England.,68.0,Mel Gibson,"['Mel Gibson', 'Sophie Marceau', 'Patrick McGoohan', 'Angus Macfadyen']",959181,2022-04-17 15:01:26.677,2022-04-17 15:01:26.677
625c2ce2f0a5bc6c426c09dc,Papillon,1973,151 min,"Biography, Crime, Drama",8.0,4.79559527106749,"A man befriends a fellow criminal as the two of them begin serving their sentence on a dreadful prison island, which inspires the man to plot his escape.",58.0,Franklin J. Schaffner,"['Steve McQueen', 'Dustin Hoffman', 'Victor Jory', 'Don Gordon']",121627,2022-04-17 15:06:10.018,2022-04-17 15:06:10.018
625c2cd9f0a5bc6c426c09ce,Gandhi,1982,191 min,"Biography, Drama, History",8.0,2.7066713981185577,The life of the lawyer who became the famed leader of the Indian revolts against the British rule through his philosophy of nonviolent protest.,79.0,Richard Attenborough,"['Ben Kingsley', 'John Gielgud', 'Rohini Hattangadi', 'Roshan Seth']",217664,2022-04-17 15:06:01.180,2022-04-17 15:06:01.180
625c2beef0a5bc6c426c07b8,Warrior,2011,140 min,"Action, Drama, Sport",8.2,2.1665358942157917,"The youngest son of an alcoholic former boxer returns home, where he's trained by his father for competition in a mixed martial arts tournament - a path that puts the fighter on a collision course with his estranged, older brother.",71.0,Gavin O'Connor,"['Tom Hardy', 'Nick Nolte', 'Joel Edgerton', 'Jennifer Morrison']",435950,2022-04-17 15:02:06.750,2022-04-17 15:02:06.750
625c2ddaf0a5bc6c426c0cae,Ray,2004,152 min,"Biography, Drama, Music",7.7,2.359722815799458,"The story of the life and career of the legendary rhythm and blues musician Ray Charles, from his humble beginnings in the South, where he went blind at age seven, to his meteoric rise to stardom during the 1950s and 1960s.",73.0,Taylor Hackford,"['Jamie Foxx', 'Regina King', 'Kerry Washington', 'Clifton Powell']",138356,2022-04-17 15:10:18.589,2022-04-17 15:10:18.589
625c2dcbf0a5bc6c426c0c70,The Social Network,2010,120 min,"Biography, Drama",7.7,4.395263656276355,"As Harvard student Mark Zuckerberg creates the social networking site that would become known as Facebook, he is sued by the twins who claimed he stole their idea, and by the co-founder who was later squeezed out of the business.",95.0,David Fincher,"['Jesse Eisenberg', 'Andrew Garfield', 'Justin Timberlake', 'Rooney Mara']",624982,2022-04-17 15:10:03.900,2022-04-17 15:10:03.900
625c2d52f0a5bc6c426c0b16,Hidden Figures,2016,127 min,"Biography, Drama, History",7.8,3.712635787972105,The story of a team of female African-American mathematicians who served a vital role in NASA during the early years of the U.S. space program.,74.0,Theodore Melfi,"['Taraji P. Henson', 'Octavia Spencer', 'Janelle Monáe', 'Kevin Costner']",200876,2022-04-17 15:08:02.060,2022-04-17 15:08:02.060
625c2c6ef0a5bc6c426c08ec,Inherit the Wind,1960,128 min,"Biography, Drama, History",8.1,3.0641823847857017,"Based on a real-life case in 1925, two great lawyers argue the case for and against a science teacher accused of the crime of teaching evolution.",75.0,Stanley Kramer,"['Spencer Tracy', 'Fredric March', 'Gene Kelly', 'Dick York']",27254,2022-04-17 15:04:14.072,2022-04-17 15:04:14.072
