_id,title,release,duration,gerne,IMDB_Rating,rating,overview,metaScore,director,stars,noOfVotes,createdAt,updatedAt
625c2cd7f0a5bc6c426c09c6,Der Himmel über Berlin,1987,128 min,"Drama, Fantasy, Romance",8.0,2.9996835652463183,An angel tires of overseeing human activity and wishes to become human when he falls in love with a mortal.,79.0,Wim Wenders,"['Bruno Ganz', 'Solveig Dommartin', 'Otto Sander', 'Curt Bois']",64722,2022-04-17 15:05:59.361,2022-04-17 15:05:59.361
625c2c54f0a5bc6c426c08aa,Dà hóng denglong gaogao guà,1991,125 min,"Drama, History, Romance",8.1,3.1489540737698754,"A young woman becomes the fourth wife of a wealthy lord, and must learn to live with the strict rules and tensions within the household.",,Yimou Zhang,"['Gong Li', 'Jingwu Ma', 'Saifei He', 'Cuifen Cao']",29662,2022-04-17 15:03:48.881,2022-04-17 15:03:48.881
625c2d63f0a5bc6c426c0b5c,Das weiße Band - Eine deutsche Kindergeschichte,2009,144 min,"Drama, History, Mystery",7.8,0.5576117392153346,"Strange events happen in a small village in the north of Germany during the years before World War I, which seem to be ritual punishment. Who is responsible?",82.0,Michael Haneke,"['Christian Friedel', 'Ernst Jacobi', 'Leonie Benesch', 'Ulrich Tukur']",68715,2022-04-17 15:08:19.374,2022-04-17 15:08:19.374
625c2cf4f0a5bc6c426c0a34,Bronenosets Potemkin,1925,75 min,"Drama, History, Thriller",8.0,2.1443964747789557,"In the midst of the Russian Revolution of 1905, the crew of the battleship Potemkin mutiny against the brutal, tyrannical regime of the vessel's officers. The resulting street demonstration in Odessa brings on a police massacre.",97.0,Sergei M. Eisenstein,"['Aleksandr Antonov', 'Vladimir Barskiy', 'Grigoriy Aleksandrov', 'Ivan Bobrov']",53054,2022-04-17 15:06:28.685,2022-04-17 15:06:28.685
625c2dd6f0a5bc6c426c0c9a,Joyeux Noël,2005,116 min,"Drama, History, Music",7.7,4.205359214464927,"In December 1914, an unofficial Christmas truce on the Western Front allows soldiers from opposing sides of the First World War to gain insight into each other's way of life.",70.0,Christian Carion,"['Diane Kruger', 'Benno Fürmann', 'Guillaume Canet', 'Natalie Dessay']",28003,2022-04-17 15:10:14.276,2022-04-17 15:10:14.276
625c2c6bf0a5bc6c426c08e0,El ángel exterminador,1962,95 min,"Drama, Fantasy",8.1,3.6694504313842256,The guests at an upper-class dinner party find themselves unable to leave.,,Luis Buñuel,"['Silvia Pinal', 'Jacqueline Andere', 'Enrique Rambal', 'José Baviera']",29682,2022-04-17 15:04:11.769,2022-04-17 15:04:11.769
625c2d7ef0a5bc6c426c0b80,The Curious Case of Benjamin Button,2008,166 min,"Drama, Fantasy, Romance",7.8,1.0792730632497038,"Tells the story of Benjamin Button, a man who starts aging backwards with consequences.",70.0,David Fincher,"['Brad Pitt', 'Cate Blanchett', 'Tilda Swinton', 'Julia Ormond']",589160,2022-04-17 15:08:46.147,2022-04-17 15:08:46.147
625c2d34f0a5bc6c426c0ab0,Edward Scissorhands,1990,105 min,"Drama, Fantasy, Romance",7.9,3.2343459156941936,"An artificial man, who was incompletely constructed and has scissors for hands, leads a solitary life. Then one day, a suburban lady meets him and introduces him to her world.",74.0,Tim Burton,"['Johnny Depp', 'Winona Ryder', 'Dianne Wiest', 'Anthony Michael Hall']",447368,2022-04-17 15:07:32.614,2022-04-17 15:07:32.614
625c2dddf0a5bc6c426c0cc4,Black Hawk Down,2001,144 min,"Drama, History, War",7.7,0.43834779700151816,160 elite U.S. soldiers drop into Somalia to capture two top lieutenants of a renegade warlord and find themselves in a desperate battle with a large force of heavily-armed Somalis.,74.0,Ridley Scott,"['Josh Hartnett', 'Ewan McGregor', 'Tom Sizemore', 'Eric Bana']",364254,2022-04-17 15:10:21.928,2022-04-17 15:10:21.928
625c2c7cf0a5bc6c426c0920,Airlift,2016,130 min,"Drama, History",8.0,3.5530194931484447,"When Iraq invades Kuwait in August 1990, a callous Indian businessman becomes the spokesperson for more than 170,000 stranded countrymen.",,Raja Menon,"['Akshay Kumar', 'Nimrat Kaur', 'Kumud Mishra', 'Prakash Belawadi']",52897,2022-04-17 15:04:28.976,2022-04-17 15:04:28.976
625c2d7df0a5bc6c426c0b78,Mr. Nobody,2009,141 min,"Drama, Fantasy, Romance",7.8,2.489776081254292,"A boy stands on a station platform as a train is about to leave. Should he go with his mother or stay with his father? Infinite possibilities arise from this decision. As long as he doesn't choose, anything is possible.",63.0,Jaco Van Dormael,"['Jared Leto', 'Sarah Polley', 'Diane Kruger', 'Linh Dan Pham']",216421,2022-04-17 15:08:45.287,2022-04-17 15:08:45.287
625c2d63f0a5bc6c426c0b60,The Trial of the Chicago 7,2020,129 min,"Drama, History, Thriller",7.8,3.7002495069935493,"The story of 7 people on trial stemming from various charges surrounding the uprising at the 1968 Democratic National Convention in Chicago, Illinois.",77.0,Aaron Sorkin,"['Eddie Redmayne', 'Alex Sharp', 'Sacha Baron Cohen', 'Jeremy Strong']",89896,2022-04-17 15:08:19.857,2022-04-17 15:08:19.857
625c2cf2f0a5bc6c426c0a2a,The Grapes of Wrath,1940,129 min,"Drama, History",8.0,0.8981540500842844,"A poor Midwest family is forced off their land. They travel to California, suffering the misfortunes of the homeless in the Great Depression.",96.0,John Ford,"['Henry Fonda', 'Jane Darwell', 'John Carradine', 'Charley Grapewin']",85559,2022-04-17 15:06:26.210,2022-04-17 15:06:26.210
625c2c57f0a5bc6c426c08b8,Pink Floyd: The Wall,1982,95 min,"Drama, Fantasy, Music",8.1,4.495346475356038,A confined but troubled rock star descends into madness in the midst of his physical and social isolation from everyone.,47.0,Alan Parker,"['Bob Geldof', 'Christine Hargreaves', 'James Laurenson', 'Eleanor David']",76081,2022-04-17 15:03:51.343,2022-04-17 15:03:51.343
625c2c71f0a5bc6c426c08f6,Kumonosu-jô,1957,110 min,"Drama, History",8.1,1.0643324900382578,"A war-hardened general, egged on by his ambitious wife, works to fulfill a prophecy that he would become lord of Spider's Web Castle.",,Akira Kurosawa,"['Toshirô Mifune', 'Minoru Chiaki', 'Isuzu Yamada', 'Takashi Shimura']",46678,2022-04-17 15:04:17.010,2022-04-17 15:04:17.010
625c2bf1f0a5bc6c426c07c4,Pan's Labyrinth,2006,118 min,"Drama, Fantasy, War",8.2,2.6067831839176803,"In the Falangist Spain of 1944, the bookish young stepdaughter of a sadistic army officer escapes into an eerie but captivating fantasy world.",98.0,Guillermo del Toro,"['Ivana Baquero', 'Ariadna Gil', 'Sergi López', 'Maribel Verdú']",618623,2022-04-17 15:02:09.605,2022-04-17 15:02:09.605
625c2e2bf0a5bc6c426c0e04,Enemy at the Gates,2001,131 min,"Drama, History, War",7.6,1.3612616347626427,A Russian and a German sniper play a game of cat-and-mouse during the Battle of Stalingrad.,53.0,Jean-Jacques Annaud,"['Jude Law', 'Ed Harris', 'Joseph Fiennes', 'Rachel Weisz']",243729,2022-04-17 15:11:39.394,2022-04-17 15:11:39.394
625c2d1ef0a5bc6c426c0a76,The Man from Earth,2007,87 min,"Drama, Fantasy, Mystery",7.9,0.40599835566297426,An impromptu goodbye party for Professor John Oldman becomes a mysterious interrogation after the retiring scholar reveals to his colleagues he has a longer and stranger past than they can imagine.,,Richard Schenkman,"['David Lee Smith', 'Tony Todd', 'John Billingsley', 'Ellen Crawford']",174125,2022-04-17 15:07:10.943,2022-04-17 15:07:10.943
625c2cdbf0a5bc6c426c09d0,Kagemusha,1980,180 min,"Drama, History, War",8.0,2.575765341504679,A petty thief with an utter resemblance to a samurai warlord is hired as the lord's double. When the warlord later dies the thief is forced to take up arms in his place.,84.0,Akira Kurosawa,"['Tatsuya Nakadai', 'Tsutomu Yamazaki', ""Ken'ichi Hagiwara"", 'Jinpachi Nezu']",32195,2022-04-17 15:06:03.123,2022-04-17 15:06:03.123
625c2cd2f0a5bc6c426c09b8,JFK,1991,189 min,"Drama, History, Thriller",8.0,2.004578598358332,New Orleans District Attorney Jim Garrison discovers there's more to the Kennedy assassination than the official story.,72.0,Oliver Stone,"['Kevin Costner', 'Gary Oldman', 'Jack Lemmon', 'Walter Matthau']",142110,2022-04-17 15:05:54.562,2022-04-17 15:05:54.562
