_id,title,release,duration,gerne,IMDB_Rating,rating,overview,metaScore,director,stars,noOfVotes,createdAt,updatedAt
625c2e04f0a5bc6c426c0d70,The Invisible Man,1933,71 min,"Horror, Sci-Fi",7.7,3.1089603653427043,"A scientist finds a way of becoming invisible, but in doing so, he becomes murderously insane.",87.0,James Whale,"['Claude Rains', 'Gloria Stuart', 'William Harrigan', 'Henry Travers']",30683,2022-04-17 15:11:00.408,2022-04-17 15:11:00.408
625c2c57f0a5bc6c426c08b6,The Thing,1982,109 min,"Horror, Mystery, Sci-Fi",8.1,1.4454344869499203,A research team in Antarctica is hunted by a shape-shifting alien that assumes the appearance of its victims.,57.0,John Carpenter,"['Kurt Russell', 'Wilford Brimley', 'Keith David', 'Richard Masur']",371271,2022-04-17 15:03:51.130,2022-04-17 15:03:51.130
625c2cd5f0a5bc6c426c09c2,Akira,1988,124 min,"Animation, Action, Sci-Fi",8.0,0.12689751269910343,A secret military project endangers Neo-Tokyo when it turns a biker gang member into a rampaging psychic psychopath who can only be stopped by two teenagers and a group of psychics.,,Katsuhiro Ôtomo,"['Mitsuo Iwata', 'Nozomu Sasaki', 'Mami Koyama', 'Tesshô Genda']",164918,2022-04-17 15:05:57.337,2022-04-17 15:05:57.337
625c2c67f0a5bc6c426c08d4,Solaris,1972,167 min,"Drama, Mystery, Sci-Fi",8.1,0.4436238523485625,A psychologist is sent to a station orbiting a distant planet in order to discover what has caused the crew to go insane.,90.0,Andrei Tarkovsky,"['Natalya Bondarchuk', 'Donatas Banionis', 'Jüri Järvet', 'Vladislav Dvorzhetskiy']",81021,2022-04-17 15:04:07.159,2022-04-17 15:04:07.159
625c2d8df0a5bc6c426c0bb4,Gattaca,1997,106 min,"Drama, Sci-Fi, Thriller",7.8,2.311791246259214,A genetically inferior man assumes the identity of a superior one in order to pursue his lifelong dream of space travel.,64.0,Andrew Niccol,"['Ethan Hawke', 'Uma Thurman', 'Jude Law', 'Gore Vidal']",280845,2022-04-17 15:09:01.127,2022-04-17 15:09:01.127
625c2d06f0a5bc6c426c0a50,Arrival,2016,116 min,"Drama, Sci-Fi",7.9,4.181641793661651,A linguist works with the military to communicate with alien lifeforms after twelve mysterious spacecrafts appear around the world.,81.0,Denis Villeneuve,"['Amy Adams', 'Jeremy Renner', 'Forest Whitaker', 'Michael Stuhlbarg']",594181,2022-04-17 15:06:46.569,2022-04-17 15:06:46.569
625c2b4ff0a5bc6c426c06a8,Inception,2010,148 min,"Action, Adventure, Sci-Fi",8.8,1.8468510658894655,A thief who steals corporate secrets through the use of dream-sharing technology is given the inverse task of planting an idea into the mind of a C.E.O.,74.0,Christopher Nolan,"['Leonardo DiCaprio', 'Joseph Gordon-Levitt', 'Elliot Page', 'Ken Watanabe']",2067042,2022-04-17 14:59:27.204,2022-04-17 14:59:27.204
625c2da1f0a5bc6c426c0bf8,E.T. the Extra-Terrestrial,1982,115 min,"Family, Sci-Fi",7.8,4.52197288653216,A troubled child summons the courage to help a friendly alien escape Earth and return to his home world.,91.0,Steven Spielberg,"['Henry Thomas', 'Drew Barrymore', 'Peter Coyote', 'Dee Wallace']",372490,2022-04-17 15:09:21.975,2022-04-17 15:09:21.975
625c2bd8f0a5bc6c426c0794,Metropolis,1927,153 min,"Drama, Sci-Fi",8.3,1.6598608665814463,"In a futuristic city sharply divided between the working class and the city planners, the son of the city's mastermind falls in love with a working-class prophet who predicts the coming of a savior to mediate their differences.",98.0,Fritz Lang,"['Brigitte Helm', 'Alfred Abel', 'Gustav Fröhlich', 'Rudolf Klein-Rogge']",159992,2022-04-17 15:01:44.229,2022-04-17 15:01:44.229
625c2c04f0a5bc6c426c07f4,Stalker,1979,162 min,"Drama, Sci-Fi",8.2,2.1102227269198,A guide leads two men through an area known as the Zone to find a room that grants wishes.,,Andrei Tarkovsky,"['Alisa Freyndlikh', 'Aleksandr Kaydanovskiy', 'Anatoliy Solonitsyn', 'Nikolay Grinko']",116945,2022-04-17 15:02:28.787,2022-04-17 15:02:28.787
625c2d22f0a5bc6c426c0a84,Iron Man,2008,126 min,"Action, Adventure, Sci-Fi",7.9,0.33870228928470136,"After being held captive in an Afghan cave, billionaire engineer Tony Stark creates a unique weaponized suit of armor to fight evil.",79.0,Jon Favreau,"['Robert Downey Jr.', 'Gwyneth Paltrow', 'Terrence Howard', 'Jeff Bridges']",939644,2022-04-17 15:07:14.806,2022-04-17 15:07:14.806
625c2b56f0a5bc6c426c06b4,The Matrix,1999,136 min,"Action, Sci-Fi",8.7,0.9890411364847818,"When a beautiful stranger leads computer hacker Neo to a forbidding underworld, he discovers the shocking truth--the life he knows is the elaborate deception of an evil cyber-intelligence.",73.0,Lana Wachowski,"['Lilly Wachowski', 'Keanu Reeves', 'Laurence Fishburne', 'Carrie-Anne Moss']",1676426,2022-04-17 14:59:34.862,2022-04-17 14:59:34.862
625c2c30f0a5bc6c426c0856,Mad Max: Fury Road,2015,120 min,"Action, Adventure, Sci-Fi",8.1,1.7800853979738818,"In a post-apocalyptic wasteland, a woman rebels against a tyrannical ruler in search for her homeland with the aid of a group of female prisoners, a psychotic worshiper, and a drifter named Max.",90.0,George Miller,"['Tom Hardy', 'Charlize Theron', 'Nicholas Hoult', 'Zoë Kravitz']",882316,2022-04-17 15:03:12.895,2022-04-17 15:03:12.895
625c2dd4f0a5bc6c426c0c90,Ex Machina,2014,108 min,"Drama, Sci-Fi, Thriller",7.7,1.7764413311231964,A young programmer is selected to participate in a ground-breaking experiment in synthetic intelligence by evaluating the human qualities of a highly advanced humanoid A.I.,78.0,Alex Garland,"['Alicia Vikander', 'Domhnall Gleeson', 'Oscar Isaac', 'Sonoya Mizuno']",474141,2022-04-17 15:10:12.681,2022-04-17 15:10:12.681
625c2ce2f0a5bc6c426c09de,The Exorcist,1973,122 min,Horror,8.0,3.3711224643142748,"When a 12-year-old girl is possessed by a mysterious entity, her mother seeks the help of two priests to save her.",81.0,William Friedkin,"['Ellen Burstyn', 'Max von Sydow', 'Linda Blair', 'Lee J. Cobb']",362393,2022-04-17 15:06:10.229,2022-04-17 15:06:10.229
625c2d98f0a5bc6c426c0be2,Predator,1987,107 min,"Action, Adventure, Sci-Fi",7.8,4.434946665068128,A team of commandos on a mission in a Central American jungle find themselves hunted by an extraterrestrial warrior.,45.0,John McTiernan,"['Arnold Schwarzenegger', 'Carl Weathers', 'Kevin Peter Hall', 'Elpidia Carrillo']",371387,2022-04-17 15:09:12.156,2022-04-17 15:09:12.156
625c2cd0f0a5bc6c426c09aa,Twelve Monkeys,1995,129 min,"Mystery, Sci-Fi, Thriller",8.0,3.4040948318837594,"In a future world devastated by disease, a convict is sent back in time to gather information about the man-made virus that wiped out most of the human population on the planet.",74.0,Terry Gilliam,"['Bruce Willis', 'Madeleine Stowe', 'Brad Pitt', 'Joseph Melito']",578443,2022-04-17 15:05:52.605,2022-04-17 15:05:52.605
625c2d83f0a5bc6c426c0b8c,Serenity,2005,119 min,"Action, Adventure, Sci-Fi",7.8,3.203980562975448,The crew of the ship Serenity try to evade an assassin sent to recapture one of their members who is telepathic.,74.0,Joss Whedon,"['Nathan Fillion', 'Gina Torres', 'Chiwetel Ejiofor', 'Alan Tudyk']",283310,2022-04-17 15:08:51.664,2022-04-17 15:08:51.664
625c2b5df0a5bc6c426c06c2,Interstellar,2014,169 min,"Adventure, Drama, Sci-Fi",8.6,3.318975522120321,A team of explorers travel through a wormhole in space in an attempt to ensure humanity's survival.,74.0,Christopher Nolan,"['Matthew McConaughey', 'Anne Hathaway', 'Jessica Chastain', 'Mackenzie Foy']",1512360,2022-04-17 14:59:41.354,2022-04-17 14:59:41.354
625c2d13f0a5bc6c426c0a68,District 9,2009,112 min,"Action, Sci-Fi, Thriller",7.9,1.2188541888019433,Violence ensues after an extraterrestrial race forced to live in slum-like conditions on Earth finds a kindred spirit in a government agent exposed to their biotechnology.,81.0,Neill Blomkamp,"['Sharlto Copley', 'David James', 'Jason Cope', 'Nathalie Boltt']",638202,2022-04-17 15:06:59.159,2022-04-17 15:06:59.159
