_id,title,release,duration,gerne,IMDB_Rating,rating,overview,metaScore,director,stars,noOfVotes,createdAt,updatedAt
625c2bb9f0a5bc6c426c0736,Witness for the Prosecution,1957,116 min,"Crime, Drama, Mystery",8.4,4.428824742858506,A veteran British barrister must defend his client in a murder trial that has surprise after surprise.,,Billy Wilder,"['Tyrone Power', 'Marlene Dietrich', 'Charles Laughton', 'Elsa Lanchester']",108862,2022-04-17 15:01:13.540,2022-04-17 15:01:13.540
625c2d60f0a5bc6c426c0b4e,The Girl with the Dragon Tattoo,2011,158 min,"Crime, Drama, Mystery",7.8,1.4927004395228083,"Journalist Mikael Blomkvist is aided in his search for a woman who has been missing for forty years by Lisbeth Salander, a young computer hacker.",71.0,David Fincher,"['Daniel Craig', 'Rooney Mara', 'Christopher Plummer', 'Stellan Skarsgård']",423010,2022-04-17 15:08:16.635,2022-04-17 15:08:16.635
625c2e23f0a5bc6c426c0dca,Inside Man,2006,129 min,"Crime, Drama, Mystery",7.6,1.3746465846292977,"A police detective, a bank robber, and a high-power broker enter high-stakes negotiations after the criminal's brilliant heist spirals into a hostage situation.",76.0,Spike Lee,"['Denzel Washington', 'Clive Owen', 'Jodie Foster', 'Christopher Plummer']",339757,2022-04-17 15:11:31.860,2022-04-17 15:11:31.860
625c2d57f0a5bc6c426c0b28,The Hateful Eight,2015,168 min,"Crime, Drama, Mystery",7.8,1.5927685431898764,"In the dead of a Wyoming winter, a bounty hunter and his prisoner find shelter in a cabin currently inhabited by a collection of nefarious characters.",68.0,Quentin Tarantino,"['Samuel L. Jackson', 'Kurt Russell', 'Jennifer Jason Leigh', 'Walton Goggins']",517059,2022-04-17 15:08:07.632,2022-04-17 15:08:07.632
625c2cecf0a5bc6c426c0a02,Anatomy of a Murder,1959,161 min,"Crime, Drama, Mystery",8.0,2.0008395354137987,"In a murder trial, the defendant says he suffered temporary insanity after the victim raped his wife. What is the truth, and will he win his case?",95.0,Otto Preminger,"['James Stewart', 'Lee Remick', 'Ben Gazzara', ""Arthur O'Connell""]",59847,2022-04-17 15:06:20.767,2022-04-17 15:06:20.767
625c2deef0a5bc6c426c0d06,Glengarry Glen Ross,1992,100 min,"Crime, Drama, Mystery",7.7,0.002808918853294262,An examination of the machinations behind the scenes at a real estate office.,82.0,James Foley,"['Al Pacino', 'Jack Lemmon', 'Alec Baldwin', 'Alan Arkin']",95826,2022-04-17 15:10:38.259,2022-04-17 15:10:38.259
625c2db8f0a5bc6c426c0c3e,Wind River,2017,107 min,"Crime, Drama, Mystery",7.7,2.5,A veteran hunter helps an FBI agent investigate the murder of a young woman on a Wyoming Native American reservation.,73.0,Taylor Sheridan,"['Kelsey Asbille', 'Jeremy Renner', 'Julia Jones', 'Teo Briones']",205444,2022-04-17 15:09:44.792,2022-04-18 04:08:04.640
625c2df3f0a5bc6c426c0d1a,Der Name der Rose,1986,130 min,"Crime, Drama, Mystery",7.7,4.433988159634847,An intellectually nonconformist friar investigates a series of mysterious deaths in an isolated abbey.,54.0,Jean-Jacques Annaud,"['Sean Connery', 'Christian Slater', 'Helmut Qualtinger', 'Elya Baskin']",102031,2022-04-17 15:10:43.316,2022-04-17 15:10:43.316
625c2d63f0a5bc6c426c0b5e,Män som hatar kvinnor,2009,152 min,"Crime, Drama, Mystery",7.8,4.1763922606534445,A journalist is aided by a young female hacker in his search for the killer of a woman who has been dead for forty years.,76.0,Niels Arden Oplev,"['Michael Nyqvist', 'Noomi Rapace', 'Ewa Fröling', 'Lena Endre']",208994,2022-04-17 15:08:19.625,2022-04-17 15:08:19.625
625c2b62f0a5bc6c426c06d0,The Silence of the Lambs,1991,118 min,"Crime, Drama, Thriller",8.6,0.6873090839614726,"A young F.B.I. cadet must receive the help of an incarcerated and manipulative cannibal killer to help catch another serial killer, a madman who skins his victims.",85.0,Jonathan Demme,"['Jodie Foster', 'Anthony Hopkins', 'Lawrence A. Bonney', 'Kasi Lemmons']",1270197,2022-04-17 14:59:46.727,2022-04-17 14:59:46.727
625c2d5ef0a5bc6c426c0b42,La migliore offerta,2013,131 min,"Crime, Drama, Mystery",7.8,0.5737262831631318,A lonely art expert working for a mysterious and reclusive heiress finds not only her art worth examining.,49.0,Giuseppe Tornatore,"['Geoffrey Rush', 'Jim Sturgess', 'Sylvia Hoeks', 'Donald Sutherland']",108399,2022-04-17 15:08:14.812,2022-04-17 15:08:14.812
625c2be0f0a5bc6c426c07a2,Talvar,2015,132 min,"Crime, Drama, Mystery",8.2,3.2725202134333387,An experienced investigator confronts several conflicting theories about the perpetrators of a violent double homicide.,,Meghna Gulzar,"['Irrfan Khan', 'Konkona Sen Sharma', 'Neeraj Kabi', 'Sohum Shah']",31142,2022-04-17 15:01:52.614,2022-04-17 15:01:52.614
625c2de6f0a5bc6c426c0cee,Primal Fear,1996,129 min,"Crime, Drama, Mystery",7.7,1.316213584063698,"An altar boy is accused of murdering a priest, and the truth is buried several layers deep.",47.0,Gregory Hoblit,"['Richard Gere', 'Laura Linney', 'Edward Norton', 'John Mahoney']",189716,2022-04-17 15:10:30.101,2022-04-17 15:10:30.101
625c2c68f0a5bc6c426c08d6,Le samouraï,1967,105 min,"Crime, Drama, Mystery",8.1,1.7896317875337997,After professional hitman Jef Costello is seen by witnesses his efforts to provide himself an alibi drive him further into a corner.,,Jean-Pierre Melville,"['Alain Delon', 'François Périer', 'Nathalie Delon', 'Cathy Rosier']",45434,2022-04-17 15:04:08.610,2022-04-17 15:04:08.610
625c2bb2f0a5bc6c426c0726,Once Upon a Time in America,1984,229 min,"Crime, Drama",8.4,1.3927572089042162,"A former Prohibition-era Jewish gangster returns to the Lower East Side of Manhattan over thirty years later, where he once again must confront the ghosts and regrets of his old life.",,Sergio Leone,"['Robert De Niro', 'James Woods', 'Elizabeth McGovern', 'Treat Williams']",311365,2022-04-17 15:01:06.276,2022-04-17 15:01:06.276
625c2c72f0a5bc6c426c08fa,On the Waterfront,1954,108 min,"Crime, Drama, Thriller",8.1,1.8318265745719575,An ex-prize fighter turned longshoreman struggles to stand up to his corrupt union bosses.,91.0,Elia Kazan,"['Marlon Brando', 'Karl Malden', 'Lee J. Cobb', 'Rod Steiger']",142107,2022-04-17 15:04:18.681,2022-04-17 15:04:18.681
625c2ceef0a5bc6c426c0a0c,The Night of the Hunter,1955,92 min,"Crime, Drama, Film-Noir",8.0,0.9752913755195003,"A religious fanatic marries a gullible widow whose young children are reluctant to tell him where their real daddy hid the $10,000 he'd stolen in a robbery.",99.0,Charles Laughton,"['Robert Mitchum', 'Shelley Winters', 'Lillian Gish', 'James Gleason']",81980,2022-04-17 15:06:22.798,2022-04-17 15:06:22.798
625c2ccef0a5bc6c426c0998,Dancer in the Dark,2000,140 min,"Crime, Drama, Musical",8.0,2.603224951332841,"An East European girl travels to the United States with her young son, expecting it to be like a Hollywood film.",61.0,Lars von Trier,"['Björk', 'Catherine Deneuve', 'David Morse', 'Peter Stormare']",102285,2022-04-17 15:05:50.637,2022-04-17 15:05:50.637
625c2e24f0a5bc6c426c0dcc,Gone Baby Gone,2007,114 min,"Crime, Drama, Mystery",7.6,4.121219847567806,"Two Boston area detectives investigate a little girl's kidnapping, which ultimately turns into a crisis both professionally and personally.",72.0,Ben Affleck,"['Morgan Freeman', 'Ed Harris', 'Casey Affleck', 'Michelle Monaghan']",250590,2022-04-17 15:11:32.062,2022-04-17 15:11:32.062
625c2c15f0a5bc6c426c0824,Contratiempo,2016,106 min,"Crime, Drama, Mystery",8.1,1.3774072784193292,A successful entrepreneur accused of murder and a witness preparation expert have less than three hours to come up with an impregnable defense.,,Oriol Paulo,"['Mario Casas', 'Ana Wagener', 'Jose Coronado', 'Bárbara Lennie']",141516,2022-04-17 15:02:45.439,2022-04-17 15:02:45.439
