_id,title,release,duration,gerne,IMDB_Rating,rating,overview,metaScore,director,stars,noOfVotes,createdAt,updatedAt
625c2cfbf0a5bc6c426c0a46,Captain Fantastic,2016,118 min,"Comedy, Drama",7.9,3.5701799330001927,"In the forests of the Pacific Northwest, a father devoted to raising his six kids with a rigorous physical and intellectual education is forced to leave his paradise and enter the world, challenging his idea of what it means to be a parent.",72.0,Matt Ross,"['Viggo Mortensen', 'George MacKay', 'Samantha Isler', 'Annalise Basso']",189400,2022-04-17 15:06:35.672,2022-04-17 15:06:35.672
625c2bdbf0a5bc6c426c0798,Chhichhore,2019,143 min,"Comedy, Drama",8.2,4.55227716993183,"A tragic incident forces Anirudh, a middle-aged man, to take a trip down memory lane and reminisce his college days along with his friends, who were labelled as losers.",,Nitesh Tiwari,"['Sushant Singh Rajput', 'Shraddha Kapoor', 'Varun Sharma', 'Prateik']",33893,2022-04-17 15:01:47.492,2022-04-17 15:01:47.492
625c2d7df0a5bc6c426c0b7c,Little Miss Sunshine,2006,101 min,"Comedy, Drama",7.8,3.547795617340049,A family determined to get their young daughter into the finals of a beauty pageant take a cross-country trip in their VW bus.,80.0,Jonathan Dayton,"['Valerie Faris', 'Steve Carell', 'Toni Collette', 'Greg Kinnear']",439856,2022-04-17 15:08:45.694,2022-04-17 15:08:45.694
625c2d38f0a5bc6c426c0ac2,Manhattan,1979,96 min,"Comedy, Drama, Romance",7.9,1.2750438494021743,The life of a divorced television writer dating a teenage girl is further complicated when he falls in love with his best friend's mistress.,83.0,Woody Allen,"['Woody Allen', 'Diane Keaton', 'Mariel Hemingway', 'Michael Murphy']",131436,2022-04-17 15:07:36.029,2022-04-17 15:07:36.029
625c2de1f0a5bc6c426c0cda,Happiness,1998,134 min,"Comedy, Drama",7.7,2.1681064599251734,"The lives of several individuals intertwine as they go about their lives in their own unique ways, engaging in acts society as a whole might find disturbing in a desperate search for human connection.",81.0,Todd Solondz,"['Jane Adams', 'Jon Lovitz', 'Philip Seymour Hoffman', 'Dylan Baker']",66408,2022-04-17 15:10:25.629,2022-04-17 15:10:25.629
625c2ccdf0a5bc6c426c0992,Vizontele,2001,110 min,"Comedy, Drama",8.0,1.4120134484560687,Lives of residents in a small Anatolian village change when television is introduced to them,,Yilmaz Erdogan,"['Ömer Faruk Sorak', 'Yilmaz Erdogan', 'Demet Akbag', 'Altan Erkekli']",33592,2022-04-17 15:05:49.380,2022-04-17 15:05:49.380
625c2d51f0a5bc6c426c0b14,Perfetti sconosciuti,2016,96 min,"Comedy, Drama",7.8,1.357510889281348,"Seven long-time friends get together for a dinner. When they decide to share with each other the content of every text message, email and phone call they receive, many secrets start to unveil and the equilibrium trembles.",,Paolo Genovese,"['Giuseppe Battiston', 'Anna Foglietta', 'Marco Giallini', 'Edoardo Leo']",57168,2022-04-17 15:08:01.851,2022-04-17 15:08:01.851
625c2c1ef0a5bc6c426c0838,OMG: Oh My God!,2012,125 min,"Comedy, Drama, Fantasy",8.1,4.746396469217041,A shopkeeper takes God to court when his shop is destroyed by an earthquake.,,Umesh Shukla,"['Paresh Rawal', 'Akshay Kumar', 'Mithun Chakraborty', 'Mahesh Manjrekar']",51739,2022-04-17 15:02:54.034,2022-04-17 15:02:54.034
625c2d06f0a5bc6c426c0a4e,Jojo Rabbit,2019,108 min,"Comedy, Drama, War",7.9,3.136792486596881,A young boy in Hitler's army finds out his mother is hiding a Jewish girl in their home.,58.0,Taika Waititi,"['Roman Griffin Davis', 'Thomasin McKenzie', 'Scarlett Johansson', 'Taika Waititi']",297918,2022-04-17 15:06:46.367,2022-04-17 15:06:46.367
625c2e03f0a5bc6c426c0d66,The Quiet Man,1952,129 min,"Comedy, Drama, Romance",7.7,1.0785021289128671,"A retired American boxer returns to the village of his birth in Ireland, where he falls for a spirited redhead whose brother is contemptuous of their union.",,John Ford,"['John Wayne', ""Maureen O'Hara"", 'Barry Fitzgerald', 'Ward Bond']",34677,2022-04-17 15:10:59.371,2022-04-17 15:10:59.371
625c2d9af0a5bc6c426c0bee,The Breakfast Club,1985,97 min,"Comedy, Drama",7.8,4.5561034374727205,Five high school students meet in Saturday detention and discover how they have a lot more in common than they thought.,66.0,John Hughes,"['Emilio Estevez', 'Judd Nelson', 'Molly Ringwald', 'Ally Sheedy']",357026,2022-04-17 15:09:14.683,2022-04-17 15:09:14.683
625c2d48f0a5bc6c426c0af2,Harvey,1950,104 min,"Comedy, Drama, Fantasy",7.9,3.672078736620321,"Due to his insistence that he has an invisible six foot-tall rabbit for a best friend, a whimsical middle-aged man is thought by his family to be insane - but he may be wiser than anyone knows.",,Henry Koster,"['James Stewart', 'Wallace Ford', 'William H. Lynn', 'Victoria Horne']",52573,2022-04-17 15:07:52.918,2022-04-17 15:07:52.918
625c2d49f0a5bc6c426c0af4,Miracle on 34th Street,1947,96 min,"Comedy, Drama, Family",7.9,2.17765834885691,"When a nice old man who claims to be Santa Claus is institutionalized as insane, a young lawyer decides to defend him by arguing in court that he is the real thing.",88.0,George Seaton,"['Edmund Gwenn', ""Maureen O'Hara"", 'John Payne', 'Gene Lockhart']",41625,2022-04-17 15:07:53.137,2022-04-17 15:07:53.137
625c2cc7f0a5bc6c426c0984,Kal Ho Naa Ho,2003,186 min,"Comedy, Drama, Musical",8.0,4.582820531643581,"Naina, an introverted, perpetually depressed girl's life changes when she meets Aman. But Aman has a secret of his own which changes their lives forever. Embroiled in all this is Rohit, Naina's best friend who conceals his love for her.",54.0,Nikkhil Advani,"['Preity Zinta', 'Shah Rukh Khan', 'Saif Ali Khan', 'Jaya Bachchan']",63460,2022-04-17 15:05:43.545,2022-04-17 15:05:43.545
625c2c4af0a5bc6c426c088c,The Truman Show,1998,103 min,"Comedy, Drama",8.1,4.568644947204023,An insurance salesman discovers his whole life is actually a reality TV show.,90.0,Peter Weir,"['Jim Carrey', 'Ed Harris', 'Laura Linney', 'Noah Emmerich']",939631,2022-04-17 15:03:38.781,2022-04-17 15:03:38.781
625c2cccf0a5bc6c426c098e,Yeopgijeogin geunyeo,2001,137 min,"Comedy, Drama, Romance",8.0,4.538894738124434,"A young man sees a drunk, cute woman standing too close to the tracks at a metro station in Seoul and pulls her back. She ends up getting him into trouble repeatedly after that, starting on the train.",,Jae-young Kwak,"['Tae-Hyun Cha', 'Jun Ji-Hyun', 'In-mun Kim', 'Song Wok-suk']",45403,2022-04-17 15:05:48.984,2022-04-17 15:05:48.984
625c2dcdf0a5bc6c426c0c78,Silver Linings Playbook,2012,122 min,"Comedy, Drama, Romance",7.7,1.2132343614610053,"After a stint in a mental institution, former teacher Pat Solitano moves back in with his parents and tries to reconcile with his ex-wife. Things get more challenging when Pat meets Tiffany, a mysterious girl with problems of her own.",81.0,David O. Russell,"['Bradley Cooper', 'Jennifer Lawrence', 'Robert De Niro', 'Jacki Weaver']",661871,2022-04-17 15:10:05.742,2022-04-17 15:10:05.742
625c2c30f0a5bc6c426c0852,Zindagi Na Milegi Dobara,2011,155 min,"Comedy, Drama",8.1,0.7234510822379614,Three friends decide to turn their fantasy vacation into reality after one of their friends gets engaged.,,Zoya Akhtar,"['Hrithik Roshan', 'Farhan Akhtar', 'Abhay Deol', 'Katrina Kaif']",67927,2022-04-17 15:03:12.403,2022-04-17 15:03:12.403
625c2e03f0a5bc6c426c0d64,Sabrina,1954,113 min,"Comedy, Drama, Romance",7.7,3.493505109688775,"A playboy becomes interested in the daughter of his family's chauffeur, but it's his more serious brother who would be the better man for her.",72.0,Billy Wilder,"['Humphrey Bogart', 'Audrey Hepburn', 'William Holden', 'Walter Hampden']",59415,2022-04-17 15:10:59.169,2022-04-17 15:10:59.169
625c2cf3f0a5bc6c426c0a2e,La règle du jeu,1939,110 min,"Comedy, Drama",8.0,4.752221594103673,"A bourgeois life in France at the onset of World War II, as the rich and their poor servants meet up at a French chateau.",,Jean Renoir,"['Marcel Dalio', 'Nora Gregor', 'Paulette Dubost', 'Mila Parély']",26725,2022-04-17 15:06:27.065,2022-04-17 15:06:27.065
