_id,title,release,duration,gerne,IMDB_Rating,rating,overview,metaScore,director,stars,noOfVotes,createdAt,updatedAt
625c2cf8f0a5bc6c426c0a44,Hunt for the Wilderpeople,2016,101 min,"Adventure, Comedy, Drama",7.9,0.7640630074896559,A national manhunt is ordered for a rebellious kid and his foster uncle who go missing in the wild New Zealand bush.,81.0,Taika Waititi,"['Sam Neill', 'Julian Dennison', 'Rima Te Wiata', 'Rachel House']",111483,2022-04-17 15:06:32.350,2022-04-17 15:06:32.350
625c2e2ef0a5bc6c426c0e12,Fear and Loathing in Las Vegas,1998,118 min,"Adventure, Comedy, Drama",7.6,1.8306311624978389,An oddball journalist and his psychopathic lawyer travel to Las Vegas for a series of psychedelic escapades.,41.0,Terry Gilliam,"['Johnny Depp', 'Benicio Del Toro', 'Tobey Maguire', 'Michael Lee Gogin']",259753,2022-04-17 15:11:42.689,2022-04-17 15:11:42.689
625c2c11f0a5bc6c426c081a,The Gold Rush,1925,95 min,"Adventure, Comedy, Drama",8.2,1.6142532033985169,A prospector goes to the Klondike in search of gold and finds it and more.,,Charles Chaplin,"['Charles Chaplin', 'Mack Swain', 'Tom Murray', 'Henry Bergman']",101053,2022-04-17 15:02:41.368,2022-04-17 15:02:41.368
625c2dc9f0a5bc6c426c0c5e,Nebraska,2013,115 min,"Adventure, Comedy, Drama",7.7,4.255920613717246,"An aging, booze-addled father makes the trip from Montana to Nebraska with his estranged son in order to claim a million-dollar Mega Sweepstakes Marketing prize.",87.0,Alexander Payne,"['Bruce Dern', 'Will Forte', 'June Squibb', 'Bob Odenkirk']",112298,2022-04-17 15:10:01.379,2022-04-17 15:10:01.379
625c2be5f0a5bc6c426c07aa,Queen,2013,146 min,"Adventure, Comedy, Drama",8.2,1.739595894614402,A Delhi girl from a traditional family sets out on a solo honeymoon after her marriage gets cancelled.,,Vikas Bahl,"['Kangana Ranaut', 'Rajkummar Rao', 'Lisa Haydon', 'Jeffrey Ho']",60701,2022-04-17 15:01:57.517,2022-04-17 15:01:57.517
625c2e09f0a5bc6c426c0d80,The Peanut Butter Falcon,2019,97 min,"Adventure, Comedy, Drama",7.6,3.5878341802601676,Zak runs away from his care home to make his dream of becoming a wrestler come true.,70.0,Tyler Nilson,"['Michael Schwartz', 'Zack Gottsagen', 'Ann Owens', 'Dakota Johnson']",66346,2022-04-17 15:11:05.819,2022-04-17 15:11:05.819
625c2d2cf0a5bc6c426c0a9c,Almost Famous,2000,122 min,"Adventure, Comedy, Drama",7.9,3.5268336933392295,A high-school boy is given the chance to write a story for Rolling Stone Magazine about an up-and-coming rock band as he accompanies them on their concert tour.,90.0,Cameron Crowe,"['Billy Crudup', 'Patrick Fugit', 'Kate Hudson', 'Frances McDormand']",252586,2022-04-17 15:07:24.740,2022-04-17 15:07:24.740
625c2d20f0a5bc6c426c0a7c,Life of Pi,2012,127 min,"Adventure, Drama, Fantasy",7.9,1.6113241614736495,"A young man who survives a disaster at sea is hurtled into an epic journey of adventure and discovery. While cast away, he forms an unexpected connection with another survivor: a fearsome Bengal tiger.",79.0,Ang Lee,"['Suraj Sharma', 'Irrfan Khan', 'Adil Hussain', 'Tabu']",580708,2022-04-17 15:07:12.758,2022-04-17 15:07:12.758
625c2c48f0a5bc6c426c0886,Lagaan: Once Upon a Time in India,2001,224 min,"Adventure, Drama, Musical",8.1,1.5804432764643428,The people of a small village in Victorian India stake their future on a game of cricket against their ruthless British rulers.,84.0,Ashutosh Gowariker,"['Aamir Khan', 'Raghuvir Yadav', 'Gracy Singh', 'Rachel Shelley']",105036,2022-04-17 15:03:36.869,2022-04-17 15:03:36.869
625c2e31f0a5bc6c426c0e24,Apollo 13,PG,140 min,"Adventure, Drama, History",7.6,3.3259619087699877,NASA must devise a strategy to return Apollo 13 to Earth safely after the spacecraft undergoes massive internal damage putting the lives of the three astronauts on board in jeopardy.,77.0,Ron Howard,"['Tom Hanks', 'Bill Paxton', 'Kevin Bacon', 'Gary Sinise']",269197,2022-04-17 15:11:45.010,2022-04-17 15:11:45.010
625c2c35f0a5bc6c426c085c,Harry Potter and the Deathly Hallows: Part 2,2011,130 min,"Adventure, Drama, Fantasy",8.1,3.5987871565392346,"Harry, Ron, and Hermione search for Voldemort's remaining Horcruxes in their effort to destroy the Dark Lord as the final battle rages on at Hogwarts.",85.0,David Yates,"['Daniel Radcliffe', 'Emma Watson', 'Rupert Grint', 'Michael Gambon']",764493,2022-04-17 15:03:17.139,2022-04-17 15:03:17.139
625c2c1ef0a5bc6c426c083a,The Grand Budapest Hotel,2014,99 min,"Adventure, Comedy, Crime",8.1,1.8642273981520052,"A writer encounters the owner of an aging high-class hotel, who tells him of his early years serving as a lobby boy in the hotel's glorious years under an exceptional concierge.",88.0,Wes Anderson,"['Ralph Fiennes', 'F. Murray Abraham', 'Mathieu Amalric', 'Adrien Brody']",707630,2022-04-17 15:02:54.727,2022-04-17 15:02:54.727
625c2d53f0a5bc6c426c0b18,Paddington 2,2017,103 min,"Adventure, Comedy, Family",7.8,1.0018057753409693,"Paddington (Ben Whishaw), now happily settled with the Brown family and a popular member of the local community, picks up a series of odd jobs to buy the perfect present for his Aunt Lucy's (Imelda Staunton's) 100th birthday, only for the gift to be stolen.",88.0,Paul King,"['Ben Whishaw', 'Hugh Grant', 'Hugh Bonneville', 'Sally Hawkins']",61594,2022-04-17 15:08:03.253,2022-04-17 15:08:03.253
625c2c57f0a5bc6c426c08ba,Fitzcarraldo,1982,158 min,"Adventure, Drama",8.1,3.8126210455364262,"The story of Brian Sweeney Fitzgerald, an extremely determined man who intends to build an opera house in the middle of a jungle.",,Werner Herzog,"['Klaus Kinski', 'Claudia Cardinale', 'José Lewgoy', 'Miguel Ángel Fuentes']",31595,2022-04-17 15:03:52.000,2022-04-17 15:03:52.000
625c2d44f0a5bc6c426c0ae8,The Ten Commandments,1956,220 min,"Adventure, Drama",7.9,4.876003666433251,"Moses, an Egyptian Prince, learns of his true heritage as a Hebrew and his divine mission as the deliverer of his people.",,Cecil B. DeMille,"['Charlton Heston', 'Yul Brynner', 'Anne Baxter', 'Edward G. Robinson']",63560,2022-04-17 15:07:48.544,2022-04-17 15:07:48.544
625c2d20f0a5bc6c426c0a7a,The Fall,2006,117 min,"Adventure, Drama, Fantasy",7.9,1.4508468121286944,"In a hospital on the outskirts of 1920s Los Angeles, an injured stuntman begins to tell a fellow patient, a little girl with a broken arm, a fantastic story of five mythical heroes. Thanks to his fractured state of mind and her vivid imagination, the line between fiction and reality blurs as the tale advances.",64.0,Tarsem Singh,"['Lee Pace', 'Catinca Untaru', 'Justine Waddell', 'Kim Uylenbroek']",107290,2022-04-17 15:07:12.454,2022-04-17 15:07:12.454
625c2d2cf0a5bc6c426c0a9a,Children of Men,2006,109 min,"Adventure, Drama, Sci-Fi",7.9,2.922480744348018,"In 2027, in a chaotic world in which women have become somehow infertile, a former activist agrees to help transport a miraculously pregnant woman to a sanctuary at sea.",84.0,Alfonso Cuarón,"['Julianne Moore', 'Clive Owen', 'Chiwetel Ejiofor', 'Michael Caine']",465113,2022-04-17 15:07:24.536,2022-04-17 15:07:24.536
625c2c55f0a5bc6c426c08ae,Stand by Me,1986,89 min,"Adventure, Drama",8.1,0.913723032252528,"After the death of one of his friends, a writer recounts a childhood journey with his friends to find the body of a missing boy.",75.0,Rob Reiner,"['Wil Wheaton', 'River Phoenix', 'Corey Feldman', ""Jerry O'Connell""]",363401,2022-04-17 15:03:49.799,2022-04-17 15:03:49.799
625c2cc2f0a5bc6c426c096a,Blood Diamond,2006,143 min,"Adventure, Drama, Thriller",8.0,4.614017206212029,"A fisherman, a smuggler, and a syndicate of businessmen match wits over the possession of a priceless diamond.",64.0,Edward Zwick,"['Leonardo DiCaprio', 'Djimon Hounsou', 'Jennifer Connelly', 'Kagiso Kuypers']",499439,2022-04-17 15:05:38.749,2022-04-17 15:05:38.749
625c2b6bf0a5bc6c426c06de,The Intouchables,2011,112 min,"Biography, Comedy, Drama",8.5,2.3490517401214794,"After he becomes a quadriplegic from a paragliding accident, an aristocrat hires a young man from the projects to be his caregiver.",57.0,Olivier Nakache,"['Éric Toledano', 'François Cluzet', 'Omar Sy', 'Anne Le Ny']",760360,2022-04-17 14:59:55.866,2022-04-17 14:59:55.866
