_id,title,release,duration,gerne,IMDB_Rating,rating,overview,metaScore,director,stars,noOfVotes,createdAt,updatedAt
625c2dc8f0a5bc6c426c0c5a,Captain America: The Winter Soldier,2014,136 min,"Action, Adventure, Sci-Fi",7.7,2.0318290997880184,"As Steve Rogers struggles to embrace his role in the modern world, he teams up with a fellow Avenger and S.H.I.E.L.D agent, Black Widow, to battle a new threat from history: an assassin known as the Winter Soldier.",70.0,Anthony Russo,"['Joe Russo', 'Chris Evans', 'Samuel L. Jackson', 'Scarlett Johansson']",736182,2022-04-17 15:10:00.342,2022-04-17 15:10:00.342
625c2de4f0a5bc6c426c0ce6,The Fifth Element,1997,126 min,"Action, Adventure, Sci-Fi",7.7,2.433415548516822,"In the colorful future, a cab driver unwittingly becomes the central figure in the search for a legendary cosmic weapon to keep Evil and Mr. Zorg at bay.",52.0,Luc Besson,"['Bruce Willis', 'Milla Jovovich', 'Gary Oldman', 'Ian Holm']",434125,2022-04-17 15:10:28.716,2022-04-17 15:10:28.716
625c2dcbf0a5bc6c426c0c6c,Star Trek Into Darkness,2013,132 min,"Action, Adventure, Sci-Fi",7.7,4.597755901762404,"After the crew of the Enterprise find an unstoppable force of terror from within their own organization, Captain Kirk leads a manhunt to a war-zone world to capture a one-man weapon of mass destruction.",72.0,J.J. Abrams,"['Chris Pine', 'Zachary Quinto', 'Zoe Saldana', 'Benedict Cumberbatch']",463188,2022-04-17 15:10:03.478,2022-04-17 15:10:03.478
625c2d1df0a5bc6c426c0a72,Star Trek,2009,127 min,"Action, Adventure, Sci-Fi",7.9,0.43416366983295873,The brash James T. Kirk tries to live up to his father's legacy with Mr. Spock keeping him in check as a vengeful Romulan from the future creates black holes to destroy the Federation one planet at a time.,82.0,J.J. Abrams,"['Chris Pine', 'Zachary Quinto', 'Simon Pegg', 'Leonard Nimoy']",577336,2022-04-17 15:07:09.420,2022-04-17 15:07:09.420
625c2d06f0a5bc6c426c0a52,Star Wars: Episode VII - The Force Awakens,2015,138 min,"Action, Adventure, Sci-Fi",7.9,0.3378700271753343,"As a new threat to the galaxy rises, Rey, a desert scavenger, and Finn, an ex-stormtrooper, must join Han Solo and Chewbacca to search for the one hope of restoring peace.",80.0,J.J. Abrams,"['Daisy Ridley', 'John Boyega', 'Oscar Isaac', 'Domhnall Gleeson']",860823,2022-04-17 15:06:46.779,2022-04-17 15:06:46.779
625c2c53f0a5bc6c426c08a4,Jurassic Park,1993,127 min,"Action, Adventure, Sci-Fi",8.1,2.97622520078653,A pragmatic paleontologist visiting an almost complete theme park is tasked with protecting a couple of kids after a power failure causes the park's cloned dinosaurs to run loose.,68.0,Steven Spielberg,"['Sam Neill', 'Laura Dern', 'Jeff Goldblum', 'Richard Attenborough']",867615,2022-04-17 15:03:47.740,2022-04-17 15:03:47.740
625c2c30f0a5bc6c426c0856,Mad Max: Fury Road,2015,120 min,"Action, Adventure, Sci-Fi",8.1,1.7800853979738818,"In a post-apocalyptic wasteland, a woman rebels against a tyrannical ruler in search for her homeland with the aid of a group of female prisoners, a psychotic worshiper, and a drifter named Max.",90.0,George Miller,"['Tom Hardy', 'Charlize Theron', 'Nicholas Hoult', 'Zoë Kravitz']",882316,2022-04-17 15:03:12.895,2022-04-17 15:03:12.895
625c2df5f0a5bc6c426c0d26,Star Trek II: The Wrath of Khan,1982,113 min,"Action, Adventure, Sci-Fi",7.7,0.5026481135816119,"With the assistance of the Enterprise crew, Admiral Kirk must stop an old nemesis, Khan Noonien Singh, from using the life-generating Genesis Device as the ultimate weapon.",67.0,Nicholas Meyer,"['William Shatner', 'Leonard Nimoy', 'DeForest Kelley', 'James Doohan']",112704,2022-04-17 15:10:45.133,2022-04-17 15:10:45.133
625c2d98f0a5bc6c426c0be2,Predator,1987,107 min,"Action, Adventure, Sci-Fi",7.8,4.434946665068128,A team of commandos on a mission in a Central American jungle find themselves hunted by an extraterrestrial warrior.,45.0,John McTiernan,"['Arnold Schwarzenegger', 'Carl Weathers', 'Kevin Peter Hall', 'Elpidia Carrillo']",371387,2022-04-17 15:09:12.156,2022-04-17 15:09:12.156
625c2b4ff0a5bc6c426c06a8,Inception,2010,148 min,"Action, Adventure, Sci-Fi",8.8,1.8468510658894655,A thief who steals corporate secrets through the use of dream-sharing technology is given the inverse task of planting an idea into the mind of a C.E.O.,74.0,Christopher Nolan,"['Leonardo DiCaprio', 'Joseph Gordon-Levitt', 'Elliot Page', 'Ken Watanabe']",2067042,2022-04-17 14:59:27.204,2022-04-17 14:59:27.204
625c2dccf0a5bc6c426c0c72,X: First Class,2011,131 min,"Action, Adventure, Sci-Fi",7.7,4.994365316918015,"In the 1960s, superpowered humans Charles Xavier and Erik Lensherr work together to find others like them, but Erik's vengeful pursuit of an ambitious mutant who ruined his life causes a schism to divide them.",65.0,Matthew Vaughn,"['James McAvoy', 'Michael Fassbender', 'Jennifer Lawrence', 'Kevin Bacon']",645512,2022-04-17 15:10:04.102,2022-04-17 15:10:04.102
625c2bcaf0a5bc6c426c076c,Aliens,1986,137 min,"Action, Adventure, Sci-Fi",8.3,2.6920613139770886,"Fifty-seven years after surviving an apocalyptic attack aboard her space vessel by merciless space creatures, Officer Ripley awakens from hyper-sleep and tries to warn anyone who will listen about the predators.",84.0,James Cameron,"['Sigourney Weaver', 'Michael Biehn', 'Carrie Henn', 'Paul Reiser']",652719,2022-04-17 15:01:30.563,2022-04-17 15:01:30.563
625c2d56f0a5bc6c426c0b24,Rogue One,2016,133 min,"Action, Adventure, Sci-Fi",7.8,4.539542494135893,The daughter of an Imperial scientist joins the Rebel Alliance in a risky move to steal the plans for the Death Star.,65.0,Gareth Edwards,"['Felicity Jones', 'Diego Luna', 'Alan Tudyk', 'Donnie Yen']",556608,2022-04-17 15:08:06.791,2022-04-17 15:08:06.791
625c2d57f0a5bc6c426c0b26,Captain America: Civil War,2016,147 min,"Action, Adventure, Sci-Fi",7.8,0.21920675345824314,Political involvement in the Avengers' affairs causes a rift between Captain America and Iron Man.,75.0,Anthony Russo,"['Joe Russo', 'Chris Evans', 'Robert Downey Jr.', 'Scarlett Johansson']",663649,2022-04-17 15:08:07.418,2022-04-17 15:08:07.418
625c2ba9f0a5bc6c426c0710,Avengers: Infinity War,2018,149 min,"Action, Adventure, Sci-Fi",8.4,1.6284819178819432,The Avengers and their allies must be willing to sacrifice all in an attempt to defeat the powerful Thanos before his blitz of devastation and ruin puts an end to the universe.,68.0,Anthony Russo,"['Joe Russo', 'Robert Downey Jr.', 'Chris Hemsworth', 'Mark Ruffalo']",834477,2022-04-17 15:00:57.331,2022-04-17 15:00:57.331
625c2d09f0a5bc6c426c0a56,X-Men: Days of Future Past,2014,132 min,"Action, Adventure, Sci-Fi",7.9,3.1167413697546964,The X-Men send Wolverine to the past in a desperate effort to change history and prevent an event that results in doom for both humans and mutants.,75.0,Bryan Singer,"['Patrick Stewart', 'Ian McKellen', 'Hugh Jackman', 'James McAvoy']",659763,2022-04-17 15:06:49.097,2022-04-17 15:06:49.097
625c2d83f0a5bc6c426c0b8c,Serenity,2005,119 min,"Action, Adventure, Sci-Fi",7.8,3.203980562975448,The crew of the ship Serenity try to evade an assassin sent to recapture one of their members who is telepathic.,74.0,Joss Whedon,"['Nathan Fillion', 'Gina Torres', 'Chiwetel Ejiofor', 'Alan Tudyk']",283310,2022-04-17 15:08:51.664,2022-04-17 15:08:51.664
625c2cc0f0a5bc6c426c0962,The Avengers,2012,143 min,"Action, Adventure, Sci-Fi",8.0,3.8684126650183606,Earth's mightiest heroes must come together and learn to fight as a team if they are going to stop the mischievous Loki and his alien army from enslaving humanity.,69.0,Joss Whedon,"['Robert Downey Jr.', 'Chris Evans', 'Scarlett Johansson', 'Jeremy Renner']",1260806,2022-04-17 15:05:36.693,2022-04-17 15:05:36.693
625c2e36f0a5bc6c426c0e44,Mad Max 2,1981,96 min,"Action, Adventure, Sci-Fi",7.6,1.7432982978005707,"In the post-apocalyptic Australian wasteland, a cynical drifter agrees to help a small, gasoline-rich community escape a horde of bandits.",77.0,George Miller,"['Mel Gibson', 'Bruce Spence', 'Michael Preston', 'Max Phipps']",166588,2022-04-17 15:11:50.441,2022-04-17 15:11:50.441
625c2cc6f0a5bc6c426c0978,Casino Royale,2006,144 min,"Action, Adventure, Thriller",8.0,3.7507263564760818,"After earning 00 status and a licence to kill, Secret Agent James Bond sets out on his first mission as 007. Bond must defeat a private banker funding terrorists in a high-stakes game of poker at Casino Royale, Montenegro.",80.0,Martin Campbell,"['Daniel Craig', 'Eva Green', 'Judi Dench', 'Jeffrey Wright']",582239,2022-04-17 15:05:42.357,2022-04-17 15:05:42.357
