_id,title,release,duration,gerne,IMDB_Rating,rating,overview,metaScore,director,stars,noOfVotes,createdAt,updatedAt
625c2c41f0a5bc6c426c0874,Munna Bhai M.B.B.S.,2003,156 min,"Comedy, Drama, Musical",8.1,1.7532626607554902,A gangster sets out to fulfill his father's dream of becoming a doctor.,,Rajkumar Hirani,"['Sanjay Dutt', 'Arshad Warsi', 'Gracy Singh', 'Sunil Dutt']",73992,2022-04-17 15:03:29.341,2022-04-17 15:03:29.341
625c2c1df0a5bc6c426c0836,PK,2014,153 min,"Comedy, Drama, Musical",8.1,4.847240080608138,An alien on Earth loses the only device he can use to communicate with his spaceship. His innocent nature and child-like questions force the country to evaluate the impact of religion on its people.,,Rajkumar Hirani,"['Aamir Khan', 'Anushka Sharma', 'Sanjay Dutt', 'Boman Irani']",163061,2022-04-17 15:02:53.827,2022-04-17 15:02:53.827
625c2bf4f0a5bc6c426c07ca,Rang De Basanti,2006,167 min,"Comedy, Crime, Drama",8.2,3.0051668426589027,"The story of six young Indians who assist an English woman to film a documentary on the freedom fighters from their past, and the events that lead them to relive the long-forgotten saga of freedom.",,Rakeysh Omprakash Mehra,"['Aamir Khan', 'Soha Ali Khan', 'Siddharth', 'Sharman Joshi']",111937,2022-04-17 15:02:12.934,2022-04-17 15:02:12.934
625c2c30f0a5bc6c426c0852,Zindagi Na Milegi Dobara,2011,155 min,"Comedy, Drama",8.1,0.7234510822379614,Three friends decide to turn their fantasy vacation into reality after one of their friends gets engaged.,,Zoya Akhtar,"['Hrithik Roshan', 'Farhan Akhtar', 'Abhay Deol', 'Katrina Kaif']",67927,2022-04-17 15:03:12.403,2022-04-17 15:03:12.403
625c2c79f0a5bc6c426c090a,Mr. Smith Goes to Washington,1939,129 min,"Comedy, Drama",8.1,3.2016330807813667,"A naive man is appointed to fill a vacancy in the United States Senate. His plans promptly collide with political corruption, but he doesn't back down.",73.0,Frank Capra,"['James Stewart', 'Jean Arthur', 'Claude Rains', 'Edward Arnold']",107017,2022-04-17 15:04:25.537,2022-04-17 15:04:25.537
625c2cf5f0a5bc6c426c0a38,Dil Bechara,2020,101 min,"Comedy, Drama, Romance",7.9,1.1534461638134241,"The emotional journey of two hopelessly in love youngsters, a young girl, Kizie, suffering from cancer, and a boy, Manny, whom she meets at a support group.",,Mukesh Chhabra,"['Sushant Singh Rajput', 'Sanjana Sanghi', 'Sahil Vaid', 'Saswata Chatterjee']",111478,2022-04-17 15:06:29.100,2022-04-17 15:06:29.100
625c2d06f0a5bc6c426c0a4e,Jojo Rabbit,2019,108 min,"Comedy, Drama, War",7.9,3.136792486596881,A young boy in Hitler's army finds out his mother is hiding a Jewish girl in their home.,58.0,Taika Waititi,"['Roman Griffin Davis', 'Thomasin McKenzie', 'Scarlett Johansson', 'Taika Waititi']",297918,2022-04-17 15:06:46.367,2022-04-17 15:06:46.367
625c2dcdf0a5bc6c426c0c78,Silver Linings Playbook,2012,122 min,"Comedy, Drama, Romance",7.7,1.2132343614610053,"After a stint in a mental institution, former teacher Pat Solitano moves back in with his parents and tries to reconcile with his ex-wife. Things get more challenging when Pat meets Tiffany, a mysterious girl with problems of her own.",81.0,David O. Russell,"['Bradley Cooper', 'Jennifer Lawrence', 'Robert De Niro', 'Jacki Weaver']",661871,2022-04-17 15:10:05.742,2022-04-17 15:10:05.742
625c2d7df0a5bc6c426c0b7c,Little Miss Sunshine,2006,101 min,"Comedy, Drama",7.8,3.547795617340049,A family determined to get their young daughter into the finals of a beauty pageant take a cross-country trip in their VW bus.,80.0,Jonathan Dayton,"['Valerie Faris', 'Steve Carell', 'Toni Collette', 'Greg Kinnear']",439856,2022-04-17 15:08:45.694,2022-04-17 15:08:45.694
625c2c00f0a5bc6c426c07ea,Dom za vesanje,1988,142 min,"Comedy, Crime, Drama",8.2,1.8844619925821637,"In this luminous tale set in the area around Sarajevo and in Italy, Perhan, an engaging young Romany (gypsy) with telekinetic powers, is seduced by the quick-cash world of petty crime, which threatens to destroy him and those he loves.",,Emir Kusturica,"['Davor Dujmovic', 'Bora Todorovic', 'Ljubica Adzovic', 'Husnija Hasimovic']",26402,2022-04-17 15:02:24.901,2022-04-17 15:02:24.901
625c2e03f0a5bc6c426c0d66,The Quiet Man,1952,129 min,"Comedy, Drama, Romance",7.7,1.0785021289128671,"A retired American boxer returns to the village of his birth in Ireland, where he falls for a spirited redhead whose brother is contemptuous of their union.",,John Ford,"['John Wayne', ""Maureen O'Hara"", 'Barry Fitzgerald', 'Ward Bond']",34677,2022-04-17 15:10:59.371,2022-04-17 15:10:59.371
625c2d5ff0a5bc6c426c0b44,Moonrise Kingdom,2012,94 min,"Comedy, Drama, Romance",7.8,0.4394409345655559,"A pair of young lovers flee their New England town, which causes a local search party to fan out to find them.",84.0,Wes Anderson,"['Jared Gilman', 'Kara Hayward', 'Bruce Willis', 'Bill Murray']",318789,2022-04-17 15:08:15.015,2022-04-17 15:08:15.015
625c2decf0a5bc6c426c0cfe,The Muppet Christmas Carol,1992,85 min,"Comedy, Drama, Family",7.7,4.436602821247333,The Muppet characters tell their version of the classic tale of an old and bitter miser's redemption on Christmas Eve.,64.0,Brian Henson,"['Michael Caine', 'Kermit the Frog', 'Dave Goelz', 'Miss Piggy']",50298,2022-04-17 15:10:36.560,2022-04-17 15:10:36.560
625c2cfbf0a5bc6c426c0a46,Captain Fantastic,2016,118 min,"Comedy, Drama",7.9,3.5701799330001927,"In the forests of the Pacific Northwest, a father devoted to raising his six kids with a rigorous physical and intellectual education is forced to leave his paradise and enter the world, challenging his idea of what it means to be a parent.",72.0,Matt Ross,"['Viggo Mortensen', 'George MacKay', 'Samantha Isler', 'Annalise Basso']",189400,2022-04-17 15:06:35.672,2022-04-17 15:06:35.672
625c2c52f0a5bc6c426c08a2,Chung Hing sam lam,1994,102 min,"Comedy, Crime, Drama",8.1,4.7931157129214155,"Two melancholy Hong Kong policemen fall in love: one with a mysterious female underworld figure, the other with a beautiful and ethereal server at a late-night restaurant he frequents.",77.0,Kar-Wai Wong,"['Brigitte Lin', 'Takeshi Kaneshiro', 'Tony Chiu-Wai Leung', 'Faye Wong']",63122,2022-04-17 15:03:46.968,2022-04-17 15:03:46.968
625c2dc1f0a5bc6c426c0c50,Me and Earl and the Dying Girl,2015,105 min,"Comedy, Drama",7.7,2.728453884274172,"High schooler Greg, who spends most of his time making parodies of classic movies with his co-worker Earl, finds his outlook forever altered after befriending a classmate who has just been diagnosed with cancer.",74.0,Alfonso Gomez-Rejon,"['Thomas Mann', 'RJ Cyler', 'Olivia Cooke', 'Nick Offerman']",123210,2022-04-17 15:09:53.862,2022-04-17 15:09:53.862
625c2c42f0a5bc6c426c0878,Dil Chahta Hai,2001,183 min,"Comedy, Drama, Romance",8.1,4.842207160191137,"Three inseparable childhood friends are just out of college. Nothing comes between them - until they each fall in love, and their wildly different approaches to relationships creates tension.",,Farhan Akhtar,"['Aamir Khan', 'Saif Ali Khan', 'Akshaye Khanna', 'Preity Zinta']",66803,2022-04-17 15:03:30.319,2022-04-17 15:03:30.319
625c2de4f0a5bc6c426c0ce2,Being John Malkovich,1999,113 min,"Comedy, Drama, Fantasy",7.7,3.614905349001077,A puppeteer discovers a portal that leads literally into the head of movie star John Malkovich.,90.0,Spike Jonze,"['John Cusack', 'Cameron Diaz', 'Catherine Keener', 'John Malkovich']",312542,2022-04-17 15:10:28.330,2022-04-17 15:10:28.330
625c2e2cf0a5bc6c426c0e0a,American Psycho,2000,101 min,"Comedy, Crime, Drama",7.6,1.5025679943931158,"A wealthy New York City investment banking executive, Patrick Bateman, hides his alternate psychopathic ego from his co-workers and friends as he delves deeper into his violent, hedonistic fantasies.",64.0,Mary Harron,"['Christian Bale', 'Justin Theroux', 'Josh Lucas', 'Bill Sage']",490062,2022-04-17 15:11:40.437,2022-04-17 15:11:40.437
625c2dbdf0a5bc6c426c0c44,En man som heter Ove,2015,116 min,"Comedy, Drama, Romance",7.7,1.3772437051615438,"Ove, an ill-tempered, isolated retiree who spends his days enforcing block association rules and visiting his wife's grave, has finally given up on life just as an unlikely friendship develops with his boisterous new neighbors.",70.0,Hannes Holm,"['Rolf Lassgård', 'Bahar Pars', 'Filip Berg', 'Ida Engvoll']",47444,2022-04-17 15:09:49.326,2022-04-17 15:09:49.326
