_id,title,release,duration,gerne,IMDB_Rating,rating,overview,metaScore,director,stars,noOfVotes,createdAt,updatedAt
625c2db8f0a5bc6c426c0c3e,Wind River,2017,107 min,"Crime, Drama, Mystery",7.7,2.5,A veteran hunter helps an FBI agent investigate the murder of a young woman on a Wyoming Native American reservation.,73.0,Taylor Sheridan,"['Kelsey Asbille', 'Jeremy Renner', 'Julia Jones', 'Teo Briones']",205444,2022-04-17 15:09:44.792,2022-04-18 04:08:04.640
625c2b4ef0a5bc6c426c06a4,Pulp Fiction,1994,154 min,"Crime, Drama",8.9,4.664637176527167,"The lives of two mob hitmen, a boxer, a gangster and his wife, and a pair of diner bandits intertwine in four tales of violence and redemption.",94.0,Quentin Tarantino,"['John Travolta', 'Uma Thurman', 'Samuel L. Jackson', 'Bruce Willis']",1826188,2022-04-17 14:59:26.767,2022-04-17 14:59:26.767
625c2c82f0a5bc6c426c0936,Special Chabbis,2013,144 min,"Crime, Drama, Thriller",8.0,0.7821489988074626,A gang of con-men rob prominent rich businessmen and politicians by posing as C.B.I and income tax officers.,,Neeraj Pandey,"['Akshay Kumar', 'Anupam Kher', 'Manoj Bajpayee', 'Jimmy Sheirgill']",51069,2022-04-17 15:04:34.238,2022-04-17 15:04:34.238
625c2b47f0a5bc6c426c069a,The Godfather,1972,175 min,"Crime, Drama",9.2,1.2255383890480909,An organized crime dynasty's aging patriarch transfers control of his clandestine empire to his reluctant son.,100.0,Francis Ford Coppola,"['Marlon Brando', 'Al Pacino', 'James Caan', 'Diane Keaton']",1620367,2022-04-17 14:59:19.890,2022-04-17 14:59:19.890
625c2df3f0a5bc6c426c0d1a,Der Name der Rose,1986,130 min,"Crime, Drama, Mystery",7.7,4.433988159634847,An intellectually nonconformist friar investigates a series of mysterious deaths in an isolated abbey.,54.0,Jean-Jacques Annaud,"['Sean Connery', 'Christian Slater', 'Helmut Qualtinger', 'Elya Baskin']",102031,2022-04-17 15:10:43.316,2022-04-17 15:10:43.316
625c2e36f0a5bc6c426c0e40,Blood Simple,1984,99 min,"Crime, Drama, Thriller",7.6,1.7240105246019743,"The owner of a seedy small-town Texas bar discovers that one of his employees is having an affair with his wife. A chaotic chain of misunderstandings, lies and mischief ensues after he devises a plot to have them murdered.",82.0,Joel Coen,"['Ethan Coen', 'John Getz', 'Frances McDormand', 'Dan Hedaya']",87745,2022-04-17 15:11:50.032,2022-04-17 15:11:50.032
625c2e29f0a5bc6c426c0dee,Boksuneun naui geot,2002,129 min,"Crime, Drama, Thriller",7.6,3.179737002803803,"A recently laid off factory worker kidnaps his former boss' friend's daughter, hoping to use the ransom money to pay for his sister's kidney transplant.",56.0,Chan-wook Park,"['Kang-ho Song', 'Shin Ha-kyun', 'Bae Doona', 'Ji-Eun Lim']",62659,2022-04-17 15:11:37.126,2022-04-17 15:11:37.126
625c2d10f0a5bc6c426c0a62,Un prophète,2009,155 min,"Crime, Drama",7.9,0.5231508342104352,A young Arab man is sent to a French prison.,90.0,Jacques Audiard,"['Tahar Rahim', 'Niels Arestrup', 'Adel Bencherif', 'Reda Kateb']",93560,2022-04-17 15:06:56.893,2022-04-17 15:06:56.893
625c2c41f0a5bc6c426c0876,Salinui chueok,2003,131 min,"Crime, Drama, Mystery",8.1,0.4382935615425798,"In a small Korean province in 1986, two detectives struggle with the case of multiple young women being found raped and murdered by an unknown culprit.",82.0,Bong Joon Ho,"['Kang-ho Song', 'Kim Sang-kyung', 'Roe-ha Kim', 'Jae-ho Song']",139558,2022-04-17 15:03:29.551,2022-04-17 15:03:29.551
625c2b4cf0a5bc6c426c069e,The Godfather: Part II,1974,202 min,"Crime, Drama",9.0,4.8909190356088175,"The early life and career of Vito Corleone in 1920s New York City is portrayed, while his son, Michael, expands and tightens his grip on the family crime syndicate.",90.0,Francis Ford Coppola,"['Al Pacino', 'Robert De Niro', 'Robert Duvall', 'Diane Keaton']",1129952,2022-04-17 14:59:24.973,2022-04-17 14:59:24.973
625c2de1f0a5bc6c426c0cdc,Training Day,2001,122 min,"Crime, Drama, Thriller",7.7,3.34310148709294,A rookie cop spends his first day as a Los Angeles narcotics officer with a rogue detective who isn't what he appears to be.,69.0,Antoine Fuqua,"['Denzel Washington', 'Ethan Hawke', 'Scott Glenn', 'Tom Berenger']",390247,2022-04-17 15:10:25.837,2022-04-17 15:10:25.837
625c2c4ff0a5bc6c426c089a,La haine,1995,98 min,"Crime, Drama",8.1,4.437766803870614,24 hours in the lives of three young men in the French suburbs the day after a violent riot.,,Mathieu Kassovitz,"['Vincent Cassel', 'Hubert Koundé', 'Saïd Taghmaoui', 'Abdel Ahmed Ghili']",150345,2022-04-17 15:03:43.394,2022-04-17 15:03:43.394
625c2d63f0a5bc6c426c0b5e,Män som hatar kvinnor,2009,152 min,"Crime, Drama, Mystery",7.8,4.1763922606534445,A journalist is aided by a young female hacker in his search for the killer of a woman who has been dead for forty years.,76.0,Niels Arden Oplev,"['Michael Nyqvist', 'Noomi Rapace', 'Ewa Fröling', 'Lena Endre']",208994,2022-04-17 15:08:19.625,2022-04-17 15:08:19.625
625c2bfbf0a5bc6c426c07e0,Heat,1995,170 min,"Crime, Drama, Thriller",8.2,3.958137797978565,A group of professional bank robbers start to feel the heat from police when they unknowingly leave a clue at their latest heist.,76.0,Michael Mann,"['Al Pacino', 'Robert De Niro', 'Val Kilmer', 'Jon Voight']",577113,2022-04-17 15:02:19.834,2022-04-17 15:02:19.834
625c2c3ff0a5bc6c426c0868,No Country for Old Men,2007,122 min,"Crime, Drama, Thriller",8.1,0.47881730820227175,Violence and mayhem ensue after a hunter stumbles upon a drug deal gone wrong and more than two million dollars in cash near the Rio Grande.,91.0,Ethan Coen,"['Joel Coen', 'Tommy Lee Jones', 'Javier Bardem', 'Josh Brolin']",856916,2022-04-17 15:03:27.379,2022-04-17 15:03:27.379
625c2d62f0a5bc6c426c0b56,Madeo,2009,129 min,"Crime, Drama, Mystery",7.8,1.77415341722731,A mother desperately searches for the killer who framed her son for a girl's horrific murder.,79.0,Bong Joon Ho,"['Hye-ja Kim', 'Won Bin', 'Jin Goo', 'Je-mun Yun']",52758,2022-04-17 15:08:18.104,2022-04-17 15:08:18.104
625c2deef0a5bc6c426c0d06,Glengarry Glen Ross,1992,100 min,"Crime, Drama, Mystery",7.7,0.002808918853294262,An examination of the machinations behind the scenes at a real estate office.,82.0,James Foley,"['Al Pacino', 'Jack Lemmon', 'Alec Baldwin', 'Alan Arkin']",95826,2022-04-17 15:10:38.259,2022-04-17 15:10:38.259
625c2c69f0a5bc6c426c08d8,Cool Hand Luke,1967,127 min,"Crime, Drama",8.1,4.292952800857495,"A laid back Southern man is sentenced to two years in a rural prison, but refuses to conform.",92.0,Stuart Rosenberg,"['Paul Newman', 'George Kennedy', 'Strother Martin', 'J.D. Cannon']",161984,2022-04-17 15:04:09.394,2022-04-17 15:04:09.394
625c2dd4f0a5bc6c426c0c8c,Death Note: Desu nôto,2006,126 min,"Crime, Drama, Fantasy",7.7,0.4527374175112808,"A battle between the world's two greatest minds begins when Light Yagami finds the Death Note, a notebook with the power to kill, and decides to rid the world of criminals.",,Shûsuke Kaneko,"['Tatsuya Fujiwara', ""Ken'ichi Matsuyama"", 'Asaka Seto', 'Yû Kashii']",28630,2022-04-17 15:10:12.284,2022-04-17 15:10:12.284
625c2bc8f0a5bc6c426c0766,Reservoir Dogs,1992,99 min,"Crime, Drama, Thriller",8.3,2.54028073683074,"When a simple jewelry heist goes horribly wrong, the surviving criminals begin to suspect that one of them is a police informant.",79.0,Quentin Tarantino,"['Harvey Keitel', 'Tim Roth', 'Michael Madsen', 'Chris Penn']",918562,2022-04-17 15:01:28.908,2022-04-17 15:01:28.908
