_id,title,release,duration,gerne,IMDB_Rating,rating,overview,metaScore,director,stars,noOfVotes,createdAt,updatedAt
625c2d8af0a5bc6c426c0bac,October Sky,1999,108 min,"Biography, Drama, Family",7.8,1.4756045304490895,"The true story of Homer Hickam, a coal miner's son who was inspired by the first Sputnik launch to take up rocketry against his father's wishes.",71.0,Joe Johnston,"['Jake Gyllenhaal', 'Chris Cooper', 'Laura Dern', 'Chris Owen']",82855,2022-04-17 15:08:58.712,2022-04-17 15:08:58.712
625c2c39f0a5bc6c426c0860,Hachi: A Dog's Tale,2009,93 min,"Biography, Drama, Family",8.1,0.5833799169000464,A college professor bonds with an abandoned dog he takes into his home.,,Lasse Hallström,"['Richard Gere', 'Joan Allen', 'Cary-Hiroyuki Tagawa', 'Sarah Roemer']",253575,2022-04-17 15:03:21.939,2022-04-17 15:03:21.939
625c2ce7f0a5bc6c426c09f2,The Sound of Music,1965,172 min,"Biography, Drama, Family",8.0,2.941277592669531,A woman leaves an Austrian convent to become a governess to the children of a Naval officer widower.,63.0,Robert Wise,"['Julie Andrews', 'Christopher Plummer', 'Eleanor Parker', 'Richard Haydn']",205425,2022-04-17 15:06:15.568,2022-04-17 15:06:15.568
625c2c04f0a5bc6c426c07f2,Raging Bull,1980,129 min,"Biography, Drama, Sport",8.2,3.4701347707083716,"The life of boxer Jake LaMotta, whose violence and temper that led him to the top in the ring destroyed his life outside of it.",89.0,Martin Scorsese,"['Robert De Niro', 'Cathy Moriarty', 'Joe Pesci', 'Frank Vincent']",321860,2022-04-17 15:02:28.589,2022-04-17 15:02:28.589
625c2dcbf0a5bc6c426c0c70,The Social Network,2010,120 min,"Biography, Drama",7.7,4.395263656276355,"As Harvard student Mark Zuckerberg creates the social networking site that would become known as Facebook, he is sued by the twins who claimed he stole their idea, and by the co-founder who was later squeezed out of the business.",95.0,David Fincher,"['Jesse Eisenberg', 'Andrew Garfield', 'Justin Timberlake', 'Rooney Mara']",624982,2022-04-17 15:10:03.900,2022-04-17 15:10:03.900
625c2dfff0a5bc6c426c0d4c,A Man for All Seasons,1966,120 min,"Biography, Drama, History",7.7,4.444477388884325,"The story of Sir Thomas More, who stood up to King Henry VIII when the King rejected the Roman Catholic Church to obtain a divorce and remarry.",72.0,Fred Zinnemann,"['Paul Scofield', 'Wendy Hiller', 'Robert Shaw', 'Leo McKern']",31222,2022-04-17 15:10:55.169,2022-04-17 15:10:55.169
625c2c21f0a5bc6c426c0840,Hacksaw Ridge,2016,139 min,"Biography, Drama, History",8.1,0.6937921818386383,"World War II American Army Medic Desmond T. Doss, who served during the Battle of Okinawa, refuses to kill people, and becomes the first man in American history to receive the Medal of Honor without firing a shot.",71.0,Mel Gibson,"['Andrew Garfield', 'Sam Worthington', 'Luke Bracey', 'Teresa Palmer']",435928,2022-04-17 15:02:57.560,2022-04-17 15:02:57.560
625c2d81f0a5bc6c426c0b88,The World's Fastest Indian,2005,127 min,"Biography, Drama, Sport",7.8,2.660029036287007,"The story of New Zealander Burt Munro, who spent years rebuilding a 1920 Indian motorcycle, which helped him set the land speed world record at Utah's Bonneville Salt Flats in 1967.",68.0,Roger Donaldson,"['Anthony Hopkins', 'Diane Ladd', 'Iain Rea', 'Tessa Mitchell']",51980,2022-04-17 15:08:49.391,2022-04-17 15:08:49.391
625c2bc6f0a5bc6c426c0764,Braveheart,1995,178 min,"Biography, Drama, History",8.3,1.3338501328663621,Scottish warrior William Wallace leads his countrymen in a rebellion to free his homeland from the tyranny of King Edward I of England.,68.0,Mel Gibson,"['Mel Gibson', 'Sophie Marceau', 'Patrick McGoohan', 'Angus Macfadyen']",959181,2022-04-17 15:01:26.677,2022-04-17 15:01:26.677
625c2dfaf0a5bc6c426c0d3a,Serpico,1973,130 min,"Biography, Crime, Drama",7.7,1.064349282245547,An honest New York cop named Frank Serpico blows the whistle on rampant corruption in the force only to have his comrades turn against him.,87.0,Sidney Lumet,"['Al Pacino', 'John Randolph', 'Jack Kehoe', 'Biff McGuire']",109941,2022-04-17 15:10:50.613,2022-04-17 15:10:50.613
625c2d9af0a5bc6c426c0bf0,The Killing Fields,1984,141 min,"Biography, Drama, History",7.8,1.6736143055190922,"A journalist is trapped in Cambodia during tyrant Pol Pot's bloody 'Year Zero' cleansing campaign, which claimed the lives of two million 'undesirable' civilians.",76.0,Roland Joffé,"['Sam Waterston', 'Haing S. Ngor', 'John Malkovich', 'Julian Sands']",51585,2022-04-17 15:09:14.920,2022-04-17 15:09:14.920
625c2cb7f0a5bc6c426c094c,The King's Speech,2010,118 min,"Biography, Drama, History",8.0,0.004753147470143437,"The story of King George VI, his impromptu ascension to the throne of the British Empire in 1936, and the speech therapist who helped the unsure monarch overcome his stammer.",88.0,Tom Hooper,"['Colin Firth', 'Geoffrey Rush', 'Helena Bonham Carter', 'Derek Jacobi']",639603,2022-04-17 15:05:27.308,2022-04-17 15:05:27.308
625c2d83f0a5bc6c426c0b8e,Walk the Line,2005,136 min,"Biography, Drama, Music",7.8,4.601924225677906,"A chronicle of country music legend Johnny Cash's life, from his early days on an Arkansas cotton farm to his rise to fame with Sun Records in Memphis, where he recorded alongside Elvis Presley, Jerry Lee Lewis, and Carl Perkins.",72.0,James Mangold,"['Joaquin Phoenix', 'Reese Witherspoon', 'Ginnifer Goodwin', 'Robert Patrick']",234207,2022-04-17 15:08:51.864,2022-04-17 15:08:51.864
625c2bf9f0a5bc6c426c07d2,Der Untergang,2004,156 min,"Biography, Drama, History",8.2,4.218486384050134,"Traudl Junge, the final secretary for Adolf Hitler, tells of the Nazi dictator's final days in his Berlin bunker at the end of WWII.",82.0,Oliver Hirschbiegel,"['Bruno Ganz', 'Alexandra Maria Lara', 'Ulrich Matthes', 'Juliane Köhler']",331308,2022-04-17 15:02:17.041,2022-04-17 15:02:17.041
625c2decf0a5bc6c426c0cfe,The Muppet Christmas Carol,1992,85 min,"Comedy, Drama, Family",7.7,4.436602821247333,The Muppet characters tell their version of the classic tale of an old and bitter miser's redemption on Christmas Eve.,64.0,Brian Henson,"['Michael Caine', 'Kermit the Frog', 'Dave Goelz', 'Miss Piggy']",50298,2022-04-17 15:10:36.560,2022-04-17 15:10:36.560
625c2cc2f0a5bc6c426c0966,Dallas Buyers Club,2013,117 min,"Biography, Drama",8.0,1.6002576709964955,"In 1985 Dallas, electrician and hustler Ron Woodroof works around the system to help AIDS patients get the medication they need after he is diagnosed with the disease.",80.0,Jean-Marc Vallée,"['Matthew McConaughey', 'Jennifer Garner', 'Jared Leto', 'Steve Zahn']",441614,2022-04-17 15:05:38.380,2022-04-17 15:05:38.380
625c2e2bf0a5bc6c426c0e02,Blow,2001,124 min,"Biography, Crime, Drama",7.6,0.8605925812212689,"The story of how George Jung, along with the Medellín Cartel headed by Pablo Escobar, established the American cocaine market in the 1970s in the United States.",52.0,Ted Demme,"['Johnny Depp', 'Penélope Cruz', 'Franka Potente', 'Rachel Griffiths']",240714,2022-04-17 15:11:39.193,2022-04-17 15:11:39.193
625c2cc7f0a5bc6c426c0980,Mar adentro,2014,126 min,"Biography, Drama",8.0,1.4312562176014243,"The factual story of Spaniard Ramon Sampedro, who fought a thirty-year campaign in favor of euthanasia and his own right to die.",74.0,Alejandro Amenábar,"['Javier Bardem', 'Belén Rueda', 'Lola Dueñas', 'Mabel Rivera']",77554,2022-04-17 15:05:43.149,2022-04-17 15:05:43.149
625c2e17f0a5bc6c426c0db4,Moneyball,2011,133 min,"Biography, Drama, Sport",7.6,0.7442283167888741,Oakland A's general manager Billy Beane's successful attempt to assemble a baseball team on a lean budget by employing computer-generated analysis to acquire new players.,87.0,Bennett Miller,"['Brad Pitt', 'Robin Wright', 'Jonah Hill', 'Philip Seymour Hoffman']",369529,2022-04-17 15:11:19.337,2022-04-17 15:11:19.337
625c2c40f0a5bc6c426c086e,Hotel Rwanda,2004,121 min,"Biography, Drama, History",8.1,1.6392188208885738,"Paul Rusesabagina, a hotel manager, houses over a thousand Tutsi refugees during their struggle against the Hutu militia in Rwanda, Africa.",79.0,Terry George,"['Don Cheadle', 'Sophie Okonedo', 'Joaquin Phoenix', 'Xolani Mali']",334320,2022-04-17 15:03:28.677,2022-04-17 15:03:28.677
