_id,title,release,duration,gerne,IMDB_Rating,rating,overview,metaScore,director,stars,noOfVotes,createdAt,updatedAt
625c2baaf0a5bc6c426c0712,Coco,2017,105 min,"Animation, Adventure, Family",8.4,0.749865263545495,"Aspiring musician Miguel, confronted with his family's ancestral ban on music, enters the Land of the Dead to find his great-great-grandfather, a legendary singer.",81.0,Lee Unkrich,"['Adrian Molina', 'Anthony Gonzalez', 'Gael García Bernal', 'Benjamin Bratt']",384171,2022-04-17 15:00:58.255,2022-04-17 15:00:58.255
625c2df6f0a5bc6c426c0d2e,Rupan sansei: Kariosutoro no shiro,1979,100 min,"Animation, Adventure, Family",7.7,4.264036475891585,"A dashing thief, his gang of desperadoes and an intrepid policeman struggle to free a princess from an evil count's clutches, and learn the hidden secret to a fabulous treasure that she holds part of a key to.",71.0,Hayao Miyazaki,"['Yasuo Yamada', 'Eiko Masuyama', 'Kiyoshi Kobayashi', 'Makio Inoue']",27014,2022-04-17 15:10:46.567,2022-04-17 15:10:46.567
625c2bf9f0a5bc6c426c07d4,Hauru no ugoku shiro,2004,119 min,"Animation, Adventure, Family",8.2,3.6686801876152533,"When an unconfident young woman is cursed with an old body by a spiteful witch, her only chance of breaking the spell lies with a self-indulgent yet insecure young wizard and his companions in his legged, walking castle.",80.0,Hayao Miyazaki,"['Chieko Baishô', 'Takuya Kimura', 'Tatsuya Gashûin', 'Akihiro Miwa']",333915,2022-04-17 15:02:17.255,2022-04-17 15:02:17.255
625c2e39f0a5bc6c426c0e58,The Jungle Book,1967,78 min,"Animation, Adventure, Family",7.6,4.563968988509217,Bagheera the Panther and Baloo the Bear have a difficult time trying to convince a boy to leave the jungle for human civilization.,65.0,Wolfgang Reitherman,"['Phil Harris', 'Sebastian Cabot', 'Louis Prima', 'Bruce Reitherman']",166409,2022-04-17 15:11:53.922,2022-04-17 15:11:53.922
625c2e23f0a5bc6c426c0dc8,The Secret of Kells,2009,71 min,"Animation, Adventure, Family",7.6,4.344502342295135,"A young boy in a remote medieval outpost under siege from barbarian raids is beckoned to adventure when a celebrated master illuminator arrives with an ancient book, brimming with secret wisdom and powers.",81.0,Tomm Moore,"['Nora Twomey', 'Evan McGuire', 'Brendan Gleeson', 'Mick Lally']",31779,2022-04-17 15:11:31.651,2022-04-17 15:11:31.651
625c2e2ef0a5bc6c426c0e10,Mulan,1998,88 min,"Animation, Adventure, Family",7.6,2.1190827090458395,"To save her father from death in the army, a young maiden secretly goes in his place and becomes one of China's greatest heroines in the process.",71.0,Tony Bancroft,"['Barry Cook', 'Ming-Na Wen', 'Eddie Murphy', 'BD Wong']",256906,2022-04-17 15:11:42.478,2022-04-17 15:11:42.478
625c2e14f0a5bc6c426c0da4,Kari-gurashi no Arietti,2010,94 min,"Animation, Adventure, Family",7.6,1.029372292213514,"The Clock family are four-inch-tall people who live anonymously in another family's residence, borrowing simple items to make their home. Life changes for the Clocks when their teenage daughter, Arrietty, is discovered.",80.0,Hiromasa Yonebayashi,"['Amy Poehler', 'Mirai Shida', 'Ryûnosuke Kamiki', 'Tatsuya Fujiwara']",80939,2022-04-17 15:11:16.877,2022-04-17 15:11:16.877
625c2b5ff0a5bc6c426c06c6,Sen to Chihiro no kamikakushi,2001,125 min,"Animation, Adventure, Family",8.6,2.3795784327905833,"During her family's move to the suburbs, a sullen 10-year-old girl wanders into a world ruled by gods, witches, and spirits, and where humans are changed into beasts.",96.0,Hayao Miyazaki,"['Daveigh Chase', 'Suzanne Pleshette', 'Miyu Irino', 'Rumi Hiiragi']",651376,2022-04-17 14:59:43.906,2022-04-17 14:59:43.906
625c2be2f0a5bc6c426c07a6,Klaus,2019,96 min,"Animation, Adventure, Comedy",8.2,2.7337232377122103,"A simple act of kindness always sparks another, even in a frozen, faraway place. When Smeerensburg's new postman, Jesper, befriends toymaker Klaus, their gifts melt an age-old feud and deliver a sleigh full of holiday traditions.",65.0,Sergio Pablos,"['Carlos Martínez López', 'Jason Schwartzman', 'J.K. Simmons', 'Rashida Jones']",104761,2022-04-17 15:01:54.558,2022-04-17 15:01:54.558
625c2cc6f0a5bc6c426c0976,Ratatouille,2007,111 min,"Animation, Adventure, Comedy",8.0,4.992219541573888,A rat who can cook makes an unusual alliance with a young kitchen worker at a famous restaurant.,96.0,Brad Bird,"['Jan Pinkava', 'Brad Garrett', 'Lou Romano', 'Patton Oswalt']",641645,2022-04-17 15:05:42.158,2022-04-17 15:05:42.158
625c2c81f0a5bc6c426c092c,Zootopia,2016,108 min,"Animation, Adventure, Comedy",8.0,1.1912905476045221,"In a city of anthropomorphic animals, a rookie bunny cop and a cynical con artist fox must work together to uncover a conspiracy.",78.0,Byron Howard,"['Rich Moore', 'Jared Bush', 'Ginnifer Goodwin', 'Jason Bateman']",434143,2022-04-17 15:04:33.013,2022-04-17 15:04:33.013
625c2cd2f0a5bc6c426c09b6,Aladdin,1992,90 min,"Animation, Adventure, Comedy",8.0,1.0450264329230696,A kindhearted street urchin and a power-hungry Grand Vizier vie for a magic lamp that has the power to make their deepest wishes come true.,86.0,Ron Clements,"['John Musker', 'Scott Weinger', 'Robin Williams', 'Linda Larkin']",373845,2022-04-17 15:05:54.352,2022-04-17 15:05:54.352
625c2c1bf0a5bc6c426c0832,Soul,2020,100 min,"Animation, Adventure, Comedy",8.1,2.3014468675324515,"After landing the gig of a lifetime, a New York jazz pianist suddenly finds himself trapped in a strange land between Earth and the afterlife.",83.0,Pete Docter,"['Kemp Powers', 'Jamie Foxx', 'Tina Fey', 'Graham Norton']",159171,2022-04-17 15:02:51.545,2022-04-17 15:02:51.545
625c2d34f0a5bc6c426c0aac,Jûbê ninpûchô,1993,94 min,"Animation, Action, Adventure",7.9,1.9686669820001845,A vagabond swordsman is aided by a beautiful ninja girl and a crafty spy in confronting a demonic clan of killers - with a ghost from his past as their leader - who are bent on overthrowing the Tokugawa Shogunate.,,Yoshiaki Kawajiri,"['Kôichi Yamadera', 'Emi Shinohara', 'Takeshi Aono', 'Osamu Saka']",34529,2022-04-17 15:07:32.226,2022-04-17 15:07:32.226
625c2d96f0a5bc6c426c0bd8,Majo no takkyûbin,1989,103 min,"Animation, Adventure, Drama",7.8,3.5753197990935948,"A young witch, on her mandatory year of independent life, finds fitting into a new community difficult while she supports herself by running an air courier service.",83.0,Hayao Miyazaki,"['Kirsten Dunst', 'Minami Takayama', 'Rei Sakuma', 'Kappei Yamaguchi']",124193,2022-04-17 15:09:10.642,2022-04-17 15:09:10.642
625c2cd8f0a5bc6c426c09ca,Tenkû no shiro Rapyuta,1986,125 min,"Animation, Adventure, Drama",8.0,4.904960791004481,A young boy and a girl with a magic crystal must race against pirates and foreign agents in a search for a legendary floating castle.,78.0,Hayao Miyazaki,"['Mayumi Tanaka', 'Keiko Yokozawa', 'Kotoe Hatsui', 'Minori Terada']",150140,2022-04-17 15:06:00.298,2022-04-17 15:06:00.298
625c2c81f0a5bc6c426c0930,Kaguyahime no monogatari,2013,137 min,"Animation, Adventure, Drama",8.0,0.6749735129375334,"Found inside a shining stalk of bamboo by an old bamboo cutter and his wife, a tiny girl grows rapidly into an exquisite young lady. The mysterious young princess enthralls all who encounter her, but ultimately she must confront her fate, the punishment for her crime.",89.0,Isao Takahata,"['Chloë Grace Moretz', 'James Caan', 'Mary Steenburgen', 'James Marsden']",38746,2022-04-17 15:04:33.598,2022-04-17 15:04:33.598
625c2e04f0a5bc6c426c0d6e,Fantasia,1940,125 min,"Animation, Family, Fantasy",7.7,3.8447569862340316,A collection of animated interpretations of great works of Western classical music.,96.0,James Algar,"['Samuel Armstrong', 'Ford Beebe Jr.', 'Norman Ferguson', 'David Hand']",88662,2022-04-17 15:11:00.202,2022-04-17 15:11:00.202
625c2dcff0a5bc6c426c0c80,Gake no ue no Ponyo,2008,101 min,"Animation, Adventure, Comedy",7.7,0.21236129953570604,"A five-year-old boy develops a relationship with Ponyo, a young goldfish princess who longs to become a human after falling in love with him.",86.0,Hayao Miyazaki,"['Cate Blanchett', 'Matt Damon', 'Liam Neeson', 'Tomoko Yamaguchi']",125317,2022-04-17 15:10:07.906,2022-04-17 15:10:07.906
625c2c15f0a5bc6c426c0822,Koe no katachi,2016,130 min,"Animation, Drama, Family",8.1,2.693217650579175,"A young man is ostracized by his classmates after he bullies a deaf girl to the point where she moves away. Years later, he sets off on a path for redemption.",78.0,Naoko Yamada,"['Miyu Irino', 'Saori Hayami', 'Aoi Yûki', 'Kenshô Ono']",47708,2022-04-17 15:02:45.239,2022-04-17 15:02:45.239
