_id,title,release,duration,gerne,IMDB_Rating,rating,overview,metaScore,director,stars,noOfVotes,createdAt,updatedAt
625c2c58f0a5bc6c426c08be,Blade Runner,1982,117 min,"Action, Sci-Fi, Thriller",8.1,1.6114448575886897,"A blade runner must pursue and terminate four replicants who stole a ship in space, and have returned to Earth to find their creator.",84.0,Ridley Scott,"['Harrison Ford', 'Rutger Hauer', 'Sean Young', 'Edward James Olmos']",693827,2022-04-17 15:03:52.416,2022-04-17 15:03:52.416
625c2d56f0a5bc6c426c0b24,Rogue One,2016,133 min,"Action, Adventure, Sci-Fi",7.8,4.539542494135893,The daughter of an Imperial scientist joins the Rebel Alliance in a risky move to steal the plans for the Death Star.,65.0,Gareth Edwards,"['Felicity Jones', 'Diego Luna', 'Alan Tudyk', 'Donnie Yen']",556608,2022-04-17 15:08:06.791,2022-04-17 15:08:06.791
625c2d98f0a5bc6c426c0be2,Predator,1987,107 min,"Action, Adventure, Sci-Fi",7.8,4.434946665068128,A team of commandos on a mission in a Central American jungle find themselves hunted by an extraterrestrial warrior.,45.0,John McTiernan,"['Arnold Schwarzenegger', 'Carl Weathers', 'Kevin Peter Hall', 'Elpidia Carrillo']",371387,2022-04-17 15:09:12.156,2022-04-17 15:09:12.156
625c2e36f0a5bc6c426c0e44,Mad Max 2,1981,96 min,"Action, Adventure, Sci-Fi",7.6,1.7432982978005707,"In the post-apocalyptic Australian wasteland, a cynical drifter agrees to help a small, gasoline-rich community escape a horde of bandits.",77.0,George Miller,"['Mel Gibson', 'Bruce Spence', 'Michael Preston', 'Max Phipps']",166588,2022-04-17 15:11:50.441,2022-04-17 15:11:50.441
625c2c08f0a5bc6c426c0802,Yôjinbô,1961,110 min,"Action, Drama, Thriller",8.2,4.337841290326461,A crafty ronin comes to a town divided by two criminal gangs and decides to play them against each other to free the town.,,Akira Kurosawa,"['Toshirô Mifune', 'Eijirô Tôno', 'Tatsuya Nakadai', 'Yôko Tsukasa']",111244,2022-04-17 15:02:32.715,2022-04-17 15:02:32.715
625c2c82f0a5bc6c426c093a,Serbuan maut 2: Berandal,2014,150 min,"Action, Crime, Thriller",8.0,1.2011263955245233,"Only a short time after the first raid, Rama goes undercover with the thugs of Jakarta and plans to bring down the syndicate and uncover the corruption within his police force.",71.0,Gareth Evans,"['Iko Uwais', 'Yayan Ruhian', 'Arifin Putra', 'Oka Antara']",114316,2022-04-17 15:04:34.828,2022-04-17 15:04:34.828
625c2b4ff0a5bc6c426c06a8,Inception,2010,148 min,"Action, Adventure, Sci-Fi",8.8,1.8468510658894655,A thief who steals corporate secrets through the use of dream-sharing technology is given the inverse task of planting an idea into the mind of a C.E.O.,74.0,Christopher Nolan,"['Leonardo DiCaprio', 'Joseph Gordon-Levitt', 'Elliot Page', 'Ken Watanabe']",2067042,2022-04-17 14:59:27.204,2022-04-17 14:59:27.204
625c2c7df0a5bc6c426c0924,Baby,2015,159 min,"Action, Crime, Thriller",8.0,0.176076261442617,"An elite counter-intelligence unit learns of a plot, masterminded by a maniacal madman. With the clock ticking, it's up to them to track the terrorists' international tentacles and prevent them from striking at the heart of India.",,Neeraj Pandey,"['Akshay Kumar', 'Danny Denzongpa', 'Rana Daggubati', 'Taapsee Pannu']",52848,2022-04-17 15:04:29.383,2022-04-17 15:04:29.383
625c2b70f0a5bc6c426c06f0,Terminator 2: Judgment Day,1991,137 min,"Action, Sci-Fi",8.5,4.241836289655357,"A cyborg, identical to the one who failed to kill Sarah Connor, must now protect her teenage son, John Connor, from a more advanced and powerful cyborg.",75.0,James Cameron,"['Arnold Schwarzenegger', 'Linda Hamilton', 'Edward Furlong', 'Robert Patrick']",995506,2022-04-17 15:00:00.857,2022-04-17 15:00:00.857
625c2d8df0a5bc6c426c0bb4,Gattaca,1997,106 min,"Drama, Sci-Fi, Thriller",7.8,2.311791246259214,A genetically inferior man assumes the identity of a superior one in order to pursue his lifelong dream of space travel.,64.0,Andrew Niccol,"['Ethan Hawke', 'Uma Thurman', 'Jude Law', 'Gore Vidal']",280845,2022-04-17 15:09:01.127,2022-04-17 15:09:01.127
625c2d22f0a5bc6c426c0a84,Iron Man,2008,126 min,"Action, Adventure, Sci-Fi",7.9,0.33870228928470136,"After being held captive in an Afghan cave, billionaire engineer Tony Stark creates a unique weaponized suit of armor to fight evil.",79.0,Jon Favreau,"['Robert Downey Jr.', 'Gwyneth Paltrow', 'Terrence Howard', 'Jeff Bridges']",939644,2022-04-17 15:07:14.806,2022-04-17 15:07:14.806
625c2d4df0a5bc6c426c0b0c,Raazi,2018,138 min,"Action, Drama, Thriller",7.8,0.6883257703817103,A Kashmiri woman agrees to marry a Pakistani army officer in order to spy on Pakistan during the Indo-Pakistan War of 1971.,,Meghna Gulzar,"['Alia Bhatt', 'Vicky Kaushal', 'Rajit Kapoor', 'Shishir Sharma']",25344,2022-04-17 15:07:57.525,2022-04-17 15:07:57.525
625c2d66f0a5bc6c426c0b66,Taken,2008,90 min,"Action, Thriller",7.8,3.491595383137315,"A retired CIA agent travels across Europe and relies on his old skills to save his estranged daughter, who has been kidnapped while on a trip to Paris.",51.0,Pierre Morel,"['Liam Neeson', 'Maggie Grace', 'Famke Janssen', 'Leland Orser']",564791,2022-04-17 15:08:22.902,2022-04-17 15:08:22.902
625c2d62f0a5bc6c426c0b58,Chugyeokja,2008,125 min,"Action, Crime, Thriller",7.8,4.564022626044695,A disgraced ex-policeman who runs a small ring of prostitutes finds himself in a race against time when one of his women goes missing.,64.0,Hong-jin Na,"['Kim Yoon-seok', 'Jung-woo Ha', 'Yeong-hie Seo', 'Yoo-Jeong Kim']",58468,2022-04-17 15:08:18.396,2022-04-17 15:08:18.396
625c2cd0f0a5bc6c426c09aa,Twelve Monkeys,1995,129 min,"Mystery, Sci-Fi, Thriller",8.0,3.4040948318837594,"In a future world devastated by disease, a convict is sent back in time to gather information about the man-made virus that wiped out most of the human population on the planet.",74.0,Terry Gilliam,"['Bruce Willis', 'Madeleine Stowe', 'Brad Pitt', 'Joseph Melito']",578443,2022-04-17 15:05:52.605,2022-04-17 15:05:52.605
625c2dd4f0a5bc6c426c0c90,Ex Machina,2014,108 min,"Drama, Sci-Fi, Thriller",7.7,1.7764413311231964,A young programmer is selected to participate in a ground-breaking experiment in synthetic intelligence by evaluating the human qualities of a highly advanced humanoid A.I.,78.0,Alex Garland,"['Alicia Vikander', 'Domhnall Gleeson', 'Oscar Isaac', 'Sonoya Mizuno']",474141,2022-04-17 15:10:12.681,2022-04-17 15:10:12.681
625c2d83f0a5bc6c426c0b8c,Serenity,2005,119 min,"Action, Adventure, Sci-Fi",7.8,3.203980562975448,The crew of the ship Serenity try to evade an assassin sent to recapture one of their members who is telepathic.,74.0,Joss Whedon,"['Nathan Fillion', 'Gina Torres', 'Chiwetel Ejiofor', 'Alan Tudyk']",283310,2022-04-17 15:08:51.664,2022-04-17 15:08:51.664
625c2dcbf0a5bc6c426c0c6a,Gravity,2013,91 min,"Drama, Sci-Fi, Thriller",7.7,3.7862962570043326,Two astronauts work together to survive after an accident leaves them stranded in space.,96.0,Alfonso Cuarón,"['Sandra Bullock', 'George Clooney', 'Ed Harris', 'Orto Ignatiussen']",769145,2022-04-17 15:10:03.267,2022-04-17 15:10:03.267
625c2c53f0a5bc6c426c08a4,Jurassic Park,1993,127 min,"Action, Adventure, Sci-Fi",8.1,2.97622520078653,A pragmatic paleontologist visiting an almost complete theme park is tasked with protecting a couple of kids after a power failure causes the park's cloned dinosaurs to run loose.,68.0,Steven Spielberg,"['Sam Neill', 'Laura Dern', 'Jeff Goldblum', 'Richard Attenborough']",867615,2022-04-17 15:03:47.740,2022-04-17 15:03:47.740
625c2c16f0a5bc6c426c082c,Logan,2017,137 min,"Action, Drama, Sci-Fi",8.1,3.7173285468218307,"In a future where mutants are nearly extinct, an elderly and weary Logan leads a quiet life. But when Laura, a mutant child pursued by scientists, comes to him for help, he must get her to safety.",77.0,James Mangold,"['Hugh Jackman', 'Patrick Stewart', 'Dafne Keen', 'Boyd Holbrook']",647884,2022-04-17 15:02:46.255,2022-04-17 15:02:46.255
