_id,title,release,duration,gerne,IMDB_Rating,rating,overview,metaScore,director,stars,noOfVotes,createdAt,updatedAt
625c2c15f0a5bc6c426c0826,Ah-ga-ssi,2016,145 min,"Drama, Romance, Thriller",8.1,1.9319878706804194,"A woman is hired as a handmaiden to a Japanese heiress, but secretly she is involved in a plot to defraud her.",84.0,Chan-wook Park,"['Kim Min-hee', 'Jung-woo Ha', 'Cho Jin-woong', 'Moon So-Ri']",113649,2022-04-17 15:02:45.634,2022-04-17 15:02:45.634
625c2cbbf0a5bc6c426c095c,Slumdog Millionaire,2008,120 min,"Drama, Romance",8.0,2.9813310248270373,"A Mumbai teenager reflects on his life after being accused of cheating on the Indian version of ""Who Wants to be a Millionaire?"".",84.0,Danny Boyle,"['Loveleen Tandan', 'Dev Patel', 'Freida Pinto', 'Saurabh Shukla']",798882,2022-04-17 15:05:31.460,2022-04-17 15:05:31.460
625c2d24f0a5bc6c426c0a88,Gegen die Wand,2004,121 min,"Drama, Romance",7.9,2.3465882439737893,"With the intention to break free from the strict familial restrictions, a suicidal young woman sets up a marriage of convenience with a forty-year-old addict, an act that will lead to an outburst of envious love.",78.0,Fatih Akin,"['Birol Ünel', 'Sibel Kekilli', 'Güven Kiraç', 'Zarah Jane McKenzie']",51325,2022-04-17 15:07:16.265,2022-04-17 15:07:16.265
625c2e00f0a5bc6c426c0d56,Cape Fear,1962,106 min,"Drama, Thriller",7.7,3.4616819260258347,A lawyer's family is stalked by a man he once helped put in jail.,76.0,J. Lee Thompson,"['Gregory Peck', 'Robert Mitchum', 'Polly Bergen', 'Lori Martin']",26457,2022-04-17 15:10:56.272,2022-04-17 15:10:56.272
625c2d60f0a5bc6c426c0b4a,Kokuhaku,2010,106 min,"Drama, Thriller",7.8,0.43141034546324675,A psychological thriller of a grieving mother turned cold-blooded avenger with a twisty master plan to pay back those who were responsible for her daughter's death.,,Tetsuya Nakashima,"['Takako Matsu', 'Yoshino Kimura', 'Masaki Okada', 'Yukito Nishii']",35713,2022-04-17 15:08:16.190,2022-04-17 15:08:16.190
625c2cbff0a5bc6c426c095e,Black Swan,2010,108 min,"Drama, Thriller",8.0,3.4936288956322725,"A committed dancer struggles to maintain her sanity after winning the lead role in a production of Tchaikovsky's ""Swan Lake"".",79.0,Darren Aronofsky,"['Natalie Portman', 'Mila Kunis', 'Vincent Cassel', 'Winona Ryder']",699673,2022-04-17 15:05:35.684,2022-04-17 15:05:35.684
625c2d43f0a5bc6c426c0ae6,Hiroshima mon amour,1959,90 min,"Drama, Romance",7.9,4.632575580587485,A French actress filming an anti-war film in Hiroshima has an affair with a married Japanese architect as they share their differing perspectives on war.,,Alain Resnais,"['Emmanuelle Riva', 'Eiji Okada', 'Stella Dassas', 'Pierre Barbaud']",28421,2022-04-17 15:07:47.779,2022-04-17 15:07:47.779
625c2dd8f0a5bc6c426c0ca2,Brokeback Mountain,2005,134 min,"Drama, Romance",7.7,1.3978929170308418,"The story of a forbidden and secretive relationship between two cowboys, and their lives over the years.",87.0,Ang Lee,"['Jake Gyllenhaal', 'Heath Ledger', 'Michelle Williams', 'Randy Quaid']",323103,2022-04-17 15:10:16.680,2022-04-17 15:10:16.680
625c2b71f0a5bc6c426c06f2,Nuovo Cinema Paradiso,1988,155 min,"Drama, Romance",8.5,2.6788782327982164,A filmmaker recalls his childhood when falling in love with the pictures at the cinema of his home village and forms a deep friendship with the cinema's projectionist.,80.0,Giuseppe Tornatore,"['Philippe Noiret', 'Enzo Cannavale', 'Antonella Attili', 'Isa Danieli']",230763,2022-04-17 15:00:01.104,2022-04-17 15:00:01.104
625c2cf1f0a5bc6c426c0a20,Brief Encounter,1945,86 min,"Drama, Romance",8.0,4.237002622780704,"Meeting a stranger in a railway station, a woman is tempted to cheat on her husband.",92.0,David Lean,"['Celia Johnson', 'Trevor Howard', 'Stanley Holloway', 'Joyce Carey']",35601,2022-04-17 15:06:25.209,2022-04-17 15:06:25.209
625c2d3cf0a5bc6c426c0ae0,The Manchurian Candidate,1962,126 min,"Drama, Thriller",7.9,4.913912769025664,A former prisoner of war is brainwashed as an unwitting assassin for an international Communist conspiracy.,94.0,John Frankenheimer,"['Frank Sinatra', 'Laurence Harvey', 'Janet Leigh', 'Angela Lansbury']",71122,2022-04-17 15:07:40.671,2022-04-17 15:07:40.671
625c2b54f0a5bc6c426c06ae,Forrest Gump,1994,142 min,"Drama, Romance",8.8,4.476678813544045,"The presidencies of Kennedy and Johnson, the events of Vietnam, Watergate and other historical events unfold through the perspective of an Alabama man with an IQ of 75, whose only desire is to be reunited with his childhood sweetheart.",82.0,Robert Zemeckis,"['Tom Hanks', 'Robin Wright', 'Gary Sinise', 'Sally Field']",1809221,2022-04-17 14:59:32.773,2022-04-17 14:59:32.773
625c2cc6f0a5bc6c426c097e,Bom Yeoareum Gaeul Gyeoul Geurigo Bom,2003,103 min,"Drama, Romance",8.0,3.7262320306777355,A boy is raised by a Buddhist monk in an isolated floating temple where the years pass like the seasons.,85.0,Ki-duk Kim,"['Ki-duk Kim', 'Yeong-su Oh', 'Jong-ho Kim', 'Kim Young-Min']",77520,2022-04-17 15:05:42.946,2022-04-17 15:05:42.946
625c2dd4f0a5bc6c426c0c90,Ex Machina,2014,108 min,"Drama, Sci-Fi, Thriller",7.7,1.7764413311231964,A young programmer is selected to participate in a ground-breaking experiment in synthetic intelligence by evaluating the human qualities of a highly advanced humanoid A.I.,78.0,Alex Garland,"['Alicia Vikander', 'Domhnall Gleeson', 'Oscar Isaac', 'Sonoya Mizuno']",474141,2022-04-17 15:10:12.681,2022-04-17 15:10:12.681
625c2d2df0a5bc6c426c0a9e,Mulholland Dr.,2001,147 min,"Drama, Mystery, Thriller",7.9,2.783593158371893,"After a car wreck on the winding Mulholland Drive renders a woman amnesiac, she and a perky Hollywood-hopeful search for clues and answers across Los Angeles in a twisting venture beyond dreams and reality.",85.0,David Lynch,"['Naomi Watts', 'Laura Harring', 'Justin Theroux', 'Jeanne Bates']",322031,2022-04-17 15:07:25.559,2022-04-17 15:07:25.559
625c2e17f0a5bc6c426c0db6,La piel que habito,2011,120 min,"Drama, Horror, Thriller",7.6,0.2795584295298059,"A brilliant plastic surgeon, haunted by past tragedies, creates a type of synthetic skin that withstands any kind of damage. His guinea pig: a mysterious and volatile woman who holds the key to his obsession.",70.0,Pedro Almodóvar,"['Antonio Banderas', 'Elena Anaya', 'Jan Cornet', 'Marisa Paredes']",138959,2022-04-17 15:11:19.543,2022-04-17 15:11:19.543
625c2d8bf0a5bc6c426c0bb0,Titanic,1997,194 min,"Drama, Romance",7.8,4.444612383843544,"A seventeen-year-old aristocrat falls in love with a kind but poor artist aboard the luxurious, ill-fated R.M.S. Titanic.",75.0,James Cameron,"['Leonardo DiCaprio', 'Kate Winslet', 'Billy Zane', 'Kathy Bates']",1046089,2022-04-17 15:08:59.642,2022-04-17 15:08:59.642
625c2c09f0a5bc6c426c0808,Smultronstället,1957,91 min,"Drama, Romance",8.2,4.8093598415686785,"After living a life marked by coldness, an aging professor is forced to confront the emptiness of his existence.",88.0,Ingmar Bergman,"['Victor Sjöström', 'Bibi Andersson', 'Ingrid Thulin', 'Gunnar Björnstrand']",96381,2022-04-17 15:02:33.294,2022-04-17 15:02:33.294
625c2df3f0a5bc6c426c0d1c,Blue Velvet,1986,120 min,"Drama, Mystery, Thriller",7.7,1.4546634168008121,"The discovery of a severed human ear found in a field leads a young man on an investigation related to a beautiful, mysterious nightclub singer and a group of psychopathic criminals who have kidnapped her child.",76.0,David Lynch,"['Isabella Rossellini', 'Kyle MacLachlan', 'Dennis Hopper', 'Laura Dern']",181285,2022-04-17 15:10:43.527,2022-04-17 15:10:43.527
625c2d95f0a5bc6c426c0bd4,Misery,1990,107 min,"Drama, Thriller",7.8,1.598151357874239,"After a famous author is rescued from a car crash by a fan of his novels, he comes to realize that the care he is receiving is only the beginning of a nightmare of captivity and abuse.",75.0,Rob Reiner,"['James Caan', 'Kathy Bates', 'Richard Farnsworth', 'Frances Sternhagen']",184740,2022-04-17 15:09:09.722,2022-04-17 15:09:09.722
