_id,title,release,duration,gerne,IMDB_Rating,rating,overview,metaScore,director,stars,noOfVotes,createdAt,updatedAt
625c2d7df0a5bc6c426c0b7c,Little Miss Sunshine,2006,101 min,"Comedy, Drama",7.8,3.547795617340049,A family determined to get their young daughter into the finals of a beauty pageant take a cross-country trip in their VW bus.,80.0,Jonathan Dayton,"['Valerie Faris', 'Steve Carell', 'Toni Collette', 'Greg Kinnear']",439856,2022-04-17 15:08:45.694,2022-04-17 15:08:45.694
625c2d5ff0a5bc6c426c0b44,Moonrise Kingdom,2012,94 min,"Comedy, Drama, Romance",7.8,0.4394409345655559,"A pair of young lovers flee their New England town, which causes a local search party to fan out to find them.",84.0,Wes Anderson,"['Jared Gilman', 'Kara Hayward', 'Bruce Willis', 'Bill Murray']",318789,2022-04-17 15:08:15.015,2022-04-17 15:08:15.015
625c2dcdf0a5bc6c426c0c78,Silver Linings Playbook,2012,122 min,"Comedy, Drama, Romance",7.7,1.2132343614610053,"After a stint in a mental institution, former teacher Pat Solitano moves back in with his parents and tries to reconcile with his ex-wife. Things get more challenging when Pat meets Tiffany, a mysterious girl with problems of her own.",81.0,David O. Russell,"['Bradley Cooper', 'Jennifer Lawrence', 'Robert De Niro', 'Jacki Weaver']",661871,2022-04-17 15:10:05.742,2022-04-17 15:10:05.742
625c2c30f0a5bc6c426c0852,Zindagi Na Milegi Dobara,2011,155 min,"Comedy, Drama",8.1,0.7234510822379614,Three friends decide to turn their fantasy vacation into reality after one of their friends gets engaged.,,Zoya Akhtar,"['Hrithik Roshan', 'Farhan Akhtar', 'Abhay Deol', 'Katrina Kaif']",67927,2022-04-17 15:03:12.403,2022-04-17 15:03:12.403
625c2debf0a5bc6c426c0cfa,Short Cuts,1993,188 min,"Comedy, Drama",7.7,4.320053061808105,The day-to-day lives of several suburban Los Angeles residents.,79.0,Robert Altman,"['Andie MacDowell', 'Julianne Moore', 'Tim Robbins', 'Bruce Davison']",42275,2022-04-17 15:10:35.285,2022-04-17 15:10:35.285
625c2bbff0a5bc6c426c073e,The Great Dictator,1940,125 min,"Comedy, Drama, War",8.4,4.3102426830488305,Dictator Adenoid Hynkel tries to expand his empire while a poor Jewish barber tries to avoid persecution from Hynkel's regime.,,Charles Chaplin,"['Charles Chaplin', 'Paulette Goddard', 'Jack Oakie', 'Reginald Gardiner']",203150,2022-04-17 15:01:19.160,2022-04-17 15:01:19.160
625c2e2cf0a5bc6c426c0e0a,American Psycho,2000,101 min,"Comedy, Crime, Drama",7.6,1.5025679943931158,"A wealthy New York City investment banking executive, Patrick Bateman, hides his alternate psychopathic ego from his co-workers and friends as he delves deeper into his violent, hedonistic fantasies.",64.0,Mary Harron,"['Christian Bale', 'Justin Theroux', 'Josh Lucas', 'Bill Sage']",490062,2022-04-17 15:11:40.437,2022-04-17 15:11:40.437
625c2b76f0a5bc6c426c0700,City Lights,1931,87 min,"Comedy, Drama, Romance",8.5,0.4001693336818479,"With the aid of a wealthy erratic tippler, a dewy-eyed tramp who has fallen in love with a sightless flower girl accumulates money to be able to help her medically.",99.0,Charles Chaplin,"['Charles Chaplin', 'Virginia Cherrill', 'Florence Lee', 'Harry Myers']",167839,2022-04-17 15:00:06.195,2022-04-17 15:00:06.195
625c2e28f0a5bc6c426c0dea,The Station Agent,2003,89 min,"Comedy, Drama",7.6,1.6071186781185098,"When his only friend dies, a man born with dwarfism moves to rural New Jersey to live a life of solitude, only to meet a chatty hot dog vendor and a woman dealing with her own personal loss.",81.0,Tom McCarthy,"['Peter Dinklage', 'Patricia Clarkson', 'Bobby Cannavale', 'Paul Benjamin']",67370,2022-04-17 15:11:36.717,2022-04-17 15:11:36.717
625c2cfbf0a5bc6c426c0a46,Captain Fantastic,2016,118 min,"Comedy, Drama",7.9,3.5701799330001927,"In the forests of the Pacific Northwest, a father devoted to raising his six kids with a rigorous physical and intellectual education is forced to leave his paradise and enter the world, challenging his idea of what it means to be a parent.",72.0,Matt Ross,"['Viggo Mortensen', 'George MacKay', 'Samantha Isler', 'Annalise Basso']",189400,2022-04-17 15:06:35.672,2022-04-17 15:06:35.672
625c2decf0a5bc6c426c0cfe,The Muppet Christmas Carol,1992,85 min,"Comedy, Drama, Family",7.7,4.436602821247333,The Muppet characters tell their version of the classic tale of an old and bitter miser's redemption on Christmas Eve.,64.0,Brian Henson,"['Michael Caine', 'Kermit the Frog', 'Dave Goelz', 'Miss Piggy']",50298,2022-04-17 15:10:36.560,2022-04-17 15:10:36.560
625c2c4af0a5bc6c426c088c,The Truman Show,1998,103 min,"Comedy, Drama",8.1,4.568644947204023,An insurance salesman discovers his whole life is actually a reality TV show.,90.0,Peter Weir,"['Jim Carrey', 'Ed Harris', 'Laura Linney', 'Noah Emmerich']",939631,2022-04-17 15:03:38.781,2022-04-17 15:03:38.781
625c2de4f0a5bc6c426c0ce2,Being John Malkovich,1999,113 min,"Comedy, Drama, Fantasy",7.7,3.614905349001077,A puppeteer discovers a portal that leads literally into the head of movie star John Malkovich.,90.0,Spike Jonze,"['John Cusack', 'Cameron Diaz', 'Catherine Keener', 'John Malkovich']",312542,2022-04-17 15:10:28.330,2022-04-17 15:10:28.330
625c2d51f0a5bc6c426c0b14,Perfetti sconosciuti,2016,96 min,"Comedy, Drama",7.8,1.357510889281348,"Seven long-time friends get together for a dinner. When they decide to share with each other the content of every text message, email and phone call they receive, many secrets start to unveil and the equilibrium trembles.",,Paolo Genovese,"['Giuseppe Battiston', 'Anna Foglietta', 'Marco Giallini', 'Edoardo Leo']",57168,2022-04-17 15:08:01.851,2022-04-17 15:08:01.851
625c2d06f0a5bc6c426c0a4e,Jojo Rabbit,2019,108 min,"Comedy, Drama, War",7.9,3.136792486596881,A young boy in Hitler's army finds out his mother is hiding a Jewish girl in their home.,58.0,Taika Waititi,"['Roman Griffin Davis', 'Thomasin McKenzie', 'Scarlett Johansson', 'Taika Waititi']",297918,2022-04-17 15:06:46.367,2022-04-17 15:06:46.367
625c2deef0a5bc6c426c0d0c,Barton Fink,1991,116 min,"Comedy, Drama, Thriller",7.7,4.833752045658408,A renowned New York playwright is enticed to California to write for the movies and discovers the hellish truth of Hollywood.,69.0,Joel Coen,"['Ethan Coen', 'John Turturro', 'John Goodman', 'Judy Davis']",113240,2022-04-17 15:10:38.872,2022-04-17 15:10:38.872
625c2e2af0a5bc6c426c0dfa,The Royal Tenenbaums,2001,110 min,"Comedy, Drama",7.6,4.470595798673232,The eccentric members of a dysfunctional family reluctantly gather under the same roof for various reasons.,76.0,Wes Anderson,"['Gene Hackman', 'Gwyneth Paltrow', 'Anjelica Huston', 'Ben Stiller']",266842,2022-04-17 15:11:38.383,2022-04-17 15:11:38.383
625c2ddff0a5bc6c426c0ccc,Hedwig and the Angry Inch,2001,95 min,"Comedy, Drama, Music",7.7,0.9544452226354516,A gender-queer punk-rock singer from East Berlin tours the U.S. with her band as she tells her life story and follows the former lover/band-mate who stole her songs.,85.0,John Cameron Mitchell,"['John Cameron Mitchell', 'Miriam Shor', 'Stephen Trask', 'Theodore Liscinski']",31957,2022-04-17 15:10:23.227,2022-04-17 15:10:23.227
625c2bf4f0a5bc6c426c07ca,Rang De Basanti,2006,167 min,"Comedy, Crime, Drama",8.2,3.0051668426589027,"The story of six young Indians who assist an English woman to film a documentary on the freedom fighters from their past, and the events that lead them to relive the long-forgotten saga of freedom.",,Rakeysh Omprakash Mehra,"['Aamir Khan', 'Soha Ali Khan', 'Siddharth', 'Sharman Joshi']",111937,2022-04-17 15:02:12.934,2022-04-17 15:02:12.934
625c2c3ff0a5bc6c426c086a,Lage Raho Munna Bhai,2006,144 min,"Comedy, Drama, Romance",8.1,0.28100454809317554,Munna Bhai embarks on a journey with Mahatma Gandhi in order to fight against a corrupt property dealer.,,Rajkumar Hirani,"['Sanjay Dutt', 'Arshad Warsi', 'Vidya Balan', 'Boman Irani']",43137,2022-04-17 15:03:27.594,2022-04-17 15:03:27.594
