_id,title,release,duration,gerne,IMDB_Rating,rating,overview,metaScore,director,stars,noOfVotes,createdAt,updatedAt
625c2e09f0a5bc6c426c0d80,The Peanut Butter Falcon,2019,97 min,"Adventure, Comedy, Drama",7.6,3.5878341802601676,Zak runs away from his care home to make his dream of becoming a wrestler come true.,70.0,Tyler Nilson,"['Michael Schwartz', 'Zack Gottsagen', 'Ann Owens', 'Dakota Johnson']",66346,2022-04-17 15:11:05.819,2022-04-17 15:11:05.819
625c2de0f0a5bc6c426c0cd4,Interstate 60: Episodes of the Road,2002,116 min,"Adventure, Comedy, Drama",7.7,2.8655283255721264,"Neal Oliver, a very confused young man and an artist, takes a journey of a lifetime on a highway I60 that doesn't exist on any of the maps, going to the places he never even heard of, searching for an answer and his dreamgirl.",,Bob Gale,"['James Marsden', 'Gary Oldman', 'Kurt Russell', 'Matthew Edison']",29999,2022-04-17 15:10:24.390,2022-04-17 15:10:24.390
625c2e2ef0a5bc6c426c0e12,Fear and Loathing in Las Vegas,1998,118 min,"Adventure, Comedy, Drama",7.6,1.8306311624978389,An oddball journalist and his psychopathic lawyer travel to Las Vegas for a series of psychedelic escapades.,41.0,Terry Gilliam,"['Johnny Depp', 'Benicio Del Toro', 'Tobey Maguire', 'Michael Lee Gogin']",259753,2022-04-17 15:11:42.689,2022-04-17 15:11:42.689
625c2cf8f0a5bc6c426c0a44,Hunt for the Wilderpeople,2016,101 min,"Adventure, Comedy, Drama",7.9,0.7640630074896559,A national manhunt is ordered for a rebellious kid and his foster uncle who go missing in the wild New Zealand bush.,81.0,Taika Waititi,"['Sam Neill', 'Julian Dennison', 'Rima Te Wiata', 'Rachel House']",111483,2022-04-17 15:06:32.350,2022-04-17 15:06:32.350
625c2be5f0a5bc6c426c07aa,Queen,2013,146 min,"Adventure, Comedy, Drama",8.2,1.739595894614402,A Delhi girl from a traditional family sets out on a solo honeymoon after her marriage gets cancelled.,,Vikas Bahl,"['Kangana Ranaut', 'Rajkummar Rao', 'Lisa Haydon', 'Jeffrey Ho']",60701,2022-04-17 15:01:57.517,2022-04-17 15:01:57.517
625c2d5ff0a5bc6c426c0b48,The Big Short,2015,130 min,"Biography, Comedy, Drama",7.8,2.5633051372083413,In 2006-2007 a group of investors bet against the US mortgage market. In their research they discover how flawed and corrupt the market is.,81.0,Adam McKay,"['Christian Bale', 'Steve Carell', 'Ryan Gosling', 'Brad Pitt']",362942,2022-04-17 15:08:15.397,2022-04-17 15:08:15.397
625c2dc9f0a5bc6c426c0c5e,Nebraska,2013,115 min,"Adventure, Comedy, Drama",7.7,4.255920613717246,"An aging, booze-addled father makes the trip from Montana to Nebraska with his estranged son in order to claim a million-dollar Mega Sweepstakes Marketing prize.",87.0,Alexander Payne,"['Bruce Dern', 'Will Forte', 'June Squibb', 'Bob Odenkirk']",112298,2022-04-17 15:10:01.379,2022-04-17 15:10:01.379
625c2d2cf0a5bc6c426c0a9c,Almost Famous,2000,122 min,"Adventure, Comedy, Drama",7.9,3.5268336933392295,A high-school boy is given the chance to write a story for Rolling Stone Magazine about an up-and-coming rock band as he accompanies them on their concert tour.,90.0,Cameron Crowe,"['Billy Crudup', 'Patrick Fugit', 'Kate Hudson', 'Frances McDormand']",252586,2022-04-17 15:07:24.740,2022-04-17 15:07:24.740
625c2e36f0a5bc6c426c0e48,The Muppet Movie,1979,95 min,"Adventure, Comedy, Family",7.6,4.7545949059237795,"Kermit and his newfound friends trek across America to find success in Hollywood, but a frog legs merchant is after Kermit.",74.0,James Frawley,"['Jim Henson', 'Frank Oz', 'Jerry Nelson', 'Richard Hunt']",32802,2022-04-17 15:11:50.865,2022-04-17 15:11:50.865
625c2c1ef0a5bc6c426c083a,The Grand Budapest Hotel,2014,99 min,"Adventure, Comedy, Crime",8.1,1.8642273981520052,"A writer encounters the owner of an aging high-class hotel, who tells him of his early years serving as a lobby boy in the hotel's glorious years under an exceptional concierge.",88.0,Wes Anderson,"['Ralph Fiennes', 'F. Murray Abraham', 'Mathieu Amalric', 'Adrien Brody']",707630,2022-04-17 15:02:54.727,2022-04-17 15:02:54.727
625c2c80f0a5bc6c426c092a,The Martian,2015,144 min,"Adventure, Drama, Sci-Fi",8.0,2.5150608424176104,"An astronaut becomes stranded on Mars after his team assume him dead, and must rely on his ingenuity to find a way to signal to Earth that he is alive.",80.0,Ridley Scott,"['Matt Damon', 'Jessica Chastain', 'Kristen Wiig', 'Kate Mara']",760094,2022-04-17 15:04:32.788,2022-04-17 15:04:32.788
625c2d44f0a5bc6c426c0ae8,The Ten Commandments,1956,220 min,"Adventure, Drama",7.9,4.876003666433251,"Moses, an Egyptian Prince, learns of his true heritage as a Hebrew and his divine mission as the deliverer of his people.",,Cecil B. DeMille,"['Charlton Heston', 'Yul Brynner', 'Anne Baxter', 'Edward G. Robinson']",63560,2022-04-17 15:07:48.544,2022-04-17 15:07:48.544
625c2cc2f0a5bc6c426c096a,Blood Diamond,2006,143 min,"Adventure, Drama, Thriller",8.0,4.614017206212029,"A fisherman, a smuggler, and a syndicate of businessmen match wits over the possession of a priceless diamond.",64.0,Edward Zwick,"['Leonardo DiCaprio', 'Djimon Hounsou', 'Jennifer Connelly', 'Kagiso Kuypers']",499439,2022-04-17 15:05:38.749,2022-04-17 15:05:38.749
625c2c08f0a5bc6c426c07fe,The Great Escape,1963,172 min,"Adventure, Drama, History",8.2,4.298792008488299,Allied prisoners of war plan for several hundred of their number to escape from a German camp during World War II.,86.0,John Sturges,"['Steve McQueen', 'James Garner', 'Richard Attenborough', 'Charles Bronson']",224730,2022-04-17 15:02:32.303,2022-04-17 15:02:32.303
625c2d20f0a5bc6c426c0a7a,The Fall,2006,117 min,"Adventure, Drama, Fantasy",7.9,1.4508468121286944,"In a hospital on the outskirts of 1920s Los Angeles, an injured stuntman begins to tell a fellow patient, a little girl with a broken arm, a fantastic story of five mythical heroes. Thanks to his fractured state of mind and her vivid imagination, the line between fiction and reality blurs as the tale advances.",64.0,Tarsem Singh,"['Lee Pace', 'Catinca Untaru', 'Justine Waddell', 'Kim Uylenbroek']",107290,2022-04-17 15:07:12.454,2022-04-17 15:07:12.454
625c2b6bf0a5bc6c426c06de,The Intouchables,2011,112 min,"Biography, Comedy, Drama",8.5,2.3490517401214794,"After he becomes a quadriplegic from a paragliding accident, an aristocrat hires a young man from the projects to be his caregiver.",57.0,Olivier Nakache,"['Éric Toledano', 'François Cluzet', 'Omar Sy', 'Anne Le Ny']",760360,2022-04-17 14:59:55.866,2022-04-17 14:59:55.866
625c2d99f0a5bc6c426c0bea,The Goonies,1985,114 min,"Adventure, Comedy, Family",7.8,3.207553765594622,A group of young misfits called The Goonies discover an ancient map and set out on an adventure to find a legendary pirate's long-lost treasure.,62.0,Richard Donner,"['Sean Astin', 'Josh Brolin', 'Jeff Cohen', 'Corey Feldman']",244430,2022-04-17 15:09:13.016,2022-04-17 15:09:13.016
625c2c0ef0a5bc6c426c0816,The Treasure of the Sierra Madre,1948,126 min,"Adventure, Drama, Western",8.2,1.3205746779947347,Two Americans searching for work in Mexico convince an old prospector to help them mine for gold in the Sierra Madre Mountains.,98.0,John Huston,"['Humphrey Bogart', 'Walter Huston', 'Tim Holt', 'Bruce Bennett']",114304,2022-04-17 15:02:38.957,2022-04-17 15:02:38.957
625c2e30f0a5bc6c426c0e20,Dead Man,1995,121 min,"Adventure, Drama, Fantasy",7.6,2.8623587792487095,"On the run after murdering a man, accountant William Blake encounters a strange aboriginal American man named Nobody who prepares him for his journey into the spiritual world.",62.0,Jim Jarmusch,"['Johnny Depp', 'Gary Farmer', 'Crispin Glover', 'Lance Henriksen']",90442,2022-04-17 15:11:44.114,2022-04-17 15:11:44.114
625c2d46f0a5bc6c426c0aea,The Searchers,1956,119 min,"Adventure, Drama, Western",7.9,2.877130297415611,An American Civil War veteran embarks on a journey to rescue his niece from the Comanches.,94.0,John Ford,"['John Wayne', 'Jeffrey Hunter', 'Vera Miles', 'Ward Bond']",80316,2022-04-17 15:07:50.084,2022-04-17 15:07:50.084
