_id,title,release,duration,gerne,IMDB_Rating,rating,overview,metaScore,director,stars,noOfVotes,createdAt,updatedAt
625c2cdbf0a5bc6c426c09d0,Kagemusha,1980,180 min,"Drama, History, War",8.0,2.575765341504679,A petty thief with an utter resemblance to a samurai warlord is hired as the lord's double. When the warlord later dies the thief is forced to take up arms in his place.,84.0,Akira Kurosawa,"['Tatsuya Nakadai', 'Tsutomu Yamazaki', ""Ken'ichi Hagiwara"", 'Jinpachi Nezu']",32195,2022-04-17 15:06:03.123,2022-04-17 15:06:03.123
625c2cf4f0a5bc6c426c0a34,Bronenosets Potemkin,1925,75 min,"Drama, History, Thriller",8.0,2.1443964747789557,"In the midst of the Russian Revolution of 1905, the crew of the battleship Potemkin mutiny against the brutal, tyrannical regime of the vessel's officers. The resulting street demonstration in Odessa brings on a police massacre.",97.0,Sergei M. Eisenstein,"['Aleksandr Antonov', 'Vladimir Barskiy', 'Grigoriy Aleksandrov', 'Ivan Bobrov']",53054,2022-04-17 15:06:28.685,2022-04-17 15:06:28.685
625c2dfff0a5bc6c426c0d50,Zulu,1964,138 min,"Drama, History, War",7.7,3.5541304311649027,Outnumbered British soldiers do battle with Zulu warriors at Rorke's Drift.,77.0,Cy Endfield,"['Stanley Baker', 'Jack Hawkins', 'Ulla Jacobsson', 'James Booth']",35999,2022-04-17 15:10:55.567,2022-04-17 15:10:55.567
625c2dd6f0a5bc6c426c0c9a,Joyeux Noël,2005,116 min,"Drama, History, Music",7.7,4.205359214464927,"In December 1914, an unofficial Christmas truce on the Western Front allows soldiers from opposing sides of the First World War to gain insight into each other's way of life.",70.0,Christian Carion,"['Diane Kruger', 'Benno Fürmann', 'Guillaume Canet', 'Natalie Dessay']",28003,2022-04-17 15:10:14.276,2022-04-17 15:10:14.276
625c2c09f0a5bc6c426c080a,Det sjunde inseglet,1957,96 min,"Drama, Fantasy, History",8.2,1.3193273549949414,"A man seeks answers about life, death, and the existence of God as he plays chess against the Grim Reaper during the Black Plague.",88.0,Ingmar Bergman,"['Max von Sydow', 'Gunnar Björnstrand', 'Bengt Ekerot', 'Nils Poppe']",164939,2022-04-17 15:02:33.478,2022-04-17 15:02:33.478
625c2d63f0a5bc6c426c0b5c,Das weiße Band - Eine deutsche Kindergeschichte,2009,144 min,"Drama, History, Mystery",7.8,0.5576117392153346,"Strange events happen in a small village in the north of Germany during the years before World War I, which seem to be ritual punishment. Who is responsible?",82.0,Michael Haneke,"['Christian Friedel', 'Ernst Jacobi', 'Leonie Benesch', 'Ulrich Tukur']",68715,2022-04-17 15:08:19.374,2022-04-17 15:08:19.374
625c2cd2f0a5bc6c426c09b8,JFK,1991,189 min,"Drama, History, Thriller",8.0,2.004578598358332,New Orleans District Attorney Jim Garrison discovers there's more to the Kennedy assassination than the official story.,72.0,Oliver Stone,"['Kevin Costner', 'Gary Oldman', 'Jack Lemmon', 'Walter Matthau']",142110,2022-04-17 15:05:54.562,2022-04-17 15:05:54.562
625c2dddf0a5bc6c426c0cc4,Black Hawk Down,2001,144 min,"Drama, History, War",7.7,0.43834779700151816,160 elite U.S. soldiers drop into Somalia to capture two top lieutenants of a renegade warlord and find themselves in a desperate battle with a large force of heavily-armed Somalis.,74.0,Ridley Scott,"['Josh Hartnett', 'Ewan McGregor', 'Tom Sizemore', 'Eric Bana']",364254,2022-04-17 15:10:21.928,2022-04-17 15:10:21.928
625c2cf2f0a5bc6c426c0a2a,The Grapes of Wrath,1940,129 min,"Drama, History",8.0,0.8981540500842844,"A poor Midwest family is forced off their land. They travel to California, suffering the misfortunes of the homeless in the Great Depression.",96.0,John Ford,"['Henry Fonda', 'Jane Darwell', 'John Carradine', 'Charley Grapewin']",85559,2022-04-17 15:06:26.210,2022-04-17 15:06:26.210
625c2d67f0a5bc6c426c0b68,The Boy in the Striped Pyjamas,2008,94 min,"Drama, History, War",7.8,3.099492184772561,"Through the innocent eyes of Bruno, the eight-year-old son of the commandant at a German concentration camp, a forbidden friendship with a Jewish boy on the other side of the camp fence has startling and unexpected consequences.",55.0,Mark Herman,"['Asa Butterfield', 'David Thewlis', 'Rupert Friend', ""Zac Mattoon O'Brien""]",190748,2022-04-17 15:08:23.116,2022-04-17 15:08:23.116
625c2d55f0a5bc6c426c0b22,Under sandet,2015,100 min,"Drama, History, War",7.8,0.700044174762553,"In post-World War II Denmark, a group of young German POWs are forced to clear a beach of thousands of land mines under the watch of a Danish Sergeant who slowly learns to appreciate their plight.",75.0,Martin Zandvliet,"['Roland Møller', 'Louis Hofmann', 'Joel Basman', 'Mikkel Boe Følsgaard']",35539,2022-04-17 15:08:05.517,2022-04-17 15:08:05.517
625c2d63f0a5bc6c426c0b60,The Trial of the Chicago 7,2020,129 min,"Drama, History, Thriller",7.8,3.7002495069935493,"The story of 7 people on trial stemming from various charges surrounding the uprising at the 1968 Democratic National Convention in Chicago, Illinois.",77.0,Aaron Sorkin,"['Eddie Redmayne', 'Alex Sharp', 'Sacha Baron Cohen', 'Jeremy Strong']",89896,2022-04-17 15:08:19.857,2022-04-17 15:08:19.857
625c2d1af0a5bc6c426c0a6e,Boyhood,2014,165 min,Drama,7.9,3.0962818810399737,"The life of Mason, from early childhood to his arrival at college.",100.0,Richard Linklater,"['Ellar Coltrane', 'Patricia Arquette', 'Ethan Hawke', 'Elijah Smith']",335533,2022-04-17 15:07:06.436,2022-04-17 15:07:06.436
625c2c54f0a5bc6c426c08aa,Dà hóng denglong gaogao guà,1991,125 min,"Drama, History, Romance",8.1,3.1489540737698754,"A young woman becomes the fourth wife of a wealthy lord, and must learn to live with the strict rules and tensions within the household.",,Yimou Zhang,"['Gong Li', 'Jingwu Ma', 'Saifei He', 'Cuifen Cao']",29662,2022-04-17 15:03:48.881,2022-04-17 15:03:48.881
625c2debf0a5bc6c426c0cfc,Philadelphia,1993,125 min,Drama,7.7,1.4984271079705747,"When a man with HIV is fired by his law firm because of his condition, he hires a homophobic small time lawyer as the only willing advocate for a wrongful dismissal suit.",66.0,Jonathan Demme,"['Tom Hanks', 'Denzel Washington', 'Roberta Maxwell', 'Buzz Kilman']",224169,2022-04-17 15:10:35.495,2022-04-17 15:10:35.495
625c2c71f0a5bc6c426c08f6,Kumonosu-jô,1957,110 min,"Drama, History",8.1,1.0643324900382578,"A war-hardened general, egged on by his ambitious wife, works to fulfill a prophecy that he would become lord of Spider's Web Castle.",,Akira Kurosawa,"['Toshirô Mifune', 'Minoru Chiaki', 'Isuzu Yamada', 'Takashi Shimura']",46678,2022-04-17 15:04:17.010,2022-04-17 15:04:17.010
625c2c6df0a5bc6c426c08ea,Jungfrukällan,1960,89 min,Drama,8.1,2.507184166174472,"An innocent yet pampered young virgin and her family's pregnant and jealous servant set out to deliver candles to church, but only one returns from events that transpire in the woods along the way.",,Ingmar Bergman,"['Max von Sydow', 'Birgitta Valberg', 'Gunnel Lindblom', 'Birgitta Pettersson']",26697,2022-04-17 15:04:13.842,2022-04-17 15:04:13.842
625c2be9f0a5bc6c426c07b2,Udaan,2010,134 min,Drama,8.2,3.3079790437553855,"Expelled from his school, a 16-year old boy returns home to his abusive and oppressive father.",,Vikramaditya Motwane,"['Rajat Barmecha', 'Ronit Roy', 'Manjot Singh', 'Ram Kapoor']",42341,2022-04-17 15:02:01.137,2022-04-17 15:02:01.137
625c2db7f0a5bc6c426c0c38,Roma,2018,135 min,Drama,7.7,4.479173475976166,A year in the life of a middle-class family's maid in Mexico City in the early 1970s.,96.0,Alfonso Cuarón,"['Yalitza Aparicio', 'Marina de Tavira', 'Diego Cortina Autrey', 'Carlos Peralta']",140375,2022-04-17 15:09:43.490,2022-04-17 15:09:43.490
625c2cc6f0a5bc6c426c097c,Vozvrashchenie,2003,110 min,Drama,8.0,3.689387860596409,"In the Russian wilderness, two brothers face a range of new, conflicting emotions when their father - a man they know only through a single photograph - resurfaces.",82.0,Andrey Zvyagintsev,"['Vladimir Garin', 'Ivan Dobronravov', 'Konstantin Lavronenko', 'Nataliya Vdovina']",42399,2022-04-17 15:05:42.743,2022-04-17 15:05:42.743
