_id,title,release,duration,gerne,IMDB_Rating,rating,overview,metaScore,director,stars,noOfVotes,createdAt,updatedAt
625c2d5cf0a5bc6c426c0b34,The Lunchbox,2013,104 min,"Drama, Romance",7.8,0.3264388998341605,A mistaken delivery in Mumbai's famously efficient lunchbox delivery system connects a young housewife to an older man in the dusk of his life as they build a fantasy world together through notes in the lunchbox.,76.0,Ritesh Batra,"['Irrfan Khan', 'Nimrat Kaur', 'Nawazuddin Siddiqui', 'Lillete Dubey']",50523,2022-04-17 15:08:12.492,2022-04-17 15:08:12.492
625c2b54f0a5bc6c426c06ae,Forrest Gump,1994,142 min,"Drama, Romance",8.8,4.476678813544045,"The presidencies of Kennedy and Johnson, the events of Vietnam, Watergate and other historical events unfold through the perspective of an Alabama man with an IQ of 75, whose only desire is to be reunited with his childhood sweetheart.",82.0,Robert Zemeckis,"['Tom Hanks', 'Robin Wright', 'Gary Sinise', 'Sally Field']",1809221,2022-04-17 14:59:32.773,2022-04-17 14:59:32.773
625c2d84f0a5bc6c426c0b92,The Notebook,2004,123 min,"Drama, Romance",7.8,4.811816390170578,"A poor yet passionate young man falls in love with a rich young woman, giving her a sense of freedom, but they are soon separated because of their social differences.",53.0,Nick Cassavetes,"['Gena Rowlands', 'James Garner', 'Rachel McAdams', 'Ryan Gosling']",520284,2022-04-17 15:08:52.563,2022-04-17 15:08:52.563
625c2d34f0a5bc6c426c0ab0,Edward Scissorhands,1990,105 min,"Drama, Fantasy, Romance",7.9,3.2343459156941936,"An artificial man, who was incompletely constructed and has scissors for hands, leads a solitary life. Then one day, a suburban lady meets him and introduces him to her world.",74.0,Tim Burton,"['Johnny Depp', 'Winona Ryder', 'Dianne Wiest', 'Anthony Michael Hall']",447368,2022-04-17 15:07:32.614,2022-04-17 15:07:32.614
625c2d43f0a5bc6c426c0ae6,Hiroshima mon amour,1959,90 min,"Drama, Romance",7.9,4.632575580587485,A French actress filming an anti-war film in Hiroshima has an affair with a married Japanese architect as they share their differing perspectives on war.,,Alain Resnais,"['Emmanuelle Riva', 'Eiji Okada', 'Stella Dassas', 'Pierre Barbaud']",28421,2022-04-17 15:07:47.779,2022-04-17 15:07:47.779
625c2b71f0a5bc6c426c06f2,Nuovo Cinema Paradiso,1988,155 min,"Drama, Romance",8.5,2.6788782327982164,A filmmaker recalls his childhood when falling in love with the pictures at the cinema of his home village and forms a deep friendship with the cinema's projectionist.,80.0,Giuseppe Tornatore,"['Philippe Noiret', 'Enzo Cannavale', 'Antonella Attili', 'Isa Danieli']",230763,2022-04-17 15:00:01.104,2022-04-17 15:00:01.104
625c2e03f0a5bc6c426c0d6c,Gilda,1946,110 min,"Drama, Film-Noir, Romance",7.7,1.6665187617327104,A small-time gambler hired to work in a Buenos Aires casino discovers his employer's new wife is his former lover.,,Charles Vidor,"['Rita Hayworth', 'Glenn Ford', 'George Macready', 'Joseph Calleia']",27991,2022-04-17 15:10:59.995,2022-04-17 15:10:59.995
625c2cf1f0a5bc6c426c0a20,Brief Encounter,1945,86 min,"Drama, Romance",8.0,4.237002622780704,"Meeting a stranger in a railway station, a woman is tempted to cheat on her husband.",92.0,David Lean,"['Celia Johnson', 'Trevor Howard', 'Stanley Holloway', 'Joyce Carey']",35601,2022-04-17 15:06:25.209,2022-04-17 15:06:25.209
625c2db7f0a5bc6c426c0c3a,God's Own Country,2017,104 min,"Drama, Romance",7.7,0.8823427683595797,"Spring. Yorkshire. Young farmer Johnny Saxby numbs his daily frustrations with binge drinking and casual sex, until the arrival of a Romanian migrant worker for lambing season ignites an intense relationship that sets Johnny on a new path.",85.0,Francis Lee,"[""Josh O'Connor"", 'Alec Secareanu', 'Gemma Jones', 'Ian Hart']",25198,2022-04-17 15:09:43.696,2022-04-17 15:09:43.696
625c2ce2f0a5bc6c426c09e2,The Last Picture Show,1971,118 min,"Drama, Romance",8.0,0.7830669710354965,"In 1951, a group of high schoolers come of age in a bleak, isolated, atrophied North Texas town that is slowly dying, both culturally and economically.",93.0,Peter Bogdanovich,"['Timothy Bottoms', 'Jeff Bridges', 'Cybill Shepherd', 'Ben Johnson']",42456,2022-04-17 15:06:10.649,2022-04-17 15:06:10.649
625c2e2ff0a5bc6c426c0e1c,Sense and Sensibility,1995,136 min,"Drama, Romance",7.6,2.917972245288408,"Rich Mr. Dashwood dies, leaving his second wife and her three daughters poor by the rules of inheritance. The two eldest daughters are the title opposites.",84.0,Ang Lee,"['Emma Thompson', 'Kate Winslet', 'James Fleet', 'Tom Wilkinson']",102598,2022-04-17 15:11:43.728,2022-04-17 15:11:43.728
625c2bc6f0a5bc6c426c075e,Good Will Hunting,1997,126 min,"Drama, Romance",8.3,1.366016847827931,"Will Hunting, a janitor at M.I.T., has a gift for mathematics, but needs help from a psychologist to find direction in his life.",70.0,Gus Van Sant,"['Robin Williams', 'Matt Damon', 'Ben Affleck', 'Stellan Skarsgård']",861606,2022-04-17 15:01:26.035,2022-04-17 15:01:26.035
625c2c75f0a5bc6c426c0904,The Red Shoes,1948,135 min,"Drama, Music, Romance",8.1,0.5685666044611248,A young ballet dancer is torn between the man she loves and her pursuit to become a prima ballerina.,,Michael Powell,"['Emeric Pressburger', 'Anton Walbrook', 'Marius Goring', 'Moira Shearer']",30935,2022-04-17 15:04:21.882,2022-04-17 15:04:21.882
625c2e30f0a5bc6c426c0e22,The Bridges of Madison County,1995,135 min,"Drama, Romance",7.6,0.2894932051535615,Photographer Robert Kincaid wanders into the life of housewife Francesca Johnson for four days in the 1960s.,69.0,Clint Eastwood,"['Clint Eastwood', 'Meryl Streep', 'Annie Corley', 'Victor Slezak']",73172,2022-04-17 15:11:44.423,2022-04-17 15:11:44.423
625c2c4cf0a5bc6c426c0892,Fa yeung nin wah,2000,98 min,"Drama, Romance",8.1,2.390005178737753,"Two neighbors, a woman and a man, form a strong bond after both suspect extramarital activities of their spouses. However, they agree to keep their bond platonic so as not to commit similar wrongs.",85.0,Kar-Wai Wong,"['Tony Chiu-Wai Leung', 'Maggie Cheung', 'Ping Lam Siu', ""Tung Cho 'Joe' Cheung""]",124383,2022-04-17 15:03:40.631,2022-04-17 15:03:40.631
625c2c7bf0a5bc6c426c0916,Sunrise: A Song of Two Humans,1927,94 min,"Drama, Romance",8.1,1.8260501833694132,An allegorical tale about a man fighting the good and evil within him. Both sides are made flesh - one a sophisticated woman he is attracted to and the other his wife.,,F.W. Murnau,"[""George O'Brien"", 'Janet Gaynor', 'Margaret Livingston', 'Bodil Rosing']",46865,2022-04-17 15:04:27.282,2022-04-17 15:04:27.282
625c2d92f0a5bc6c426c0bc2,The Remains of the Day,1993,134 min,"Drama, Romance",7.8,4.99885732754575,A butler who sacrificed body and soul to service in the years leading up to World War II realizes too late how misguided his loyalty was to his lordly employer.,84.0,James Ivory,"['Anthony Hopkins', 'Emma Thompson', 'John Haycraft', 'Christopher Reeve']",66065,2022-04-17 15:09:06.014,2022-04-17 15:09:06.014
625c2cbbf0a5bc6c426c095c,Slumdog Millionaire,2008,120 min,"Drama, Romance",8.0,2.9813310248270373,"A Mumbai teenager reflects on his life after being accused of cheating on the Indian version of ""Who Wants to be a Millionaire?"".",84.0,Danny Boyle,"['Loveleen Tandan', 'Dev Patel', 'Freida Pinto', 'Saurabh Shukla']",798882,2022-04-17 15:05:31.460,2022-04-17 15:05:31.460
625c2ce7f0a5bc6c426c09f4,Doctor Zhivago,1965,197 min,"Drama, Romance, War",8.0,2.4804447835608734,"The life of a Russian physician and poet who, although married to another, falls in love with a political activist's wife and experiences hardship during World War I and then the October Revolution.",69.0,David Lean,"['Omar Sharif', 'Julie Christie', 'Geraldine Chaplin', 'Rod Steiger']",69903,2022-04-17 15:06:15.770,2022-04-17 15:06:15.770
625c2dc1f0a5bc6c426c0c4e,The Fault in Our Stars,2014,126 min,"Drama, Romance",7.7,1.8846504309046053,Two teenage cancer patients begin a life-affirming journey to visit a reclusive author in Amsterdam.,69.0,Josh Boone,"['Shailene Woodley', 'Ansel Elgort', 'Nat Wolff', 'Laura Dern']",344312,2022-04-17 15:09:53.667,2022-04-17 15:09:53.667
