_id,title,release,duration,gerne,IMDB_Rating,rating,overview,metaScore,director,stars,noOfVotes,createdAt,updatedAt
625c2d2df0a5bc6c426c0a9e,Mulholland Dr.,2001,147 min,"Drama, Mystery, Thriller",7.9,2.783593158371893,"After a car wreck on the winding Mulholland Drive renders a woman amnesiac, she and a perky Hollywood-hopeful search for clues and answers across Los Angeles in a twisting venture beyond dreams and reality.",85.0,David Lynch,"['Naomi Watts', 'Laura Harring', 'Justin Theroux', 'Jeanne Bates']",322031,2022-04-17 15:07:25.559,2022-04-17 15:07:25.559
625c2bb4f0a5bc6c426c072c,Apocalypse Now,1979,147 min,"Drama, Mystery, War",8.4,0.9576523373909118,A U.S. Army officer serving in Vietnam is tasked with assassinating a renegade Special Forces Colonel who sees himself as a god.,94.0,Francis Ford Coppola,"['Martin Sheen', 'Marlon Brando', 'Robert Duvall', 'Frederic Forrest']",606398,2022-04-17 15:01:08.099,2022-04-17 15:01:08.099
625c2df3f0a5bc6c426c0d1c,Blue Velvet,1986,120 min,"Drama, Mystery, Thriller",7.7,1.4546634168008121,"The discovery of a severed human ear found in a field leads a young man on an investigation related to a beautiful, mysterious nightclub singer and a group of psychopathic criminals who have kidnapped her child.",76.0,David Lynch,"['Isabella Rossellini', 'Kyle MacLachlan', 'Dennis Hopper', 'Laura Dern']",181285,2022-04-17 15:10:43.527,2022-04-17 15:10:43.527
625c2ccdf0a5bc6c426c0994,Donnie Darko,2001,113 min,"Drama, Mystery, Sci-Fi",8.0,0.9312626851443451,"After narrowly escaping a bizarre accident, a troubled teenager is plagued by visions of a man in a large rabbit suit who manipulates him to commit a series of crimes.",88.0,Richard Kelly,"['Jake Gyllenhaal', 'Jena Malone', 'Mary McDonnell', 'Holmes Osborne']",740086,2022-04-17 15:05:49.583,2022-04-17 15:05:49.583
625c2e28f0a5bc6c426c0de8,Un long dimanche de fiançailles,2004,133 min,"Drama, Mystery, Romance",7.6,3.2465560313482325,"Tells the story of a young woman's relentless search for her fiancé, who has disappeared from the trenches of the Somme during World War One.",76.0,Jean-Pierre Jeunet,"['Audrey Tautou', 'Gaspard Ulliel', 'Jodie Foster', 'Dominique Pinon']",70925,2022-04-17 15:11:36.517,2022-04-17 15:11:36.517
625c2bd7f0a5bc6c426c0790,Citizen Kane,1941,119 min,"Drama, Mystery",8.3,0.710381138172278,"Following the death of publishing tycoon Charles Foster Kane, reporters scramble to uncover the meaning of his final utterance; 'Rosebud'.",100.0,Orson Welles,"['Orson Welles', 'Joseph Cotten', 'Dorothy Comingore', 'Agnes Moorehead']",403351,2022-04-17 15:01:43.824,2022-04-17 15:01:43.824
625c2d12f0a5bc6c426c0a64,Moon,2009,97 min,"Drama, Mystery, Sci-Fi",7.9,4.986237803631121,"Astronaut Sam Bell has a quintessentially personal encounter toward the end of his three-year stint on the Moon, where he, working alongside his computer, GERTY, sends back to Earth parcels of a resource that has helped diminish our planet's power problems.",67.0,Duncan Jones,"['Sam Rockwell', 'Kevin Spacey', 'Dominique McElligott', 'Rosie Shaw']",335152,2022-04-17 15:06:58.631,2022-04-17 15:06:58.631
625c2c67f0a5bc6c426c08d4,Solaris,1972,167 min,"Drama, Mystery, Sci-Fi",8.1,0.4436238523485625,A psychologist is sent to a station orbiting a distant planet in order to discover what has caused the crew to go insane.,90.0,Andrei Tarkovsky,"['Natalya Bondarchuk', 'Donatas Banionis', 'Jüri Järvet', 'Vladislav Dvorzhetskiy']",81021,2022-04-17 15:04:07.159,2022-04-17 15:04:07.159
625c2d63f0a5bc6c426c0b5c,Das weiße Band - Eine deutsche Kindergeschichte,2009,144 min,"Drama, History, Mystery",7.8,0.5576117392153346,"Strange events happen in a small village in the north of Germany during the years before World War I, which seem to be ritual punishment. Who is responsible?",82.0,Michael Haneke,"['Christian Friedel', 'Ernst Jacobi', 'Leonie Benesch', 'Ulrich Tukur']",68715,2022-04-17 15:08:19.374,2022-04-17 15:08:19.374
625c2d5cf0a5bc6c426c0b30,Le passé,2013,130 min,"Drama, Mystery",7.8,3.300216530511256,"An Iranian man deserts his French wife and her two children to return to his homeland. Meanwhile, his wife starts up a new relationship, a reality her husband confronts upon his wife's request for a divorce.",85.0,Asghar Farhadi,"['Bérénice Bejo', 'Tahar Rahim', 'Ali Mosaffa', 'Pauline Burlet']",45002,2022-04-17 15:08:12.070,2022-04-17 15:08:12.070
625c2c61f0a5bc6c426c08ce,Chinatown,1974,130 min,"Drama, Mystery, Thriller",8.1,0.7281021825703771,"A private detective hired to expose an adulterer finds himself caught up in a web of deceit, corruption, and murder.",92.0,Roman Polanski,"['Jack Nicholson', 'Faye Dunaway', 'John Huston', 'Perry Lopez']",294230,2022-04-17 15:04:01.280,2022-04-17 15:04:01.280
625c2d34f0a5bc6c426c0aaa,Trois couleurs: Bleu,1993,94 min,"Drama, Music, Mystery",7.9,2.5819380923280946,A woman struggles to find a way to live her life after the death of her husband and child.,85.0,Krzysztof Kieslowski,"['Juliette Binoche', 'Zbigniew Zamachowski', 'Julie Delpy', 'Benoît Régent']",89836,2022-04-17 15:07:32.035,2022-04-17 15:07:32.035
625c2c1ff0a5bc6c426c083c,Gone Girl,2014,149 min,"Drama, Mystery, Thriller",8.1,1.7483286389528752,"With his wife's disappearance having become the focus of an intense media circus, a man sees the spotlight turned on him when it's suspected that he may not be innocent.",79.0,David Fincher,"['Ben Affleck', 'Rosamund Pike', 'Neil Patrick Harris', 'Tyler Perry']",859695,2022-04-17 15:02:55.897,2022-04-17 15:02:55.897
625c2cf1f0a5bc6c426c0a22,Laura,1944,88 min,"Drama, Film-Noir, Mystery",8.0,1.8554926281634043,A police detective falls in love with the woman whose murder he is investigating.,,Otto Preminger,"['Gene Tierney', 'Dana Andrews', 'Clifton Webb', 'Vincent Price']",42725,2022-04-17 15:06:25.405,2022-04-17 15:06:25.405
625c2e3af0a5bc6c426c0e5a,Blowup,1966,111 min,"Drama, Mystery, Thriller",7.6,0.20147217464361988,A fashion photographer unknowingly captures a death on film after following two lovers in a park.,82.0,Michelangelo Antonioni,"['David Hemmings', 'Vanessa Redgrave', 'Sarah Miles', 'John Castle']",56513,2022-04-17 15:11:54.125,2022-04-17 15:11:54.125
625c2c49f0a5bc6c426c0888,The Sixth Sense,1999,107 min,"Drama, Mystery, Thriller",8.1,0.29274374703442185,A boy who communicates with spirits seeks the help of a disheartened child psychologist.,64.0,M. Night Shyamalan,"['Bruce Willis', 'Haley Joel Osment', 'Toni Collette', 'Olivia Williams']",911573,2022-04-17 15:03:37.072,2022-04-17 15:03:37.072
625c2d42f0a5bc6c426c0ae4,L'avventura,1960,144 min,"Drama, Mystery",7.9,4.233700617343295,"A woman disappears during a Mediterranean boating trip. During the search, her lover and her best friend become attracted to each other.",,Michelangelo Antonioni,"['Gabriele Ferzetti', 'Monica Vitti', 'Lea Massari', 'Dominique Blanchar']",26542,2022-04-17 15:07:46.930,2022-04-17 15:07:46.930
625c2de2f0a5bc6c426c0ce0,Abre los ojos,1997,119 min,"Drama, Mystery, Sci-Fi",7.7,0.497746000126017,"A very handsome man finds the love of his life, but he suffers an accident and needs to have his face rebuilt by surgery after it is severely disfigured.",,Alejandro Amenábar,"['Eduardo Noriega', 'Penélope Cruz', 'Chete Lera', 'Fele Martínez']",64082,2022-04-17 15:10:26.919,2022-04-17 15:10:26.919
625c2d68f0a5bc6c426c0b70,Atonement,2007,123 min,"Drama, Mystery, Romance",7.8,4.5654126115894575,Thirteen-year-old fledgling writer Briony Tallis irrevocably changes the course of several lives when she accuses her older sister's lover of a crime he did not commit.,85.0,Joe Wright,"['Keira Knightley', 'James McAvoy', 'Brenda Blethyn', 'Saoirse Ronan']",251370,2022-04-17 15:08:24.571,2022-04-17 15:08:24.571
625c2c52f0a5bc6c426c08a0,Trois couleurs: Rouge,1994,99 min,"Drama, Mystery, Romance",8.1,0.8946112152458174,A model discovers a retired judge is keen on invading people's privacy.,100.0,Krzysztof Kieslowski,"['Irène Jacob', 'Jean-Louis Trintignant', 'Frédérique Feder', 'Jean-Pierre Lorit']",90729,2022-04-17 15:03:46.760,2022-04-17 15:03:46.760
