_id,title,release,duration,gerne,IMDB_Rating,rating,overview,metaScore,director,stars,noOfVotes,createdAt,updatedAt
625c2c7df0a5bc6c426c0924,Baby,2015,159 min,"Action, Crime, Thriller",8.0,0.176076261442617,"An elite counter-intelligence unit learns of a plot, masterminded by a maniacal madman. With the clock ticking, it's up to them to track the terrorists' international tentacles and prevent them from striking at the heart of India.",,Neeraj Pandey,"['Akshay Kumar', 'Danny Denzongpa', 'Rana Daggubati', 'Taapsee Pannu']",52848,2022-04-17 15:04:29.383,2022-04-17 15:04:29.383
625c2e35f0a5bc6c426c0e3e,Lethal Weapon,1987,109 min,"Action, Crime, Thriller",7.6,4.045014003507644,Two newly paired cops who are complete opposites must put aside their differences in order to catch a gang of drug smugglers.,68.0,Richard Donner,"['Mel Gibson', 'Danny Glover', 'Gary Busey', 'Mitchell Ryan']",236894,2022-04-17 15:11:49.291,2022-04-17 15:11:49.291
625c2c82f0a5bc6c426c093a,Serbuan maut 2: Berandal,2014,150 min,"Action, Crime, Thriller",8.0,1.2011263955245233,"Only a short time after the first raid, Rama goes undercover with the thugs of Jakarta and plans to bring down the syndicate and uncover the corruption within his police force.",71.0,Gareth Evans,"['Iko Uwais', 'Yayan Ruhian', 'Arifin Putra', 'Oka Antara']",114316,2022-04-17 15:04:34.828,2022-04-17 15:04:34.828
625c2cc6f0a5bc6c426c097a,Kill Bill: Vol. 2,2004,137 min,"Action, Crime, Thriller",8.0,4.270117286540593,"The Bride continues her quest of vengeance against her former boss and lover Bill, the reclusive bouncer Budd, and the treacherous, one-eyed Elle.",83.0,Quentin Tarantino,"['Uma Thurman', 'David Carradine', 'Michael Madsen', 'Daryl Hannah']",683900,2022-04-17 15:05:42.548,2022-04-17 15:05:42.548
625c2dfcf0a5bc6c426c0d42,Dirty Harry,1971,102 min,"Action, Crime, Thriller",7.7,2.891500040832317,"When a madman calling himself ""the Scorpio Killer"" menaces the city, tough-as-nails San Francisco Police Inspector ""Dirty"" Harry Callahan is assigned to track down and ferret out the crazed psychopath.",90.0,Don Siegel,"['Clint Eastwood', 'Andrew Robinson', 'Harry Guardino', 'Reni Santoni']",143292,2022-04-17 15:10:52.527,2022-04-17 15:10:52.527
625c2d93f0a5bc6c426c0bcc,Lat sau san taam,1992,128 min,"Action, Crime, Thriller",7.8,0.974785003648081,A tough-as-nails cop teams up with an undercover agent to shut down a sinister mobster and his crew.,,John Woo,"['Yun-Fat Chow', 'Tony Chiu-Wai Leung', 'Teresa Mo', 'Philip Chan']",46700,2022-04-17 15:09:07.764,2022-04-17 15:09:07.764
625c2d8af0a5bc6c426c0ba8,The Boondock Saints,1999,108 min,"Action, Crime, Thriller",7.8,0.4136619232518324,Two Irish Catholic brothers become vigilantes and wipe out Boston's criminal underworld in the name of God.,44.0,Troy Duffy,"['Willem Dafoe', 'Sean Patrick Flanery', 'Norman Reedus', 'David Della Rocco']",227143,2022-04-17 15:08:58.294,2022-04-17 15:08:58.294
625c2e36f0a5bc6c426c0e46,The Warriors,1979,92 min,"Action, Crime, Thriller",7.6,0.855571287475233,"In the near future, a charismatic leader summons the street gangs of New York City in a bid to take it over. When he is killed, The Warriors are falsely blamed and now must fight their way home while every other gang is hunting them down.",65.0,Walter Hill,"['Michael Beck', 'James Remar', 'Dorsey Wright', 'Brian Tyler']",93878,2022-04-17 15:11:50.658,2022-04-17 15:11:50.658
625c2c08f0a5bc6c426c0802,Yôjinbô,1961,110 min,"Action, Drama, Thriller",8.2,4.337841290326461,A crafty ronin comes to a town divided by two criminal gangs and decides to play them against each other to free the town.,,Akira Kurosawa,"['Toshirô Mifune', 'Eijirô Tôno', 'Tatsuya Nakadai', 'Yôko Tsukasa']",111244,2022-04-17 15:02:32.715,2022-04-17 15:02:32.715
625c2c02f0a5bc6c426c07ee,Die Hard,1988,132 min,"Action, Thriller",8.2,3.02654634639096,An NYPD officer tries to save his wife and several others taken hostage by German terrorists during a Christmas party at the Nakatomi Plaza in Los Angeles.,72.0,John McTiernan,"['Bruce Willis', 'Alan Rickman', 'Bonnie Bedelia', 'Reginald VelJohnson']",793164,2022-04-17 15:02:26.733,2022-04-17 15:02:26.733
625c2d4df0a5bc6c426c0b0c,Raazi,2018,138 min,"Action, Drama, Thriller",7.8,0.6883257703817103,A Kashmiri woman agrees to marry a Pakistani army officer in order to spy on Pakistan during the Indo-Pakistan War of 1971.,,Meghna Gulzar,"['Alia Bhatt', 'Vicky Kaushal', 'Rajit Kapoor', 'Shishir Sharma']",25344,2022-04-17 15:07:57.525,2022-04-17 15:07:57.525
625c2dfaf0a5bc6c426c0d36,The Taking of Pelham One Two Three,1974,104 min,"Action, Crime, Thriller",7.7,4.702787265796664,"In New York, armed men hijack a subway car and demand a ransom for the passengers. Even if it's paid, how could they get away?",68.0,Joseph Sargent,"['Walter Matthau', 'Robert Shaw', 'Martin Balsam', 'Hector Elizondo']",26729,2022-04-17 15:10:50.264,2022-04-17 15:10:50.264
625c2b6ef0a5bc6c426c06ec,Léon,1994,110 min,"Action, Crime, Drama",8.5,4.259460920663958,"Mathilda, a 12-year-old girl, is reluctantly taken in by Léon, a professional assassin, after her family is murdered. An unusual relationship forms as she becomes his protégée and learns the assassin's trade.",64.0,Luc Besson,"['Jean Reno', 'Gary Oldman', 'Natalie Portman', 'Danny Aiello']",1035236,2022-04-17 14:59:58.591,2022-04-17 14:59:58.591
625c2c16f0a5bc6c426c082a,Haider,2014,160 min,"Action, Crime, Drama",8.1,2.7322831857962893,"A young man returns to Kashmir after his father's disappearance to confront his uncle, whom he suspects of playing a role in his father's fate.",,Vishal Bhardwaj,"['Shahid Kapoor', 'Tabu', 'Shraddha Kapoor', 'Kay Kay Menon']",50445,2022-04-17 15:02:46.039,2022-04-17 15:02:46.039
625c2d61f0a5bc6c426c0b52,Ajeossi,2010,119 min,"Action, Crime, Drama",7.8,4.377903297457262,A quiet pawnshop keeper with a violent past takes on a drug-and-organ trafficking ring in hope of saving the child who is his only friend.,,Jeong-beom Lee,"['Won Bin', 'Sae-ron Kim', 'Tae-hoon Kim', 'Hee-won Kim']",62848,2022-04-17 15:08:17.680,2022-04-17 15:08:17.680
625c2e14f0a5bc6c426c0da0,Serbuan maut,2011,101 min,"Action, Thriller",7.6,3.727916097240711,A S.W.A.T. team becomes trapped in a tenement run by a ruthless mobster and his army of killers and thugs.,73.0,Gareth Evans,"['Iko Uwais', 'Ananda George', 'Ray Sahetapy', 'Donny Alamsyah']",190531,2022-04-17 15:11:16.467,2022-04-17 15:11:16.467
625c2d66f0a5bc6c426c0b66,Taken,2008,90 min,"Action, Thriller",7.8,3.491595383137315,"A retired CIA agent travels across Europe and relies on his old skills to save his estranged daughter, who has been kidnapped while on a trip to Paris.",51.0,Pierre Morel,"['Liam Neeson', 'Maggie Grace', 'Famke Janssen', 'Leland Orser']",564791,2022-04-17 15:08:22.902,2022-04-17 15:08:22.902
625c2e2cf0a5bc6c426c0e06,Minority Report,2002,145 min,"Action, Crime, Mystery",7.6,1.620145268140838,"In a future where a special police unit is able to arrest murderers before they commit their crimes, an officer from that unit is himself accused of a future murder.",80.0,Steven Spielberg,"['Tom Cruise', 'Colin Farrell', 'Samantha Morton', 'Max von Sydow']",508417,2022-04-17 15:11:40.033,2022-04-17 15:11:40.033
625c2d54f0a5bc6c426c0b1a,Udta Punjab,2016,148 min,"Action, Crime, Drama",7.8,3.6522573054091767,A story that revolves around drug abuse in the affluent north Indian State of Punjab and how the youth there have succumbed to it en-masse resulting in a socio-economic decline.,,Abhishek Chaubey,"['Shahid Kapoor', 'Alia Bhatt', 'Kareena Kapoor', 'Diljit Dosanjh']",27175,2022-04-17 15:08:04.060,2022-04-17 15:08:04.060
625c2dd6f0a5bc6c426c0c98,Lucky Number Slevin,2006,110 min,"Action, Crime, Drama",7.7,0.6850494718156053,"A case of mistaken identity lands Slevin into the middle of a war being plotted by two of the city's most rival crime bosses. Under constant surveillance by Detective Brikowski and assassin Goodkat, he must get them before they get him.",53.0,Paul McGuigan,"['Josh Hartnett', 'Ben Kingsley', 'Morgan Freeman', 'Lucy Liu']",299524,2022-04-17 15:10:14.074,2022-04-17 15:10:14.074
