_id,title,release,duration,gerne,IMDB_Rating,rating,overview,metaScore,director,stars,noOfVotes,createdAt,updatedAt
625c2bb3f0a5bc6c426c072a,The Shining,1980,146 min,"Drama, Horror",8.4,2.770617041112936,"A family heads to an isolated hotel for the winter where a sinister presence influences the father into violence, while his psychic son sees horrific forebodings from both past and future.",66.0,Stanley Kubrick,"['Jack Nicholson', 'Shelley Duvall', 'Danny Lloyd', 'Scatman Crothers']",898237,2022-04-17 15:01:07.316,2022-04-17 15:01:07.316
625c2b6cf0a5bc6c426c06e0,The Prestige,2006,130 min,"Drama, Mystery, Sci-Fi",8.5,0.1261262535588925,"After a tragic accident, two stage magicians engage in a battle to create the ultimate illusion while sacrificing everything they have to outwit each other.",66.0,Christopher Nolan,"['Christian Bale', 'Hugh Jackman', 'Scarlett Johansson', 'Michael Caine']",1190259,2022-04-17 14:59:56.091,2022-04-17 14:59:56.091
625c2da4f0a5bc6c426c0c02,The Conversation,1974,113 min,"Drama, Mystery, Thriller",7.8,1.7054814445563382,"A paranoid, secretive surveillance expert has a crisis of conscience when he suspects that the couple he is spying on will be murdered.",85.0,Francis Ford Coppola,"['Gene Hackman', 'John Cazale', 'Allen Garfield', 'Frederic Forrest']",98611,2022-04-17 15:09:24.759,2022-04-17 15:09:24.759
625c2e24f0a5bc6c426c0dd2,The Illusionist,2006,110 min,"Drama, Fantasy, Mystery",7.6,2.1588815784828306,"In turn-of-the-century Vienna, a magician uses his abilities to secure the love of a woman far above his social standing.",68.0,Neil Burger,"['Edward Norton', 'Jessica Biel', 'Paul Giamatti', 'Rufus Sewell']",354728,2022-04-17 15:11:32.744,2022-04-17 15:11:32.744
625c2c49f0a5bc6c426c0888,The Sixth Sense,1999,107 min,"Drama, Mystery, Thriller",8.1,0.29274374703442185,A boy who communicates with spirits seeks the help of a disheartened child psychologist.,64.0,M. Night Shyamalan,"['Bruce Willis', 'Haley Joel Osment', 'Toni Collette', 'Olivia Williams']",911573,2022-04-17 15:03:37.072,2022-04-17 15:03:37.072
625c2bb1f0a5bc6c426c071e,The Lives of Others,2006,137 min,"Drama, Mystery, Thriller",8.4,4.854147988341575,"In 1984 East Berlin, an agent of the secret police, conducting surveillance on a writer and his lover, finds himself becoming increasingly absorbed by their lives.",89.0,Florian Henckel von Donnersmarck,"['Ulrich Mühe', 'Martina Gedeck', 'Sebastian Koch', 'Ulrich Tukur']",358685,2022-04-17 15:01:05.425,2022-04-17 15:01:05.425
625c2d1ef0a5bc6c426c0a76,The Man from Earth,2007,87 min,"Drama, Fantasy, Mystery",7.9,0.40599835566297426,An impromptu goodbye party for Professor John Oldman becomes a mysterious interrogation after the retiring scholar reveals to his colleagues he has a longer and stranger past than they can imagine.,,Richard Schenkman,"['David Lee Smith', 'Tony Todd', 'John Billingsley', 'Ellen Crawford']",174125,2022-04-17 15:07:10.943,2022-04-17 15:07:10.943
625c2ce4f0a5bc6c426c09ea,Rosemary's Baby,1968,137 min,"Drama, Horror",8.0,1.335804695787075,A young couple trying for a baby move into a fancy apartment surrounded by peculiar neighbors.,96.0,Roman Polanski,"['Mia Farrow', 'John Cassavetes', 'Ruth Gordon', 'Sidney Blackmer']",193674,2022-04-17 15:06:12.017,2022-04-17 15:06:12.017
625c2d4cf0a5bc6c426c0b06,Freaks,1932,64 min,"Drama, Horror",7.9,0.06943144729484652,"A circus' beautiful trapeze artist agrees to marry the leader of side-show performers, but his deformed friends discover she is only marrying him for his inheritance.",80.0,Tod Browning,"['Wallace Ford', 'Leila Hyams', 'Olga Baclanova', 'Roscoe Ates']",42117,2022-04-17 15:07:56.694,2022-04-17 15:07:56.694
625c2d5cf0a5bc6c426c0b30,Le passé,2013,130 min,"Drama, Mystery",7.8,3.300216530511256,"An Iranian man deserts his French wife and her two children to return to his homeland. Meanwhile, his wife starts up a new relationship, a reality her husband confronts upon his wife's request for a divorce.",85.0,Asghar Farhadi,"['Bérénice Bejo', 'Tahar Rahim', 'Ali Mosaffa', 'Pauline Burlet']",45002,2022-04-17 15:08:12.070,2022-04-17 15:08:12.070
625c2df3f0a5bc6c426c0d1c,Blue Velvet,1986,120 min,"Drama, Mystery, Thriller",7.7,1.4546634168008121,"The discovery of a severed human ear found in a field leads a young man on an investigation related to a beautiful, mysterious nightclub singer and a group of psychopathic criminals who have kidnapped her child.",76.0,David Lynch,"['Isabella Rossellini', 'Kyle MacLachlan', 'Dennis Hopper', 'Laura Dern']",181285,2022-04-17 15:10:43.527,2022-04-17 15:10:43.527
625c2bd7f0a5bc6c426c0790,Citizen Kane,1941,119 min,"Drama, Mystery",8.3,0.710381138172278,"Following the death of publishing tycoon Charles Foster Kane, reporters scramble to uncover the meaning of his final utterance; 'Rosebud'.",100.0,Orson Welles,"['Orson Welles', 'Joseph Cotten', 'Dorothy Comingore', 'Agnes Moorehead']",403351,2022-04-17 15:01:43.824,2022-04-17 15:01:43.824
625c2d2df0a5bc6c426c0a9e,Mulholland Dr.,2001,147 min,"Drama, Mystery, Thriller",7.9,2.783593158371893,"After a car wreck on the winding Mulholland Drive renders a woman amnesiac, she and a perky Hollywood-hopeful search for clues and answers across Los Angeles in a twisting venture beyond dreams and reality.",85.0,David Lynch,"['Naomi Watts', 'Laura Harring', 'Justin Theroux', 'Jeanne Bates']",322031,2022-04-17 15:07:25.559,2022-04-17 15:07:25.559
625c2bc2f0a5bc6c426c074c,Incendies,2010,131 min,"Drama, Mystery, War",8.3,2.2322371245198003,Twins journey to the Middle East to discover their family history and fulfill their mother's last wishes.,80.0,Denis Villeneuve,"['Lubna Azabal', 'Mélissa Désormeaux-Poulin', 'Maxim Gaudette', 'Mustafa Kamel']",150023,2022-04-17 15:01:22.521,2022-04-17 15:01:22.521
625c2e01f0a5bc6c426c0d5e,Invasion of the Body Snatchers,1956,80 min,"Drama, Horror, Sci-Fi",7.7,3.8750971331683415,A small-town doctor learns that the population of his community is being replaced by emotionless alien duplicates.,92.0,Don Siegel,"['Kevin McCarthy', 'Dana Wynter', 'Larry Gates', 'King Donovan']",44839,2022-04-17 15:10:57.130,2022-04-17 15:10:57.130
625c2cf1f0a5bc6c426c0a22,Laura,1944,88 min,"Drama, Film-Noir, Mystery",8.0,1.8554926281634043,A police detective falls in love with the woman whose murder he is investigating.,,Otto Preminger,"['Gene Tierney', 'Dana Andrews', 'Clifton Webb', 'Vincent Price']",42725,2022-04-17 15:06:25.405,2022-04-17 15:06:25.405
625c2cb9f0a5bc6c426c0952,Darbareye Elly,2009,119 min,"Drama, Mystery",8.0,1.3430809095774465,The mysterious disappearance of a kindergarten teacher during a picnic in the north of Iran is followed by a series of misadventures for her fellow travelers.,87.0,Asghar Farhadi,"['Golshifteh Farahani', 'Shahab Hosseini', 'Taraneh Alidoosti', ""Merila Zare'i""]",45803,2022-04-17 15:05:29.244,2022-04-17 15:05:29.244
625c2cb8f0a5bc6c426c094e,The Help,2011,146 min,Drama,8.0,2.27381697640177,"An aspiring author during the civil rights movement of the 1960s decides to write a book detailing the African American maids' point of view on the white families for which they work, and the hardships they go through on a daily basis.",62.0,Tate Taylor,"['Emma Stone', 'Viola Davis', 'Octavia Spencer', 'Bryce Dallas Howard']",428521,2022-04-17 15:05:28.898,2022-04-17 15:05:28.898
625c2e19f0a5bc6c426c0dc0,The Visitor,2007,104 min,Drama,7.6,4.329784793972047,A college professor travels to New York City to attend a conference and finds a young couple living in his apartment.,79.0,Tom McCarthy,"['Richard Jenkins', 'Haaz Sleiman', 'Danai Gurira', 'Hiam Abbass']",41544,2022-04-17 15:11:21.308,2022-04-17 15:11:21.308
625c2e00f0a5bc6c426c0d5c,Les yeux sans visage,1960,90 min,"Drama, Horror",7.7,3.1615073139542305,"A surgeon causes an accident which leaves his daughter disfigured, and goes to extremes to give her a new face.",90.0,Georges Franju,"['Pierre Brasseur', 'Alida Valli', 'Juliette Mayniel', 'Alexandre Rignault']",27620,2022-04-17 15:10:56.914,2022-04-17 15:10:56.914
