_id,title,release,duration,gerne,IMDB_Rating,rating,overview,metaScore,director,stars,noOfVotes,createdAt,updatedAt
625c2cd0f0a5bc6c426c09a6,Sling Blade,1996,135 min,Drama,8.0,0.21053433873782001,"Karl Childers, a simple man hospitalized since his childhood murder of his mother and her lover, is released to start a new life in a small town.",84.0,Billy Bob Thornton,"['Billy Bob Thornton', 'Dwight Yoakam', 'J.T. Walsh', 'John Ritter']",86838,2022-04-17 15:05:52.184,2022-04-17 15:05:52.184
625c2c1df0a5bc6c426c0834,Kis Uykusu,2014,196 min,Drama,8.1,3.657784455182517,A hotel owner and landlord in a remote Turkish village deals with conflicts within his family and a tenant behind on his rent.,88.0,Nuri Bilge Ceylan,"['Haluk Bilginer', 'Melisa Sözen', 'Demet Akbag', 'Ayberk Pekcan']",46547,2022-04-17 15:02:53.621,2022-04-17 15:02:53.621
625c2e08f0a5bc6c426c0d7a,The Florida Project,2017,111 min,Drama,7.6,4.2017898791249255,"Set over one summer, the film follows precocious six-year-old Moonee as she courts mischief and adventure with her ragtag playmates and bonds with her rebellious but caring mother, all while living in the shadows of Walt Disney World.",92.0,Sean Baker,"['Brooklynn Prince', 'Bria Vinaite', 'Willem Dafoe', 'Christopher Rivera']",95181,2022-04-17 15:11:04.601,2022-04-17 15:11:04.601
625c2bc2f0a5bc6c426c074a,Jodaeiye Nader az Simin,2011,123 min,Drama,8.3,1.283170311160965,A married couple are faced with a difficult decision - to improve the life of their child by moving to another country or to stay in Iran and look after a deteriorating parent who has Alzheimer's disease.,95.0,Asghar Farhadi,"['Payman Maadi', 'Leila Hatami', 'Sareh Bayat', 'Shahab Hosseini']",220002,2022-04-17 15:01:22.308,2022-04-17 15:01:22.308
625c2daef0a5bc6c426c0c0e,Midnight Cowboy,1969,113 min,Drama,7.8,4.224138388021959,"A naive hustler travels from Texas to New York City to seek personal fortune, finding a new friend in the process.",79.0,John Schlesinger,"['Dustin Hoffman', 'Jon Voight', 'Sylvia Miles', 'John McGiver']",101124,2022-04-17 15:09:34.643,2022-04-17 15:09:34.643
625c2d9af0a5bc6c426c0bec,The Color Purple,1985,154 min,Drama,7.8,1.0587551428593212,A black Southern woman struggles to find her identity after suffering abuse from her father and others over four decades.,78.0,Steven Spielberg,"['Danny Glover', 'Whoopi Goldberg', 'Oprah Winfrey', 'Margaret Avery']",78321,2022-04-17 15:09:14.471,2022-04-17 15:09:14.471
625c2deef0a5bc6c426c0d0a,Fried Green Tomatoes,1991,130 min,Drama,7.7,2.7897342332159814,A housewife who is unhappy with her life befriends an old lady in a nursing home and is enthralled by the tales she tells of people she used to know.,64.0,Jon Avnet,"['Kathy Bates', 'Jessica Tandy', 'Mary Stuart Masterson', 'Mary-Louise Parker']",66941,2022-04-17 15:10:38.667,2022-04-17 15:10:38.667
625c2d67f0a5bc6c426c0b6e,Auf der anderen Seite,2007,122 min,Drama,7.8,0.2628071466856041,A Turkish man travels to Istanbul to find the daughter of his father's former girlfriend.,85.0,Fatih Akin,"['Baki Davrak', 'Nurgül Yesilçay', 'Tuncel Kurtiz', 'Nursel Köse']",30827,2022-04-17 15:08:23.926,2022-04-17 15:08:23.926
625c2b71f0a5bc6c426c06f2,Nuovo Cinema Paradiso,1988,155 min,"Drama, Romance",8.5,2.6788782327982164,A filmmaker recalls his childhood when falling in love with the pictures at the cinema of his home village and forms a deep friendship with the cinema's projectionist.,80.0,Giuseppe Tornatore,"['Philippe Noiret', 'Enzo Cannavale', 'Antonella Attili', 'Isa Danieli']",230763,2022-04-17 15:00:01.104,2022-04-17 15:00:01.104
625c2c34f0a5bc6c426c085a,Gran Torino,2008,116 min,Drama,8.1,0.9276259140771848,"Disgruntled Korean War veteran Walt Kowalski sets out to reform his neighbor, Thao Lor, a Hmong teenager who tried to steal Kowalski's prized possession: a 1972 Gran Torino.",72.0,Clint Eastwood,"['Clint Eastwood', 'Bee Vang', 'Christopher Carley', 'Ahney Her']",720450,2022-04-17 15:03:16.928,2022-04-17 15:03:16.928
625c2bacf0a5bc6c426c0714,Django Unchained,2012,165 min,"Drama, Western",8.4,4.280966566521654,"With the help of a German bounty hunter, a freed slave sets out to rescue his wife from a brutal Mississippi plantation owner.",81.0,Quentin Tarantino,"['Jamie Foxx', 'Christoph Waltz', 'Leonardo DiCaprio', 'Kerry Washington']",1357682,2022-04-17 15:01:00.094,2022-04-17 15:01:00.094
625c2d5cf0a5bc6c426c0b30,Le passé,2013,130 min,"Drama, Mystery",7.8,3.300216530511256,"An Iranian man deserts his French wife and her two children to return to his homeland. Meanwhile, his wife starts up a new relationship, a reality her husband confronts upon his wife's request for a divorce.",85.0,Asghar Farhadi,"['Bérénice Bejo', 'Tahar Rahim', 'Ali Mosaffa', 'Pauline Burlet']",45002,2022-04-17 15:08:12.070,2022-04-17 15:08:12.070
625c2cedf0a5bc6c426c0a06,Cat on a Hot Tin Roof,1958,108 min,Drama,8.0,2.822216147247852,Brick is an alcoholic ex-football player who drinks his days away and resists the affections of his wife. A reunion with his terminal father jogs a host of memories and revelations for both father and son.,84.0,Richard Brooks,"['Elizabeth Taylor', 'Paul Newman', 'Burl Ives', 'Jack Carson']",45062,2022-04-17 15:06:21.724,2022-04-17 15:06:21.724
625c2cd4f0a5bc6c426c09c0,Rain Man,1988,133 min,Drama,8.0,1.7469463745237956,Selfish yuppie Charlie Babbitt's father left a fortune to his savant brother Raymond and a pittance to Charlie; they travel cross-country.,65.0,Barry Levinson,"['Dustin Hoffman', 'Tom Cruise', 'Valeria Golino', 'Gerald R. Molen']",473064,2022-04-17 15:05:56.706,2022-04-17 15:05:56.706
625c2d2ff0a5bc6c426c0aa2,Boogie Nights,1997,155 min,Drama,7.9,0.7826049515791789,"Back when sex was safe, pleasure was a business and business was booming, an idealistic porn producer aspires to elevate his craft to an art when he discovers a hot young talent.",85.0,Paul Thomas Anderson,"['Mark Wahlberg', 'Julianne Moore', 'Burt Reynolds', 'Luis Guzmán']",239473,2022-04-17 15:07:27.785,2022-04-17 15:07:27.785
625c2bc9f0a5bc6c426c0768,Full Metal Jacket,1987,116 min,"Drama, War",8.3,3.5406088506166844,A pragmatic U.S. Marine observes the dehumanizing effects the Vietnam War has on his fellow recruits from their brutal boot camp training to the bloody street fighting in Hue.,76.0,Stanley Kubrick,"['Matthew Modine', 'R. Lee Ermey', ""Vincent D'Onofrio"", 'Adam Baldwin']",675146,2022-04-17 15:01:29.583,2022-04-17 15:01:29.583
625c2ccdf0a5bc6c426c0994,Donnie Darko,2001,113 min,"Drama, Mystery, Sci-Fi",8.0,0.9312626851443451,"After narrowly escaping a bizarre accident, a troubled teenager is plagued by visions of a man in a large rabbit suit who manipulates him to commit a series of crimes.",88.0,Richard Kelly,"['Jake Gyllenhaal', 'Jena Malone', 'Mary McDonnell', 'Holmes Osborne']",740086,2022-04-17 15:05:49.583,2022-04-17 15:05:49.583
625c2b54f0a5bc6c426c06ae,Forrest Gump,1994,142 min,"Drama, Romance",8.8,4.476678813544045,"The presidencies of Kennedy and Johnson, the events of Vietnam, Watergate and other historical events unfold through the perspective of an Alabama man with an IQ of 75, whose only desire is to be reunited with his childhood sweetheart.",82.0,Robert Zemeckis,"['Tom Hanks', 'Robin Wright', 'Gary Sinise', 'Sally Field']",1809221,2022-04-17 14:59:32.773,2022-04-17 14:59:32.773
625c2bc5f0a5bc6c426c075c,American Beauty,1999,122 min,Drama,8.3,3.079981612315301,A sexually frustrated suburban father has a mid-life crisis after becoming infatuated with his daughter's best friend.,84.0,Sam Mendes,"['Kevin Spacey', 'Annette Bening', 'Thora Birch', 'Wes Bentley']",1069738,2022-04-17 15:01:25.820,2022-04-17 15:01:25.820
625c2e36f0a5bc6c426c0e42,On Golden Pond,1981,109 min,Drama,7.6,0.766619410123125,"Norman is a curmudgeon with an estranged relationship with his daughter Chelsea. At Golden Pond, he and his wife nevertheless agree to care for Billy, the son of Chelsea's new boyfriend, and a most unexpected relationship blooms.",68.0,Mark Rydell,"['Katharine Hepburn', 'Henry Fonda', 'Jane Fonda', 'Doug McKeon']",27650,2022-04-17 15:11:50.237,2022-04-17 15:11:50.237
