_id,title,release,duration,gerne,IMDB_Rating,rating,overview,metaScore,director,stars,noOfVotes,createdAt,updatedAt
625c2bf0f0a5bc6c426c07c0,Chak De! India,2007,153 min,"Drama, Family, Sport",8.2,4.106584173440938,Kabir Khan is the coach of the Indian Women's National Hockey Team and his dream is to make his all girls team emerge victorious against all odds.,68.0,Shimit Amin,"['Shah Rukh Khan', 'Vidya Malvade', 'Sagarika Ghatge', 'Shilpa Shukla']",74129,2022-04-17 15:02:08.676,2022-04-17 15:02:08.676
625c2c3ff0a5bc6c426c086c,Million Dollar Baby,2004,132 min,"Drama, Sport",8.1,0.5021722249012195,A determined woman works with a hardened boxing trainer to become a professional.,86.0,Clint Eastwood,"['Hilary Swank', 'Clint Eastwood', 'Morgan Freeman', 'Jay Baruchel']",635975,2022-04-17 15:03:27.802,2022-04-17 15:03:27.802
625c2c5cf0a5bc6c426c08c6,Rocky,1976,120 min,"Drama, Sport",8.1,4.334345380352095,A small-time boxer gets a supremely rare chance to fight a heavy-weight champion in a bout in which he strives to go the distance for his self-respect.,70.0,John G. Avildsen,"['Sylvester Stallone', 'Talia Shire', 'Burt Young', 'Carl Weathers']",518546,2022-04-17 15:03:56.729,2022-04-17 15:03:56.729
625c2d13f0a5bc6c426c0a6a,The Wrestler,2008,109 min,"Drama, Sport",7.9,2.0020007514035254,"A faded professional wrestler must retire, but finds his quest for a new life outside the ring a dispiriting struggle.",80.0,Darren Aronofsky,"['Mickey Rourke', 'Marisa Tomei', 'Evan Rachel Wood', 'Mark Margolis']",289415,2022-04-17 15:06:59.369,2022-04-17 15:06:59.369
625c2bc6f0a5bc6c426c0760,Bacheha-Ye aseman,1997,89 min,"Drama, Family, Sport",8.3,2.422594114012775,"After a boy loses his sister's pair of shoes, he goes on a series of adventures in order to find them. When he can't, he tries a new way to ""win"" a new pair.",77.0,Majid Majidi,"['Mohammad Amir Naji', 'Amir Farrokh Hashemian', 'Bahare Seddiqi', 'Nafise Jafar-Mohammadi']",65341,2022-04-17 15:01:26.245,2022-04-17 15:01:26.245
625c2c13f0a5bc6c426c081e,Portrait de la jeune fille en feu,2019,122 min,"Drama, Romance",8.1,4.587971402846379,"On an isolated island in Brittany at the end of the eighteenth century, a female painter is obliged to paint a wedding portrait of a young woman.",95.0,Céline Sciamma,"['Noémie Merlant', 'Adèle Haenel', 'Luàna Bajrami', 'Valeria Golino']",63134,2022-04-17 15:02:43.005,2022-04-17 15:02:43.005
625c2bc2f0a5bc6c426c074a,Jodaeiye Nader az Simin,2011,123 min,Drama,8.3,1.283170311160965,A married couple are faced with a difficult decision - to improve the life of their child by moving to another country or to stay in Iran and look after a deteriorating parent who has Alzheimer's disease.,95.0,Asghar Farhadi,"['Payman Maadi', 'Leila Hatami', 'Sareh Bayat', 'Shahab Hosseini']",220002,2022-04-17 15:01:22.308,2022-04-17 15:01:22.308
625c2ceaf0a5bc6c426c09fc,The Hustler,1961,134 min,"Drama, Sport",8.0,0.8957244893575744,An up-and-coming pool player plays a long-time champion in a single high-stakes match.,90.0,Robert Rossen,"['Paul Newman', 'Jackie Gleason', 'Piper Laurie', 'George C. Scott']",75067,2022-04-17 15:06:18.441,2022-04-17 15:06:18.441
625c2dfdf0a5bc6c426c0d4a,Belle de jour,1967,100 min,"Drama, Romance",7.7,4.22587405202126,A frigid young housewife decides to spend her midweek afternoons as a prostitute.,,Luis Buñuel,"['Catherine Deneuve', 'Jean Sorel', 'Michel Piccoli', 'Geneviève Page']",40274,2022-04-17 15:10:53.932,2022-04-17 15:10:53.932
625c2c1df0a5bc6c426c0834,Kis Uykusu,2014,196 min,Drama,8.1,3.657784455182517,A hotel owner and landlord in a remote Turkish village deals with conflicts within his family and a tenant behind on his rent.,88.0,Nuri Bilge Ceylan,"['Haluk Bilginer', 'Melisa Sözen', 'Demet Akbag', 'Ayberk Pekcan']",46547,2022-04-17 15:02:53.621,2022-04-17 15:02:53.621
625c2bbdf0a5bc6c426c073c,Sunset Blvd.,1950,110 min,"Drama, Film-Noir",8.4,2.4851408637275707,A screenwriter develops a dangerous relationship with a faded film star determined to make a triumphant return.,,Billy Wilder,"['William Holden', 'Gloria Swanson', 'Erich von Stroheim', 'Nancy Olson']",201632,2022-04-17 15:01:17.844,2022-04-17 15:01:17.844
625c2c70f0a5bc6c426c08f4,Le notti di Cabiria,1957,110 min,Drama,8.1,3.7837831772612818,A waifish prostitute wanders the streets of Rome looking for true love but finds only heartbreak.,,Federico Fellini,"['Giulietta Masina', 'François Périer', 'Franca Marzi', 'Dorian Gray']",42940,2022-04-17 15:04:16.341,2022-04-17 15:04:16.341
625c2daef0a5bc6c426c0c0e,Midnight Cowboy,1969,113 min,Drama,7.8,4.224138388021959,"A naive hustler travels from Texas to New York City to seek personal fortune, finding a new friend in the process.",79.0,John Schlesinger,"['Dustin Hoffman', 'Jon Voight', 'Sylvia Miles', 'John McGiver']",101124,2022-04-17 15:09:34.643,2022-04-17 15:09:34.643
625c2e0df0a5bc6c426c0d94,Creed,2015,133 min,"Drama, Sport",7.6,4.7797999990697875,"The former World Heavyweight Champion Rocky Balboa serves as a trainer and mentor to Adonis Johnson, the son of his late friend and former rival Apollo Creed.",82.0,Ryan Coogler,"['Michael B. Jordan', 'Sylvester Stallone', 'Tessa Thompson', 'Phylicia Rashad']",247666,2022-04-17 15:11:09.458,2022-04-17 15:11:09.458
625c2b6df0a5bc6c426c06e8,American History X,1998,119 min,Drama,8.5,1.2834472896333238,A former neo-nazi skinhead tries to prevent his younger brother from going down the same wrong path that he did.,62.0,Tony Kaye,"['Edward Norton', 'Edward Furlong', ""Beverly D'Angelo"", 'Jennifer Lien']",1034705,2022-04-17 14:59:57.054,2022-04-17 14:59:57.054
625c2b71f0a5bc6c426c06f2,Nuovo Cinema Paradiso,1988,155 min,"Drama, Romance",8.5,2.6788782327982164,A filmmaker recalls his childhood when falling in love with the pictures at the cinema of his home village and forms a deep friendship with the cinema's projectionist.,80.0,Giuseppe Tornatore,"['Philippe Noiret', 'Enzo Cannavale', 'Antonella Attili', 'Isa Danieli']",230763,2022-04-17 15:00:01.104,2022-04-17 15:00:01.104
625c2b5cf0a5bc6c426c06c0,Soorarai Pottru,2020,153 min,Drama,8.6,4.333727614180858,"Nedumaaran Rajangam ""Maara"" sets out to make the common man fly and in the process takes on the world's most capital intensive industry and several enemies who stand in his way.",,Sudha Kongara,"['Suriya', 'Madhavan', 'Paresh Rawal', 'Aparna Balamurali']",54995,2022-04-17 14:59:40.370,2022-04-17 14:59:40.370
625c2ceaf0a5bc6c426c09fa,Vivre sa vie: Film en douze tableaux,1962,80 min,Drama,8.0,3.2085803844982683,Twelve episodic tales in the life of a Parisian woman and her slow descent into prostitution.,,Jean-Luc Godard,"['Anna Karina', 'Sady Rebbot', 'André S. Labarthe', 'Guylaine Schlumberger']",28057,2022-04-17 15:06:18.237,2022-04-17 15:06:18.237
625c2d89f0a5bc6c426c0ba4,Todo sobre mi madre,1999,101 min,Drama,7.8,2.036182384969134,"Young Esteban wants to become a writer and also to discover the identity of his second mother, a trans woman, carefully concealed by his mother Manuela.",87.0,Pedro Almodóvar,"['Cecilia Roth', 'Marisa Paredes', 'Candela Peña', 'Antonia San Juan']",89058,2022-04-17 15:08:57.876,2022-04-17 15:08:57.876
625c2cd4f0a5bc6c426c09c0,Rain Man,1988,133 min,Drama,8.0,1.7469463745237956,Selfish yuppie Charlie Babbitt's father left a fortune to his savant brother Raymond and a pittance to Charlie; they travel cross-country.,65.0,Barry Levinson,"['Dustin Hoffman', 'Tom Cruise', 'Valeria Golino', 'Gerald R. Molen']",473064,2022-04-17 15:05:56.706,2022-04-17 15:05:56.706
