_id,title,release,duration,gerne,IMDB_Rating,rating,overview,metaScore,director,stars,noOfVotes,createdAt,updatedAt
625c2c1df0a5bc6c426c0834,Kis Uykusu,2014,196 min,Drama,8.1,3.657784455182517,A hotel owner and landlord in a remote Turkish village deals with conflicts within his family and a tenant behind on his rent.,88.0,Nuri Bilge Ceylan,"['Haluk Bilginer', 'Melisa Sözen', 'Demet Akbag', 'Ayberk Pekcan']",46547,2022-04-17 15:02:53.621,2022-04-17 15:02:53.621
625c2b46f0a5bc6c426c0698,The Shawshank Redemption,1994,142 min,Drama,9.3,0.30976262621264405,"Two imprisoned men bond over a number of years, finding solace and eventual redemption through acts of common decency.",80.0,Frank Darabont,"['Tim Robbins', 'Morgan Freeman', 'Bob Gunton', 'William Sadler']",2343110,2022-04-17 14:59:18.658,2022-04-17 14:59:18.658
625c2e08f0a5bc6c426c0d7a,The Florida Project,2017,111 min,Drama,7.6,4.2017898791249255,"Set over one summer, the film follows precocious six-year-old Moonee as she courts mischief and adventure with her ragtag playmates and bonds with her rebellious but caring mother, all while living in the shadows of Walt Disney World.",92.0,Sean Baker,"['Brooklynn Prince', 'Bria Vinaite', 'Willem Dafoe', 'Christopher Rivera']",95181,2022-04-17 15:11:04.601,2022-04-17 15:11:04.601
625c2e36f0a5bc6c426c0e42,On Golden Pond,1981,109 min,Drama,7.6,0.766619410123125,"Norman is a curmudgeon with an estranged relationship with his daughter Chelsea. At Golden Pond, he and his wife nevertheless agree to care for Billy, the son of Chelsea's new boyfriend, and a most unexpected relationship blooms.",68.0,Mark Rydell,"['Katharine Hepburn', 'Henry Fonda', 'Jane Fonda', 'Doug McKeon']",27650,2022-04-17 15:11:50.237,2022-04-17 15:11:50.237
625c2d9af0a5bc6c426c0bec,The Color Purple,1985,154 min,Drama,7.8,1.0587551428593212,A black Southern woman struggles to find her identity after suffering abuse from her father and others over four decades.,78.0,Steven Spielberg,"['Danny Glover', 'Whoopi Goldberg', 'Oprah Winfrey', 'Margaret Avery']",78321,2022-04-17 15:09:14.471,2022-04-17 15:09:14.471
625c2c5cf0a5bc6c426c08c4,The Deer Hunter,1978,183 min,"Drama, War",8.1,3.6124131829337225,An in-depth examination of the ways in which the U.S. Vietnam War impacts and disrupts the lives of people in a small industrial town in Pennsylvania.,86.0,Michael Cimino,"['Robert De Niro', 'Christopher Walken', 'John Cazale', 'John Savage']",311361,2022-04-17 15:03:56.431,2022-04-17 15:03:56.431
625c2b5cf0a5bc6c426c06c0,Soorarai Pottru,2020,153 min,Drama,8.6,4.333727614180858,"Nedumaaran Rajangam ""Maara"" sets out to make the common man fly and in the process takes on the world's most capital intensive industry and several enemies who stand in his way.",,Sudha Kongara,"['Suriya', 'Madhavan', 'Paresh Rawal', 'Aparna Balamurali']",54995,2022-04-17 14:59:40.370,2022-04-17 14:59:40.370
625c2deef0a5bc6c426c0d0a,Fried Green Tomatoes,1991,130 min,Drama,7.7,2.7897342332159814,A housewife who is unhappy with her life befriends an old lady in a nursing home and is enthralled by the tales she tells of people she used to know.,64.0,Jon Avnet,"['Kathy Bates', 'Jessica Tandy', 'Mary Stuart Masterson', 'Mary-Louise Parker']",66941,2022-04-17 15:10:38.667,2022-04-17 15:10:38.667
625c2cd4f0a5bc6c426c09c0,Rain Man,1988,133 min,Drama,8.0,1.7469463745237956,Selfish yuppie Charlie Babbitt's father left a fortune to his savant brother Raymond and a pittance to Charlie; they travel cross-country.,65.0,Barry Levinson,"['Dustin Hoffman', 'Tom Cruise', 'Valeria Golino', 'Gerald R. Molen']",473064,2022-04-17 15:05:56.706,2022-04-17 15:05:56.706
625c2b59f0a5bc6c426c06ba,One Flew Over the Cuckoo's Nest,1975,133 min,Drama,8.7,3.134088967746539,"A criminal pleads insanity and is admitted to a mental institution, where he rebels against the oppressive nurse and rallies up the scared patients.",83.0,Milos Forman,"['Jack Nicholson', 'Louise Fletcher', 'Michael Berryman', 'Peter Brocco']",918088,2022-04-17 14:59:37.278,2022-04-17 14:59:37.278
625c2c6cf0a5bc6c426c08e6,The Man Who Shot Liberty Valance,1962,123 min,"Drama, Western",8.1,3.631922167237761,A senator returns to a western town for the funeral of an old friend and tells the story of his origins.,94.0,John Ford,"['James Stewart', 'John Wayne', 'Vera Miles', 'Lee Marvin']",68827,2022-04-17 15:04:12.918,2022-04-17 15:04:12.918
625c2b71f0a5bc6c426c06f2,Nuovo Cinema Paradiso,1988,155 min,"Drama, Romance",8.5,2.6788782327982164,A filmmaker recalls his childhood when falling in love with the pictures at the cinema of his home village and forms a deep friendship with the cinema's projectionist.,80.0,Giuseppe Tornatore,"['Philippe Noiret', 'Enzo Cannavale', 'Antonella Attili', 'Isa Danieli']",230763,2022-04-17 15:00:01.104,2022-04-17 15:00:01.104
625c2cf0f0a5bc6c426c0a16,A Streetcar Named Desire,1951,122 min,Drama,8.0,4.549815059173121,Disturbed Blanche DuBois moves in with her sister in New Orleans and is tormented by her brutish brother-in-law while her reality crumbles around her.,97.0,Elia Kazan,"['Vivien Leigh', 'Marlon Brando', 'Kim Hunter', 'Karl Malden']",99182,2022-04-17 15:06:24.239,2022-04-17 15:06:24.239
625c2c70f0a5bc6c426c08f4,Le notti di Cabiria,1957,110 min,Drama,8.1,3.7837831772612818,A waifish prostitute wanders the streets of Rome looking for true love but finds only heartbreak.,,Federico Fellini,"['Giulietta Masina', 'François Périer', 'Franca Marzi', 'Dorian Gray']",42940,2022-04-17 15:04:16.341,2022-04-17 15:04:16.341
625c2bc9f0a5bc6c426c0768,Full Metal Jacket,1987,116 min,"Drama, War",8.3,3.5406088506166844,A pragmatic U.S. Marine observes the dehumanizing effects the Vietnam War has on his fellow recruits from their brutal boot camp training to the bloody street fighting in Hue.,76.0,Stanley Kubrick,"['Matthew Modine', 'R. Lee Ermey', ""Vincent D'Onofrio"", 'Adam Baldwin']",675146,2022-04-17 15:01:29.583,2022-04-17 15:01:29.583
625c2e38f0a5bc6c426c0e50,Close Encounters of the Third Kind,1977,138 min,"Drama, Sci-Fi",7.6,3.8491081058614585,"Roy Neary, an electric lineman, watches how his quiet and ordinary daily life turns upside down after a close encounter with a UFO.",90.0,Steven Spielberg,"['Richard Dreyfuss', 'François Truffaut', 'Teri Garr', 'Melinda Dillon']",184966,2022-04-17 15:11:52.513,2022-04-17 15:11:52.513
625c2e01f0a5bc6c426c0d60,Rebel Without a Cause,1955,111 min,Drama,7.7,2.975204927412171,"A rebellious young man with a troubled past comes to a new town, finding friends and enemies.",89.0,Nicholas Ray,"['James Dean', 'Natalie Wood', 'Sal Mineo', 'Jim Backus']",83363,2022-04-17 15:10:57.334,2022-04-17 15:10:57.334
625c2ddcf0a5bc6c426c0cba,The Magdalene Sisters,2002,114 min,Drama,7.7,3.4969687101300773,Three young Irish women struggle to maintain their spirits while they endure dehumanizing abuse as inmates of a Magdalene Sisters Asylum.,83.0,Peter Mullan,"['Eileen Walsh', 'Dorothy Duffy', 'Nora-Jane Noone', 'Anne-Marie Duff']",25938,2022-04-17 15:10:20.287,2022-04-17 15:10:20.287
625c2d3cf0a5bc6c426c0ae0,The Manchurian Candidate,1962,126 min,"Drama, Thriller",7.9,4.913912769025664,A former prisoner of war is brainwashed as an unwitting assassin for an international Communist conspiracy.,94.0,John Frankenheimer,"['Frank Sinatra', 'Laurence Harvey', 'Janet Leigh', 'Angela Lansbury']",71122,2022-04-17 15:07:40.671,2022-04-17 15:07:40.671
625c2d7ef0a5bc6c426c0b80,The Curious Case of Benjamin Button,2008,166 min,"Drama, Fantasy, Romance",7.8,1.0792730632497038,"Tells the story of Benjamin Button, a man who starts aging backwards with consequences.",70.0,David Fincher,"['Brad Pitt', 'Cate Blanchett', 'Tilda Swinton', 'Julia Ormond']",589160,2022-04-17 15:08:46.147,2022-04-17 15:08:46.147
