_id,title,release,duration,gerne,IMDB_Rating,rating,overview,metaScore,director,stars,noOfVotes,createdAt,updatedAt
625c2c11f0a5bc6c426c081a,The Gold Rush,1925,95 min,"Adventure, Comedy, Drama",8.2,1.6142532033985169,A prospector goes to the Klondike in search of gold and finds it and more.,,Charles Chaplin,"['Charles Chaplin', 'Mack Swain', 'Tom Murray', 'Henry Bergman']",101053,2022-04-17 15:02:41.368,2022-04-17 15:02:41.368
625c2be5f0a5bc6c426c07aa,Queen,2013,146 min,"Adventure, Comedy, Drama",8.2,1.739595894614402,A Delhi girl from a traditional family sets out on a solo honeymoon after her marriage gets cancelled.,,Vikas Bahl,"['Kangana Ranaut', 'Rajkummar Rao', 'Lisa Haydon', 'Jeffrey Ho']",60701,2022-04-17 15:01:57.517,2022-04-17 15:01:57.517
625c2de0f0a5bc6c426c0cd4,Interstate 60: Episodes of the Road,2002,116 min,"Adventure, Comedy, Drama",7.7,2.8655283255721264,"Neal Oliver, a very confused young man and an artist, takes a journey of a lifetime on a highway I60 that doesn't exist on any of the maps, going to the places he never even heard of, searching for an answer and his dreamgirl.",,Bob Gale,"['James Marsden', 'Gary Oldman', 'Kurt Russell', 'Matthew Edison']",29999,2022-04-17 15:10:24.390,2022-04-17 15:10:24.390
625c2dc9f0a5bc6c426c0c5e,Nebraska,2013,115 min,"Adventure, Comedy, Drama",7.7,4.255920613717246,"An aging, booze-addled father makes the trip from Montana to Nebraska with his estranged son in order to claim a million-dollar Mega Sweepstakes Marketing prize.",87.0,Alexander Payne,"['Bruce Dern', 'Will Forte', 'June Squibb', 'Bob Odenkirk']",112298,2022-04-17 15:10:01.379,2022-04-17 15:10:01.379
625c2cf8f0a5bc6c426c0a44,Hunt for the Wilderpeople,2016,101 min,"Adventure, Comedy, Drama",7.9,0.7640630074896559,A national manhunt is ordered for a rebellious kid and his foster uncle who go missing in the wild New Zealand bush.,81.0,Taika Waititi,"['Sam Neill', 'Julian Dennison', 'Rima Te Wiata', 'Rachel House']",111483,2022-04-17 15:06:32.350,2022-04-17 15:06:32.350
625c2e2ef0a5bc6c426c0e12,Fear and Loathing in Las Vegas,1998,118 min,"Adventure, Comedy, Drama",7.6,1.8306311624978389,An oddball journalist and his psychopathic lawyer travel to Las Vegas for a series of psychedelic escapades.,41.0,Terry Gilliam,"['Johnny Depp', 'Benicio Del Toro', 'Tobey Maguire', 'Michael Lee Gogin']",259753,2022-04-17 15:11:42.689,2022-04-17 15:11:42.689
625c2d2cf0a5bc6c426c0a9c,Almost Famous,2000,122 min,"Adventure, Comedy, Drama",7.9,3.5268336933392295,A high-school boy is given the chance to write a story for Rolling Stone Magazine about an up-and-coming rock band as he accompanies them on their concert tour.,90.0,Cameron Crowe,"['Billy Crudup', 'Patrick Fugit', 'Kate Hudson', 'Frances McDormand']",252586,2022-04-17 15:07:24.740,2022-04-17 15:07:24.740
625c2c1ef0a5bc6c426c083a,The Grand Budapest Hotel,2014,99 min,"Adventure, Comedy, Crime",8.1,1.8642273981520052,"A writer encounters the owner of an aging high-class hotel, who tells him of his early years serving as a lobby boy in the hotel's glorious years under an exceptional concierge.",88.0,Wes Anderson,"['Ralph Fiennes', 'F. Murray Abraham', 'Mathieu Amalric', 'Adrien Brody']",707630,2022-04-17 15:02:54.727,2022-04-17 15:02:54.727
625c2c80f0a5bc6c426c092a,The Martian,2015,144 min,"Adventure, Drama, Sci-Fi",8.0,2.5150608424176104,"An astronaut becomes stranded on Mars after his team assume him dead, and must rely on his ingenuity to find a way to signal to Earth that he is alive.",80.0,Ridley Scott,"['Matt Damon', 'Jessica Chastain', 'Kristen Wiig', 'Kate Mara']",760094,2022-04-17 15:04:32.788,2022-04-17 15:04:32.788
625c2e36f0a5bc6c426c0e48,The Muppet Movie,1979,95 min,"Adventure, Comedy, Family",7.6,4.7545949059237795,"Kermit and his newfound friends trek across America to find success in Hollywood, but a frog legs merchant is after Kermit.",74.0,James Frawley,"['Jim Henson', 'Frank Oz', 'Jerry Nelson', 'Richard Hunt']",32802,2022-04-17 15:11:50.865,2022-04-17 15:11:50.865
625c2c0ef0a5bc6c426c0816,The Treasure of the Sierra Madre,1948,126 min,"Adventure, Drama, Western",8.2,1.3205746779947347,Two Americans searching for work in Mexico convince an old prospector to help them mine for gold in the Sierra Madre Mountains.,98.0,John Huston,"['Humphrey Bogart', 'Walter Huston', 'Tim Holt', 'Bruce Bennett']",114304,2022-04-17 15:02:38.957,2022-04-17 15:02:38.957
625c2c71f0a5bc6c426c08f8,The Bridge on the River Kwai,1957,161 min,"Adventure, Drama, War",8.1,3.1055210732228424,"British POWs are forced to build a railway bridge across the river Kwai for their Japanese captors, not knowing that the allied forces are planning to destroy it.",87.0,David Lean,"['William Holden', 'Alec Guinness', 'Jack Hawkins', 'Sessue Hayakawa']",203463,2022-04-17 15:04:17.274,2022-04-17 15:04:17.274
625c2d5ff0a5bc6c426c0b48,The Big Short,2015,130 min,"Biography, Comedy, Drama",7.8,2.5633051372083413,In 2006-2007 a group of investors bet against the US mortgage market. In their research they discover how flawed and corrupt the market is.,81.0,Adam McKay,"['Christian Bale', 'Steve Carell', 'Ryan Gosling', 'Brad Pitt']",362942,2022-04-17 15:08:15.397,2022-04-17 15:08:15.397
625c2c08f0a5bc6c426c07fe,The Great Escape,1963,172 min,"Adventure, Drama, History",8.2,4.298792008488299,Allied prisoners of war plan for several hundred of their number to escape from a German camp during World War II.,86.0,John Sturges,"['Steve McQueen', 'James Garner', 'Richard Attenborough', 'Charles Bronson']",224730,2022-04-17 15:02:32.303,2022-04-17 15:02:32.303
625c2d97f0a5bc6c426c0bde,Back to the Future Part II,1989,108 min,"Adventure, Comedy, Sci-Fi",7.8,3.066548435013007,"After visiting 2015, Marty McFly must repeat his visit to 1955 to prevent disastrous changes to 1985...without interfering with his first trip.",57.0,Robert Zemeckis,"['Michael J. Fox', 'Christopher Lloyd', 'Lea Thompson', 'Thomas F. Wilson']",481918,2022-04-17 15:09:11.642,2022-04-17 15:09:11.642
625c2e03f0a5bc6c426c0d6a,The African Queen,1951,105 min,"Adventure, Drama, Romance",7.7,2.7685233387690724,"In WWI Africa, a gin-swilling riverboat captain is persuaded by a strait-laced missionary to use his boat to attack an enemy warship.",91.0,John Huston,"['Humphrey Bogart', 'Katharine Hepburn', 'Robert Morley', 'Peter Bull']",71481,2022-04-17 15:10:59.786,2022-04-17 15:10:59.786
625c2d8ef0a5bc6c426c0bba,Ed Wood,1994,127 min,"Biography, Comedy, Drama",7.8,3.8699283643050544,"Ambitious but troubled movie director Edward D. Wood Jr. tries his best to fulfill his dreams, despite his lack of talent.",70.0,Tim Burton,"['Johnny Depp', 'Martin Landau', 'Sarah Jessica Parker', 'Patricia Arquette']",164937,2022-04-17 15:09:02.711,2022-04-17 15:09:02.711
625c2b6bf0a5bc6c426c06de,The Intouchables,2011,112 min,"Biography, Comedy, Drama",8.5,2.3490517401214794,"After he becomes a quadriplegic from a paragliding accident, an aristocrat hires a young man from the projects to be his caregiver.",57.0,Olivier Nakache,"['Éric Toledano', 'François Cluzet', 'Omar Sy', 'Anne Le Ny']",760360,2022-04-17 14:59:55.866,2022-04-17 14:59:55.866
625c2c5ef0a5bc6c426c08ca,Barry Lyndon,1975,185 min,"Adventure, Drama, History",8.1,1.811410823150179,An Irish rogue wins the heart of a rich widow and assumes her dead husband's aristocratic position in 18th-century England.,89.0,Stanley Kubrick,"[""Ryan O'Neal"", 'Marisa Berenson', 'Patrick Magee', 'Hardy Krüger']",149843,2022-04-17 15:03:58.713,2022-04-17 15:03:58.713
625c2ccbf0a5bc6c426c098a,Big Fish,2003,125 min,"Adventure, Drama, Fantasy",8.0,3.6834999545863223,A frustrated son tries to determine the fact from fiction in his dying father's life.,58.0,Tim Burton,"['Ewan McGregor', 'Albert Finney', 'Billy Crudup', 'Jessica Lange']",415218,2022-04-17 15:05:47.714,2022-04-17 15:05:47.714
