_id,title,release,duration,gerne,IMDB_Rating,rating,overview,metaScore,director,stars,noOfVotes,createdAt,updatedAt
625c2d8cf0a5bc6c426c0bb2,Hana-bi,1997,103 min,"Crime, Drama, Romance",7.8,2.3939044527439757,"Nishi leaves the police in the face of harrowing personal and professional difficulties. Spiraling into depression, he makes questionable decisions.",,Takeshi Kitano,"['Takeshi Kitano', 'Kayoko Kishimoto', 'Ren Osugi', 'Susumu Terajima']",27712,2022-04-17 15:09:00.386,2022-04-17 15:09:00.386
625c2d92f0a5bc6c426c0bc8,A Bronx Tale,1993,121 min,"Crime, Drama, Romance",7.8,2.882802386450697,A father becomes worried when a local gangster befriends his son in the Bronx in the 1960s.,80.0,Robert De Niro,"['Robert De Niro', 'Chazz Palminteri', 'Lillo Brancato', 'Francis Capra']",128171,2022-04-17 15:09:06.724,2022-04-17 15:09:06.724
625c2e0af0a5bc6c426c0d82,Victoria,2015,138 min,"Crime, Drama, Romance",7.6,0.6496112250353636,A young Spanish woman who has recently moved to Berlin finds her flirtation with a local guy turn potentially deadly as their night out with his friends reveals a dangerous secret.,77.0,Sebastian Schipper,"['Laia Costa', 'Frederick Lau', 'Franz Rogowski', 'Burak Yigit']",52903,2022-04-17 15:11:06.030,2022-04-17 15:11:06.030
625c2d30f0a5bc6c426c0aa8,True Romance,1993,119 min,"Crime, Drama, Romance",7.9,3.308716759727389,"In Detroit, a lonely pop culture geek marries a call girl, steals cocaine from her pimp, and tries to sell it in Hollywood. Meanwhile, the owners of the cocaine, the Mob, track them down in an attempt to reclaim it.",59.0,Tony Scott,"['Christian Slater', 'Patricia Arquette', 'Dennis Hopper', 'Val Kilmer']",206918,2022-04-17 15:07:28.451,2022-04-17 15:07:28.451
625c2d85f0a5bc6c426c0b96,Lilja 4-ever,2002,109 min,"Crime, Drama",7.8,2.1473410970935047,"Sixteen-year-old Lilja and her only friend, the young boy Volodja, live in Russia, fantasizing about a better life. One day, Lilja falls in love with Andrej, who is going to Sweden, and invites Lilja to come along and start a new life.",82.0,Lukas Moodysson,"['Oksana Akinshina', 'Artyom Bogucharskiy', 'Pavel Ponomaryov', 'Lyubov Agapova']",42673,2022-04-17 15:08:53.545,2022-04-17 15:08:53.545
625c2db1f0a5bc6c426c0c20,À bout de souffle,1960,90 min,"Crime, Drama",7.8,2.366142130639084,"A small-time thief steals a car and impulsively murders a motorcycle policeman. Wanted by the authorities, he reunites with a hip American journalism student and attempts to persuade her to run away with him to Italy.",,Jean-Luc Godard,"['Jean-Paul Belmondo', 'Jean Seberg', 'Daniel Boulanger', 'Henri-Jacques Huet']",73251,2022-04-17 15:09:37.990,2022-04-17 15:09:37.990
625c2c4ff0a5bc6c426c089a,La haine,1995,98 min,"Crime, Drama",8.1,4.437766803870614,24 hours in the lives of three young men in the French suburbs the day after a violent riot.,,Mathieu Kassovitz,"['Vincent Cassel', 'Hubert Koundé', 'Saïd Taghmaoui', 'Abdel Ahmed Ghili']",150345,2022-04-17 15:03:43.394,2022-04-17 15:03:43.394
625c2d10f0a5bc6c426c0a62,Un prophète,2009,155 min,"Crime, Drama",7.9,0.5231508342104352,A young Arab man is sent to a French prison.,90.0,Jacques Audiard,"['Tahar Rahim', 'Niels Arestrup', 'Adel Bencherif', 'Reda Kateb']",93560,2022-04-17 15:06:56.893,2022-04-17 15:06:56.893
625c2bc1f0a5bc6c426c0746,Drishyam,2013,160 min,"Crime, Drama, Thriller",8.3,4.938834684300563,A man goes to extreme lengths to save his family from punishment after the family commits an accidental crime.,,Jeethu Joseph,"['Mohanlal', 'Meena', 'Asha Sharath', 'Ansiba']",30722,2022-04-17 15:01:21.411,2022-04-17 15:01:21.411
625c2be0f0a5bc6c426c07a2,Talvar,2015,132 min,"Crime, Drama, Mystery",8.2,3.2725202134333387,An experienced investigator confronts several conflicting theories about the perpetrators of a violent double homicide.,,Meghna Gulzar,"['Irrfan Khan', 'Konkona Sen Sharma', 'Neeraj Kabi', 'Sohum Shah']",31142,2022-04-17 15:01:52.614,2022-04-17 15:01:52.614
625c2cf5f0a5bc6c426c0a3a,Manbiki kazoku,2018,121 min,"Crime, Drama",7.9,4.430013072403255,A family of small-time crooks take in a child they find outside in the cold.,93.0,Hirokazu Koreeda,"['Lily Franky', 'Sakura Andô', 'Kirin Kiki', 'Mayu Matsuoka']",62754,2022-04-17 15:06:29.304,2022-04-17 15:06:29.304
625c2bcbf0a5bc6c426c0770,Scarface,1983,170 min,"Crime, Drama",8.3,1.9615119865685948,"In 1980 Miami, a determined Cuban immigrant takes over a drug cartel and succumbs to greed.",65.0,Brian De Palma,"['Al Pacino', 'Michelle Pfeiffer', 'Steven Bauer', 'Mary Elizabeth Mastrantonio']",740911,2022-04-17 15:01:31.001,2022-04-17 15:01:31.001
625c2d09f0a5bc6c426c0a58,Bir Zamanlar Anadolu'da,2011,157 min,"Crime, Drama",7.9,4.488120834276128,A group of men set out in search of a dead body in the Anatolian steppes.,82.0,Nuri Bilge Ceylan,"['Muhammet Uzuner', 'Yilmaz Erdogan', 'Taner Birsel', 'Ahmet Mümtaz Taylan']",41995,2022-04-17 15:06:49.711,2022-04-17 15:06:49.711
625c2b5ff0a5bc6c426c06c4,Cidade de Deus,2002,130 min,"Crime, Drama",8.6,2.487574768903338,"In the slums of Rio, two kids' paths diverge as one struggles to become a photographer and the other a kingpin.",79.0,Fernando Meirelles,"['Kátia Lund', 'Alexandre Rodrigues', 'Leandro Firmino', 'Matheus Nachtergaele']",699256,2022-04-17 14:59:43.029,2022-04-17 14:59:43.029
625c2ccdf0a5bc6c426c0990,Dogville,2003,178 min,"Crime, Drama",8.0,4.596795647818935,"A woman on the run from the mob is reluctantly accepted in a small Colorado community in exchange for labor, but when a search visits the town she finds out that their support has a price.",60.0,Lars von Trier,"['Nicole Kidman', 'Paul Bettany', 'Lauren Bacall', 'Harriet Andersson']",137963,2022-04-17 15:05:49.180,2022-04-17 15:05:49.180
625c2cf0f0a5bc6c426c0a1c,Rope,1948,80 min,"Crime, Drama, Mystery",8.0,0.2301731777240401,Two men attempt to prove they committed the perfect crime by hosting a dinner party after strangling their former classmate to death.,73.0,Alfred Hitchcock,"['James Stewart', 'John Dall', 'Farley Granger', 'Dick Hogan']",129783,2022-04-17 15:06:24.816,2022-04-17 15:06:24.816
625c2dd5f0a5bc6c426c0c96,Zodiac,2007,157 min,"Crime, Drama, Mystery",7.7,2.868135959493685,"In the late 1960s/early 1970s, a San Francisco cartoonist becomes an amateur detective obsessed with tracking down the Zodiac Killer, an unidentified individual who terrorizes Northern California with a killing spree.",78.0,David Fincher,"['Jake Gyllenhaal', 'Robert Downey Jr.', 'Mark Ruffalo', 'Anthony Edwards']",466080,2022-04-17 15:10:13.871,2022-04-17 15:10:13.871
625c2c41f0a5bc6c426c0876,Salinui chueok,2003,131 min,"Crime, Drama, Mystery",8.1,0.4382935615425798,"In a small Korean province in 1986, two detectives struggle with the case of multiple young women being found raped and murdered by an unknown culprit.",82.0,Bong Joon Ho,"['Kang-ho Song', 'Kim Sang-kyung', 'Roe-ha Kim', 'Jae-ho Song']",139558,2022-04-17 15:03:29.551,2022-04-17 15:03:29.551
625c2dbdf0a5bc6c426c0c44,En man som heter Ove,2015,116 min,"Comedy, Drama, Romance",7.7,1.3772437051615438,"Ove, an ill-tempered, isolated retiree who spends his days enforcing block association rules and visiting his wife's grave, has finally given up on life just as an unlikely friendship develops with his boisterous new neighbors.",70.0,Hannes Holm,"['Rolf Lassgård', 'Bahar Pars', 'Filip Berg', 'Ida Engvoll']",47444,2022-04-17 15:09:49.326,2022-04-17 15:09:49.326
625c2bcdf0a5bc6c426c0776,Taxi Driver,1976,114 min,"Crime, Drama",8.3,3.9121916868713837,"A mentally unstable veteran works as a nighttime taxi driver in New York City, where the perceived decadence and sleaze fuels his urge for violent action by attempting to liberate a presidential campaign worker and an underage prostitute.",94.0,Martin Scorsese,"['Robert De Niro', 'Jodie Foster', 'Cybill Shepherd', 'Albert Brooks']",724636,2022-04-17 15:01:33.218,2022-04-17 15:01:33.218
