_id,title,release,duration,gerne,IMDB_Rating,rating,overview,metaScore,director,stars,noOfVotes,createdAt,updatedAt
625c2bb1f0a5bc6c426c0722,Memento,2000,113 min,"Mystery, Thriller",8.4,0.14164255254410785,A man with short-term memory loss attempts to track down his wife's murderer.,80.0,Christopher Nolan,"['Guy Pearce', 'Carrie-Anne Moss', 'Joe Pantoliano', 'Mark Boone Junior']",1125712,2022-04-17 15:01:05.860,2022-04-17 15:01:05.860
625c2c30f0a5bc6c426c0850,Kahaani,2012,122 min,"Mystery, Thriller",8.1,1.393437173359302,"A pregnant woman's search for her missing husband takes her from London to Kolkata, but everyone she questions denies having ever met him.",,Sujoy Ghosh,"['Vidya Balan', 'Parambrata Chattopadhyay', 'Indraneil Sengupta', 'Nawazuddin Siddiqui']",57806,2022-04-17 15:03:12.089,2022-04-17 15:03:12.089
625c2ce2f0a5bc6c426c09e0,Sleuth,1972,138 min,"Mystery, Thriller",8.0,1.398047129831388,"A man who loves games and theater invites his wife's lover to meet him, setting up a battle of wits with potentially deadly results.",,Joseph L. Mankiewicz,"['Laurence Olivier', 'Michael Caine', 'Alec Cawthorne', 'John Matthews']",44748,2022-04-17 15:06:10.438,2022-04-17 15:06:10.438
625c2e14f0a5bc6c426c0d9e,El cuerpo,2012,112 min,"Mystery, Thriller",7.6,1.0798158723484574,A detective searches for the body of a femme fatale which has gone missing from a morgue.,,Oriol Paulo,"['Jose Coronado', 'Hugo Silva', 'Belén Rueda', 'Aura Garrido']",57549,2022-04-17 15:11:16.159,2022-04-17 15:11:16.159
625c2df0f0a5bc6c426c0d12,Spoorloos,1988,107 min,"Mystery, Thriller",7.7,4.356334989812678,"Rex and Saskia, a young couple in love, are on vacation. They stop at a busy service station and Saskia is abducted. After three years and no sign of Saskia, Rex begins receiving letters from the abductor.",,George Sluizer,"['Bernard-Pierre Donnadieu', 'Gene Bervoets', 'Johanna ter Steege', 'Gwen Eckhaus']",33982,2022-04-17 15:10:40.655,2022-04-17 15:10:40.655
625c2bbbf0a5bc6c426c073a,Rear Window,1954,112 min,"Mystery, Thriller",8.4,4.339334821863256,A wheelchair-bound photographer spies on his neighbors from his apartment window and becomes convinced one of them has committed murder.,100.0,Alfred Hitchcock,"['James Stewart', 'Grace Kelly', 'Wendell Corey', 'Thelma Ritter']",444074,2022-04-17 15:01:15.688,2022-04-17 15:01:15.688
625c2db3f0a5bc6c426c0c2c,The Lady Vanishes,1938,96 min,"Mystery, Thriller",7.8,1.3009284401828047,"While travelling in continental Europe, a rich young playgirl realizes that an elderly lady seems to have disappeared from the train.",98.0,Alfred Hitchcock,"['Margaret Lockwood', 'Michael Redgrave', 'Paul Lukas', 'May Whitty']",47400,2022-04-17 15:09:39.781,2022-04-17 15:09:39.781
625c2e2ff0a5bc6c426c0e1a,Lost Highway,1997,134 min,"Mystery, Thriller",7.6,4.769542722312776,"Anonymous videotapes presage a musician's murder conviction, and a gangster's girlfriend leads a mechanic astray.",52.0,David Lynch,"['Bill Pullman', 'Patricia Arquette', 'John Roselius', 'Louis Eppolito']",131101,2022-04-17 15:11:43.530,2022-04-17 15:11:43.530
625c2beff0a5bc6c426c07ba,Shutter Island,2010,138 min,"Mystery, Thriller",8.2,3.8719875706026787,"In 1954, a U.S. Marshal investigates the disappearance of a murderer who escaped from a hospital for the criminally insane.",63.0,Martin Scorsese,"['Leonardo DiCaprio', 'Emily Mortimer', 'Mark Ruffalo', 'Ben Kingsley']",1129894,2022-04-17 15:02:07.507,2022-04-17 15:02:07.507
625c2cd0f0a5bc6c426c09aa,Twelve Monkeys,1995,129 min,"Mystery, Sci-Fi, Thriller",8.0,3.4040948318837594,"In a future world devastated by disease, a convict is sent back in time to gather information about the man-made virus that wiped out most of the human population on the planet.",74.0,Terry Gilliam,"['Bruce Willis', 'Madeleine Stowe', 'Brad Pitt', 'Joseph Melito']",578443,2022-04-17 15:05:52.605,2022-04-17 15:05:52.605
625c2e2ff0a5bc6c426c0e16,Dark City,1998,100 min,"Mystery, Sci-Fi, Thriller",7.6,1.5999137168804722,"A man struggles with memories of his past, which include a wife he cannot remember and a nightmarish world no one else ever seems to wake up from.",66.0,Alex Proyas,"['Rufus Sewell', 'Kiefer Sutherland', 'Jennifer Connelly', 'William Hurt']",187927,2022-04-17 15:11:43.114,2022-04-17 15:11:43.114
625c2c15f0a5bc6c426c0826,Ah-ga-ssi,2016,145 min,"Drama, Romance, Thriller",8.1,1.9319878706804194,"A woman is hired as a handmaiden to a Japanese heiress, but secretly she is involved in a plot to defraud her.",84.0,Chan-wook Park,"['Kim Min-hee', 'Jung-woo Ha', 'Cho Jin-woong', 'Moon So-Ri']",113649,2022-04-17 15:02:45.634,2022-04-17 15:02:45.634
625c2c1af0a5bc6c426c082e,Room,2015,118 min,"Drama, Thriller",8.1,1.8917269608571097,"Held captive for 7 years in an enclosed space, a woman and her young son finally gain their freedom, allowing the boy to experience the outside world for the first time.",86.0,Lenny Abrahamson,"['Brie Larson', 'Jacob Tremblay', 'Sean Bridgers', 'Wendy Crewson']",371538,2022-04-17 15:02:50.074,2022-04-17 15:02:50.074
625c2e25f0a5bc6c426c0dda,Match Point,2005,124 min,"Drama, Romance, Thriller",7.6,4.856093837254995,"At a turning point in his life, a former tennis pro falls for an actress who happens to be dating his friend and soon-to-be brother-in-law.",72.0,Woody Allen,"['Scarlett Johansson', 'Jonathan Rhys Meyers', 'Emily Mortimer', 'Matthew Goode']",206294,2022-04-17 15:11:33.548,2022-04-17 15:11:33.548
625c2d43f0a5bc6c426c0ae6,Hiroshima mon amour,1959,90 min,"Drama, Romance",7.9,4.632575580587485,A French actress filming an anti-war film in Hiroshima has an affair with a married Japanese architect as they share their differing perspectives on war.,,Alain Resnais,"['Emmanuelle Riva', 'Eiji Okada', 'Stella Dassas', 'Pierre Barbaud']",28421,2022-04-17 15:07:47.779,2022-04-17 15:07:47.779
625c2d60f0a5bc6c426c0b4a,Kokuhaku,2010,106 min,"Drama, Thriller",7.8,0.43141034546324675,A psychological thriller of a grieving mother turned cold-blooded avenger with a twisty master plan to pay back those who were responsible for her daughter's death.,,Tetsuya Nakashima,"['Takako Matsu', 'Yoshino Kimura', 'Masaki Okada', 'Yukito Nishii']",35713,2022-04-17 15:08:16.190,2022-04-17 15:08:16.190
625c2b74f0a5bc6c426c06fc,Casablanca,1942,102 min,"Drama, Romance, War",8.5,3.405290886829766,A cynical expatriate American cafe owner struggles to decide whether or not to help his former lover and her fugitive husband escape the Nazis in French Morocco.,100.0,Michael Curtiz,"['Humphrey Bogart', 'Ingrid Bergman', 'Paul Henreid', 'Claude Rains']",522093,2022-04-17 15:00:04.091,2022-04-17 15:00:04.091
625c2b5af0a5bc6c426c06be,Gisaengchung,2019,132 min,"Comedy, Drama, Thriller",8.6,3.560072324027954,Greed and class discrimination threaten the newly formed symbiotic relationship between the wealthy Park family and the destitute Kim clan.,96.0,Bong Joon Ho,"['Kang-ho Song', 'Lee Sun-kyun', 'Cho Yeo-jeong', 'Choi Woo-sik']",552778,2022-04-17 14:59:38.461,2022-04-17 14:59:38.461
625c2d8df0a5bc6c426c0bb4,Gattaca,1997,106 min,"Drama, Sci-Fi, Thriller",7.8,2.311791246259214,A genetically inferior man assumes the identity of a superior one in order to pursue his lifelong dream of space travel.,64.0,Andrew Niccol,"['Ethan Hawke', 'Uma Thurman', 'Jude Law', 'Gore Vidal']",280845,2022-04-17 15:09:01.127,2022-04-17 15:09:01.127
625c2d38f0a5bc6c426c0ac2,Manhattan,1979,96 min,"Comedy, Drama, Romance",7.9,1.2750438494021743,The life of a divorced television writer dating a teenage girl is further complicated when he falls in love with his best friend's mistress.,83.0,Woody Allen,"['Woody Allen', 'Diane Keaton', 'Mariel Hemingway', 'Michael Murphy']",131436,2022-04-17 15:07:36.029,2022-04-17 15:07:36.029
