_id,title,release,duration,gerne,IMDB_Rating,rating,overview,metaScore,director,stars,noOfVotes,createdAt,updatedAt
625c2c52f0a5bc6c426c08a2,Chung Hing sam lam,1994,102 min,"Comedy, Crime, Drama",8.1,4.7931157129214155,"Two melancholy Hong Kong policemen fall in love: one with a mysterious female underworld figure, the other with a beautiful and ethereal server at a late-night restaurant he frequents.",77.0,Kar-Wai Wong,"['Brigitte Lin', 'Takeshi Kaneshiro', 'Tony Chiu-Wai Leung', 'Faye Wong']",63122,2022-04-17 15:03:46.968,2022-04-17 15:03:46.968
625c2e38f0a5bc6c426c0e52,The Long Goodbye,1973,112 min,"Comedy, Crime, Drama",7.6,1.2231987057301263,"Private investigator Philip Marlowe helps a friend out of a jam, but in doing so gets implicated in his wife's murder.",87.0,Robert Altman,"['Elliott Gould', 'Nina van Pallandt', 'Sterling Hayden', 'Mark Rydell']",26337,2022-04-17 15:11:52.719,2022-04-17 15:11:52.719
625c2c00f0a5bc6c426c07ea,Dom za vesanje,1988,142 min,"Comedy, Crime, Drama",8.2,1.8844619925821637,"In this luminous tale set in the area around Sarajevo and in Italy, Perhan, an engaging young Romany (gypsy) with telekinetic powers, is seduced by the quick-cash world of petty crime, which threatens to destroy him and those he loves.",,Emir Kusturica,"['Davor Dujmovic', 'Bora Todorovic', 'Ljubica Adzovic', 'Husnija Hasimovic']",26402,2022-04-17 15:02:24.901,2022-04-17 15:02:24.901
625c2bf4f0a5bc6c426c07ca,Rang De Basanti,2006,167 min,"Comedy, Crime, Drama",8.2,3.0051668426589027,"The story of six young Indians who assist an English woman to film a documentary on the freedom fighters from their past, and the events that lead them to relive the long-forgotten saga of freedom.",,Rakeysh Omprakash Mehra,"['Aamir Khan', 'Soha Ali Khan', 'Siddharth', 'Sharman Joshi']",111937,2022-04-17 15:02:12.934,2022-04-17 15:02:12.934
625c2c66f0a5bc6c426c08d0,Paper Moon,1973,102 min,"Comedy, Crime, Drama",8.1,1.82303303162495,"During the Great Depression, a con man finds himself saddled with a young girl who may or may not be his daughter, and the two forge an unlikely partnership.",77.0,Peter Bogdanovich,"[""Ryan O'Neal"", ""Tatum O'Neal"", 'Madeline Kahn', 'John Hillerman']",42285,2022-04-17 15:04:06.720,2022-04-17 15:04:06.720
625c2de6f0a5bc6c426c0cf4,Do lok tin si,1995,99 min,"Comedy, Crime, Drama",7.7,4.0601891351292805,"This Hong Kong-set crime drama follows the lives of a hitman, hoping to get out of the business, and his elusive female partner.",71.0,Kar-Wai Wong,"['Leon Lai', 'Michelle Reis', 'Takeshi Kaneshiro', 'Charlie Yeung']",26429,2022-04-17 15:10:30.809,2022-04-17 15:10:30.809
625c2d77f0a5bc6c426c0b74,American Gangster,2007,157 min,"Biography, Crime, Drama",7.8,1.1277604495050264,"An outcast New York City cop is charged with bringing down Harlem drug lord Frank Lucas, whose real life inspired this partly biographical film.",76.0,Ridley Scott,"['Denzel Washington', 'Russell Crowe', 'Chiwetel Ejiofor', 'Josh Brolin']",392449,2022-04-17 15:08:39.184,2022-04-17 15:08:39.184
625c2be0f0a5bc6c426c07a0,"Three Billboards Outside Ebbing, Missouri",2017,115 min,"Comedy, Crime, Drama",8.2,3.6723246719935334,A mother personally challenges the local authorities to solve her daughter's murder when they fail to catch the culprit.,88.0,Martin McDonagh,"['Frances McDormand', 'Woody Harrelson', 'Sam Rockwell', 'Caleb Landry Jones']",432610,2022-04-17 15:01:52.409,2022-04-17 15:01:52.409
625c2d7ff0a5bc6c426c0b84,Adams æbler,2005,94 min,"Comedy, Crime, Drama",7.8,0.9877452106620987,A neo-nazi sentenced to community service at a church clashes with the blindly devotional priest.,51.0,Anders Thomas Jensen,"['Ulrich Thomsen', 'Mads Mikkelsen', 'Nicolas Bro', 'Paprika Steen']",45717,2022-04-17 15:08:47.570,2022-04-17 15:08:47.570
625c2bcdf0a5bc6c426c0778,The Sting,1973,129 min,"Comedy, Crime, Drama",8.3,1.5816141416145746,Two grifters team up to pull off the ultimate con.,83.0,George Roy Hill,"['Paul Newman', 'Robert Redford', 'Robert Shaw', 'Charles Durning']",241513,2022-04-17 15:01:33.942,2022-04-17 15:01:33.942
625c2d7df0a5bc6c426c0b7c,Little Miss Sunshine,2006,101 min,"Comedy, Drama",7.8,3.547795617340049,A family determined to get their young daughter into the finals of a beauty pageant take a cross-country trip in their VW bus.,80.0,Jonathan Dayton,"['Valerie Faris', 'Steve Carell', 'Toni Collette', 'Greg Kinnear']",439856,2022-04-17 15:08:45.694,2022-04-17 15:08:45.694
625c2c55f0a5bc6c426c08ac,Dead Poets Society,1989,128 min,"Comedy, Drama",8.1,0.7805170389942628,Maverick teacher John Keating uses poetry to embolden his boarding school students to new heights of self-expression.,79.0,Peter Weir,"['Robin Williams', 'Robert Sean Leonard', 'Ethan Hawke', 'Josh Charles']",425457,2022-04-17 15:03:49.587,2022-04-17 15:03:49.587
625c2d1df0a5bc6c426c0a74,In Bruges,2008,107 min,"Comedy, Crime, Drama",7.9,1.3691181686996412,"Guilt-stricken after a job gone wrong, hitman Ray and his partner await orders from their ruthless boss in Bruges, Belgium, the last place in the world Ray wants to be.",67.0,Martin McDonagh,"['Colin Farrell', 'Brendan Gleeson', 'Ciarán Hinds', 'Elizabeth Berrington']",390334,2022-04-17 15:07:09.636,2022-04-17 15:07:09.636
625c2da1f0a5bc6c426c0bf6,The King of Comedy,1982,109 min,"Comedy, Crime, Drama",7.8,3.61142330620709,"Rupert Pupkin is a passionate yet unsuccessful comic who craves nothing more than to be in the spotlight and to achieve this, he stalks and kidnaps his idol to take the spotlight for himself.",73.0,Martin Scorsese,"['Robert De Niro', 'Jerry Lewis', 'Diahnne Abbott', 'Sandra Bernhard']",88511,2022-04-17 15:09:21.120,2022-04-17 15:09:21.120
625c2cf4f0a5bc6c426c0a36,Knives Out,2019,130 min,"Comedy, Crime, Drama",7.9,3.34868093095418,"A detective investigates the death of a patriarch of an eccentric, combative family.",82.0,Rian Johnson,"['Daniel Craig', 'Chris Evans', 'Ana de Armas', 'Jamie Lee Curtis']",454203,2022-04-17 15:06:28.899,2022-04-17 15:06:28.899
625c2c74f0a5bc6c426c0900,White Heat,1949,114 min,"Action, Crime, Drama",8.1,0.7181003180845069,A psychopathic criminal with a mother complex makes a daring break from prison and leads his old gang in a chemical plant payroll heist.,,Raoul Walsh,"['James Cagney', 'Virginia Mayo', ""Edmond O'Brien"", 'Margaret Wycherly']",29807,2022-04-17 15:04:20.429,2022-04-17 15:04:20.429
625c2e28f0a5bc6c426c0dea,The Station Agent,2003,89 min,"Comedy, Drama",7.6,1.6071186781185098,"When his only friend dies, a man born with dwarfism moves to rural New Jersey to live a life of solitude, only to meet a chatty hot dog vendor and a woman dealing with her own personal loss.",81.0,Tom McCarthy,"['Peter Dinklage', 'Patricia Clarkson', 'Bobby Cannavale', 'Paul Benjamin']",67370,2022-04-17 15:11:36.717,2022-04-17 15:11:36.717
625c2d5ff0a5bc6c426c0b44,Moonrise Kingdom,2012,94 min,"Comedy, Drama, Romance",7.8,0.4394409345655559,"A pair of young lovers flee their New England town, which causes a local search party to fan out to find them.",84.0,Wes Anderson,"['Jared Gilman', 'Kara Hayward', 'Bruce Willis', 'Bill Murray']",318789,2022-04-17 15:08:15.015,2022-04-17 15:08:15.015
625c2debf0a5bc6c426c0cfa,Short Cuts,1993,188 min,"Comedy, Drama",7.7,4.320053061808105,The day-to-day lives of several suburban Los Angeles residents.,79.0,Robert Altman,"['Andie MacDowell', 'Julianne Moore', 'Tim Robbins', 'Bruce Davison']",42275,2022-04-17 15:10:35.285,2022-04-17 15:10:35.285
625c2decf0a5bc6c426c0cfe,The Muppet Christmas Carol,1992,85 min,"Comedy, Drama, Family",7.7,4.436602821247333,The Muppet characters tell their version of the classic tale of an old and bitter miser's redemption on Christmas Eve.,64.0,Brian Henson,"['Michael Caine', 'Kermit the Frog', 'Dave Goelz', 'Miss Piggy']",50298,2022-04-17 15:10:36.560,2022-04-17 15:10:36.560
