_id,title,release,duration,gerne,IMDB_Rating,rating,overview,metaScore,director,stars,noOfVotes,createdAt,updatedAt
625c2c76f0a5bc6c426c0908,Rebecca,1940,130 min,"Drama, Mystery, Romance",8.1,0.9190577288286628,A self-conscious woman juggles adjusting to her new role as an aristocrat's wife and avoiding being intimidated by his first wife's spectral presence.,86.0,Alfred Hitchcock,"['Laurence Olivier', 'Joan Fontaine', 'George Sanders', 'Judith Anderson']",123942,2022-04-17 15:04:22.313,2022-04-17 15:04:22.313
625c2c52f0a5bc6c426c08a0,Trois couleurs: Rouge,1994,99 min,"Drama, Mystery, Romance",8.1,0.8946112152458174,A model discovers a retired judge is keen on invading people's privacy.,100.0,Krzysztof Kieslowski,"['Irène Jacob', 'Jean-Louis Trintignant', 'Frédérique Feder', 'Jean-Pierre Lorit']",90729,2022-04-17 15:03:46.760,2022-04-17 15:03:46.760
625c2d25f0a5bc6c426c0a90,Hable con ella,2002,112 min,"Drama, Mystery, Romance",7.9,0.09909463267836038,Two men share an odd friendship while they care for two women who are both in deep comas.,86.0,Pedro Almodóvar,"['Rosario Flores', 'Javier Cámara', 'Darío Grandinetti', 'Leonor Watling']",104691,2022-04-17 15:07:17.697,2022-04-17 15:07:17.697
625c2e28f0a5bc6c426c0de8,Un long dimanche de fiançailles,2004,133 min,"Drama, Mystery, Romance",7.6,3.2465560313482325,"Tells the story of a young woman's relentless search for her fiancé, who has disappeared from the trenches of the Somme during World War One.",76.0,Jean-Pierre Jeunet,"['Audrey Tautou', 'Gaspard Ulliel', 'Jodie Foster', 'Dominique Pinon']",70925,2022-04-17 15:11:36.517,2022-04-17 15:11:36.517
625c2be9f0a5bc6c426c07b6,El secreto de sus ojos,2009,129 min,"Drama, Mystery, Romance",8.2,2.234094293029915,A retired legal counselor writes a novel hoping to find closure for one of his past unresolved homicide cases and for his unreciprocated love with his superior - both of which still haunt him decades later.,80.0,Juan José Campanella,"['Ricardo Darín', 'Soledad Villamil', 'Pablo Rago', 'Carla Quevedo']",193217,2022-04-17 15:02:01.547,2022-04-17 15:02:01.547
625c2d12f0a5bc6c426c0a64,Moon,2009,97 min,"Drama, Mystery, Sci-Fi",7.9,4.986237803631121,"Astronaut Sam Bell has a quintessentially personal encounter toward the end of his three-year stint on the Moon, where he, working alongside his computer, GERTY, sends back to Earth parcels of a resource that has helped diminish our planet's power problems.",67.0,Duncan Jones,"['Sam Rockwell', 'Kevin Spacey', 'Dominique McElligott', 'Rosie Shaw']",335152,2022-04-17 15:06:58.631,2022-04-17 15:06:58.631
625c2d8bf0a5bc6c426c0bb0,Titanic,1997,194 min,"Drama, Romance",7.8,4.444612383843544,"A seventeen-year-old aristocrat falls in love with a kind but poor artist aboard the luxurious, ill-fated R.M.S. Titanic.",75.0,James Cameron,"['Leonardo DiCaprio', 'Kate Winslet', 'Billy Zane', 'Kathy Bates']",1046089,2022-04-17 15:08:59.642,2022-04-17 15:08:59.642
625c2d24f0a5bc6c426c0a88,Gegen die Wand,2004,121 min,"Drama, Romance",7.9,2.3465882439737893,"With the intention to break free from the strict familial restrictions, a suicidal young woman sets up a marriage of convenience with a forty-year-old addict, an act that will lead to an outburst of envious love.",78.0,Fatih Akin,"['Birol Ünel', 'Sibel Kekilli', 'Güven Kiraç', 'Zarah Jane McKenzie']",51325,2022-04-17 15:07:16.265,2022-04-17 15:07:16.265
625c2e03f0a5bc6c426c0d6c,Gilda,1946,110 min,"Drama, Film-Noir, Romance",7.7,1.6665187617327104,A small-time gambler hired to work in a Buenos Aires casino discovers his employer's new wife is his former lover.,,Charles Vidor,"['Rita Hayworth', 'Glenn Ford', 'George Macready', 'Joseph Calleia']",27991,2022-04-17 15:10:59.995,2022-04-17 15:10:59.995
625c2b74f0a5bc6c426c06fc,Casablanca,1942,102 min,"Drama, Romance, War",8.5,3.405290886829766,A cynical expatriate American cafe owner struggles to decide whether or not to help his former lover and her fugitive husband escape the Nazis in French Morocco.,100.0,Michael Curtiz,"['Humphrey Bogart', 'Ingrid Bergman', 'Paul Henreid', 'Claude Rains']",522093,2022-04-17 15:00:04.091,2022-04-17 15:00:04.091
625c2cf1f0a5bc6c426c0a22,Laura,1944,88 min,"Drama, Film-Noir, Mystery",8.0,1.8554926281634043,A police detective falls in love with the woman whose murder he is investigating.,,Otto Preminger,"['Gene Tierney', 'Dana Andrews', 'Clifton Webb', 'Vincent Price']",42725,2022-04-17 15:06:25.405,2022-04-17 15:06:25.405
625c2d2df0a5bc6c426c0a9e,Mulholland Dr.,2001,147 min,"Drama, Mystery, Thriller",7.9,2.783593158371893,"After a car wreck on the winding Mulholland Drive renders a woman amnesiac, she and a perky Hollywood-hopeful search for clues and answers across Los Angeles in a twisting venture beyond dreams and reality.",85.0,David Lynch,"['Naomi Watts', 'Laura Harring', 'Justin Theroux', 'Jeanne Bates']",322031,2022-04-17 15:07:25.559,2022-04-17 15:07:25.559
625c2cf1f0a5bc6c426c0a20,Brief Encounter,1945,86 min,"Drama, Romance",8.0,4.237002622780704,"Meeting a stranger in a railway station, a woman is tempted to cheat on her husband.",92.0,David Lean,"['Celia Johnson', 'Trevor Howard', 'Stanley Holloway', 'Joyce Carey']",35601,2022-04-17 15:06:25.209,2022-04-17 15:06:25.209
625c2cb9f0a5bc6c426c0954,Dev.D,2009,144 min,"Drama, Romance",8.0,2.9005289218670716,"After breaking up with his childhood sweetheart, a young man finds solace in drugs. Meanwhile, a teenage girl is caught in the world of prostitution. Will they be destroyed, or will they find redemption?",,Anurag Kashyap,"['Abhay Deol', 'Mahie Gill', 'Kalki Koechlin', 'Dibyendu Bhattacharya']",28749,2022-04-17 15:05:29.420,2022-04-17 15:05:29.420
625c2c41f0a5bc6c426c0872,Before Sunset,2004,80 min,"Drama, Romance",8.1,2.2632269610786446,"Nine years after Jesse and Celine first met, they encounter each other again on the French leg of Jesse's book tour.",90.0,Richard Linklater,"['Ethan Hawke', 'Julie Delpy', 'Vernon Dobtcheff', 'Louise Lemoine Torrès']",236311,2022-04-17 15:03:29.138,2022-04-17 15:03:29.138
625c2cb9f0a5bc6c426c0952,Darbareye Elly,2009,119 min,"Drama, Mystery",8.0,1.3430809095774465,The mysterious disappearance of a kindergarten teacher during a picnic in the north of Iran is followed by a series of misadventures for her fellow travelers.,87.0,Asghar Farhadi,"['Golshifteh Farahani', 'Shahab Hosseini', 'Taraneh Alidoosti', ""Merila Zare'i""]",45803,2022-04-17 15:05:29.244,2022-04-17 15:05:29.244
625c2d43f0a5bc6c426c0ae6,Hiroshima mon amour,1959,90 min,"Drama, Romance",7.9,4.632575580587485,A French actress filming an anti-war film in Hiroshima has an affair with a married Japanese architect as they share their differing perspectives on war.,,Alain Resnais,"['Emmanuelle Riva', 'Eiji Okada', 'Stella Dassas', 'Pierre Barbaud']",28421,2022-04-17 15:07:47.779,2022-04-17 15:07:47.779
625c2d3cf0a5bc6c426c0ade,Charade,1963,113 min,"Comedy, Mystery, Romance",7.9,3.878380889551533,Romance and suspense ensue in Paris as a woman is pursued by several men who want a fortune her murdered husband had stolen. Whom can she trust?,83.0,Stanley Donen,"['Cary Grant', 'Audrey Hepburn', 'Walter Matthau', 'James Coburn']",68689,2022-04-17 15:07:40.453,2022-04-17 15:07:40.453
625c2c09f0a5bc6c426c0808,Smultronstället,1957,91 min,"Drama, Romance",8.2,4.8093598415686785,"After living a life marked by coldness, an aging professor is forced to confront the emptiness of his existence.",88.0,Ingmar Bergman,"['Victor Sjöström', 'Bibi Andersson', 'Ingrid Thulin', 'Gunnar Björnstrand']",96381,2022-04-17 15:02:33.294,2022-04-17 15:02:33.294
625c2e15f0a5bc6c426c0daa,Hævnen,2010,118 min,"Drama, Romance",7.6,0.8152034985683609,"The lives of two Danish families cross each other, and an extraordinary but risky friendship comes into bud. But loneliness, frailty and sorrow lie in wait.",65.0,Susanne Bier,"['Mikael Persbrandt', 'Trine Dyrholm', 'Markus Rygaard', 'Wil Johnson']",38491,2022-04-17 15:11:17.799,2022-04-17 15:11:17.799
