_id,title,release,duration,gerne,IMDB_Rating,rating,overview,metaScore,director,stars,noOfVotes,createdAt,updatedAt
625c2e33f0a5bc6c426c0e38,The Little Mermaid,1989,83 min,"Animation, Family, Fantasy",7.6,3.783456984683742,A mermaid princess makes a Faustian bargain in an attempt to become human and win a prince's love.,88.0,Ron Clements,"['John Musker', 'Jodi Benson', 'Samuel E. Wright', 'Rene Auberjonois']",237696,2022-04-17 15:11:47.627,2022-04-17 15:11:47.627
625c2c02f0a5bc6c426c07ec,Tonari no Totoro,1988,86 min,"Animation, Family, Fantasy",8.2,4.553388014379108,"When two girls move to the country to be near their ailing mother, they have adventures with the wondrous forest spirits who live nearby.",86.0,Hayao Miyazaki,"['Hitoshi Takagi', 'Noriko Hidaka', 'Chika Sakamoto', 'Shigesato Itoi']",291180,2022-04-17 15:02:26.521,2022-04-17 15:02:26.521
625c2cd1f0a5bc6c426c09ae,The Nightmare Before Christmas,1993,76 min,"Animation, Family, Fantasy",8.0,3.62962422253314,"Jack Skellington, king of Halloween Town, discovers Christmas Town, but his attempts to bring Christmas to his home causes confusion.",82.0,Henry Selick,"['Danny Elfman', 'Chris Sarandon', ""Catherine O'Hara"", 'William Hickey']",300208,2022-04-17 15:05:53.503,2022-04-17 15:05:53.503
625c2ddaf0a5bc6c426c0cb2,Harry Potter and the Goblet of Fire,2005,157 min,"Adventure, Family, Fantasy",7.7,0.5576747502305979,"Harry Potter finds himself competing in a hazardous tournament between rival schools of magic, but he is distracted by recurring nightmares.",81.0,Mike Newell,"['Daniel Radcliffe', 'Emma Watson', 'Rupert Grint', 'Eric Sykes']",548619,2022-04-17 15:10:18.979,2022-04-17 15:10:18.979
625c2e04f0a5bc6c426c0d6e,Fantasia,1940,125 min,"Animation, Family, Fantasy",7.7,3.8447569862340316,A collection of animated interpretations of great works of Western classical music.,96.0,James Algar,"['Samuel Armstrong', 'Ford Beebe Jr.', 'Norman Ferguson', 'David Hand']",88662,2022-04-17 15:11:00.202,2022-04-17 15:11:00.202
625c2e23f0a5bc6c426c0dc8,The Secret of Kells,2009,71 min,"Animation, Adventure, Family",7.6,4.344502342295135,"A young boy in a remote medieval outpost under siege from barbarian raids is beckoned to adventure when a celebrated master illuminator arrives with an ancient book, brimming with secret wisdom and powers.",81.0,Tomm Moore,"['Nora Twomey', 'Evan McGuire', 'Brendan Gleeson', 'Mick Lally']",31779,2022-04-17 15:11:31.651,2022-04-17 15:11:31.651
625c2cf2f0a5bc6c426c0a2c,The Wizard of Oz,1939,102 min,"Adventure, Family, Fantasy",8.0,0.66838051222605,Dorothy Gale is swept away from a farm in Kansas to a magical land of Oz in a tornado and embarks on a quest with her new friends to see the Wizard who can help her return home to Kansas and help her friends as well.,92.0,Victor Fleming,"['George Cukor', 'Mervyn LeRoy', 'Norman Taurog', 'Richard Thorpe']",371379,2022-04-17 15:06:26.422,2022-04-17 15:06:26.422
625c2e2af0a5bc6c426c0dfe,Harry Potter and the Sorcerer's Stone,2001,152 min,"Adventure, Family, Fantasy",7.6,4.3078390977915095,"An orphaned boy enrolls in a school of wizardry, where he learns the truth about himself, his family and the terrible evil that haunts the magical world.",64.0,Chris Columbus,"['Daniel Radcliffe', 'Rupert Grint', 'Richard Harris', 'Maggie Smith']",658185,2022-04-17 15:11:38.799,2022-04-17 15:11:38.799
625c2d25f0a5bc6c426c0a8c,Harry Potter and the Prisoner of Azkaban,2004,142 min,"Adventure, Family, Fantasy",7.9,1.6095415323142759,"Harry Potter, Ron and Hermione return to Hogwarts School of Witchcraft and Wizardry for their third year of study, where they delve into the mystery surrounding an escaped prisoner who poses a dangerous threat to the young wizard.",82.0,Alfonso Cuarón,"['Daniel Radcliffe', 'Emma Watson', 'Rupert Grint', 'Richard Griffiths']",552493,2022-04-17 15:07:17.267,2022-04-17 15:07:17.267
625c2e39f0a5bc6c426c0e58,The Jungle Book,1967,78 min,"Animation, Adventure, Family",7.6,4.563968988509217,Bagheera the Panther and Baloo the Bear have a difficult time trying to convince a boy to leave the jungle for human civilization.,65.0,Wolfgang Reitherman,"['Phil Harris', 'Sebastian Cabot', 'Louis Prima', 'Bruce Reitherman']",166409,2022-04-17 15:11:53.922,2022-04-17 15:11:53.922
625c2cd7f0a5bc6c426c09c4,The Princess Bride,1987,98 min,"Adventure, Family, Fantasy",8.0,4.609968932014846,"While home sick in bed, a young boy's grandfather reads him the story of a farmboy-turned-pirate who encounters numerous obstacles, enemies and allies in his quest to be reunited with his true love.",77.0,Rob Reiner,"['Cary Elwes', 'Mandy Patinkin', 'Robin Wright', 'Chris Sarandon']",393899,2022-04-17 15:05:59.156,2022-04-17 15:05:59.156
625c2bf9f0a5bc6c426c07d4,Hauru no ugoku shiro,2004,119 min,"Animation, Adventure, Family",8.2,3.6686801876152533,"When an unconfident young woman is cursed with an old body by a spiteful witch, her only chance of breaking the spell lies with a self-indulgent yet insecure young wizard and his companions in his legged, walking castle.",80.0,Hayao Miyazaki,"['Chieko Baishô', 'Takuya Kimura', 'Tatsuya Gashûin', 'Akihiro Miwa']",333915,2022-04-17 15:02:17.255,2022-04-17 15:02:17.255
625c2c20f0a5bc6c426c083e,Ôkami kodomo no Ame to Yuki,2012,117 min,"Animation, Drama, Fantasy",8.1,2.503668080502713,"After her werewolf lover unexpectedly dies in an accident while hunting for food for their children, a young woman must find ways to raise the werewolf son and daughter that she had with him while keeping their trait hidden from society.",71.0,Mamoru Hosoda,"['Aoi Miyazaki', 'Takao Osawa', 'Haru Kuroki', 'Yukito Nishii']",38803,2022-04-17 15:02:56.221,2022-04-17 15:02:56.221
625c2dcff0a5bc6c426c0c7e,Harry Potter and the Deathly Hallows: Part 1,2010,146 min,"Adventure, Family, Fantasy",7.7,3.726908401834741,"As Harry, Ron, and Hermione race against time and evil to destroy the Horcruxes, they uncover the existence of the three most powerful objects in the wizarding world: the Deathly Hallows.",65.0,David Yates,"['Daniel Radcliffe', 'Emma Watson', 'Rupert Grint', 'Bill Nighy']",479120,2022-04-17 15:10:07.707,2022-04-17 15:10:07.707
625c2db1f0a5bc6c426c0c18,Mary Poppins,1964,139 min,"Comedy, Family, Fantasy",7.8,4.600533263604142,"In turn of the century London, a magical nanny employs music and adventure to help two neglected children become closer to their father.",88.0,Robert Stevenson,"['Julie Andrews', 'Dick Van Dyke', 'David Tomlinson', 'Glynis Johns']",158029,2022-04-17 15:09:37.181,2022-04-17 15:09:37.181
625c2df6f0a5bc6c426c0d2e,Rupan sansei: Kariosutoro no shiro,1979,100 min,"Animation, Adventure, Family",7.7,4.264036475891585,"A dashing thief, his gang of desperadoes and an intrepid policeman struggle to free a princess from an evil count's clutches, and learn the hidden secret to a fabulous treasure that she holds part of a key to.",71.0,Hayao Miyazaki,"['Yasuo Yamada', 'Eiko Masuyama', 'Kiyoshi Kobayashi', 'Makio Inoue']",27014,2022-04-17 15:10:46.567,2022-04-17 15:10:46.567
625c2e23f0a5bc6c426c0dc6,Stardust,2007,127 min,"Adventure, Family, Fantasy",7.6,3.748549863588009,"In a countryside town bordering on a magical land, a young man makes a promise to his beloved that he'll retrieve a fallen star by venturing into the magical realm.",66.0,Matthew Vaughn,"['Charlie Cox', 'Claire Danes', 'Sienna Miller', 'Ian McKellen']",255036,2022-04-17 15:11:31.449,2022-04-17 15:11:31.449
625c2d89f0a5bc6c426c0b9e,Waking Life,2001,99 min,"Animation, Drama, Fantasy",7.8,4.9524967135366404,A man shuffles through a dream meeting various people and discussing the meanings and purposes of the universe.,83.0,Richard Linklater,"['Ethan Hawke', 'Trevor Jack Brooks', 'Lorelei Linklater', 'Wiley Wiggins']",60684,2022-04-17 15:08:57.262,2022-04-17 15:08:57.262
625c2baaf0a5bc6c426c0712,Coco,2017,105 min,"Animation, Adventure, Family",8.4,0.749865263545495,"Aspiring musician Miguel, confronted with his family's ancestral ban on music, enters the Land of the Dead to find his great-great-grandfather, a legendary singer.",81.0,Lee Unkrich,"['Adrian Molina', 'Anthony Gonzalez', 'Gael García Bernal', 'Benjamin Bratt']",384171,2022-04-17 15:00:58.255,2022-04-17 15:00:58.255
625c2de6f0a5bc6c426c0cf2,A Little Princess,1995,97 min,"Drama, Family, Fantasy",7.7,0.8162737375664875,A young girl is relegated to servitude at a boarding school when her father goes missing and is presumed dead.,83.0,Alfonso Cuarón,"['Liesel Matthews', 'Eleanor Bron', 'Liam Cunningham', 'Rusty Schwimmer']",32236,2022-04-17 15:10:30.592,2022-04-17 15:10:30.592
