_id,title,release,duration,gerne,IMDB_Rating,rating,overview,metaScore,director,stars,noOfVotes,createdAt,updatedAt
625c2cfbf0a5bc6c426c0a46,Captain Fantastic,2016,118 min,"Comedy, Drama",7.9,3.5701799330001927,"In the forests of the Pacific Northwest, a father devoted to raising his six kids with a rigorous physical and intellectual education is forced to leave his paradise and enter the world, challenging his idea of what it means to be a parent.",72.0,Matt Ross,"['Viggo Mortensen', 'George MacKay', 'Samantha Isler', 'Annalise Basso']",189400,2022-04-17 15:06:35.672,2022-04-17 15:06:35.672
625c2b5af0a5bc6c426c06be,Gisaengchung,2019,132 min,"Comedy, Drama, Thriller",8.6,3.560072324027954,Greed and class discrimination threaten the newly formed symbiotic relationship between the wealthy Park family and the destitute Kim clan.,96.0,Bong Joon Ho,"['Kang-ho Song', 'Lee Sun-kyun', 'Cho Yeo-jeong', 'Choi Woo-sik']",552778,2022-04-17 14:59:38.461,2022-04-17 14:59:38.461
625c2c55f0a5bc6c426c08ac,Dead Poets Society,1989,128 min,"Comedy, Drama",8.1,0.7805170389942628,Maverick teacher John Keating uses poetry to embolden his boarding school students to new heights of self-expression.,79.0,Peter Weir,"['Robin Williams', 'Robert Sean Leonard', 'Ethan Hawke', 'Josh Charles']",425457,2022-04-17 15:03:49.587,2022-04-17 15:03:49.587
625c2decf0a5bc6c426c0cfe,The Muppet Christmas Carol,1992,85 min,"Comedy, Drama, Family",7.7,4.436602821247333,The Muppet characters tell their version of the classic tale of an old and bitter miser's redemption on Christmas Eve.,64.0,Brian Henson,"['Michael Caine', 'Kermit the Frog', 'Dave Goelz', 'Miss Piggy']",50298,2022-04-17 15:10:36.560,2022-04-17 15:10:36.560
625c2e36f0a5bc6c426c0e40,Blood Simple,1984,99 min,"Crime, Drama, Thriller",7.6,1.7240105246019743,"The owner of a seedy small-town Texas bar discovers that one of his employees is having an affair with his wife. A chaotic chain of misunderstandings, lies and mischief ensues after he devises a plot to have them murdered.",82.0,Joel Coen,"['Ethan Coen', 'John Getz', 'Frances McDormand', 'Dan Hedaya']",87745,2022-04-17 15:11:50.032,2022-04-17 15:11:50.032
625c2e28f0a5bc6c426c0dea,The Station Agent,2003,89 min,"Comedy, Drama",7.6,1.6071186781185098,"When his only friend dies, a man born with dwarfism moves to rural New Jersey to live a life of solitude, only to meet a chatty hot dog vendor and a woman dealing with her own personal loss.",81.0,Tom McCarthy,"['Peter Dinklage', 'Patricia Clarkson', 'Bobby Cannavale', 'Paul Benjamin']",67370,2022-04-17 15:11:36.717,2022-04-17 15:11:36.717
625c2d5ff0a5bc6c426c0b44,Moonrise Kingdom,2012,94 min,"Comedy, Drama, Romance",7.8,0.4394409345655559,"A pair of young lovers flee their New England town, which causes a local search party to fan out to find them.",84.0,Wes Anderson,"['Jared Gilman', 'Kara Hayward', 'Bruce Willis', 'Bill Murray']",318789,2022-04-17 15:08:15.015,2022-04-17 15:08:15.015
625c2b76f0a5bc6c426c0700,City Lights,1931,87 min,"Comedy, Drama, Romance",8.5,0.4001693336818479,"With the aid of a wealthy erratic tippler, a dewy-eyed tramp who has fallen in love with a sightless flower girl accumulates money to be able to help her medically.",99.0,Charles Chaplin,"['Charles Chaplin', 'Virginia Cherrill', 'Florence Lee', 'Harry Myers']",167839,2022-04-17 15:00:06.195,2022-04-17 15:00:06.195
625c2bf4f0a5bc6c426c07ca,Rang De Basanti,2006,167 min,"Comedy, Crime, Drama",8.2,3.0051668426589027,"The story of six young Indians who assist an English woman to film a documentary on the freedom fighters from their past, and the events that lead them to relive the long-forgotten saga of freedom.",,Rakeysh Omprakash Mehra,"['Aamir Khan', 'Soha Ali Khan', 'Siddharth', 'Sharman Joshi']",111937,2022-04-17 15:02:12.934,2022-04-17 15:02:12.934
625c2c79f0a5bc6c426c090a,Mr. Smith Goes to Washington,1939,129 min,"Comedy, Drama",8.1,3.2016330807813667,"A naive man is appointed to fill a vacancy in the United States Senate. His plans promptly collide with political corruption, but he doesn't back down.",73.0,Frank Capra,"['James Stewart', 'Jean Arthur', 'Claude Rains', 'Edward Arnold']",107017,2022-04-17 15:04:25.537,2022-04-17 15:04:25.537
625c2c66f0a5bc6c426c08d0,Paper Moon,1973,102 min,"Comedy, Crime, Drama",8.1,1.82303303162495,"During the Great Depression, a con man finds himself saddled with a young girl who may or may not be his daughter, and the two forge an unlikely partnership.",77.0,Peter Bogdanovich,"[""Ryan O'Neal"", ""Tatum O'Neal"", 'Madeline Kahn', 'John Hillerman']",42285,2022-04-17 15:04:06.720,2022-04-17 15:04:06.720
625c2c3ff0a5bc6c426c086a,Lage Raho Munna Bhai,2006,144 min,"Comedy, Drama, Romance",8.1,0.28100454809317554,Munna Bhai embarks on a journey with Mahatma Gandhi in order to fight against a corrupt property dealer.,,Rajkumar Hirani,"['Sanjay Dutt', 'Arshad Warsi', 'Vidya Balan', 'Boman Irani']",43137,2022-04-17 15:03:27.594,2022-04-17 15:03:27.594
625c2c83f0a5bc6c426c093c,The Imitation Game,2014,114 min,"Biography, Drama, Thriller",8.0,0.7751004826228669,"During World War II, the English mathematical genius Alan Turing tries to crack the German Enigma code with help from fellow mathematicians.",73.0,Morten Tyldum,"['Benedict Cumberbatch', 'Keira Knightley', 'Matthew Goode', 'Allen Leech']",685201,2022-04-17 15:04:35.756,2022-04-17 15:04:35.756
625c2d7df0a5bc6c426c0b7c,Little Miss Sunshine,2006,101 min,"Comedy, Drama",7.8,3.547795617340049,A family determined to get their young daughter into the finals of a beauty pageant take a cross-country trip in their VW bus.,80.0,Jonathan Dayton,"['Valerie Faris', 'Steve Carell', 'Toni Collette', 'Greg Kinnear']",439856,2022-04-17 15:08:45.694,2022-04-17 15:08:45.694
625c2c1af0a5bc6c426c0830,Relatos salvajes,2014,122 min,"Comedy, Drama, Thriller",8.1,3.459394409924348,Six short stories that explore the extremities of human behavior involving people in distress.,77.0,Damián Szifron,"['Darío Grandinetti', 'María Marull', 'Mónica Villa', 'Diego Starosta']",177059,2022-04-17 15:02:50.286,2022-04-17 15:02:50.286
625c2de1f0a5bc6c426c0cdc,Training Day,2001,122 min,"Crime, Drama, Thriller",7.7,3.34310148709294,A rookie cop spends his first day as a Los Angeles narcotics officer with a rogue detective who isn't what he appears to be.,69.0,Antoine Fuqua,"['Denzel Washington', 'Ethan Hawke', 'Scott Glenn', 'Tom Berenger']",390247,2022-04-17 15:10:25.837,2022-04-17 15:10:25.837
625c2c00f0a5bc6c426c07ea,Dom za vesanje,1988,142 min,"Comedy, Crime, Drama",8.2,1.8844619925821637,"In this luminous tale set in the area around Sarajevo and in Italy, Perhan, an engaging young Romany (gypsy) with telekinetic powers, is seduced by the quick-cash world of petty crime, which threatens to destroy him and those he loves.",,Emir Kusturica,"['Davor Dujmovic', 'Bora Todorovic', 'Ljubica Adzovic', 'Husnija Hasimovic']",26402,2022-04-17 15:02:24.901,2022-04-17 15:02:24.901
625c2e2af0a5bc6c426c0dfa,The Royal Tenenbaums,2001,110 min,"Comedy, Drama",7.6,4.470595798673232,The eccentric members of a dysfunctional family reluctantly gather under the same roof for various reasons.,76.0,Wes Anderson,"['Gene Hackman', 'Gwyneth Paltrow', 'Anjelica Huston', 'Ben Stiller']",266842,2022-04-17 15:11:38.383,2022-04-17 15:11:38.383
625c2de4f0a5bc6c426c0ce2,Being John Malkovich,1999,113 min,"Comedy, Drama, Fantasy",7.7,3.614905349001077,A puppeteer discovers a portal that leads literally into the head of movie star John Malkovich.,90.0,Spike Jonze,"['John Cusack', 'Cameron Diaz', 'Catherine Keener', 'John Malkovich']",312542,2022-04-17 15:10:28.330,2022-04-17 15:10:28.330
625c2c08f0a5bc6c426c0802,Yôjinbô,1961,110 min,"Action, Drama, Thriller",8.2,4.337841290326461,A crafty ronin comes to a town divided by two criminal gangs and decides to play them against each other to free the town.,,Akira Kurosawa,"['Toshirô Mifune', 'Eijirô Tôno', 'Tatsuya Nakadai', 'Yôko Tsukasa']",111244,2022-04-17 15:02:32.715,2022-04-17 15:02:32.715
