_id,title,release,duration,gerne,IMDB_Rating,rating,overview,metaScore,director,stars,noOfVotes,createdAt,updatedAt
625c2dcdf0a5bc6c426c0c78,Silver Linings Playbook,2012,122 min,"Comedy, Drama, Romance",7.7,1.2132343614610053,"After a stint in a mental institution, former teacher Pat Solitano moves back in with his parents and tries to reconcile with his ex-wife. Things get more challenging when Pat meets Tiffany, a mysterious girl with problems of her own.",81.0,David O. Russell,"['Bradley Cooper', 'Jennifer Lawrence', 'Robert De Niro', 'Jacki Weaver']",661871,2022-04-17 15:10:05.742,2022-04-17 15:10:05.742
625c2d5cf0a5bc6c426c0b36,Vicky Donor,2012,126 min,"Comedy, Romance",7.8,1.395395141558221,"A man is brought in by an infertility doctor to supply him with his sperm, where he becomes the biggest sperm donor for his clinic.",,Shoojit Sircar,"['Ayushmann Khurrana', 'Yami Gautam', 'Annu Kapoor', 'Dolly Ahluwalia']",39710,2022-04-17 15:08:12.709,2022-04-17 15:08:12.709
625c2cf6f0a5bc6c426c0a3c,Marriage Story,2019,137 min,"Comedy, Drama, Romance",7.9,4.359834048666592,Noah Baumbach's incisive and compassionate look at a marriage breaking up and a family staying together.,94.0,Noah Baumbach,"['Adam Driver', 'Scarlett Johansson', 'Julia Greer', 'Azhy Robertson']",246644,2022-04-17 15:06:30.063,2022-04-17 15:06:30.063
625c2e03f0a5bc6c426c0d66,The Quiet Man,1952,129 min,"Comedy, Drama, Romance",7.7,1.0785021289128671,"A retired American boxer returns to the village of his birth in Ireland, where he falls for a spirited redhead whose brother is contemptuous of their union.",,John Ford,"['John Wayne', ""Maureen O'Hara"", 'Barry Fitzgerald', 'Ward Bond']",34677,2022-04-17 15:10:59.371,2022-04-17 15:10:59.371
625c2d0cf0a5bc6c426c0a5a,The Artist,2011,100 min,"Comedy, Drama, Romance",7.9,2.8538249510576232,An egomaniacal film star develops a relationship with a young dancer against the backdrop of Hollywood's silent era.,89.0,Michel Hazanavicius,"['Jean Dujardin', 'Bérénice Bejo', 'John Goodman', 'James Cromwell']",230624,2022-04-17 15:06:52.073,2022-04-17 15:06:52.073
625c2b76f0a5bc6c426c0700,City Lights,1931,87 min,"Comedy, Drama, Romance",8.5,0.4001693336818479,"With the aid of a wealthy erratic tippler, a dewy-eyed tramp who has fallen in love with a sightless flower girl accumulates money to be able to help her medically.",99.0,Charles Chaplin,"['Charles Chaplin', 'Virginia Cherrill', 'Florence Lee', 'Harry Myers']",167839,2022-04-17 15:00:06.195,2022-04-17 15:00:06.195
625c2ce4f0a5bc6c426c09ee,The Graduate,1967,106 min,"Comedy, Drama, Romance",8.0,2.855440925050763,A disillusioned college graduate finds himself torn between his older lover and her daughter.,83.0,Mike Nichols,"['Dustin Hoffman', 'Anne Bancroft', 'Katharine Ross', 'William Daniels']",253676,2022-04-17 15:06:12.404,2022-04-17 15:06:12.404
625c2c76f0a5bc6c426c0906,The Shop Around the Corner,1940,99 min,"Comedy, Drama, Romance",8.1,0.32116668203771903,"Two employees at a gift shop can barely stand each other, without realizing that they are falling in love through the post as each other's anonymous pen pal.",96.0,Ernst Lubitsch,"['Margaret Sullavan', 'James Stewart', 'Frank Morgan', 'Joseph Schildkraut']",28450,2022-04-17 15:04:22.101,2022-04-17 15:04:22.101
625c2c7bf0a5bc6c426c0914,The Circus,1928,72 min,"Comedy, Romance",8.1,0.6257735815891519,The Tramp finds work and the girl of his dreams at a circus.,90.0,Charles Chaplin,"['Charles Chaplin', 'Merna Kennedy', 'Al Ernest Garcia', 'Harry Crocker']",30205,2022-04-17 15:04:27.061,2022-04-17 15:04:27.061
625c2c42f0a5bc6c426c0878,Dil Chahta Hai,2001,183 min,"Comedy, Drama, Romance",8.1,4.842207160191137,"Three inseparable childhood friends are just out of college. Nothing comes between them - until they each fall in love, and their wildly different approaches to relationships creates tension.",,Farhan Akhtar,"['Aamir Khan', 'Saif Ali Khan', 'Akshaye Khanna', 'Preity Zinta']",66803,2022-04-17 15:03:30.319,2022-04-17 15:03:30.319
625c2cd1f0a5bc6c426c09b0,Groundhog Day,1993,101 min,"Comedy, Fantasy, Romance",8.0,0.37709031945060256,A weatherman finds himself inexplicably living the same day over and over again.,72.0,Harold Ramis,"['Bill Murray', 'Andie MacDowell', 'Chris Elliott', 'Stephen Tobolowsky']",577991,2022-04-17 15:05:53.720,2022-04-17 15:05:53.720
625c2d5ff0a5bc6c426c0b44,Moonrise Kingdom,2012,94 min,"Comedy, Drama, Romance",7.8,0.4394409345655559,"A pair of young lovers flee their New England town, which causes a local search party to fan out to find them.",84.0,Wes Anderson,"['Jared Gilman', 'Kara Hayward', 'Bruce Willis', 'Bill Murray']",318789,2022-04-17 15:08:15.015,2022-04-17 15:08:15.015
625c2cddf0a5bc6c426c09d4,Annie Hall,1977,93 min,"Comedy, Romance",8.0,0.5285180654865418,Neurotic New York comedian Alvy Singer falls in love with the ditzy Annie Hall.,92.0,Woody Allen,"['Woody Allen', 'Diane Keaton', 'Tony Roberts', 'Carol Kane']",251823,2022-04-17 15:06:05.096,2022-04-17 15:06:05.096
625c2bd2f0a5bc6c426c0782,The Apartment,1960,125 min,"Comedy, Drama, Romance",8.3,1.8684354726242758,"A man tries to rise in his company by letting its executives use his apartment for trysts, but complications and a romance of his own ensue.",94.0,Billy Wilder,"['Jack Lemmon', 'Shirley MacLaine', 'Fred MacMurray', 'Ray Walston']",164363,2022-04-17 15:01:38.040,2022-04-17 15:01:38.040
625c2ddcf0a5bc6c426c0cbc,Good Bye Lenin!,2003,121 min,"Comedy, Drama, Romance",7.7,1.5246790747908878,"In 1990, to protect his fragile mother from a fatal shock after a long coma, a young man must keep her from learning that her beloved nation of East Germany as she knew it has disappeared.",68.0,Wolfgang Becker,"['Daniel Brühl', 'Katrin Saß', 'Chulpan Khamatova', 'Florian Lukas']",137981,2022-04-17 15:10:20.492,2022-04-17 15:10:20.492
625c2cf5f0a5bc6c426c0a38,Dil Bechara,2020,101 min,"Comedy, Drama, Romance",7.9,1.1534461638134241,"The emotional journey of two hopelessly in love youngsters, a young girl, Kizie, suffering from cancer, and a boy, Manny, whom she meets at a support group.",,Mukesh Chhabra,"['Sushant Singh Rajput', 'Sanjana Sanghi', 'Sahil Vaid', 'Saswata Chatterjee']",111478,2022-04-17 15:06:29.100,2022-04-17 15:06:29.100
625c2b62f0a5bc6c426c06cc,La vita è bella,1997,116 min,"Comedy, Drama, Romance",8.6,3.0447739537422738,"When an open-minded Jewish librarian and his son become victims of the Holocaust, he uses a perfect mixture of will, humor, and imagination to protect his son from the dangers around their camp.",59.0,Roberto Benigni,"['Roberto Benigni', 'Nicoletta Braschi', 'Giorgio Cantarini', 'Giustino Durano']",623629,2022-04-17 14:59:46.285,2022-04-17 14:59:46.285
625c2df4f0a5bc6c426c0d1e,The Purple Rose of Cairo,1985,82 min,"Comedy, Fantasy, Romance",7.7,1.3199617820048914,"In New Jersey in 1935, a movie character walks off the screen and into the real world.",75.0,Woody Allen,"['Mia Farrow', 'Jeff Daniels', 'Danny Aiello', 'Irving Metzman']",47102,2022-04-17 15:10:44.076,2022-04-17 15:10:44.076
625c2e27f0a5bc6c426c0de6,Jeux d'enfants,2003,93 min,"Comedy, Drama, Romance",7.6,0.5879204396275739,"As adults, best friends Julien and Sophie continue the odd game they started as children -- a fearless competition to outdo one another with daring and outrageous stunts. While they often act out to relieve one another's pain, their game might be a way to avoid the fact that they are truly meant for one another.",45.0,Yann Samuell,"['Guillaume Canet', 'Marion Cotillard', 'Thibault Verhaeghe', 'Joséphine Lebas-Joly']",67360,2022-04-17 15:11:35.738,2022-04-17 15:11:35.738
625c2dbdf0a5bc6c426c0c44,En man som heter Ove,2015,116 min,"Comedy, Drama, Romance",7.7,1.3772437051615438,"Ove, an ill-tempered, isolated retiree who spends his days enforcing block association rules and visiting his wife's grave, has finally given up on life just as an unlikely friendship develops with his boisterous new neighbors.",70.0,Hannes Holm,"['Rolf Lassgård', 'Bahar Pars', 'Filip Berg', 'Ida Engvoll']",47444,2022-04-17 15:09:49.326,2022-04-17 15:09:49.326
