_id,title,release,duration,gerne,IMDB_Rating,rating,overview,metaScore,director,stars,noOfVotes,createdAt,updatedAt
625c2c08f0a5bc6c426c07fe,The Great Escape,1963,172 min,"Adventure, Drama, History",8.2,4.298792008488299,Allied prisoners of war plan for several hundred of their number to escape from a German camp during World War II.,86.0,John Sturges,"['Steve McQueen', 'James Garner', 'Richard Attenborough', 'Charles Bronson']",224730,2022-04-17 15:02:32.303,2022-04-17 15:02:32.303
625c2c6ef0a5bc6c426c08f0,Ben-Hur,1959,212 min,"Adventure, Drama, History",8.1,0.4081309851680537,"After a Jewish prince is betrayed and sent into slavery by a Roman friend, he regains his freedom and comes back for revenge.",90.0,William Wyler,"['Charlton Heston', 'Jack Hawkins', 'Stephen Boyd', 'Haya Harareet']",219466,2022-04-17 15:04:14.961,2022-04-17 15:04:14.961
625c2e31f0a5bc6c426c0e24,Apollo 13,PG,140 min,"Adventure, Drama, History",7.6,3.3259619087699877,NASA must devise a strategy to return Apollo 13 to Earth safely after the spacecraft undergoes massive internal damage putting the lives of the three astronauts on board in jeopardy.,77.0,Ron Howard,"['Tom Hanks', 'Bill Paxton', 'Kevin Bacon', 'Gary Sinise']",269197,2022-04-17 15:11:45.010,2022-04-17 15:11:45.010
625c2bf9f0a5bc6c426c07d2,Der Untergang,2004,156 min,"Biography, Drama, History",8.2,4.218486384050134,"Traudl Junge, the final secretary for Adolf Hitler, tells of the Nazi dictator's final days in his Berlin bunker at the end of WWII.",82.0,Oliver Hirschbiegel,"['Bruno Ganz', 'Alexandra Maria Lara', 'Ulrich Matthes', 'Juliane Köhler']",331308,2022-04-17 15:02:17.041,2022-04-17 15:02:17.041
625c2c69f0a5bc6c426c08dc,Andrei Rublev,1966,205 min,"Biography, Drama, History",8.1,0.07163094110712143,"The life, times and afflictions of the fifteenth-century Russian iconographer St. Andrei Rublev.",,Andrei Tarkovsky,"['Anatoliy Solonitsyn', 'Ivan Lapikov', 'Nikolay Grinko', 'Nikolay Sergeev']",46947,2022-04-17 15:04:09.840,2022-04-17 15:04:09.840
625c2e07f0a5bc6c426c0d72,Dark Waters,2019,126 min,"Biography, Drama, History",7.6,4.596929284715828,A corporate defense attorney takes on an environmental lawsuit against a chemical company that exposes a lengthy history of pollution.,73.0,Todd Haynes,"['Mark Ruffalo', 'Anne Hathaway', 'Tim Robbins', 'Bill Pullman']",60408,2022-04-17 15:11:03.360,2022-04-17 15:11:03.360
625c2d61f0a5bc6c426c0b54,Straight Outta Compton,2015,147 min,"Biography, Drama, History",7.8,3.9561889449815366,"The rap group NWA emerges from the mean streets of Compton in Los Angeles, California, in the mid-1980s and revolutionizes Hip Hop culture with their music and tales about life in the hood.",72.0,F. Gary Gray,"[""O'Shea Jackson Jr."", 'Corey Hawkins', 'Jason Mitchell', 'Neil Brown Jr.']",179264,2022-04-17 15:08:17.891,2022-04-17 15:08:17.891
625c2d39f0a5bc6c426c0aca,La montaña sagrada,1973,114 min,"Adventure, Drama, Fantasy",7.9,3.7951437233856167,"In a corrupt, greed-fueled world, a powerful alchemist leads a messianic character and seven materialistic figures to the Holy Mountain, where they hope to achieve enlightenment.",76.0,Alejandro Jodorowsky,"['Alejandro Jodorowsky', 'Horacio Salinas', 'Zamira Saunders', 'Juan Ferrara']",37183,2022-04-17 15:07:37.256,2022-04-17 15:07:37.256
625c2decf0a5bc6c426c0d00,Malcolm X,1992,202 min,"Biography, Drama, History",7.7,4.619424228654964,"Biographical epic of the controversial and influential Black Nationalist leader, from his early life and career as a small-time gangster, to his ministry as a member of the Nation of Islam.",73.0,Spike Lee,"['Denzel Washington', 'Angela Bassett', 'Delroy Lindo', 'Spike Lee']",85819,2022-04-17 15:10:36.826,2022-04-17 15:10:36.826
625c2c21f0a5bc6c426c0840,Hacksaw Ridge,2016,139 min,"Biography, Drama, History",8.1,0.6937921818386383,"World War II American Army Medic Desmond T. Doss, who served during the Battle of Okinawa, refuses to kill people, and becomes the first man in American history to receive the Medal of Honor without firing a shot.",71.0,Mel Gibson,"['Andrew Garfield', 'Sam Worthington', 'Luke Bracey', 'Teresa Palmer']",435928,2022-04-17 15:02:57.560,2022-04-17 15:02:57.560
625c2d3cf0a5bc6c426c0ae2,Spartacus,1960,197 min,"Adventure, Biography, Drama",7.9,4.6226128435299305,The slave Spartacus leads a violent revolt against the decadent Roman Republic.,87.0,Stanley Kubrick,"['Kirk Douglas', 'Laurence Olivier', 'Jean Simmons', 'Charles Laughton']",124339,2022-04-17 15:07:40.889,2022-04-17 15:07:40.889
625c2e30f0a5bc6c426c0e20,Dead Man,1995,121 min,"Adventure, Drama, Fantasy",7.6,2.8623587792487095,"On the run after murdering a man, accountant William Blake encounters a strange aboriginal American man named Nobody who prepares him for his journey into the spiritual world.",62.0,Jim Jarmusch,"['Johnny Depp', 'Gary Farmer', 'Crispin Glover', 'Lance Henriksen']",90442,2022-04-17 15:11:44.114,2022-04-17 15:11:44.114
625c2cc7f0a5bc6c426c0982,Cinderella Man,2005,144 min,"Biography, Drama, History",8.0,0.15815611441763466,"The story of James J. Braddock, a supposedly washed-up boxer who came back to become a champion and an inspiration in the 1930s.",69.0,Ron Howard,"['Russell Crowe', 'Renée Zellweger', 'Craig Bierko', 'Paul Giamatti']",176151,2022-04-17 15:05:43.344,2022-04-17 15:05:43.344
625c2bc3f0a5bc6c426c0752,Inglourious Basterds,2009,153 min,"Adventure, Drama, War",8.3,1.0761554042386345,"In Nazi-occupied France during World War II, a plan to assassinate Nazi leaders by a group of Jewish U.S. soldiers coincides with a theatre owner's vengeful plans for the same.",69.0,Quentin Tarantino,"['Brad Pitt', 'Diane Kruger', 'Eli Roth', 'Mélanie Laurent']",1267869,2022-04-17 15:01:23.148,2022-04-17 15:01:23.148
625c2d52f0a5bc6c426c0b16,Hidden Figures,2016,127 min,"Biography, Drama, History",7.8,3.712635787972105,The story of a team of female African-American mathematicians who served a vital role in NASA during the early years of the U.S. space program.,74.0,Theodore Melfi,"['Taraji P. Henson', 'Octavia Spencer', 'Janelle Monáe', 'Kevin Costner']",200876,2022-04-17 15:08:02.060,2022-04-17 15:08:02.060
625c2bcdf0a5bc6c426c0774,Das Boot,1981,149 min,"Adventure, Drama, Thriller",8.3,3.467463510445814,"The claustrophobic world of a WWII German U-boat; boredom, filth and sheer terror.",86.0,Wolfgang Petersen,"['Jürgen Prochnow', 'Herbert Grönemeyer', 'Klaus Wennemann', 'Hubertus Bengsch']",231855,2022-04-17 15:01:33.017,2022-04-17 15:01:33.017
625c2b5af0a5bc6c426c06bc,Hamilton,2020,160 min,"Biography, Drama, History",8.6,2.2094065692805422,"The real life of one of America's foremost founding fathers and first Secretary of the Treasury, Alexander Hamilton. Captured live on Broadway from the Richard Rodgers Theater with the original Broadway cast.",90.0,Thomas Kail,"['Lin-Manuel Miranda', 'Phillipa Soo', 'Leslie Odom Jr.', 'Renée Elise Goldsberry']",55291,2022-04-17 14:59:38.228,2022-04-17 14:59:38.228
625c2d44f0a5bc6c426c0ae8,The Ten Commandments,1956,220 min,"Adventure, Drama",7.9,4.876003666433251,"Moses, an Egyptian Prince, learns of his true heritage as a Hebrew and his divine mission as the deliverer of his people.",,Cecil B. DeMille,"['Charlton Heston', 'Yul Brynner', 'Anne Baxter', 'Edward G. Robinson']",63560,2022-04-17 15:07:48.544,2022-04-17 15:07:48.544
625c2c57f0a5bc6c426c08ba,Fitzcarraldo,1982,158 min,"Adventure, Drama",8.1,3.8126210455364262,"The story of Brian Sweeney Fitzgerald, an extremely determined man who intends to build an opera house in the middle of a jungle.",,Werner Herzog,"['Klaus Kinski', 'Claudia Cardinale', 'José Lewgoy', 'Miguel Ángel Fuentes']",31595,2022-04-17 15:03:52.000,2022-04-17 15:03:52.000
625c2e2ef0a5bc6c426c0e12,Fear and Loathing in Las Vegas,1998,118 min,"Adventure, Comedy, Drama",7.6,1.8306311624978389,An oddball journalist and his psychopathic lawyer travel to Las Vegas for a series of psychedelic escapades.,41.0,Terry Gilliam,"['Johnny Depp', 'Benicio Del Toro', 'Tobey Maguire', 'Michael Lee Gogin']",259753,2022-04-17 15:11:42.689,2022-04-17 15:11:42.689
