_id,title,release,duration,gerne,IMDB_Rating,rating,overview,metaScore,director,stars,noOfVotes,createdAt,updatedAt
625c2d89f0a5bc6c426c0ba2,Wo hu cang long,2000,120 min,"Action, Adventure, Fantasy",7.8,3.477265308015408,A young Chinese warrior steals a sword from a famed swordsman and then escapes into a world of romantic adventure with a mysterious man in the frontier of the nation.,94.0,Ang Lee,"['Yun-Fat Chow', 'Michelle Yeoh', 'Ziyi Zhang', 'Chen Chang']",253228,2022-04-17 15:08:57.669,2022-04-17 15:08:57.669
625c2b62f0a5bc6c426c06d2,Star Wars,1977,121 min,"Action, Adventure, Fantasy",8.6,1.5443005127819376,"Luke Skywalker joins forces with a Jedi Knight, a cocky pilot, a Wookiee and two droids to save the galaxy from the Empire's world-destroying battle station, while also attempting to rescue Princess Leia from the mysterious Darth Vader.",90.0,George Lucas,"['Mark Hamill', 'Harrison Ford', 'Carrie Fisher', 'Alec Guinness']",1231473,2022-04-17 14:59:46.943,2022-04-17 14:59:46.943
625c2b59f0a5bc6c426c06b8,Star Wars: Episode V - The Empire Strikes Back,1980,124 min,"Action, Adventure, Fantasy",8.7,4.803374457188991,"After the Rebels are brutally overpowered by the Empire on the ice planet Hoth, Luke Skywalker begins Jedi training with Yoda, while his friends are pursued by Darth Vader and a bounty hunter named Boba Fett all over the galaxy.",82.0,Irvin Kershner,"['Mark Hamill', 'Harrison Ford', 'Carrie Fisher', 'Billy Dee Williams']",1159315,2022-04-17 14:59:37.063,2022-04-17 14:59:37.063
625c2bcbf0a5bc6c426c0772,Star Wars: Episode VI - Return of the Jedi,1983,131 min,"Action, Adventure, Fantasy",8.3,2.875737100533411,"After a daring mission to rescue Han Solo from Jabba the Hutt, the Rebels dispatch to Endor to destroy the second Death Star. Meanwhile, Luke struggles to help Darth Vader back from the dark side without falling into the Emperor's trap.",58.0,Richard Marquand,"['Mark Hamill', 'Harrison Ford', 'Carrie Fisher', 'Billy Dee Williams']",950470,2022-04-17 15:01:31.739,2022-04-17 15:01:31.739
625c2d98f0a5bc6c426c0be2,Predator,1987,107 min,"Action, Adventure, Sci-Fi",7.8,4.434946665068128,A team of commandos on a mission in a Central American jungle find themselves hunted by an extraterrestrial warrior.,45.0,John McTiernan,"['Arnold Schwarzenegger', 'Carl Weathers', 'Kevin Peter Hall', 'Elpidia Carrillo']",371387,2022-04-17 15:09:12.156,2022-04-17 15:09:12.156
625c2df5f0a5bc6c426c0d28,First Blood,1982,93 min,"Action, Adventure",7.7,1.6491267768528672,A veteran Green Beret is forced by a cruel Sheriff and his deputies to flee into the mountains and wage an escalating one-man war against his pursuers.,61.0,Ted Kotcheff,"['Sylvester Stallone', 'Brian Dennehy', 'Richard Crenna', 'Bill McKinney']",226541,2022-04-17 15:10:45.326,2022-04-17 15:10:45.326
625c2ccbf0a5bc6c426c0988,Pirates of the Caribbean: The Curse of the Black Pearl,2003,143 min,"Action, Adventure, Fantasy",8.0,3.117927893239969,"Blacksmith Will Turner teams up with eccentric pirate ""Captain"" Jack Sparrow to save his love, the governor's daughter, from Jack's former pirate allies, who are now undead.",63.0,Gore Verbinski,"['Johnny Depp', 'Geoffrey Rush', 'Orlando Bloom', 'Keira Knightley']",1015122,2022-04-17 15:05:47.068,2022-04-17 15:05:47.068
625c2d83f0a5bc6c426c0b8c,Serenity,2005,119 min,"Action, Adventure, Sci-Fi",7.8,3.203980562975448,The crew of the ship Serenity try to evade an assassin sent to recapture one of their members who is telepathic.,74.0,Joss Whedon,"['Nathan Fillion', 'Gina Torres', 'Chiwetel Ejiofor', 'Alan Tudyk']",283310,2022-04-17 15:08:51.664,2022-04-17 15:08:51.664
625c2b4ff0a5bc6c426c06a8,Inception,2010,148 min,"Action, Adventure, Sci-Fi",8.8,1.8468510658894655,A thief who steals corporate secrets through the use of dream-sharing technology is given the inverse task of planting an idea into the mind of a C.E.O.,74.0,Christopher Nolan,"['Leonardo DiCaprio', 'Joseph Gordon-Levitt', 'Elliot Page', 'Ken Watanabe']",2067042,2022-04-17 14:59:27.204,2022-04-17 14:59:27.204
625c2b6cf0a5bc6c426c06e6,Gladiator,2000,155 min,"Action, Adventure, Drama",8.5,4.66248624777033,A former Roman General sets out to exact vengeance against the corrupt emperor who murdered his family and sent him into slavery.,67.0,Ridley Scott,"['Russell Crowe', 'Joaquin Phoenix', 'Connie Nielsen', 'Oliver Reed']",1341460,2022-04-17 14:59:56.830,2022-04-17 14:59:56.830
625c2c07f0a5bc6c426c07fa,Sholay,1975,204 min,"Action, Adventure, Comedy",8.2,0.8899052011239472,"After his family is murdered by a notorious and ruthless bandit, a former police officer enlists the services of two outlaws to capture the bandit.",,Ramesh Sippy,"['Sanjeev Kumar', 'Dharmendra', 'Amitabh Bachchan', 'Amjad Khan']",51284,2022-04-17 15:02:31.907,2022-04-17 15:02:31.907
625c2cb9f0a5bc6c426c0950,Deadpool,2016,108 min,"Action, Adventure, Comedy",8.0,4.646334413776728,"A wisecracking mercenary gets experimented on and becomes immortal but ugly, and sets out to track down the man who ruined his looks.",65.0,Tim Miller,"['Ryan Reynolds', 'Morena Baccarin', 'T.J. Miller', 'Ed Skrein']",902669,2022-04-17 15:05:29.069,2022-04-17 15:05:29.069
625c2d1df0a5bc6c426c0a72,Star Trek,2009,127 min,"Action, Adventure, Sci-Fi",7.9,0.43416366983295873,The brash James T. Kirk tries to live up to his father's legacy with Mr. Spock keeping him in check as a vengeful Romulan from the future creates black holes to destroy the Federation one planet at a time.,82.0,J.J. Abrams,"['Chris Pine', 'Zachary Quinto', 'Simon Pegg', 'Leonard Nimoy']",577336,2022-04-17 15:07:09.420,2022-04-17 15:07:09.420
625c2cfef0a5bc6c426c0a4a,Thor: Ragnarok,2017,130 min,"Action, Adventure, Comedy",7.9,1.7000491815044871,"Imprisoned on the planet Sakaar, Thor must race against time to return to Asgard and stop Ragnarök, the destruction of his world, at the hands of the powerful and ruthless villain Hela.",74.0,Taika Waititi,"['Chris Hemsworth', 'Tom Hiddleston', 'Cate Blanchett', 'Mark Ruffalo']",587775,2022-04-17 15:06:38.740,2022-04-17 15:06:38.740
625c2dfff0a5bc6c426c0d52,Goldfinger,1964,110 min,"Action, Adventure, Thriller",7.7,2.5845055640517955,"While investigating a gold magnate's smuggling, James Bond uncovers a plot to contaminate the Fort Knox gold reserve.",87.0,Guy Hamilton,"['Sean Connery', 'Gert Fröbe', 'Honor Blackman', 'Shirley Eaton']",174119,2022-04-17 15:10:55.765,2022-04-17 15:10:55.765
625c2ba9f0a5bc6c426c0710,Avengers: Infinity War,2018,149 min,"Action, Adventure, Sci-Fi",8.4,1.6284819178819432,The Avengers and their allies must be willing to sacrifice all in an attempt to defeat the powerful Thanos before his blitz of devastation and ruin puts an end to the universe.,68.0,Anthony Russo,"['Joe Russo', 'Robert Downey Jr.', 'Chris Hemsworth', 'Mark Ruffalo']",834477,2022-04-17 15:00:57.331,2022-04-17 15:00:57.331
625c2dd9f0a5bc6c426c0ca8,Kung fu,2004,99 min,"Action, Comedy, Fantasy",7.7,4.243731857569143,"In Shanghai, China in the 1940s, a wannabe gangster aspires to join the notorious ""Axe Gang"" while residents of a housing complex exhibit extraordinary powers in defending their turf.",78.0,Stephen Chow,"['Stephen Chow', 'Wah Yuen', 'Qiu Yuen', 'Siu-Lung Leung']",127250,2022-04-17 15:10:17.996,2022-04-17 15:10:17.996
625c2d7df0a5bc6c426c0b7a,Apocalypto,2006,139 min,"Action, Adventure, Drama",7.8,4.9359980677421955,"As the Mayan kingdom faces its decline, a young man is taken on a perilous journey to a world ruled by fear and oppression.",68.0,Mel Gibson,"['Gerardo Taracena', 'Raoul Max Trujillo', 'Dalia Hernández', 'Rudy Youngblood']",291018,2022-04-17 15:08:45.490,2022-04-17 15:08:45.490
625c2bcaf0a5bc6c426c076c,Aliens,1986,137 min,"Action, Adventure, Sci-Fi",8.3,2.6920613139770886,"Fifty-seven years after surviving an apocalyptic attack aboard her space vessel by merciless space creatures, Officer Ripley awakens from hyper-sleep and tries to warn anyone who will listen about the predators.",84.0,James Cameron,"['Sigourney Weaver', 'Michael Biehn', 'Carrie Henn', 'Paul Reiser']",652719,2022-04-17 15:01:30.563,2022-04-17 15:01:30.563
625c2dc1f0a5bc6c426c0c4c,Kingsman: The Secret Service,2014,129 min,"Action, Adventure, Comedy",7.7,2.5981185253792383,"A spy organisation recruits a promising street kid into the agency's training program, while a global threat emerges from a twisted tech genius.",60.0,Matthew Vaughn,"['Colin Firth', 'Taron Egerton', 'Samuel L. Jackson', 'Michael Caine']",590440,2022-04-17 15:09:53.456,2022-04-17 15:09:53.456
