_id,title,release,duration,gerne,IMDB_Rating,rating,overview,metaScore,director,stars,noOfVotes,createdAt,updatedAt
625c2deef0a5bc6c426c0d06,Glengarry Glen Ross,1992,100 min,"Crime, Drama, Mystery",7.7,0.002808918853294262,An examination of the machinations behind the scenes at a real estate office.,82.0,James Foley,"['Al Pacino', 'Jack Lemmon', 'Alec Baldwin', 'Alan Arkin']",95826,2022-04-17 15:10:38.259,2022-04-17 15:10:38.259
625c2c69f0a5bc6c426c08d8,Cool Hand Luke,1967,127 min,"Crime, Drama",8.1,4.292952800857495,"A laid back Southern man is sentenced to two years in a rural prison, but refuses to conform.",92.0,Stuart Rosenberg,"['Paul Newman', 'George Kennedy', 'Strother Martin', 'J.D. Cannon']",161984,2022-04-17 15:04:09.394,2022-04-17 15:04:09.394
625c2b5ff0a5bc6c426c06c4,Cidade de Deus,2002,130 min,"Crime, Drama",8.6,2.487574768903338,"In the slums of Rio, two kids' paths diverge as one struggles to become a photographer and the other a kingpin.",79.0,Fernando Meirelles,"['Kátia Lund', 'Alexandre Rodrigues', 'Leandro Firmino', 'Matheus Nachtergaele']",699256,2022-04-17 14:59:43.029,2022-04-17 14:59:43.029
625c2b62f0a5bc6c426c06ca,The Green Mile,1999,189 min,"Crime, Drama, Fantasy",8.6,0.08676333883240961,"The lives of guards on Death Row are affected by one of their charges: a black man accused of child murder and rape, yet who has a mysterious gift.",61.0,Frank Darabont,"['Tom Hanks', 'Michael Clarke Duncan', 'David Morse', 'Bonnie Hunt']",1147794,2022-04-17 14:59:46.061,2022-04-17 14:59:46.061
625c2b4ef0a5bc6c426c06a4,Pulp Fiction,1994,154 min,"Crime, Drama",8.9,4.664637176527167,"The lives of two mob hitmen, a boxer, a gangster and his wife, and a pair of diner bandits intertwine in four tales of violence and redemption.",94.0,Quentin Tarantino,"['John Travolta', 'Uma Thurman', 'Samuel L. Jackson', 'Bruce Willis']",1826188,2022-04-17 14:59:26.767,2022-04-17 14:59:26.767
625c2d57f0a5bc6c426c0b28,The Hateful Eight,2015,168 min,"Crime, Drama, Mystery",7.8,1.5927685431898764,"In the dead of a Wyoming winter, a bounty hunter and his prisoner find shelter in a cabin currently inhabited by a collection of nefarious characters.",68.0,Quentin Tarantino,"['Samuel L. Jackson', 'Kurt Russell', 'Jennifer Jason Leigh', 'Walton Goggins']",517059,2022-04-17 15:08:07.632,2022-04-17 15:08:07.632
625c2d92f0a5bc6c426c0bc8,A Bronx Tale,1993,121 min,"Crime, Drama, Romance",7.8,2.882802386450697,A father becomes worried when a local gangster befriends his son in the Bronx in the 1960s.,80.0,Robert De Niro,"['Robert De Niro', 'Chazz Palminteri', 'Lillo Brancato', 'Francis Capra']",128171,2022-04-17 15:09:06.724,2022-04-17 15:09:06.724
625c2db8f0a5bc6c426c0c3e,Wind River,2017,107 min,"Crime, Drama, Mystery",7.7,2.5,A veteran hunter helps an FBI agent investigate the murder of a young woman on a Wyoming Native American reservation.,73.0,Taylor Sheridan,"['Kelsey Asbille', 'Jeremy Renner', 'Julia Jones', 'Teo Briones']",205444,2022-04-17 15:09:44.792,2022-04-18 04:08:04.640
625c2c3ff0a5bc6c426c0868,No Country for Old Men,2007,122 min,"Crime, Drama, Thriller",8.1,0.47881730820227175,Violence and mayhem ensue after a hunter stumbles upon a drug deal gone wrong and more than two million dollars in cash near the Rio Grande.,91.0,Ethan Coen,"['Joel Coen', 'Tommy Lee Jones', 'Javier Bardem', 'Josh Brolin']",856916,2022-04-17 15:03:27.379,2022-04-17 15:03:27.379
625c2df3f0a5bc6c426c0d1a,Der Name der Rose,1986,130 min,"Crime, Drama, Mystery",7.7,4.433988159634847,An intellectually nonconformist friar investigates a series of mysterious deaths in an isolated abbey.,54.0,Jean-Jacques Annaud,"['Sean Connery', 'Christian Slater', 'Helmut Qualtinger', 'Elya Baskin']",102031,2022-04-17 15:10:43.316,2022-04-17 15:10:43.316
625c2c4ff0a5bc6c426c089a,La haine,1995,98 min,"Crime, Drama",8.1,4.437766803870614,24 hours in the lives of three young men in the French suburbs the day after a violent riot.,,Mathieu Kassovitz,"['Vincent Cassel', 'Hubert Koundé', 'Saïd Taghmaoui', 'Abdel Ahmed Ghili']",150345,2022-04-17 15:03:43.394,2022-04-17 15:03:43.394
625c2bcdf0a5bc6c426c0776,Taxi Driver,1976,114 min,"Crime, Drama",8.3,3.9121916868713837,"A mentally unstable veteran works as a nighttime taxi driver in New York City, where the perceived decadence and sleaze fuels his urge for violent action by attempting to liberate a presidential campaign worker and an underage prostitute.",94.0,Martin Scorsese,"['Robert De Niro', 'Jodie Foster', 'Cybill Shepherd', 'Albert Brooks']",724636,2022-04-17 15:01:33.218,2022-04-17 15:01:33.218
625c2c82f0a5bc6c426c0936,Special Chabbis,2013,144 min,"Crime, Drama, Thriller",8.0,0.7821489988074626,A gang of con-men rob prominent rich businessmen and politicians by posing as C.B.I and income tax officers.,,Neeraj Pandey,"['Akshay Kumar', 'Anupam Kher', 'Manoj Bajpayee', 'Jimmy Sheirgill']",51069,2022-04-17 15:04:34.238,2022-04-17 15:04:34.238
625c2ccdf0a5bc6c426c0990,Dogville,2003,178 min,"Crime, Drama",8.0,4.596795647818935,"A woman on the run from the mob is reluctantly accepted in a small Colorado community in exchange for labor, but when a search visits the town she finds out that their support has a price.",60.0,Lars von Trier,"['Nicole Kidman', 'Paul Bettany', 'Lauren Bacall', 'Harriet Andersson']",137963,2022-04-17 15:05:49.180,2022-04-17 15:05:49.180
625c2dd4f0a5bc6c426c0c8c,Death Note: Desu nôto,2006,126 min,"Crime, Drama, Fantasy",7.7,0.4527374175112808,"A battle between the world's two greatest minds begins when Light Yagami finds the Death Note, a notebook with the power to kill, and decides to rid the world of criminals.",,Shûsuke Kaneko,"['Tatsuya Fujiwara', ""Ken'ichi Matsuyama"", 'Asaka Seto', 'Yû Kashii']",28630,2022-04-17 15:10:12.284,2022-04-17 15:10:12.284
625c2cf5f0a5bc6c426c0a3a,Manbiki kazoku,2018,121 min,"Crime, Drama",7.9,4.430013072403255,A family of small-time crooks take in a child they find outside in the cold.,93.0,Hirokazu Koreeda,"['Lily Franky', 'Sakura Andô', 'Kirin Kiki', 'Mayu Matsuoka']",62754,2022-04-17 15:06:29.304,2022-04-17 15:06:29.304
625c2e29f0a5bc6c426c0dee,Boksuneun naui geot,2002,129 min,"Crime, Drama, Thriller",7.6,3.179737002803803,"A recently laid off factory worker kidnaps his former boss' friend's daughter, hoping to use the ransom money to pay for his sister's kidney transplant.",56.0,Chan-wook Park,"['Kang-ho Song', 'Shin Ha-kyun', 'Bae Doona', 'Ji-Eun Lim']",62659,2022-04-17 15:11:37.126,2022-04-17 15:11:37.126
625c2b4df0a5bc6c426c06a0,12 Angry Men,1957,96 min,"Crime, Drama",9.0,1.4291679440074234,A jury holdout attempts to prevent a miscarriage of justice by forcing his colleagues to reconsider the evidence.,96.0,Sidney Lumet,"['Henry Fonda', 'Lee J. Cobb', 'Martin Balsam', 'John Fiedler']",689845,2022-04-17 14:59:25.195,2022-04-17 14:59:25.195
625c2d24f0a5bc6c426c0a8a,Mystic River,2003,138 min,"Crime, Drama, Mystery",7.9,0.006923244516883198,The lives of three men who were childhood friends are shattered when one of them has a family tragedy.,84.0,Clint Eastwood,"['Sean Penn', 'Tim Robbins', 'Kevin Bacon', 'Emmy Rossum']",419420,2022-04-17 15:07:16.482,2022-04-17 15:07:16.482
625c2e36f0a5bc6c426c0e40,Blood Simple,1984,99 min,"Crime, Drama, Thriller",7.6,1.7240105246019743,"The owner of a seedy small-town Texas bar discovers that one of his employees is having an affair with his wife. A chaotic chain of misunderstandings, lies and mischief ensues after he devises a plot to have them murdered.",82.0,Joel Coen,"['Ethan Coen', 'John Getz', 'Frances McDormand', 'Dan Hedaya']",87745,2022-04-17 15:11:50.032,2022-04-17 15:11:50.032
