_id,title,release,duration,gerne,IMDB_Rating,rating,overview,metaScore,director,stars,noOfVotes,createdAt,updatedAt
625c2d4df0a5bc6c426c0b0c,Raazi,2018,138 min,"Action, Drama, Thriller",7.8,0.6883257703817103,A Kashmiri woman agrees to marry a Pakistani army officer in order to spy on Pakistan during the Indo-Pakistan War of 1971.,,Meghna Gulzar,"['Alia Bhatt', 'Vicky Kaushal', 'Rajit Kapoor', 'Shishir Sharma']",25344,2022-04-17 15:07:57.525,2022-04-17 15:07:57.525
625c2c7df0a5bc6c426c0924,Baby,2015,159 min,"Action, Crime, Thriller",8.0,0.176076261442617,"An elite counter-intelligence unit learns of a plot, masterminded by a maniacal madman. With the clock ticking, it's up to them to track the terrorists' international tentacles and prevent them from striking at the heart of India.",,Neeraj Pandey,"['Akshay Kumar', 'Danny Denzongpa', 'Rana Daggubati', 'Taapsee Pannu']",52848,2022-04-17 15:04:29.383,2022-04-17 15:04:29.383
625c2b6cf0a5bc6c426c06e6,Gladiator,2000,155 min,"Action, Adventure, Drama",8.5,4.66248624777033,A former Roman General sets out to exact vengeance against the corrupt emperor who murdered his family and sent him into slavery.,67.0,Ridley Scott,"['Russell Crowe', 'Joaquin Phoenix', 'Connie Nielsen', 'Oliver Reed']",1341460,2022-04-17 14:59:56.830,2022-04-17 14:59:56.830
625c2d85f0a5bc6c426c0b9a,Gongdong gyeongbi guyeok JSA,2000,110 min,"Action, Drama, Thriller",7.8,0.2943356849388823,"After a shooting incident at the North/South Korean border/DMZ leaves 2 North Korean soldiers dead, a neutral Swiss/Swedish team investigates, what actually happened.",58.0,Chan-wook Park,"['Lee Yeong-ae', 'Lee Byung-Hun', 'Kang-ho Song', 'Kim Tae-Woo']",26518,2022-04-17 15:08:53.953,2022-04-17 15:08:53.953
625c2bfbf0a5bc6c426c07e0,Heat,1995,170 min,"Crime, Drama, Thriller",8.2,3.958137797978565,A group of professional bank robbers start to feel the heat from police when they unknowingly leave a clue at their latest heist.,76.0,Michael Mann,"['Al Pacino', 'Robert De Niro', 'Val Kilmer', 'Jon Voight']",577113,2022-04-17 15:02:19.834,2022-04-17 15:02:19.834
625c2dfbf0a5bc6c426c0d3e,Deliverance,1972,109 min,"Adventure, Drama, Thriller",7.7,4.638408248721717,"Intent on seeing the Cahulawassee River before it's dammed and turned into a lake, outdoor fanatic Lewis Medlock takes his friends on a canoeing trip they'll never forget into the dangerous American back-country.",80.0,John Boorman,"['Jon Voight', 'Burt Reynolds', 'Ned Beatty', 'Ronny Cox']",98740,2022-04-17 15:10:51.590,2022-04-17 15:10:51.590
625c2e0df0a5bc6c426c0d92,Sicario,2015,121 min,"Action, Crime, Drama",7.6,1.2943894086814034,An idealistic FBI agent is enlisted by a government task force to aid in the escalating war against drugs at the border area between the U.S. and Mexico.,82.0,Denis Villeneuve,"['Emily Blunt', 'Josh Brolin', 'Benicio Del Toro', 'Jon Bernthal']",371291,2022-04-17 15:11:09.256,2022-04-17 15:11:09.256
625c2cbbf0a5bc6c426c095a,Nefes: Vatan Sagolsun,2009,128 min,"Action, Drama, Thriller",8.0,3.6433251929306176,Story of 40-man Turkish task force who must defend a relay station.,,Levent Semerci,"['Erdem Can', 'Mete Horozoglu', 'Ilker Kizmaz', 'Baris Bagci']",31838,2022-04-17 15:05:31.252,2022-04-17 15:05:31.252
625c2d90f0a5bc6c426c0bbe,Tombstone,1993,130 min,"Action, Biography, Drama",7.8,0.15030896987843212,"A successful lawman's plans to retire anonymously in Tombstone, Arizona are disrupted by the kind of outlaws he was famous for eliminating.",50.0,George P. Cosmatos,"['Kevin Jarre', 'Kurt Russell', 'Val Kilmer', 'Sam Elliott']",126871,2022-04-17 15:09:04.158,2022-04-17 15:09:04.158
625c2bdef0a5bc6c426c079a,Uri: The Surgical Strike,2018,138 min,"Action, Drama, War",8.2,1.945032388442085,"Indian army special forces execute a covert operation, avenging the killing of fellow army men at their base by a terrorist group.",,Aditya Dhar,"['Vicky Kaushal', 'Paresh Rawal', 'Mohit Raina', 'Yami Gautam']",43444,2022-04-17 15:01:50.445,2022-04-17 15:01:50.445
625c2d62f0a5bc6c426c0b58,Chugyeokja,2008,125 min,"Action, Crime, Thriller",7.8,4.564022626044695,A disgraced ex-policeman who runs a small ring of prostitutes finds himself in a race against time when one of his women goes missing.,64.0,Hong-jin Na,"['Kim Yoon-seok', 'Jung-woo Ha', 'Yeong-hie Seo', 'Yoo-Jeong Kim']",58468,2022-04-17 15:08:18.396,2022-04-17 15:08:18.396
625c2e36f0a5bc6c426c0e40,Blood Simple,1984,99 min,"Crime, Drama, Thriller",7.6,1.7240105246019743,"The owner of a seedy small-town Texas bar discovers that one of his employees is having an affair with his wife. A chaotic chain of misunderstandings, lies and mischief ensues after he devises a plot to have them murdered.",82.0,Joel Coen,"['Ethan Coen', 'John Getz', 'Frances McDormand', 'Dan Hedaya']",87745,2022-04-17 15:11:50.032,2022-04-17 15:11:50.032
625c2e0bf0a5bc6c426c0d88,Baby Driver,2017,113 min,"Action, Crime, Drama",7.6,0.29419769838560095,"After being coerced into working for a crime boss, a young getaway driver finds himself taking part in a heist doomed to fail.",86.0,Edgar Wright,"['Ansel Elgort', 'Jon Bernthal', 'Jon Hamm', 'Eiza González']",439406,2022-04-17 15:11:07.776,2022-04-17 15:11:07.776
625c2e2af0a5bc6c426c0df8,Batoru rowaiaru,2000,114 min,"Action, Adventure, Drama",7.6,0.7606060488078603,"In the future, the Japanese government captures a class of ninth-grade students and forces them to kill each other under the revolutionary ""Battle Royale"" act.",81.0,Kinji Fukasaku,"['Tatsuya Fujiwara', 'Aki Maeda', 'Tarô Yamamoto', 'Takeshi Kitano']",169091,2022-04-17 15:11:38.174,2022-04-17 15:11:38.174
625c2deef0a5bc6c426c0d0c,Barton Fink,1991,116 min,"Comedy, Drama, Thriller",7.7,4.833752045658408,A renowned New York playwright is enticed to California to write for the movies and discovers the hellish truth of Hollywood.,69.0,Joel Coen,"['Ethan Coen', 'John Turturro', 'John Goodman', 'Judy Davis']",113240,2022-04-17 15:10:38.872,2022-04-17 15:10:38.872
625c2d13f0a5bc6c426c0a68,District 9,2009,112 min,"Action, Sci-Fi, Thriller",7.9,1.2188541888019433,Violence ensues after an extraterrestrial race forced to live in slum-like conditions on Earth finds a kindred spirit in a government agent exposed to their biotechnology.,81.0,Neill Blomkamp,"['Sharlto Copley', 'David James', 'Jason Cope', 'Nathalie Boltt']",638202,2022-04-17 15:06:59.159,2022-04-17 15:06:59.159
625c2dd6f0a5bc6c426c0c98,Lucky Number Slevin,2006,110 min,"Action, Crime, Drama",7.7,0.6850494718156053,"A case of mistaken identity lands Slevin into the middle of a war being plotted by two of the city's most rival crime bosses. Under constant surveillance by Detective Brikowski and assassin Goodkat, he must get them before they get him.",53.0,Paul McGuigan,"['Josh Hartnett', 'Ben Kingsley', 'Morgan Freeman', 'Lucy Liu']",299524,2022-04-17 15:10:14.074,2022-04-17 15:10:14.074
625c2b7bf0a5bc6c426c070a,Dangal,2016,161 min,"Action, Biography, Drama",8.4,0.5855129463407616,Former wrestler Mahavir Singh Phogat and his two wrestler daughters struggle towards glory at the Commonwealth Games in the face of societal oppression.,,Nitesh Tiwari,"['Aamir Khan', 'Sakshi Tanwar', 'Fatima Sana Shaikh', 'Sanya Malhotra']",156479,2022-04-17 15:00:11.349,2022-04-17 15:00:11.349
625c2d61f0a5bc6c426c0b52,Ajeossi,2010,119 min,"Action, Crime, Drama",7.8,4.377903297457262,A quiet pawnshop keeper with a violent past takes on a drug-and-organ trafficking ring in hope of saving the child who is his only friend.,,Jeong-beom Lee,"['Won Bin', 'Sae-ron Kim', 'Tae-hoon Kim', 'Hee-won Kim']",62848,2022-04-17 15:08:17.680,2022-04-17 15:08:17.680
625c2c82f0a5bc6c426c093a,Serbuan maut 2: Berandal,2014,150 min,"Action, Crime, Thriller",8.0,1.2011263955245233,"Only a short time after the first raid, Rama goes undercover with the thugs of Jakarta and plans to bring down the syndicate and uncover the corruption within his police force.",71.0,Gareth Evans,"['Iko Uwais', 'Yayan Ruhian', 'Arifin Putra', 'Oka Antara']",114316,2022-04-17 15:04:34.828,2022-04-17 15:04:34.828
