_id,title,release,duration,gerne,IMDB_Rating,rating,overview,metaScore,director,stars,noOfVotes,createdAt,updatedAt
625c2bacf0a5bc6c426c0716,The Dark Knight Rises,2012,164 min,"Action, Adventure",8.4,4.7587097916708245,"Eight years after the Joker's reign of anarchy, Batman, with the help of the enigmatic Catwoman, is forced from his exile to save Gotham City from the brutal guerrilla terrorist Bane.",78.0,Christopher Nolan,"['Christian Bale', 'Tom Hardy', 'Anne Hathaway', 'Gary Oldman']",1516346,2022-04-17 15:01:00.313,2022-04-17 15:01:00.313
625c2dcbf0a5bc6c426c0c6c,Star Trek Into Darkness,2013,132 min,"Action, Adventure, Sci-Fi",7.7,4.597755901762404,"After the crew of the Enterprise find an unstoppable force of terror from within their own organization, Captain Kirk leads a manhunt to a war-zone world to capture a one-man weapon of mass destruction.",72.0,J.J. Abrams,"['Chris Pine', 'Zachary Quinto', 'Zoe Saldana', 'Benedict Cumberbatch']",463188,2022-04-17 15:10:03.478,2022-04-17 15:10:03.478
625c2df5f0a5bc6c426c0d28,First Blood,1982,93 min,"Action, Adventure",7.7,1.6491267768528672,A veteran Green Beret is forced by a cruel Sheriff and his deputies to flee into the mountains and wage an escalating one-man war against his pursuers.,61.0,Ted Kotcheff,"['Sylvester Stallone', 'Brian Dennehy', 'Richard Crenna', 'Bill McKinney']",226541,2022-04-17 15:10:45.326,2022-04-17 15:10:45.326
625c2d56f0a5bc6c426c0b24,Rogue One,2016,133 min,"Action, Adventure, Sci-Fi",7.8,4.539542494135893,The daughter of an Imperial scientist joins the Rebel Alliance in a risky move to steal the plans for the Death Star.,65.0,Gareth Edwards,"['Felicity Jones', 'Diego Luna', 'Alan Tudyk', 'Donnie Yen']",556608,2022-04-17 15:08:06.791,2022-04-17 15:08:06.791
625c2d1df0a5bc6c426c0a72,Star Trek,2009,127 min,"Action, Adventure, Sci-Fi",7.9,0.43416366983295873,The brash James T. Kirk tries to live up to his father's legacy with Mr. Spock keeping him in check as a vengeful Romulan from the future creates black holes to destroy the Federation one planet at a time.,82.0,J.J. Abrams,"['Chris Pine', 'Zachary Quinto', 'Simon Pegg', 'Leonard Nimoy']",577336,2022-04-17 15:07:09.420,2022-04-17 15:07:09.420
625c2c53f0a5bc6c426c08a4,Jurassic Park,1993,127 min,"Action, Adventure, Sci-Fi",8.1,2.97622520078653,A pragmatic paleontologist visiting an almost complete theme park is tasked with protecting a couple of kids after a power failure causes the park's cloned dinosaurs to run loose.,68.0,Steven Spielberg,"['Sam Neill', 'Laura Dern', 'Jeff Goldblum', 'Richard Attenborough']",867615,2022-04-17 15:03:47.740,2022-04-17 15:03:47.740
625c2e18f0a5bc6c426c0dbc,Sherlock Holmes,2009,128 min,"Action, Adventure, Mystery",7.6,4.921940408362352,Detective Sherlock Holmes and his stalwart partner Watson engage in a battle of wits and brawn with a nemesis whose plot is a threat to all of England.,57.0,Guy Ritchie,"['Robert Downey Jr.', 'Jude Law', 'Rachel McAdams', 'Mark Strong']",583158,2022-04-17 15:11:20.269,2022-04-17 15:11:20.269
625c2d89f0a5bc6c426c0ba2,Wo hu cang long,2000,120 min,"Action, Adventure, Fantasy",7.8,3.477265308015408,A young Chinese warrior steals a sword from a famed swordsman and then escapes into a world of romantic adventure with a mysterious man in the frontier of the nation.,94.0,Ang Lee,"['Yun-Fat Chow', 'Michelle Yeoh', 'Ziyi Zhang', 'Chen Chang']",253228,2022-04-17 15:08:57.669,2022-04-17 15:08:57.669
625c2db2f0a5bc6c426c0c22,Red River,1948,133 min,"Action, Adventure, Drama",7.8,0.0056356934111223556,"Dunson leads a cattle drive, the culmination of over 14 years of work, to its destination in Missouri. But his tyrannical behavior along the way causes a mutiny, led by his adopted son.",,Howard Hawks,"['Arthur Rosson', 'John Wayne', 'Montgomery Clift', 'Joanne Dru']",28167,2022-04-17 15:09:38.194,2022-04-17 15:09:38.194
625c2df5f0a5bc6c426c0d26,Star Trek II: The Wrath of Khan,1982,113 min,"Action, Adventure, Sci-Fi",7.7,0.5026481135816119,"With the assistance of the Enterprise crew, Admiral Kirk must stop an old nemesis, Khan Noonien Singh, from using the life-generating Genesis Device as the ultimate weapon.",67.0,Nicholas Meyer,"['William Shatner', 'Leonard Nimoy', 'DeForest Kelley', 'James Doohan']",112704,2022-04-17 15:10:45.133,2022-04-17 15:10:45.133
625c2b59f0a5bc6c426c06b8,Star Wars: Episode V - The Empire Strikes Back,1980,124 min,"Action, Adventure, Fantasy",8.7,4.803374457188991,"After the Rebels are brutally overpowered by the Empire on the ice planet Hoth, Luke Skywalker begins Jedi training with Yoda, while his friends are pursued by Darth Vader and a bounty hunter named Boba Fett all over the galaxy.",82.0,Irvin Kershner,"['Mark Hamill', 'Harrison Ford', 'Carrie Fisher', 'Billy Dee Williams']",1159315,2022-04-17 14:59:37.063,2022-04-17 14:59:37.063
625c2dc8f0a5bc6c426c0c5a,Captain America: The Winter Soldier,2014,136 min,"Action, Adventure, Sci-Fi",7.7,2.0318290997880184,"As Steve Rogers struggles to embrace his role in the modern world, he teams up with a fellow Avenger and S.H.I.E.L.D agent, Black Widow, to battle a new threat from history: an assassin known as the Winter Soldier.",70.0,Anthony Russo,"['Joe Russo', 'Chris Evans', 'Samuel L. Jackson', 'Scarlett Johansson']",736182,2022-04-17 15:10:00.342,2022-04-17 15:10:00.342
625c2c30f0a5bc6c426c0856,Mad Max: Fury Road,2015,120 min,"Action, Adventure, Sci-Fi",8.1,1.7800853979738818,"In a post-apocalyptic wasteland, a woman rebels against a tyrannical ruler in search for her homeland with the aid of a group of female prisoners, a psychotic worshiper, and a drifter named Max.",90.0,George Miller,"['Tom Hardy', 'Charlize Theron', 'Nicholas Hoult', 'Zoë Kravitz']",882316,2022-04-17 15:03:12.895,2022-04-17 15:03:12.895
625c2d20f0a5bc6c426c0a78,Letters from Iwo Jima,2006,141 min,"Action, Adventure, Drama",7.9,1.2592399680617916,"The story of the battle of Iwo Jima between the United States and Imperial Japan during World War II, as told from the perspective of the Japanese who fought it.",89.0,Clint Eastwood,"['Ken Watanabe', 'Kazunari Ninomiya', 'Tsuyoshi Ihara', 'Ryô Kase']",154011,2022-04-17 15:07:12.238,2022-04-17 15:07:12.238
625c2d06f0a5bc6c426c0a52,Star Wars: Episode VII - The Force Awakens,2015,138 min,"Action, Adventure, Sci-Fi",7.9,0.3378700271753343,"As a new threat to the galaxy rises, Rey, a desert scavenger, and Finn, an ex-stormtrooper, must join Han Solo and Chewbacca to search for the one hope of restoring peace.",80.0,J.J. Abrams,"['Daisy Ridley', 'John Boyega', 'Oscar Isaac', 'Domhnall Gleeson']",860823,2022-04-17 15:06:46.779,2022-04-17 15:06:46.779
625c2cc6f0a5bc6c426c0978,Casino Royale,2006,144 min,"Action, Adventure, Thriller",8.0,3.7507263564760818,"After earning 00 status and a licence to kill, Secret Agent James Bond sets out on his first mission as 007. Bond must defeat a private banker funding terrorists in a high-stakes game of poker at Casino Royale, Montenegro.",80.0,Martin Campbell,"['Daniel Craig', 'Eva Green', 'Judi Dench', 'Jeffrey Wright']",582239,2022-04-17 15:05:42.357,2022-04-17 15:05:42.357
625c2d22f0a5bc6c426c0a84,Iron Man,2008,126 min,"Action, Adventure, Sci-Fi",7.9,0.33870228928470136,"After being held captive in an Afghan cave, billionaire engineer Tony Stark creates a unique weaponized suit of armor to fight evil.",79.0,Jon Favreau,"['Robert Downey Jr.', 'Gwyneth Paltrow', 'Terrence Howard', 'Jeff Bridges']",939644,2022-04-17 15:07:14.806,2022-04-17 15:07:14.806
625c2bcbf0a5bc6c426c0772,Star Wars: Episode VI - Return of the Jedi,1983,131 min,"Action, Adventure, Fantasy",8.3,2.875737100533411,"After a daring mission to rescue Han Solo from Jabba the Hutt, the Rebels dispatch to Endor to destroy the second Death Star. Meanwhile, Luke struggles to help Darth Vader back from the dark side without falling into the Emperor's trap.",58.0,Richard Marquand,"['Mark Hamill', 'Harrison Ford', 'Carrie Fisher', 'Billy Dee Williams']",950470,2022-04-17 15:01:31.739,2022-04-17 15:01:31.739
625c2b4ff0a5bc6c426c06a8,Inception,2010,148 min,"Action, Adventure, Sci-Fi",8.8,1.8468510658894655,A thief who steals corporate secrets through the use of dream-sharing technology is given the inverse task of planting an idea into the mind of a C.E.O.,74.0,Christopher Nolan,"['Leonardo DiCaprio', 'Joseph Gordon-Levitt', 'Elliot Page', 'Ken Watanabe']",2067042,2022-04-17 14:59:27.204,2022-04-17 14:59:27.204
625c2e00f0a5bc6c426c0d5a,The Magnificent Seven,1960,128 min,"Action, Adventure, Western",7.7,4.446067795752865,Seven gunfighters are hired by Mexican peasants to liberate their village from oppressive bandits.,74.0,John Sturges,"['Yul Brynner', 'Steve McQueen', 'Charles Bronson', 'Eli Wallach']",87719,2022-04-17 15:10:56.703,2022-04-17 15:10:56.703
