_id,title,release,duration,gerne,IMDB_Rating,rating,overview,metaScore,director,stars,noOfVotes,createdAt,updatedAt
625c2bf4f0a5bc6c426c07ca,Rang De Basanti,2006,167 min,"Comedy, Crime, Drama",8.2,3.0051668426589027,"The story of six young Indians who assist an English woman to film a documentary on the freedom fighters from their past, and the events that lead them to relive the long-forgotten saga of freedom.",,Rakeysh Omprakash Mehra,"['Aamir Khan', 'Soha Ali Khan', 'Siddharth', 'Sharman Joshi']",111937,2022-04-17 15:02:12.934,2022-04-17 15:02:12.934
625c2c52f0a5bc6c426c08a2,Chung Hing sam lam,1994,102 min,"Comedy, Crime, Drama",8.1,4.7931157129214155,"Two melancholy Hong Kong policemen fall in love: one with a mysterious female underworld figure, the other with a beautiful and ethereal server at a late-night restaurant he frequents.",77.0,Kar-Wai Wong,"['Brigitte Lin', 'Takeshi Kaneshiro', 'Tony Chiu-Wai Leung', 'Faye Wong']",63122,2022-04-17 15:03:46.968,2022-04-17 15:03:46.968
625c2df4f0a5bc6c426c0d20,After Hours,1985,97 min,"Comedy, Crime, Drama",7.7,3.6818512258075184,An ordinary word processor has the worst night of his life after he agrees to visit a girl in Soho who he met that evening at a coffee shop.,90.0,Martin Scorsese,"['Griffin Dunne', 'Rosanna Arquette', 'Verna Bloom', 'Tommy Chong']",59635,2022-04-17 15:10:44.278,2022-04-17 15:10:44.278
625c2c66f0a5bc6c426c08d0,Paper Moon,1973,102 min,"Comedy, Crime, Drama",8.1,1.82303303162495,"During the Great Depression, a con man finds himself saddled with a young girl who may or may not be his daughter, and the two forge an unlikely partnership.",77.0,Peter Bogdanovich,"[""Ryan O'Neal"", ""Tatum O'Neal"", 'Madeline Kahn', 'John Hillerman']",42285,2022-04-17 15:04:06.720,2022-04-17 15:04:06.720
625c2c00f0a5bc6c426c07ea,Dom za vesanje,1988,142 min,"Comedy, Crime, Drama",8.2,1.8844619925821637,"In this luminous tale set in the area around Sarajevo and in Italy, Perhan, an engaging young Romany (gypsy) with telekinetic powers, is seduced by the quick-cash world of petty crime, which threatens to destroy him and those he loves.",,Emir Kusturica,"['Davor Dujmovic', 'Bora Todorovic', 'Ljubica Adzovic', 'Husnija Hasimovic']",26402,2022-04-17 15:02:24.901,2022-04-17 15:02:24.901
625c2de6f0a5bc6c426c0cf4,Do lok tin si,1995,99 min,"Comedy, Crime, Drama",7.7,4.0601891351292805,"This Hong Kong-set crime drama follows the lives of a hitman, hoping to get out of the business, and his elusive female partner.",71.0,Kar-Wai Wong,"['Leon Lai', 'Michelle Reis', 'Takeshi Kaneshiro', 'Charlie Yeung']",26429,2022-04-17 15:10:30.809,2022-04-17 15:10:30.809
625c2d7ff0a5bc6c426c0b84,Adams æbler,2005,94 min,"Comedy, Crime, Drama",7.8,0.9877452106620987,A neo-nazi sentenced to community service at a church clashes with the blindly devotional priest.,51.0,Anders Thomas Jensen,"['Ulrich Thomsen', 'Mads Mikkelsen', 'Nicolas Bro', 'Paprika Steen']",45717,2022-04-17 15:08:47.570,2022-04-17 15:08:47.570
625c2e38f0a5bc6c426c0e52,The Long Goodbye,1973,112 min,"Comedy, Crime, Drama",7.6,1.2231987057301263,"Private investigator Philip Marlowe helps a friend out of a jam, but in doing so gets implicated in his wife's murder.",87.0,Robert Altman,"['Elliott Gould', 'Nina van Pallandt', 'Sterling Hayden', 'Mark Rydell']",26337,2022-04-17 15:11:52.719,2022-04-17 15:11:52.719
625c2e2cf0a5bc6c426c0e0a,American Psycho,2000,101 min,"Comedy, Crime, Drama",7.6,1.5025679943931158,"A wealthy New York City investment banking executive, Patrick Bateman, hides his alternate psychopathic ego from his co-workers and friends as he delves deeper into his violent, hedonistic fantasies.",64.0,Mary Harron,"['Christian Bale', 'Justin Theroux', 'Josh Lucas', 'Bill Sage']",490062,2022-04-17 15:11:40.437,2022-04-17 15:11:40.437
625c2be0f0a5bc6c426c07a0,"Three Billboards Outside Ebbing, Missouri",2017,115 min,"Comedy, Crime, Drama",8.2,3.6723246719935334,A mother personally challenges the local authorities to solve her daughter's murder when they fail to catch the culprit.,88.0,Martin McDonagh,"['Frances McDormand', 'Woody Harrelson', 'Sam Rockwell', 'Caleb Landry Jones']",432610,2022-04-17 15:01:52.409,2022-04-17 15:01:52.409
625c2d1df0a5bc6c426c0a74,In Bruges,2008,107 min,"Comedy, Crime, Drama",7.9,1.3691181686996412,"Guilt-stricken after a job gone wrong, hitman Ray and his partner await orders from their ruthless boss in Bruges, Belgium, the last place in the world Ray wants to be.",67.0,Martin McDonagh,"['Colin Farrell', 'Brendan Gleeson', 'Ciarán Hinds', 'Elizabeth Berrington']",390334,2022-04-17 15:07:09.636,2022-04-17 15:07:09.636
625c2da1f0a5bc6c426c0bf6,The King of Comedy,1982,109 min,"Comedy, Crime, Drama",7.8,3.61142330620709,"Rupert Pupkin is a passionate yet unsuccessful comic who craves nothing more than to be in the spotlight and to achieve this, he stalks and kidnaps his idol to take the spotlight for himself.",73.0,Martin Scorsese,"['Robert De Niro', 'Jerry Lewis', 'Diahnne Abbott', 'Sandra Bernhard']",88511,2022-04-17 15:09:21.120,2022-04-17 15:09:21.120
625c2d98f0a5bc6c426c0be8,Down by Law,1986,107 min,"Comedy, Crime, Drama",7.8,2.0810577232944882,"Two men are framed and sent to jail, where they meet a murderer who helps them escape and leave the state.",75.0,Jim Jarmusch,"['Tom Waits', 'John Lurie', 'Roberto Benigni', 'Nicoletta Braschi']",47834,2022-04-17 15:09:12.801,2022-04-17 15:09:12.801
625c2bcdf0a5bc6c426c0778,The Sting,1973,129 min,"Comedy, Crime, Drama",8.3,1.5816141416145746,Two grifters team up to pull off the ultimate con.,83.0,George Roy Hill,"['Paul Newman', 'Robert Redford', 'Robert Shaw', 'Charles Durning']",241513,2022-04-17 15:01:33.942,2022-04-17 15:01:33.942
625c2e32f0a5bc6c426c0e30,Delicatessen,1991,99 min,"Comedy, Crime",7.6,3.4287653322426284,Post-apocalyptic surrealist black comedy about the landlord of an apartment building who occasionally prepares a delicacy for his odd tenants.,66.0,Marc Caro,"['Jean-Pierre Jeunet', 'Marie-Laure Dougnac', 'Dominique Pinon', 'Pascal Benezech']",80487,2022-04-17 15:11:46.820,2022-04-17 15:11:46.820
625c2de5f0a5bc6c426c0cea,Donnie Brasco,1997,127 min,"Biography, Crime, Drama",7.7,4.580466867972184,"An FBI undercover agent infiltrates the mob and finds himself identifying more with the mafia life, at the expense of his regular one.",76.0,Mike Newell,"['Al Pacino', 'Johnny Depp', 'Michael Madsen', 'Bruno Kirby']",279318,2022-04-17 15:10:29.698,2022-04-17 15:10:29.698
625c2c74f0a5bc6c426c0900,White Heat,1949,114 min,"Action, Crime, Drama",8.1,0.7181003180845069,A psychopathic criminal with a mother complex makes a daring break from prison and leads his old gang in a chemical plant payroll heist.,,Raoul Walsh,"['James Cagney', 'Virginia Mayo', ""Edmond O'Brien"", 'Margaret Wycherly']",29807,2022-04-17 15:04:20.429,2022-04-17 15:04:20.429
625c2ceaf0a5bc6c426c09fe,La dolce vita,1960,174 min,"Comedy, Drama",8.0,2.5968532759262377,A series of stories following a week in the life of a philandering paparazzo journalist living in Rome.,95.0,Federico Fellini,"['Marcello Mastroianni', 'Anita Ekberg', 'Anouk Aimée', 'Yvonne Furneaux']",66621,2022-04-17 15:06:18.642,2022-04-17 15:06:18.642
625c2d93f0a5bc6c426c0bce,Night on Earth,1991,129 min,"Comedy, Drama",7.8,4.161643098692561,An anthology of 5 different cab drivers in 5 American and European cities and their remarkable fares on the same eventful night.,68.0,Jim Jarmusch,"['Winona Ryder', 'Gena Rowlands', 'Lisanne Falk', 'Alan Randolph Scott']",55362,2022-04-17 15:09:07.963,2022-04-17 15:09:07.963
625c2cf0f0a5bc6c426c0a1a,Kind Hearts and Coronets,1949,106 min,"Comedy, Crime",8.0,0.3183557833483963,A distant poor relative of the Duke D'Ascoyne plots to inherit the title by murdering the eight other heirs who stand ahead of him in the line of succession.,,Robert Hamer,"['Dennis Price', 'Alec Guinness', 'Valerie Hobson', 'Joan Greenwood']",34485,2022-04-17 15:06:24.624,2022-04-17 15:06:24.624
