_id,title,release,duration,gerne,IMDB_Rating,rating,overview,metaScore,director,stars,noOfVotes,createdAt,updatedAt
625c2dc1f0a5bc6c426c0c4c,Kingsman: The Secret Service,2014,129 min,"Action, Adventure, Comedy",7.7,2.5981185253792383,"A spy organisation recruits a promising street kid into the agency's training program, while a global threat emerges from a twisted tech genius.",60.0,Matthew Vaughn,"['Colin Firth', 'Taron Egerton', 'Samuel L. Jackson', 'Michael Caine']",590440,2022-04-17 15:09:53.456,2022-04-17 15:09:53.456
625c2d37f0a5bc6c426c0ac0,The Blues Brothers,1980,133 min,"Action, Adventure, Comedy",7.9,0.9349747490413451,"Jake Blues, just released from prison, puts together his old band to save the Catholic home where he and his brother Elwood were raised.",60.0,John Landis,"['John Belushi', 'Dan Aykroyd', 'Cab Calloway', 'John Candy']",183182,2022-04-17 15:07:35.816,2022-04-17 15:07:35.816
625c2e0bf0a5bc6c426c0d86,Guardians of the Galaxy Vol. 2,2017,136 min,"Action, Adventure, Comedy",7.6,2.858875804528218,"The Guardians struggle to keep together as a team while dealing with their personal family issues, notably Star-Lord's encounter with his father the ambitious celestial being Ego.",67.0,James Gunn,"['Chris Pratt', 'Zoe Saldana', 'Dave Bautista', 'Vin Diesel']",569974,2022-04-17 15:11:07.575,2022-04-17 15:11:07.575
625c2c84f0a5bc6c426c093e,Guardians of the Galaxy,2014,121 min,"Action, Adventure, Comedy",8.0,3.1728653236542117,A group of intergalactic criminals must pull together to stop a fanatical warrior with plans to purge the universe.,76.0,James Gunn,"['Chris Pratt', 'Vin Diesel', 'Bradley Cooper', 'Zoe Saldana']",1043455,2022-04-17 15:04:36.055,2022-04-17 15:04:36.055
625c2cb9f0a5bc6c426c0950,Deadpool,2016,108 min,"Action, Adventure, Comedy",8.0,4.646334413776728,"A wisecracking mercenary gets experimented on and becomes immortal but ugly, and sets out to track down the man who ruined his looks.",65.0,Tim Miller,"['Ryan Reynolds', 'Morena Baccarin', 'T.J. Miller', 'Ed Skrein']",902669,2022-04-17 15:05:29.069,2022-04-17 15:05:29.069
625c2c07f0a5bc6c426c07fa,Sholay,1975,204 min,"Action, Adventure, Comedy",8.2,0.8899052011239472,"After his family is murdered by a notorious and ruthless bandit, a former police officer enlists the services of two outlaws to capture the bandit.",,Ramesh Sippy,"['Sanjeev Kumar', 'Dharmendra', 'Amitabh Bachchan', 'Amjad Khan']",51284,2022-04-17 15:02:31.907,2022-04-17 15:02:31.907
625c2c7df0a5bc6c426c0922,Bajrangi Bhaijaan,2015,163 min,"Action, Adventure, Comedy",8.0,2.235017702076113,An Indian man with a magnanimous heart takes a young mute Pakistani girl back to her homeland to reunite her with her family.,,Kabir Khan,"['Salman Khan', 'Harshaali Malhotra', 'Nawazuddin Siddiqui', 'Kareena Kapoor']",72245,2022-04-17 15:04:29.180,2022-04-17 15:04:29.180
625c2cfef0a5bc6c426c0a4a,Thor: Ragnarok,2017,130 min,"Action, Adventure, Comedy",7.9,1.7000491815044871,"Imprisoned on the planet Sakaar, Thor must race against time to return to Asgard and stop Ragnarök, the destruction of his world, at the hands of the powerful and ruthless villain Hela.",74.0,Taika Waititi,"['Chris Hemsworth', 'Tom Hiddleston', 'Cate Blanchett', 'Mark Ruffalo']",587775,2022-04-17 15:06:38.740,2022-04-17 15:06:38.740
625c2db8f0a5bc6c426c0c3c,Deadpool 2,2018,119 min,"Action, Adventure, Comedy",7.7,4.562841087898405,"Foul-mouthed mutant mercenary Wade Wilson (a.k.a. Deadpool), brings together a team of fellow mutant rogues to protect a young boy with supernatural abilities from the brutal, time-traveling cyborg Cable.",66.0,David Leitch,"['Ryan Reynolds', 'Josh Brolin', 'Morena Baccarin', 'Julian Dennison']",478586,2022-04-17 15:09:44.575,2022-04-17 15:09:44.575
625c2cc0f0a5bc6c426c0962,The Avengers,2012,143 min,"Action, Adventure, Sci-Fi",8.0,3.8684126650183606,Earth's mightiest heroes must come together and learn to fight as a team if they are going to stop the mischievous Loki and his alien army from enslaving humanity.,69.0,Joss Whedon,"['Robert Downey Jr.', 'Chris Evans', 'Scarlett Johansson', 'Jeremy Renner']",1260806,2022-04-17 15:05:36.693,2022-04-17 15:05:36.693
625c2de4f0a5bc6c426c0ce6,The Fifth Element,1997,126 min,"Action, Adventure, Sci-Fi",7.7,2.433415548516822,"In the colorful future, a cab driver unwittingly becomes the central figure in the search for a legendary cosmic weapon to keep Evil and Mr. Zorg at bay.",52.0,Luc Besson,"['Bruce Willis', 'Milla Jovovich', 'Gary Oldman', 'Ian Holm']",434125,2022-04-17 15:10:28.716,2022-04-17 15:10:28.716
625c2d3af0a5bc6c426c0ad6,The Wild Bunch,1969,145 min,"Action, Adventure, Western",7.9,0.6223914913764106,"An aging group of outlaws look for one last big score as the ""traditional"" American West is disappearing around them.",97.0,Sam Peckinpah,"['William Holden', 'Ernest Borgnine', 'Robert Ryan', ""Edmond O'Brien""]",77401,2022-04-17 15:07:38.516,2022-04-17 15:07:38.516
625c2ccbf0a5bc6c426c0988,Pirates of the Caribbean: The Curse of the Black Pearl,2003,143 min,"Action, Adventure, Fantasy",8.0,3.117927893239969,"Blacksmith Will Turner teams up with eccentric pirate ""Captain"" Jack Sparrow to save his love, the governor's daughter, from Jack's former pirate allies, who are now undead.",63.0,Gore Verbinski,"['Johnny Depp', 'Geoffrey Rush', 'Orlando Bloom', 'Keira Knightley']",1015122,2022-04-17 15:05:47.068,2022-04-17 15:05:47.068
625c2bc6f0a5bc6c426c0762,Toy Story,1995,81 min,"Animation, Adventure, Comedy",8.3,1.9030532068869488,A cowboy doll is profoundly threatened and jealous when a new spaceman figure supplants him as top toy in a boy's room.,95.0,John Lasseter,"['Tom Hanks', 'Tim Allen', 'Don Rickles', 'Jim Varney']",887429,2022-04-17 15:01:26.466,2022-04-17 15:01:26.466
625c2bacf0a5bc6c426c0716,The Dark Knight Rises,2012,164 min,"Action, Adventure",8.4,4.7587097916708245,"Eight years after the Joker's reign of anarchy, Batman, with the help of the enigmatic Catwoman, is forced from his exile to save Gotham City from the brutal guerrilla terrorist Bane.",78.0,Christopher Nolan,"['Christian Bale', 'Tom Hardy', 'Anne Hathaway', 'Gary Oldman']",1516346,2022-04-17 15:01:00.313,2022-04-17 15:01:00.313
625c2dc8f0a5bc6c426c0c5a,Captain America: The Winter Soldier,2014,136 min,"Action, Adventure, Sci-Fi",7.7,2.0318290997880184,"As Steve Rogers struggles to embrace his role in the modern world, he teams up with a fellow Avenger and S.H.I.E.L.D agent, Black Widow, to battle a new threat from history: an assassin known as the Winter Soldier.",70.0,Anthony Russo,"['Joe Russo', 'Chris Evans', 'Samuel L. Jackson', 'Scarlett Johansson']",736182,2022-04-17 15:10:00.342,2022-04-17 15:10:00.342
625c2d4df0a5bc6c426c0b0a,The Gentlemen,2019,113 min,"Action, Comedy, Crime",7.8,2.287320980540566,"An American expat tries to sell off his highly profitable marijuana empire in London, triggering plots, schemes, bribery and blackmail in an attempt to steal his domain out from under him.",51.0,Guy Ritchie,"['Matthew McConaughey', 'Charlie Hunnam', 'Michelle Dockery', 'Jeremy Strong']",237392,2022-04-17 15:07:57.302,2022-04-17 15:07:57.302
625c2cb6f0a5bc6c426c0946,The Revenant,2015,156 min,"Action, Adventure, Drama",8.0,1.0066501383954096,A frontiersman on a fur trading expedition in the 1820s fights for survival after being mauled by a bear and left for dead by members of his own hunting team.,76.0,Alejandro G. Iñárritu,"['Leonardo DiCaprio', 'Tom Hardy', 'Will Poulter', 'Domhnall Gleeson']",705589,2022-04-17 15:05:26.747,2022-04-17 15:05:26.747
625c2e00f0a5bc6c426c0d5a,The Magnificent Seven,1960,128 min,"Action, Adventure, Western",7.7,4.446067795752865,Seven gunfighters are hired by Mexican peasants to liberate their village from oppressive bandits.,74.0,John Sturges,"['Yul Brynner', 'Steve McQueen', 'Charles Bronson', 'Eli Wallach']",87719,2022-04-17 15:10:56.703,2022-04-17 15:10:56.703
625c2dfdf0a5bc6c426c0d48,The Dirty Dozen,1967,150 min,"Action, Adventure, War",7.7,3.629014784293446,"During World War II, a rebellious U.S. Army Major is assigned a dozen convicted murderers to train and lead them into a mass assassination mission of German officers.",73.0,Robert Aldrich,"['Lee Marvin', 'Ernest Borgnine', 'Charles Bronson', 'John Cassavetes']",67183,2022-04-17 15:10:53.733,2022-04-17 15:10:53.733
