_id,title,release,duration,gerne,IMDB_Rating,rating,overview,metaScore,director,stars,noOfVotes,createdAt,updatedAt
625c2e30f0a5bc6c426c0e20,Dead Man,1995,121 min,"Adventure, Drama, Fantasy",7.6,2.8623587792487095,"On the run after murdering a man, accountant William Blake encounters a strange aboriginal American man named Nobody who prepares him for his journey into the spiritual world.",62.0,Jim Jarmusch,"['Johnny Depp', 'Gary Farmer', 'Crispin Glover', 'Lance Henriksen']",90442,2022-04-17 15:11:44.114,2022-04-17 15:11:44.114
625c2c35f0a5bc6c426c085c,Harry Potter and the Deathly Hallows: Part 2,2011,130 min,"Adventure, Drama, Fantasy",8.1,3.5987871565392346,"Harry, Ron, and Hermione search for Voldemort's remaining Horcruxes in their effort to destroy the Dark Lord as the final battle rages on at Hogwarts.",85.0,David Yates,"['Daniel Radcliffe', 'Emma Watson', 'Rupert Grint', 'Michael Gambon']",764493,2022-04-17 15:03:17.139,2022-04-17 15:03:17.139
625c2ccbf0a5bc6c426c098a,Big Fish,2003,125 min,"Adventure, Drama, Fantasy",8.0,3.6834999545863223,A frustrated son tries to determine the fact from fiction in his dying father's life.,58.0,Tim Burton,"['Ewan McGregor', 'Albert Finney', 'Billy Crudup', 'Jessica Lange']",415218,2022-04-17 15:05:47.714,2022-04-17 15:05:47.714
625c2d20f0a5bc6c426c0a7a,The Fall,2006,117 min,"Adventure, Drama, Fantasy",7.9,1.4508468121286944,"In a hospital on the outskirts of 1920s Los Angeles, an injured stuntman begins to tell a fellow patient, a little girl with a broken arm, a fantastic story of five mythical heroes. Thanks to his fractured state of mind and her vivid imagination, the line between fiction and reality blurs as the tale advances.",64.0,Tarsem Singh,"['Lee Pace', 'Catinca Untaru', 'Justine Waddell', 'Kim Uylenbroek']",107290,2022-04-17 15:07:12.454,2022-04-17 15:07:12.454
625c2d39f0a5bc6c426c0aca,La montaña sagrada,1973,114 min,"Adventure, Drama, Fantasy",7.9,3.7951437233856167,"In a corrupt, greed-fueled world, a powerful alchemist leads a messianic character and seven materialistic figures to the Holy Mountain, where they hope to achieve enlightenment.",76.0,Alejandro Jodorowsky,"['Alejandro Jodorowsky', 'Horacio Salinas', 'Zamira Saunders', 'Juan Ferrara']",37183,2022-04-17 15:07:37.256,2022-04-17 15:07:37.256
625c2ddaf0a5bc6c426c0cb2,Harry Potter and the Goblet of Fire,2005,157 min,"Adventure, Family, Fantasy",7.7,0.5576747502305979,"Harry Potter finds himself competing in a hazardous tournament between rival schools of magic, but he is distracted by recurring nightmares.",81.0,Mike Newell,"['Daniel Radcliffe', 'Emma Watson', 'Rupert Grint', 'Eric Sykes']",548619,2022-04-17 15:10:18.979,2022-04-17 15:10:18.979
625c2cf8f0a5bc6c426c0a44,Hunt for the Wilderpeople,2016,101 min,"Adventure, Comedy, Drama",7.9,0.7640630074896559,A national manhunt is ordered for a rebellious kid and his foster uncle who go missing in the wild New Zealand bush.,81.0,Taika Waititi,"['Sam Neill', 'Julian Dennison', 'Rima Te Wiata', 'Rachel House']",111483,2022-04-17 15:06:32.350,2022-04-17 15:06:32.350
625c2cf2f0a5bc6c426c0a2c,The Wizard of Oz,1939,102 min,"Adventure, Family, Fantasy",8.0,0.66838051222605,Dorothy Gale is swept away from a farm in Kansas to a magical land of Oz in a tornado and embarks on a quest with her new friends to see the Wizard who can help her return home to Kansas and help her friends as well.,92.0,Victor Fleming,"['George Cukor', 'Mervyn LeRoy', 'Norman Taurog', 'Richard Thorpe']",371379,2022-04-17 15:06:26.422,2022-04-17 15:06:26.422
625c2d25f0a5bc6c426c0a8c,Harry Potter and the Prisoner of Azkaban,2004,142 min,"Adventure, Family, Fantasy",7.9,1.6095415323142759,"Harry Potter, Ron and Hermione return to Hogwarts School of Witchcraft and Wizardry for their third year of study, where they delve into the mystery surrounding an escaped prisoner who poses a dangerous threat to the young wizard.",82.0,Alfonso Cuarón,"['Daniel Radcliffe', 'Emma Watson', 'Rupert Grint', 'Richard Griffiths']",552493,2022-04-17 15:07:17.267,2022-04-17 15:07:17.267
625c2d2cf0a5bc6c426c0a9a,Children of Men,2006,109 min,"Adventure, Drama, Sci-Fi",7.9,2.922480744348018,"In 2027, in a chaotic world in which women have become somehow infertile, a former activist agrees to help transport a miraculously pregnant woman to a sanctuary at sea.",84.0,Alfonso Cuarón,"['Julianne Moore', 'Clive Owen', 'Chiwetel Ejiofor', 'Michael Caine']",465113,2022-04-17 15:07:24.536,2022-04-17 15:07:24.536
625c2de0f0a5bc6c426c0cd4,Interstate 60: Episodes of the Road,2002,116 min,"Adventure, Comedy, Drama",7.7,2.8655283255721264,"Neal Oliver, a very confused young man and an artist, takes a journey of a lifetime on a highway I60 that doesn't exist on any of the maps, going to the places he never even heard of, searching for an answer and his dreamgirl.",,Bob Gale,"['James Marsden', 'Gary Oldman', 'Kurt Russell', 'Matthew Edison']",29999,2022-04-17 15:10:24.390,2022-04-17 15:10:24.390
625c2bd0f0a5bc6c426c0780,Lawrence of Arabia,1962,228 min,"Adventure, Biography, Drama",8.3,3.0203303603789644,"The story of T.E. Lawrence, the English officer who successfully united and led the diverse, often warring, Arab tribes during World War I in order to fight the Turks.",100.0,David Lean,"[""Peter O'Toole"", 'Alec Guinness', 'Anthony Quinn', 'Jack Hawkins']",268085,2022-04-17 15:01:36.934,2022-04-17 15:01:36.934
625c2e2af0a5bc6c426c0dfe,Harry Potter and the Sorcerer's Stone,2001,152 min,"Adventure, Family, Fantasy",7.6,4.3078390977915095,"An orphaned boy enrolls in a school of wizardry, where he learns the truth about himself, his family and the terrible evil that haunts the magical world.",64.0,Chris Columbus,"['Daniel Radcliffe', 'Rupert Grint', 'Richard Harris', 'Maggie Smith']",658185,2022-04-17 15:11:38.799,2022-04-17 15:11:38.799
625c2e2ef0a5bc6c426c0e12,Fear and Loathing in Las Vegas,1998,118 min,"Adventure, Comedy, Drama",7.6,1.8306311624978389,An oddball journalist and his psychopathic lawyer travel to Las Vegas for a series of psychedelic escapades.,41.0,Terry Gilliam,"['Johnny Depp', 'Benicio Del Toro', 'Tobey Maguire', 'Michael Lee Gogin']",259753,2022-04-17 15:11:42.689,2022-04-17 15:11:42.689
625c2c48f0a5bc6c426c0886,Lagaan: Once Upon a Time in India,2001,224 min,"Adventure, Drama, Musical",8.1,1.5804432764643428,The people of a small village in Victorian India stake their future on a game of cricket against their ruthless British rulers.,84.0,Ashutosh Gowariker,"['Aamir Khan', 'Raghuvir Yadav', 'Gracy Singh', 'Rachel Shelley']",105036,2022-04-17 15:03:36.869,2022-04-17 15:03:36.869
625c2c57f0a5bc6c426c08ba,Fitzcarraldo,1982,158 min,"Adventure, Drama",8.1,3.8126210455364262,"The story of Brian Sweeney Fitzgerald, an extremely determined man who intends to build an opera house in the middle of a jungle.",,Werner Herzog,"['Klaus Kinski', 'Claudia Cardinale', 'José Lewgoy', 'Miguel Ángel Fuentes']",31595,2022-04-17 15:03:52.000,2022-04-17 15:03:52.000
625c2d63f0a5bc6c426c0b5a,The Hobbit: The Desolation of Smaug,2013,161 min,"Adventure, Fantasy",7.8,2.3199206160037344,"The dwarves, along with Bilbo Baggins and Gandalf the Grey, continue their quest to reclaim Erebor, their homeland, from Smaug. Bilbo Baggins is in possession of a mysterious and magical ring.",66.0,Peter Jackson,"['Ian McKellen', 'Martin Freeman', 'Richard Armitage', 'Ken Stott']",601408,2022-04-17 15:08:19.168,2022-04-17 15:08:19.168
625c2cc2f0a5bc6c426c096a,Blood Diamond,2006,143 min,"Adventure, Drama, Thriller",8.0,4.614017206212029,"A fisherman, a smuggler, and a syndicate of businessmen match wits over the possession of a priceless diamond.",64.0,Edward Zwick,"['Leonardo DiCaprio', 'Djimon Hounsou', 'Jennifer Connelly', 'Kagiso Kuypers']",499439,2022-04-17 15:05:38.749,2022-04-17 15:05:38.749
625c2c55f0a5bc6c426c08ae,Stand by Me,1986,89 min,"Adventure, Drama",8.1,0.913723032252528,"After the death of one of his friends, a writer recounts a childhood journey with his friends to find the body of a missing boy.",75.0,Rob Reiner,"['Wil Wheaton', 'River Phoenix', 'Corey Feldman', ""Jerry O'Connell""]",363401,2022-04-17 15:03:49.799,2022-04-17 15:03:49.799
625c2d67f0a5bc6c426c0b6c,The Hobbit: An Unexpected Journey,2012,169 min,"Adventure, Fantasy",7.8,0.09753728796126016,"A reluctant Hobbit, Bilbo Baggins, sets out to the Lonely Mountain with a spirited group of dwarves to reclaim their mountain home, and the gold within it from the dragon Smaug.",58.0,Peter Jackson,"['Martin Freeman', 'Ian McKellen', 'Richard Armitage', 'Andy Serkis']",757377,2022-04-17 15:08:23.618,2022-04-17 15:08:23.618
