_id,title,release,duration,gerne,IMDB_Rating,rating,overview,metaScore,director,stars,noOfVotes,createdAt,updatedAt
625c2b46f0a5bc6c426c0698,The Shawshank Redemption,1994,142 min,Drama,9.3,0.30976262621264405,"Two imprisoned men bond over a number of years, finding solace and eventual redemption through acts of common decency.",80.0,Frank Darabont,"['Tim Robbins', 'Morgan Freeman', 'Bob Gunton', 'William Sadler']",2343110,2022-04-17 14:59:18.658,2022-04-17 14:59:18.658
625c2c5cf0a5bc6c426c08c4,The Deer Hunter,1978,183 min,"Drama, War",8.1,3.6124131829337225,An in-depth examination of the ways in which the U.S. Vietnam War impacts and disrupts the lives of people in a small industrial town in Pennsylvania.,86.0,Michael Cimino,"['Robert De Niro', 'Christopher Walken', 'John Cazale', 'John Savage']",311361,2022-04-17 15:03:56.431,2022-04-17 15:03:56.431
625c2df4f0a5bc6c426c0d24,The Verdict,1982,129 min,Drama,7.7,0.4791998803837616,A lawyer sees the chance to salvage his career and self-respect by taking a medical malpractice case to trial rather than settling.,77.0,Sidney Lumet,"['Paul Newman', 'Charlotte Rampling', 'Jack Warden', 'James Mason']",36096,2022-04-17 15:10:44.688,2022-04-17 15:10:44.688
625c2d9af0a5bc6c426c0bec,The Color Purple,1985,154 min,Drama,7.8,1.0587551428593212,A black Southern woman struggles to find her identity after suffering abuse from her father and others over four decades.,78.0,Steven Spielberg,"['Danny Glover', 'Whoopi Goldberg', 'Oprah Winfrey', 'Margaret Avery']",78321,2022-04-17 15:09:14.471,2022-04-17 15:09:14.471
625c2b5cf0a5bc6c426c06c0,Soorarai Pottru,2020,153 min,Drama,8.6,4.333727614180858,"Nedumaaran Rajangam ""Maara"" sets out to make the common man fly and in the process takes on the world's most capital intensive industry and several enemies who stand in his way.",,Sudha Kongara,"['Suriya', 'Madhavan', 'Paresh Rawal', 'Aparna Balamurali']",54995,2022-04-17 14:59:40.370,2022-04-17 14:59:40.370
625c2ddcf0a5bc6c426c0cba,The Magdalene Sisters,2002,114 min,Drama,7.7,3.4969687101300773,Three young Irish women struggle to maintain their spirits while they endure dehumanizing abuse as inmates of a Magdalene Sisters Asylum.,83.0,Peter Mullan,"['Eileen Walsh', 'Dorothy Duffy', 'Nora-Jane Noone', 'Anne-Marie Duff']",25938,2022-04-17 15:10:20.287,2022-04-17 15:10:20.287
625c2ceef0a5bc6c426c0a0e,La Strada,1954,108 min,Drama,8.0,0.1216422681117657,"A care-free girl is sold to a traveling entertainer, consequently enduring physical and emotional pain along the way.",,Federico Fellini,"['Anthony Quinn', 'Giulietta Masina', 'Richard Basehart', 'Aldo Silvani']",58314,2022-04-17 15:06:22.986,2022-04-17 15:06:22.986
625c2c1df0a5bc6c426c0834,Kis Uykusu,2014,196 min,Drama,8.1,3.657784455182517,A hotel owner and landlord in a remote Turkish village deals with conflicts within his family and a tenant behind on his rent.,88.0,Nuri Bilge Ceylan,"['Haluk Bilginer', 'Melisa Sözen', 'Demet Akbag', 'Ayberk Pekcan']",46547,2022-04-17 15:02:53.621,2022-04-17 15:02:53.621
625c2cf0f0a5bc6c426c0a16,A Streetcar Named Desire,1951,122 min,Drama,8.0,4.549815059173121,Disturbed Blanche DuBois moves in with her sister in New Orleans and is tormented by her brutish brother-in-law while her reality crumbles around her.,97.0,Elia Kazan,"['Vivien Leigh', 'Marlon Brando', 'Kim Hunter', 'Karl Malden']",99182,2022-04-17 15:06:24.239,2022-04-17 15:06:24.239
625c2e19f0a5bc6c426c0dc0,The Visitor,2007,104 min,Drama,7.6,4.329784793972047,A college professor travels to New York City to attend a conference and finds a young couple living in his apartment.,79.0,Tom McCarthy,"['Richard Jenkins', 'Haaz Sleiman', 'Danai Gurira', 'Hiam Abbass']",41544,2022-04-17 15:11:21.308,2022-04-17 15:11:21.308
625c2ceaf0a5bc6c426c09fc,The Hustler,1961,134 min,"Drama, Sport",8.0,0.8957244893575744,An up-and-coming pool player plays a long-time champion in a single high-stakes match.,90.0,Robert Rossen,"['Paul Newman', 'Jackie Gleason', 'Piper Laurie', 'George C. Scott']",75067,2022-04-17 15:06:18.441,2022-04-17 15:06:18.441
625c2daef0a5bc6c426c0c0e,Midnight Cowboy,1969,113 min,Drama,7.8,4.224138388021959,"A naive hustler travels from Texas to New York City to seek personal fortune, finding a new friend in the process.",79.0,John Schlesinger,"['Dustin Hoffman', 'Jon Voight', 'Sylvia Miles', 'John McGiver']",101124,2022-04-17 15:09:34.643,2022-04-17 15:09:34.643
625c2cedf0a5bc6c426c0a06,Cat on a Hot Tin Roof,1958,108 min,Drama,8.0,2.822216147247852,Brick is an alcoholic ex-football player who drinks his days away and resists the affections of his wife. A reunion with his terminal father jogs a host of memories and revelations for both father and son.,84.0,Richard Brooks,"['Elizabeth Taylor', 'Paul Newman', 'Burl Ives', 'Jack Carson']",45062,2022-04-17 15:06:21.724,2022-04-17 15:06:21.724
625c2bc5f0a5bc6c426c075c,American Beauty,1999,122 min,Drama,8.3,3.079981612315301,A sexually frustrated suburban father has a mid-life crisis after becoming infatuated with his daughter's best friend.,84.0,Sam Mendes,"['Kevin Spacey', 'Annette Bening', 'Thora Birch', 'Wes Bentley']",1069738,2022-04-17 15:01:25.820,2022-04-17 15:01:25.820
625c2cd0f0a5bc6c426c09a6,Sling Blade,1996,135 min,Drama,8.0,0.21053433873782001,"Karl Childers, a simple man hospitalized since his childhood murder of his mother and her lover, is released to start a new life in a small town.",84.0,Billy Bob Thornton,"['Billy Bob Thornton', 'Dwight Yoakam', 'J.T. Walsh', 'John Ritter']",86838,2022-04-17 15:05:52.184,2022-04-17 15:05:52.184
625c2d5cf0a5bc6c426c0b34,The Lunchbox,2013,104 min,"Drama, Romance",7.8,0.3264388998341605,A mistaken delivery in Mumbai's famously efficient lunchbox delivery system connects a young housewife to an older man in the dusk of his life as they build a fantasy world together through notes in the lunchbox.,76.0,Ritesh Batra,"['Irrfan Khan', 'Nimrat Kaur', 'Nawazuddin Siddiqui', 'Lillete Dubey']",50523,2022-04-17 15:08:12.492,2022-04-17 15:08:12.492
625c2d3cf0a5bc6c426c0ae0,The Manchurian Candidate,1962,126 min,"Drama, Thriller",7.9,4.913912769025664,A former prisoner of war is brainwashed as an unwitting assassin for an international Communist conspiracy.,94.0,John Frankenheimer,"['Frank Sinatra', 'Laurence Harvey', 'Janet Leigh', 'Angela Lansbury']",71122,2022-04-17 15:07:40.671,2022-04-17 15:07:40.671
625c2ce2f0a5bc6c426c09e2,The Last Picture Show,1971,118 min,"Drama, Romance",8.0,0.7830669710354965,"In 1951, a group of high schoolers come of age in a bleak, isolated, atrophied North Texas town that is slowly dying, both culturally and economically.",93.0,Peter Bogdanovich,"['Timothy Bottoms', 'Jeff Bridges', 'Cybill Shepherd', 'Ben Johnson']",42456,2022-04-17 15:06:10.649,2022-04-17 15:06:10.649
625c2d67f0a5bc6c426c0b68,The Boy in the Striped Pyjamas,2008,94 min,"Drama, History, War",7.8,3.099492184772561,"Through the innocent eyes of Bruno, the eight-year-old son of the commandant at a German concentration camp, a forbidden friendship with a Jewish boy on the other side of the camp fence has startling and unexpected consequences.",55.0,Mark Herman,"['Asa Butterfield', 'David Thewlis', 'Rupert Friend', ""Zac Mattoon O'Brien""]",190748,2022-04-17 15:08:23.116,2022-04-17 15:08:23.116
625c2d49f0a5bc6c426c0afa,The Lost Weekend,1945,101 min,"Drama, Film-Noir",7.9,4.3549087251654495,The desperate life of a chronic alcoholic is followed through a four-day drinking bout.,,Billy Wilder,"['Ray Milland', 'Jane Wyman', 'Phillip Terry', 'Howard Da Silva']",33549,2022-04-17 15:07:53.759,2022-04-17 15:07:53.759
