_id,title,release,duration,gerne,IMDB_Rating,rating,overview,metaScore,director,stars,noOfVotes,createdAt,updatedAt
625c2db1f0a5bc6c426c0c1a,The Longest Day,1962,178 min,"Action, Drama, History",7.8,0.8609656713968294,"The events of D-Day, told on a grand scale from both the Allied and German points of view.",75.0,Ken Annakin,"['Andrew Marton', 'Gerd Oswald', 'Bernhard Wicki', 'Darryl F. Zanuck']",52141,2022-04-17 15:09:37.382,2022-04-17 15:09:37.382
625c2b51f0a5bc6c426c06ac,The Lord of the Rings: The Fellowship of the Ring,2001,178 min,"Action, Adventure, Drama",8.8,2.4774114995908123,A meek Hobbit from the Shire and eight companions set out on a journey to destroy the powerful One Ring and save Middle-earth from the Dark Lord Sauron.,92.0,Peter Jackson,"['Elijah Wood', 'Ian McKellen', 'Orlando Bloom', 'Sean Bean']",1661481,2022-04-17 14:59:29.234,2022-04-17 14:59:29.234
625c2b4df0a5bc6c426c06a2,The Lord of the Rings: The Return of the King,2003,201 min,"Action, Adventure, Drama",8.9,0.7605487349431206,Gandalf and Aragorn lead the World of Men against Sauron's army to draw his gaze from Frodo and Sam as they approach Mount Doom with the One Ring.,94.0,Peter Jackson,"['Elijah Wood', 'Viggo Mortensen', 'Ian McKellen', 'Orlando Bloom']",1642758,2022-04-17 14:59:25.991,2022-04-17 14:59:25.991
625c2d4ef0a5bc6c426c0b12,Dunkirk,2017,106 min,"Action, Drama, History",7.8,4.707970590766717,"Allied soldiers from Belgium, the British Empire, and France are surrounded by the German Army and evacuated during a fierce battle in World War II.",94.0,Christopher Nolan,"['Fionn Whitehead', 'Barry Keoghan', 'Mark Rylance', 'Tom Hardy']",555092,2022-04-17 15:07:58.173,2022-04-17 15:07:58.173
625c2e13f0a5bc6c426c0d9c,Dawn of the Planet of the Apes,2014,130 min,"Action, Adventure, Drama",7.6,3.3555286529170116,A growing nation of genetically evolved apes led by Caesar is threatened by a band of human survivors of the devastating virus unleashed a decade earlier.,79.0,Matt Reeves,"['Gary Oldman', 'Keri Russell', 'Andy Serkis', 'Kodi Smit-McPhee']",411599,2022-04-17 15:11:15.260,2022-04-17 15:11:15.260
625c2dd5f0a5bc6c426c0c94,The Last King of Scotland,2006,123 min,"Biography, Drama, History",7.7,3.2373955299212764,Based on the events of the brutal Ugandan dictator Idi Amin's regime as seen by his personal physician during the 1970s.,74.0,Kevin Macdonald,"['James McAvoy', 'Forest Whitaker', 'Gillian Anderson', 'Kerry Washington']",175355,2022-04-17 15:10:13.673,2022-04-17 15:10:13.673
625c2dedf0a5bc6c426c0d02,The Last of the Mohicans,1992,112 min,"Action, Adventure, Drama",7.7,1.667639548980523,Three trappers protect the daughters of a British Colonel in the midst of the French and Indian War.,76.0,Michael Mann,"['Daniel Day-Lewis', 'Madeleine Stowe', 'Russell Means', 'Eric Schweig']",150409,2022-04-17 15:10:37.840,2022-04-17 15:10:37.840
625c2dfff0a5bc6c426c0d4c,A Man for All Seasons,1966,120 min,"Biography, Drama, History",7.7,4.444477388884325,"The story of Sir Thomas More, who stood up to King Henry VIII when the King rejected the Roman Catholic Church to obtain a divorce and remarry.",72.0,Fred Zinnemann,"['Paul Scofield', 'Wendy Hiller', 'Robert Shaw', 'Leo McKern']",31222,2022-04-17 15:10:55.169,2022-04-17 15:10:55.169
625c2d20f0a5bc6c426c0a78,Letters from Iwo Jima,2006,141 min,"Action, Adventure, Drama",7.9,1.2592399680617916,"The story of the battle of Iwo Jima between the United States and Imperial Japan during World War II, as told from the perspective of the Japanese who fought it.",89.0,Clint Eastwood,"['Ken Watanabe', 'Kazunari Ninomiya', 'Tsuyoshi Ihara', 'Ryô Kase']",154011,2022-04-17 15:07:12.238,2022-04-17 15:07:12.238
625c2b55f0a5bc6c426c06b2,The Lord of the Rings: The Two Towers,2002,179 min,"Action, Adventure, Drama",8.7,4.581141589278673,"While Frodo and Sam edge closer to Mordor with the help of the shifty Gollum, the divided fellowship makes a stand against Sauron's new ally, Saruman, and his hordes of Isengard.",87.0,Peter Jackson,"['Elijah Wood', 'Ian McKellen', 'Viggo Mortensen', 'Orlando Bloom']",1485555,2022-04-17 14:59:33.779,2022-04-17 14:59:33.779
625c2c08f0a5bc6c426c07fe,The Great Escape,1963,172 min,"Adventure, Drama, History",8.2,4.298792008488299,Allied prisoners of war plan for several hundred of their number to escape from a German camp during World War II.,86.0,John Sturges,"['Steve McQueen', 'James Garner', 'Richard Attenborough', 'Charles Bronson']",224730,2022-04-17 15:02:32.303,2022-04-17 15:02:32.303
625c2bdef0a5bc6c426c079a,Uri: The Surgical Strike,2018,138 min,"Action, Drama, War",8.2,1.945032388442085,"Indian army special forces execute a covert operation, avenging the killing of fellow army men at their base by a terrorist group.",,Aditya Dhar,"['Vicky Kaushal', 'Paresh Rawal', 'Mohit Raina', 'Yami Gautam']",43444,2022-04-17 15:01:50.445,2022-04-17 15:01:50.445
625c2e0ef0a5bc6c426c0d98,Hell or High Water,2016,102 min,"Action, Crime, Drama",7.6,3.011146454407485,A divorced father and his ex-con older brother resort to a desperate scheme in order to save their family's ranch in West Texas.,88.0,David Mackenzie,"['Chris Pine', 'Ben Foster', 'Jeff Bridges', 'Gil Birmingham']",204175,2022-04-17 15:11:10.447,2022-04-17 15:11:10.447
625c2dd0f0a5bc6c426c0c82,Frost/Nixon,2008,122 min,"Biography, Drama, History",7.7,3.6879411949911898,A dramatic retelling of the post-Watergate television interviews between British talk-show host David Frost and former president Richard Nixon.,80.0,Ron Howard,"['Frank Langella', 'Michael Sheen', 'Kevin Bacon', 'Sam Rockwell']",103330,2022-04-17 15:10:08.100,2022-04-17 15:10:08.100
625c2bf4f0a5bc6c426c07c8,V for Vendetta,2005,132 min,"Action, Drama, Sci-Fi",8.2,4.350409718165085,"In a future British tyranny, a shadowy freedom fighter, known only by the alias of ""V"", plots to overthrow it with the help of a young woman.",62.0,James McTeigue,"['Hugo Weaving', 'Natalie Portman', 'Rupert Graves', 'Stephen Rea']",1032749,2022-04-17 15:02:12.722,2022-04-17 15:02:12.722
625c2d86f0a5bc6c426c0b9c,The Count of Monte Cristo,2002,131 min,"Action, Adventure, Drama",7.8,3.417150141293128,"A young man, falsely imprisoned by his jealous ""friend"", escapes and uses a hidden treasure to exact his revenge.",61.0,Kevin Reynolds,"['Jim Caviezel', 'Guy Pearce', 'Christopher Adamson', 'JB Blanc']",129022,2022-04-17 15:08:54.465,2022-04-17 15:08:54.465
625c2c29f0a5bc6c426c084a,Ford v Ferrari,2019,152 min,"Action, Biography, Drama",8.1,1.9409899059711255,American car designer Carroll Shelby and driver Ken Miles battle corporate interference and the laws of physics to build a revolutionary race car for Ford in order to defeat Ferrari at the 24 Hours of Le Mans in 1966.,81.0,James Mangold,"['Matt Damon', 'Christian Bale', 'Jon Bernthal', 'Caitriona Balfe']",291289,2022-04-17 15:03:05.128,2022-04-17 15:03:05.128
625c2b4ef0a5bc6c426c06a6,Schindler's List,1993,195 min,"Biography, Drama, History",8.9,1.7382378799771603,"In German-occupied Poland during World War II, industrialist Oskar Schindler gradually becomes concerned for his Jewish workforce after witnessing their persecution by the Nazis.",94.0,Steven Spielberg,"['Liam Neeson', 'Ralph Fiennes', 'Ben Kingsley', 'Caroline Goodall']",1213505,2022-04-17 14:59:26.989,2022-04-17 14:59:26.989
625c2ddcf0a5bc6c426c0cb8,The Last Samurai,2003,154 min,"Action, Drama",7.7,0.22702538624516655,An American military advisor embraces the Samurai culture he was hired to destroy after he is captured in battle.,55.0,Edward Zwick,"['Tom Cruise', 'Ken Watanabe', 'Billy Connolly', 'William Atherton']",400049,2022-04-17 15:10:20.083,2022-04-17 15:10:20.083
625c2dfbf0a5bc6c426c0d40,The French Connection,1971,104 min,"Action, Crime, Drama",7.7,2.245755905528295,A pair of NYC cops in the Narcotics Bureau stumble onto a drug smuggling job with a French connection.,94.0,William Friedkin,"['Gene Hackman', 'Roy Scheider', 'Fernando Rey', 'Tony Lo Bianco']",110075,2022-04-17 15:10:51.801,2022-04-17 15:10:51.801
