_id,title,release,duration,gerne,IMDB_Rating,rating,overview,metaScore,director,stars,noOfVotes,createdAt,updatedAt
625c2cc4f0a5bc6c426c0972,Le scaphandre et le papillon,2007,112 min,"Biography, Drama",8.0,2.762326969712862,The true story of Elle editor Jean-Dominique Bauby who suffers a stroke and has to live with an almost totally paralyzed body; only his left eye isn't paralyzed.,92.0,Julian Schnabel,"['Laura Obiols', 'Mathieu Amalric', 'Emmanuelle Seigner', 'Marie-Josée Croze']",103284,2022-04-17 15:05:40.654,2022-04-17 15:05:40.654
625c2decf0a5bc6c426c0d00,Malcolm X,1992,202 min,"Biography, Drama, History",7.7,4.619424228654964,"Biographical epic of the controversial and influential Black Nationalist leader, from his early life and career as a small-time gangster, to his ministry as a member of the Nation of Islam.",73.0,Spike Lee,"['Denzel Washington', 'Angela Bassett', 'Delroy Lindo', 'Spike Lee']",85819,2022-04-17 15:10:36.826,2022-04-17 15:10:36.826
625c2ddaf0a5bc6c426c0cae,Ray,2004,152 min,"Biography, Drama, Music",7.7,2.359722815799458,"The story of the life and career of the legendary rhythm and blues musician Ray Charles, from his humble beginnings in the South, where he went blind at age seven, to his meteoric rise to stardom during the 1950s and 1960s.",73.0,Taylor Hackford,"['Jamie Foxx', 'Regina King', 'Kerry Washington', 'Clifton Powell']",138356,2022-04-17 15:10:18.589,2022-04-17 15:10:18.589
625c2e17f0a5bc6c426c0db4,Moneyball,2011,133 min,"Biography, Drama, Sport",7.6,0.7442283167888741,Oakland A's general manager Billy Beane's successful attempt to assemble a baseball team on a lean budget by employing computer-generated analysis to acquire new players.,87.0,Bennett Miller,"['Brad Pitt', 'Robin Wright', 'Jonah Hill', 'Philip Seymour Hoffman']",369529,2022-04-17 15:11:19.337,2022-04-17 15:11:19.337
625c2bc6f0a5bc6c426c0764,Braveheart,1995,178 min,"Biography, Drama, History",8.3,1.3338501328663621,Scottish warrior William Wallace leads his countrymen in a rebellion to free his homeland from the tyranny of King Edward I of England.,68.0,Mel Gibson,"['Mel Gibson', 'Sophie Marceau', 'Patrick McGoohan', 'Angus Macfadyen']",959181,2022-04-17 15:01:26.677,2022-04-17 15:01:26.677
625c2dcef0a5bc6c426c0c7a,Argo,2012,120 min,"Biography, Drama, Thriller",7.7,2.7662923509444717,"Acting under the cover of a Hollywood producer scouting a location for a science fiction film, a CIA agent launches a dangerous operation to rescue six Americans in Tehran during the U.S. hostage crisis in Iran in 1979.",86.0,Ben Affleck,"['Ben Affleck', 'Bryan Cranston', 'John Goodman', 'Alan Arkin']",572581,2022-04-17 15:10:06.018,2022-04-17 15:10:06.018
625c2c59f0a5bc6c426c08c0,The Elephant Man,1980,124 min,"Biography, Drama",8.1,2.1047841672380105,"A Victorian surgeon rescues a heavily disfigured man who is mistreated while scraping a living as a side-show freak. Behind his monstrous façade, there is revealed a person of kindness, intelligence and sophistication.",78.0,David Lynch,"['Anthony Hopkins', 'John Hurt', 'Anne Bancroft', 'John Gielgud']",220078,2022-04-17 15:03:53.231,2022-04-17 15:03:53.231
625c2c2cf0a5bc6c426c084c,Spotlight,2015,129 min,"Biography, Crime, Drama",8.1,3.2704524436781335,"The true story of how the Boston Globe uncovered the massive scandal of child molestation and cover-up within the local Catholic Archdiocese, shaking the entire Catholic Church to its core.",93.0,Tom McCarthy,"['Mark Ruffalo', 'Michael Keaton', 'Rachel McAdams', 'Liev Schreiber']",420316,2022-04-17 15:03:08.199,2022-04-17 15:03:08.199
625c2c60f0a5bc6c426c08cc,Zerkalo,1975,107 min,"Biography, Drama",8.1,0.0963309044992211,"A dying man in his forties remembers his past. His childhood, his mother, the war, personal moments and things that tell of the recent history of all the Russian nation.",,Andrei Tarkovsky,"['Margarita Terekhova', 'Filipp Yankovskiy', 'Ignat Daniltsev', 'Oleg Yankovskiy']",40081,2022-04-17 15:04:00.443,2022-04-17 15:04:00.443
625c2bf9f0a5bc6c426c07d2,Der Untergang,2004,156 min,"Biography, Drama, History",8.2,4.218486384050134,"Traudl Junge, the final secretary for Adolf Hitler, tells of the Nazi dictator's final days in his Berlin bunker at the end of WWII.",82.0,Oliver Hirschbiegel,"['Bruno Ganz', 'Alexandra Maria Lara', 'Ulrich Matthes', 'Juliane Köhler']",331308,2022-04-17 15:02:17.041,2022-04-17 15:02:17.041
625c2dd7f0a5bc6c426c0c9c,Control,2007,122 min,"Biography, Drama, Music",7.7,4.19866778976083,"A profile of Ian Curtis, the enigmatic singer of Joy Division whose personal, professional, and romantic troubles led him to commit suicide at the age of 23.",78.0,Anton Corbijn,"['Sam Riley', 'Samantha Morton', 'Craig Parkinson', 'Alexandra Maria Lara']",61609,2022-04-17 15:10:15.004,2022-04-17 15:10:15.004
625c2d96f0a5bc6c426c0bda,Glory,1989,122 min,"Biography, Drama, History",7.8,1.724455022660084,"Robert Gould Shaw leads the U.S. Civil War's first all-black volunteer company, fighting prejudices from both his own Union Army, and the Confederates.",78.0,Edward Zwick,"['Matthew Broderick', 'Denzel Washington', 'Cary Elwes', 'Morgan Freeman']",122779,2022-04-17 15:09:10.830,2022-04-17 15:09:10.830
625c2b57f0a5bc6c426c06b6,Goodfellas,1990,146 min,"Biography, Crime, Drama",8.7,0.9320208590213308,"The story of Henry Hill and his life in the mob, covering his relationship with his wife Karen Hill and his mob partners Jimmy Conway and Tommy DeVito in the Italian-American crime syndicate.",90.0,Martin Scorsese,"['Robert De Niro', 'Ray Liotta', 'Joe Pesci', 'Lorraine Bracco']",1020727,2022-04-17 14:59:35.256,2022-04-17 14:59:35.256
625c2cc7f0a5bc6c426c0982,Cinderella Man,2005,144 min,"Biography, Drama, History",8.0,0.15815611441763466,"The story of James J. Braddock, a supposedly washed-up boxer who came back to become a champion and an inspiration in the 1930s.",69.0,Ron Howard,"['Russell Crowe', 'Renée Zellweger', 'Craig Bierko', 'Paul Giamatti']",176151,2022-04-17 15:05:43.344,2022-04-17 15:05:43.344
625c2bfaf0a5bc6c426c07d6,A Beautiful Mind,2001,135 min,"Biography, Drama",8.2,3.361926545587991,"After John Nash, a brilliant but asocial mathematician, accepts secret work in cryptography, his life takes a turn for the nightmarish.",72.0,Ron Howard,"['Russell Crowe', 'Ed Harris', 'Jennifer Connelly', 'Christopher Plummer']",848920,2022-04-17 15:02:18.321,2022-04-17 15:02:18.321
625c2b5af0a5bc6c426c06bc,Hamilton,2020,160 min,"Biography, Drama, History",8.6,2.2094065692805422,"The real life of one of America's foremost founding fathers and first Secretary of the Treasury, Alexander Hamilton. Captured live on Broadway from the Richard Rodgers Theater with the original Broadway cast.",90.0,Thomas Kail,"['Lin-Manuel Miranda', 'Phillipa Soo', 'Leslie Odom Jr.', 'Renée Elise Goldsberry']",55291,2022-04-17 14:59:38.228,2022-04-17 14:59:38.228
625c2bdff0a5bc6c426c079e,Green Book,2018,130 min,"Biography, Comedy, Drama",8.2,3.3991154144454114,A working-class Italian-American bouncer becomes the driver of an African-American classical pianist on a tour of venues through the 1960s American South.,69.0,Peter Farrelly,"['Viggo Mortensen', 'Mahershala Ali', 'Linda Cardellini', 'Sebastian Maniscalco']",377884,2022-04-17 15:01:51.756,2022-04-17 15:01:51.756
625c2c40f0a5bc6c426c086e,Hotel Rwanda,2004,121 min,"Biography, Drama, History",8.1,1.6392188208885738,"Paul Rusesabagina, a hotel manager, houses over a thousand Tutsi refugees during their struggle against the Hutu militia in Rwanda, Africa.",79.0,Terry George,"['Don Cheadle', 'Sophie Okonedo', 'Joaquin Phoenix', 'Xolani Mali']",334320,2022-04-17 15:03:28.677,2022-04-17 15:03:28.677
625c2d54f0a5bc6c426c0b1e,M.S. Dhoni: The Untold Story,2016,184 min,"Biography, Drama, Sport",7.8,2.9895619449027633,The untold story of Mahendra Singh Dhoni's journey from ticket collector to trophy collector - the world-cup-winning captain of the Indian Cricket Team.,,Neeraj Pandey,"['Sushant Singh Rajput', 'Kiara Advani', 'Anupam Kher', 'Disha Patani']",40416,2022-04-17 15:08:04.563,2022-04-17 15:08:04.563
625c2deaf0a5bc6c426c0cf6,Il postino,1994,108 min,"Biography, Comedy, Drama",7.7,4.044201471345559,"A simple Italian postman learns to love poetry while delivering mail to a famous poet, and then uses this to woo local beauty Beatrice.",81.0,Michael Radford,"['Massimo Troisi', 'Massimo Troisi', 'Philippe Noiret', 'Maria Grazia Cucinotta']",33600,2022-04-17 15:10:34.177,2022-04-17 15:10:34.177
