_id,title,release,duration,gerne,IMDB_Rating,rating,overview,metaScore,director,stars,noOfVotes,createdAt,updatedAt
625c2d5df0a5bc6c426c0b3a,About Time,2013,123 min,"Comedy, Drama, Fantasy",7.8,1.0398391396640638,"At the age of 21, Tim discovers he can travel in time and change what happens and has happened in his own life. His decision to make his world a better place by getting a girlfriend turns out not to be as easy as you might think.",55.0,Richard Curtis,"['Domhnall Gleeson', 'Rachel McAdams', 'Bill Nighy', 'Lydia Wilson']",303032,2022-04-17 15:08:13.182,2022-04-17 15:08:13.182
625c2d48f0a5bc6c426c0af2,Harvey,1950,104 min,"Comedy, Drama, Fantasy",7.9,3.672078736620321,"Due to his insistence that he has an invisible six foot-tall rabbit for a best friend, a whimsical middle-aged man is thought by his family to be insane - but he may be wiser than anyone knows.",,Henry Koster,"['James Stewart', 'Wallace Ford', 'William H. Lynn', 'Victoria Horne']",52573,2022-04-17 15:07:52.918,2022-04-17 15:07:52.918
625c2c1ef0a5bc6c426c0838,OMG: Oh My God!,2012,125 min,"Comedy, Drama, Fantasy",8.1,4.746396469217041,A shopkeeper takes God to court when his shop is destroyed by an earthquake.,,Umesh Shukla,"['Paresh Rawal', 'Akshay Kumar', 'Mithun Chakraborty', 'Mahesh Manjrekar']",51739,2022-04-17 15:02:54.034,2022-04-17 15:02:54.034
625c2c55f0a5bc6c426c08ac,Dead Poets Society,1989,128 min,"Comedy, Drama",8.1,0.7805170389942628,Maverick teacher John Keating uses poetry to embolden his boarding school students to new heights of self-expression.,79.0,Peter Weir,"['Robin Williams', 'Robert Sean Leonard', 'Ethan Hawke', 'Josh Charles']",425457,2022-04-17 15:03:49.587,2022-04-17 15:03:49.587
625c2c79f0a5bc6c426c090a,Mr. Smith Goes to Washington,1939,129 min,"Comedy, Drama",8.1,3.2016330807813667,"A naive man is appointed to fill a vacancy in the United States Senate. His plans promptly collide with political corruption, but he doesn't back down.",73.0,Frank Capra,"['James Stewart', 'Jean Arthur', 'Claude Rains', 'Edward Arnold']",107017,2022-04-17 15:04:25.537,2022-04-17 15:04:25.537
625c2d7df0a5bc6c426c0b7c,Little Miss Sunshine,2006,101 min,"Comedy, Drama",7.8,3.547795617340049,A family determined to get their young daughter into the finals of a beauty pageant take a cross-country trip in their VW bus.,80.0,Jonathan Dayton,"['Valerie Faris', 'Steve Carell', 'Toni Collette', 'Greg Kinnear']",439856,2022-04-17 15:08:45.694,2022-04-17 15:08:45.694
625c2d5ff0a5bc6c426c0b44,Moonrise Kingdom,2012,94 min,"Comedy, Drama, Romance",7.8,0.4394409345655559,"A pair of young lovers flee their New England town, which causes a local search party to fan out to find them.",84.0,Wes Anderson,"['Jared Gilman', 'Kara Hayward', 'Bruce Willis', 'Bill Murray']",318789,2022-04-17 15:08:15.015,2022-04-17 15:08:15.015
625c2deef0a5bc6c426c0d0c,Barton Fink,1991,116 min,"Comedy, Drama, Thriller",7.7,4.833752045658408,A renowned New York playwright is enticed to California to write for the movies and discovers the hellish truth of Hollywood.,69.0,Joel Coen,"['Ethan Coen', 'John Turturro', 'John Goodman', 'Judy Davis']",113240,2022-04-17 15:10:38.872,2022-04-17 15:10:38.872
625c2d89f0a5bc6c426c0b9e,Waking Life,2001,99 min,"Animation, Drama, Fantasy",7.8,4.9524967135366404,A man shuffles through a dream meeting various people and discussing the meanings and purposes of the universe.,83.0,Richard Linklater,"['Ethan Hawke', 'Trevor Jack Brooks', 'Lorelei Linklater', 'Wiley Wiggins']",60684,2022-04-17 15:08:57.262,2022-04-17 15:08:57.262
625c2dcdf0a5bc6c426c0c78,Silver Linings Playbook,2012,122 min,"Comedy, Drama, Romance",7.7,1.2132343614610053,"After a stint in a mental institution, former teacher Pat Solitano moves back in with his parents and tries to reconcile with his ex-wife. Things get more challenging when Pat meets Tiffany, a mysterious girl with problems of her own.",81.0,David O. Russell,"['Bradley Cooper', 'Jennifer Lawrence', 'Robert De Niro', 'Jacki Weaver']",661871,2022-04-17 15:10:05.742,2022-04-17 15:10:05.742
625c2c4af0a5bc6c426c088c,The Truman Show,1998,103 min,"Comedy, Drama",8.1,4.568644947204023,An insurance salesman discovers his whole life is actually a reality TV show.,90.0,Peter Weir,"['Jim Carrey', 'Ed Harris', 'Laura Linney', 'Noah Emmerich']",939631,2022-04-17 15:03:38.781,2022-04-17 15:03:38.781
625c2e2af0a5bc6c426c0dfa,The Royal Tenenbaums,2001,110 min,"Comedy, Drama",7.6,4.470595798673232,The eccentric members of a dysfunctional family reluctantly gather under the same roof for various reasons.,76.0,Wes Anderson,"['Gene Hackman', 'Gwyneth Paltrow', 'Anjelica Huston', 'Ben Stiller']",266842,2022-04-17 15:11:38.383,2022-04-17 15:11:38.383
625c2d0cf0a5bc6c426c0a5a,The Artist,2011,100 min,"Comedy, Drama, Romance",7.9,2.8538249510576232,An egomaniacal film star develops a relationship with a young dancer against the backdrop of Hollywood's silent era.,89.0,Michel Hazanavicius,"['Jean Dujardin', 'Bérénice Bejo', 'John Goodman', 'James Cromwell']",230624,2022-04-17 15:06:52.073,2022-04-17 15:06:52.073
625c2cfbf0a5bc6c426c0a46,Captain Fantastic,2016,118 min,"Comedy, Drama",7.9,3.5701799330001927,"In the forests of the Pacific Northwest, a father devoted to raising his six kids with a rigorous physical and intellectual education is forced to leave his paradise and enter the world, challenging his idea of what it means to be a parent.",72.0,Matt Ross,"['Viggo Mortensen', 'George MacKay', 'Samantha Isler', 'Annalise Basso']",189400,2022-04-17 15:06:35.672,2022-04-17 15:06:35.672
625c2c41f0a5bc6c426c0874,Munna Bhai M.B.B.S.,2003,156 min,"Comedy, Drama, Musical",8.1,1.7532626607554902,A gangster sets out to fulfill his father's dream of becoming a doctor.,,Rajkumar Hirani,"['Sanjay Dutt', 'Arshad Warsi', 'Gracy Singh', 'Sunil Dutt']",73992,2022-04-17 15:03:29.341,2022-04-17 15:03:29.341
625c2bf4f0a5bc6c426c07ca,Rang De Basanti,2006,167 min,"Comedy, Crime, Drama",8.2,3.0051668426589027,"The story of six young Indians who assist an English woman to film a documentary on the freedom fighters from their past, and the events that lead them to relive the long-forgotten saga of freedom.",,Rakeysh Omprakash Mehra,"['Aamir Khan', 'Soha Ali Khan', 'Siddharth', 'Sharman Joshi']",111937,2022-04-17 15:02:12.934,2022-04-17 15:02:12.934
625c2cc7f0a5bc6c426c0984,Kal Ho Naa Ho,2003,186 min,"Comedy, Drama, Musical",8.0,4.582820531643581,"Naina, an introverted, perpetually depressed girl's life changes when she meets Aman. But Aman has a secret of his own which changes their lives forever. Embroiled in all this is Rohit, Naina's best friend who conceals his love for her.",54.0,Nikkhil Advani,"['Preity Zinta', 'Shah Rukh Khan', 'Saif Ali Khan', 'Jaya Bachchan']",63460,2022-04-17 15:05:43.545,2022-04-17 15:05:43.545
625c2decf0a5bc6c426c0cfe,The Muppet Christmas Carol,1992,85 min,"Comedy, Drama, Family",7.7,4.436602821247333,The Muppet characters tell their version of the classic tale of an old and bitter miser's redemption on Christmas Eve.,64.0,Brian Henson,"['Michael Caine', 'Kermit the Frog', 'Dave Goelz', 'Miss Piggy']",50298,2022-04-17 15:10:36.560,2022-04-17 15:10:36.560
625c2c30f0a5bc6c426c0852,Zindagi Na Milegi Dobara,2011,155 min,"Comedy, Drama",8.1,0.7234510822379614,Three friends decide to turn their fantasy vacation into reality after one of their friends gets engaged.,,Zoya Akhtar,"['Hrithik Roshan', 'Farhan Akhtar', 'Abhay Deol', 'Katrina Kaif']",67927,2022-04-17 15:03:12.403,2022-04-17 15:03:12.403
625c2cf3f0a5bc6c426c0a2e,La règle du jeu,1939,110 min,"Comedy, Drama",8.0,4.752221594103673,"A bourgeois life in France at the onset of World War II, as the rich and their poor servants meet up at a French chateau.",,Jean Renoir,"['Marcel Dalio', 'Nora Gregor', 'Paulette Dubost', 'Mila Parély']",26725,2022-04-17 15:06:27.065,2022-04-17 15:06:27.065
