_id,title,release,duration,gerne,IMDB_Rating,rating,overview,metaScore,director,stars,noOfVotes,createdAt,updatedAt
625c2cd8f0a5bc6c426c09ca,Tenkû no shiro Rapyuta,1986,125 min,"Animation, Adventure, Drama",8.0,4.904960791004481,A young boy and a girl with a magic crystal must race against pirates and foreign agents in a search for a legendary floating castle.,78.0,Hayao Miyazaki,"['Mayumi Tanaka', 'Keiko Yokozawa', 'Kotoe Hatsui', 'Minori Terada']",150140,2022-04-17 15:06:00.298,2022-04-17 15:06:00.298
625c2dc9f0a5bc6c426c0c62,Le Petit Prince,2015,108 min,"Animation, Adventure, Drama",7.7,0.09538220839389266,"A little girl lives in a very grown-up world with her mother, who tries to prepare her for it. Her neighbor, the Aviator, introduces the girl to an extraordinary world where anything is possible, the world of the Little Prince.",70.0,Mark Osborne,"['Jeff Bridges', 'Mackenzie Foy', 'Rachel McAdams', 'Marion Cotillard']",56720,2022-04-17 15:10:01.801,2022-04-17 15:10:01.801
625c2c81f0a5bc6c426c0930,Kaguyahime no monogatari,2013,137 min,"Animation, Adventure, Drama",8.0,0.6749735129375334,"Found inside a shining stalk of bamboo by an old bamboo cutter and his wife, a tiny girl grows rapidly into an exquisite young lady. The mysterious young princess enthralls all who encounter her, but ultimately she must confront her fate, the punishment for her crime.",89.0,Isao Takahata,"['Chloë Grace Moretz', 'James Caan', 'Mary Steenburgen', 'James Marsden']",38746,2022-04-17 15:04:33.598,2022-04-17 15:04:33.598
625c2b6ff0a5bc6c426c06ee,The Lion King,1994,88 min,"Animation, Adventure, Drama",8.5,4.493475427737119,"Lion prince Simba and his father are targeted by his bitter uncle, who wants to ascend the throne himself.",88.0,Roger Allers,"['Rob Minkoff', 'Matthew Broderick', 'Jeremy Irons', 'James Earl Jones']",942045,2022-04-17 14:59:59.712,2022-04-17 14:59:59.712
625c2d96f0a5bc6c426c0bd8,Majo no takkyûbin,1989,103 min,"Animation, Adventure, Drama",7.8,3.5753197990935948,"A young witch, on her mandatory year of independent life, finds fitting into a new community difficult while she supports herself by running an air courier service.",83.0,Hayao Miyazaki,"['Kirsten Dunst', 'Minami Takayama', 'Rei Sakuma', 'Kappei Yamaguchi']",124193,2022-04-17 15:09:10.642,2022-04-17 15:09:10.642
625c2e37f0a5bc6c426c0e4c,Watership Down,1978,91 min,"Animation, Adventure, Drama",7.6,1.6927194813818025,"Hoping to escape destruction by human developers and save their community, a colony of rabbits, led by Hazel and Fiver, seek out a safe place to set up a new warren.",64.0,Martin Rosen,"['John Hubley', 'John Hurt', 'Richard Briers', 'Ralph Richardson']",33656,2022-04-17 15:11:51.528,2022-04-17 15:11:51.528
625c2b51f0a5bc6c426c06ac,The Lord of the Rings: The Fellowship of the Ring,2001,178 min,"Action, Adventure, Drama",8.8,2.4774114995908123,A meek Hobbit from the Shire and eight companions set out on a journey to destroy the powerful One Ring and save Middle-earth from the Dark Lord Sauron.,92.0,Peter Jackson,"['Elijah Wood', 'Ian McKellen', 'Orlando Bloom', 'Sean Bean']",1661481,2022-04-17 14:59:29.234,2022-04-17 14:59:29.234
625c2e23f0a5bc6c426c0dc8,The Secret of Kells,2009,71 min,"Animation, Adventure, Family",7.6,4.344502342295135,"A young boy in a remote medieval outpost under siege from barbarian raids is beckoned to adventure when a celebrated master illuminator arrives with an ancient book, brimming with secret wisdom and powers.",81.0,Tomm Moore,"['Nora Twomey', 'Evan McGuire', 'Brendan Gleeson', 'Mick Lally']",31779,2022-04-17 15:11:31.651,2022-04-17 15:11:31.651
625c2d86f0a5bc6c426c0b9c,The Count of Monte Cristo,2002,131 min,"Action, Adventure, Drama",7.8,3.417150141293128,"A young man, falsely imprisoned by his jealous ""friend"", escapes and uses a hidden treasure to exact his revenge.",61.0,Kevin Reynolds,"['Jim Caviezel', 'Guy Pearce', 'Christopher Adamson', 'JB Blanc']",129022,2022-04-17 15:08:54.465,2022-04-17 15:08:54.465
625c2e13f0a5bc6c426c0d9c,Dawn of the Planet of the Apes,2014,130 min,"Action, Adventure, Drama",7.6,3.3555286529170116,A growing nation of genetically evolved apes led by Caesar is threatened by a band of human survivors of the devastating virus unleashed a decade earlier.,79.0,Matt Reeves,"['Gary Oldman', 'Keri Russell', 'Andy Serkis', 'Kodi Smit-McPhee']",411599,2022-04-17 15:11:15.260,2022-04-17 15:11:15.260
625c2b4df0a5bc6c426c06a2,The Lord of the Rings: The Return of the King,2003,201 min,"Action, Adventure, Drama",8.9,0.7605487349431206,Gandalf and Aragorn lead the World of Men against Sauron's army to draw his gaze from Frodo and Sam as they approach Mount Doom with the One Ring.,94.0,Peter Jackson,"['Elijah Wood', 'Viggo Mortensen', 'Ian McKellen', 'Orlando Bloom']",1642758,2022-04-17 14:59:25.991,2022-04-17 14:59:25.991
625c2dedf0a5bc6c426c0d02,The Last of the Mohicans,1992,112 min,"Action, Adventure, Drama",7.7,1.667639548980523,Three trappers protect the daughters of a British Colonel in the midst of the French and Indian War.,76.0,Michael Mann,"['Daniel Day-Lewis', 'Madeleine Stowe', 'Russell Means', 'Eric Schweig']",150409,2022-04-17 15:10:37.840,2022-04-17 15:10:37.840
625c2e39f0a5bc6c426c0e58,The Jungle Book,1967,78 min,"Animation, Adventure, Family",7.6,4.563968988509217,Bagheera the Panther and Baloo the Bear have a difficult time trying to convince a boy to leave the jungle for human civilization.,65.0,Wolfgang Reitherman,"['Phil Harris', 'Sebastian Cabot', 'Louis Prima', 'Bruce Reitherman']",166409,2022-04-17 15:11:53.922,2022-04-17 15:11:53.922
625c2ccff0a5bc6c426c09a2,The Iron Giant,1999,86 min,"Animation, Action, Adventure",8.0,0.5205153277576857,A young boy befriends a giant robot from outer space that a paranoid government agent wants to destroy.,85.0,Brad Bird,"['Eli Marienthal', 'Harry Connick Jr.', 'Jennifer Aniston', 'Vin Diesel']",172083,2022-04-17 15:05:51.768,2022-04-17 15:05:51.768
625c2d54f0a5bc6c426c0b1c,Kubo and the Two Strings,2016,101 min,"Animation, Action, Adventure",7.8,2.8165950301119547,A young boy named Kubo must locate a magical suit of armour worn by his late father in order to defeat a vengeful spirit from the past.,84.0,Travis Knight,"['Charlize Theron', 'Art Parkinson', 'Matthew McConaughey', 'Ralph Fiennes']",118035,2022-04-17 15:08:04.368,2022-04-17 15:08:04.368
625c2b55f0a5bc6c426c06b2,The Lord of the Rings: The Two Towers,2002,179 min,"Action, Adventure, Drama",8.7,4.581141589278673,"While Frodo and Sam edge closer to Mordor with the help of the shifty Gollum, the divided fellowship makes a stand against Sauron's new ally, Saruman, and his hordes of Isengard.",87.0,Peter Jackson,"['Elijah Wood', 'Ian McKellen', 'Viggo Mortensen', 'Orlando Bloom']",1485555,2022-04-17 14:59:33.779,2022-04-17 14:59:33.779
625c2dcbf0a5bc6c426c0c68,The Lego Movie,2014,100 min,"Animation, Action, Adventure",7.7,2.984869968454864,"An ordinary LEGO construction worker, thought to be the prophesied as ""special"", is recruited to join a quest to stop an evil tyrant from gluing the LEGO universe into eternal stasis.",83.0,Christopher Miller,"['Phil Lord', 'Chris Pratt', 'Will Ferrell', 'Elizabeth Banks']",323982,2022-04-17 15:10:03.059,2022-04-17 15:10:03.059
625c2c20f0a5bc6c426c083e,Ôkami kodomo no Ame to Yuki,2012,117 min,"Animation, Drama, Fantasy",8.1,2.503668080502713,"After her werewolf lover unexpectedly dies in an accident while hunting for food for their children, a young woman must find ways to raise the werewolf son and daughter that she had with him while keeping their trait hidden from society.",71.0,Mamoru Hosoda,"['Aoi Miyazaki', 'Takao Osawa', 'Haru Kuroki', 'Yukito Nishii']",38803,2022-04-17 15:02:56.221,2022-04-17 15:02:56.221
625c2d20f0a5bc6c426c0a78,Letters from Iwo Jima,2006,141 min,"Action, Adventure, Drama",7.9,1.2592399680617916,"The story of the battle of Iwo Jima between the United States and Imperial Japan during World War II, as told from the perspective of the Japanese who fought it.",89.0,Clint Eastwood,"['Ken Watanabe', 'Kazunari Ninomiya', 'Tsuyoshi Ihara', 'Ryô Kase']",154011,2022-04-17 15:07:12.238,2022-04-17 15:07:12.238
625c2b7bf0a5bc6c426c070c,Spider-Man: Into the Spider-Verse,2018,117 min,"Animation, Action, Adventure",8.4,0.25935195402954636,"Teen Miles Morales becomes the Spider-Man of his universe, and must join with five spider-powered individuals from other dimensions to stop a threat for all realities.",87.0,Bob Persichetti,"['Peter Ramsey', 'Rodney Rothman', 'Shameik Moore', 'Jake Johnson']",375110,2022-04-17 15:00:11.572,2022-04-17 15:00:11.572
