_id,title,release,duration,gerne,IMDB_Rating,rating,overview,metaScore,director,stars,noOfVotes,createdAt,updatedAt
625c2b46f0a5bc6c426c0698,The Shawshank Redemption,1994,142 min,Drama,9.3,0.30976262621264405,"Two imprisoned men bond over a number of years, finding solace and eventual redemption through acts of common decency.",80.0,Frank Darabont,"['Tim Robbins', 'Morgan Freeman', 'Bob Gunton', 'William Sadler']",2343110,2022-04-17 14:59:18.658,2022-04-17 14:59:18.658
625c2c6bf0a5bc6c426c08de,La battaglia di Algeri,1966,121 min,"Drama, War",8.1,3.7043596113599353,"In the 1950s, fear and violence escalate as the people of Algiers fight for independence from the French government.",96.0,Gillo Pontecorvo,"['Brahim Hadjadj', 'Jean Martin', 'Yacef Saadi', 'Samia Kerbash']",53089,2022-04-17 15:04:11.551,2022-04-17 15:04:11.551
625c2c13f0a5bc6c426c081e,Portrait de la jeune fille en feu,2019,122 min,"Drama, Romance",8.1,4.587971402846379,"On an isolated island in Brittany at the end of the eighteenth century, a female painter is obliged to paint a wedding portrait of a young woman.",95.0,Céline Sciamma,"['Noémie Merlant', 'Adèle Haenel', 'Luàna Bajrami', 'Valeria Golino']",63134,2022-04-17 15:02:43.005,2022-04-17 15:02:43.005
625c2ceef0a5bc6c426c0a0e,La Strada,1954,108 min,Drama,8.0,0.1216422681117657,"A care-free girl is sold to a traveling entertainer, consequently enduring physical and emotional pain along the way.",,Federico Fellini,"['Anthony Quinn', 'Giulietta Masina', 'Richard Basehart', 'Aldo Silvani']",58314,2022-04-17 15:06:22.986,2022-04-17 15:06:22.986
625c2e2af0a5bc6c426c0dfc,Y tu mamá también,2001,106 min,Drama,7.6,4.671089049033586,"In Mexico, two teenage boys and an attractive older woman embark on a road trip and learn a thing or two about life, friendship, sex, and each other.",88.0,Alfonso Cuarón,"['Maribel Verdú', 'Gael García Bernal', 'Daniel Giménez Cacho', 'Ana López Mercado']",115827,2022-04-17 15:11:38.600,2022-04-17 15:11:38.600
625c2bc2f0a5bc6c426c074a,Jodaeiye Nader az Simin,2011,123 min,Drama,8.3,1.283170311160965,A married couple are faced with a difficult decision - to improve the life of their child by moving to another country or to stay in Iran and look after a deteriorating parent who has Alzheimer's disease.,95.0,Asghar Farhadi,"['Payman Maadi', 'Leila Hatami', 'Sareh Bayat', 'Shahab Hosseini']",220002,2022-04-17 15:01:22.308,2022-04-17 15:01:22.308
625c2cd8f0a5bc6c426c09c8,Au revoir les enfants,1987,104 min,"Drama, War",8.0,1.5687426903323765,"A French boarding school run by priests seems to be a haven from World War II until a new student arrives. He becomes the roommate of the top student in his class. Rivals at first, the roommates form a bond and share a secret.",88.0,Louis Malle,"['Gaspard Manesse', 'Raphael Fejtö', 'Francine Racette', 'Stanislas Carré de Malberg']",31163,2022-04-17 15:06:00.095,2022-04-17 15:06:00.095
625c2be9f0a5bc6c426c07b6,El secreto de sus ojos,2009,129 min,"Drama, Mystery, Romance",8.2,2.234094293029915,A retired legal counselor writes a novel hoping to find closure for one of his past unresolved homicide cases and for his unreciprocated love with his superior - both of which still haunt him decades later.,80.0,Juan José Campanella,"['Ricardo Darín', 'Soledad Villamil', 'Pablo Rago', 'Carla Quevedo']",193217,2022-04-17 15:02:01.547,2022-04-17 15:02:01.547
625c2cedf0a5bc6c426c0a06,Cat on a Hot Tin Roof,1958,108 min,Drama,8.0,2.822216147247852,Brick is an alcoholic ex-football player who drinks his days away and resists the affections of his wife. A reunion with his terminal father jogs a host of memories and revelations for both father and son.,84.0,Richard Brooks,"['Elizabeth Taylor', 'Paul Newman', 'Burl Ives', 'Jack Carson']",45062,2022-04-17 15:06:21.724,2022-04-17 15:06:21.724
625c2dfdf0a5bc6c426c0d4a,Belle de jour,1967,100 min,"Drama, Romance",7.7,4.22587405202126,A frigid young housewife decides to spend her midweek afternoons as a prostitute.,,Luis Buñuel,"['Catherine Deneuve', 'Jean Sorel', 'Michel Piccoli', 'Geneviève Page']",40274,2022-04-17 15:10:53.932,2022-04-17 15:10:53.932
625c2e17f0a5bc6c426c0db6,La piel que habito,2011,120 min,"Drama, Horror, Thriller",7.6,0.2795584295298059,"A brilliant plastic surgeon, haunted by past tragedies, creates a type of synthetic skin that withstands any kind of damage. His guinea pig: a mysterious and volatile woman who holds the key to his obsession.",70.0,Pedro Almodóvar,"['Antonio Banderas', 'Elena Anaya', 'Jan Cornet', 'Marisa Paredes']",138959,2022-04-17 15:11:19.543,2022-04-17 15:11:19.543
625c2cd7f0a5bc6c426c09c6,Der Himmel über Berlin,1987,128 min,"Drama, Fantasy, Romance",8.0,2.9996835652463183,An angel tires of overseeing human activity and wishes to become human when he falls in love with a mortal.,79.0,Wim Wenders,"['Bruno Ganz', 'Solveig Dommartin', 'Otto Sander', 'Curt Bois']",64722,2022-04-17 15:05:59.361,2022-04-17 15:05:59.361
625c2ddcf0a5bc6c426c0cba,The Magdalene Sisters,2002,114 min,Drama,7.7,3.4969687101300773,Three young Irish women struggle to maintain their spirits while they endure dehumanizing abuse as inmates of a Magdalene Sisters Asylum.,83.0,Peter Mullan,"['Eileen Walsh', 'Dorothy Duffy', 'Nora-Jane Noone', 'Anne-Marie Duff']",25938,2022-04-17 15:10:20.287,2022-04-17 15:10:20.287
625c2c1df0a5bc6c426c0834,Kis Uykusu,2014,196 min,Drama,8.1,3.657784455182517,A hotel owner and landlord in a remote Turkish village deals with conflicts within his family and a tenant behind on his rent.,88.0,Nuri Bilge Ceylan,"['Haluk Bilginer', 'Melisa Sözen', 'Demet Akbag', 'Ayberk Pekcan']",46547,2022-04-17 15:02:53.621,2022-04-17 15:02:53.621
625c2ceaf0a5bc6c426c09fa,Vivre sa vie: Film en douze tableaux,1962,80 min,Drama,8.0,3.2085803844982683,Twelve episodic tales in the life of a Parisian woman and her slow descent into prostitution.,,Jean-Luc Godard,"['Anna Karina', 'Sady Rebbot', 'André S. Labarthe', 'Guylaine Schlumberger']",28057,2022-04-17 15:06:18.237,2022-04-17 15:06:18.237
625c2cc6f0a5bc6c426c097e,Bom Yeoareum Gaeul Gyeoul Geurigo Bom,2003,103 min,"Drama, Romance",8.0,3.7262320306777355,A boy is raised by a Buddhist monk in an isolated floating temple where the years pass like the seasons.,85.0,Ki-duk Kim,"['Ki-duk Kim', 'Yeong-su Oh', 'Jong-ho Kim', 'Kim Young-Min']",77520,2022-04-17 15:05:42.946,2022-04-17 15:05:42.946
625c2daef0a5bc6c426c0c0e,Midnight Cowboy,1969,113 min,Drama,7.8,4.224138388021959,"A naive hustler travels from Texas to New York City to seek personal fortune, finding a new friend in the process.",79.0,John Schlesinger,"['Dustin Hoffman', 'Jon Voight', 'Sylvia Miles', 'John McGiver']",101124,2022-04-17 15:09:34.643,2022-04-17 15:09:34.643
625c2e08f0a5bc6c426c0d7a,The Florida Project,2017,111 min,Drama,7.6,4.2017898791249255,"Set over one summer, the film follows precocious six-year-old Moonee as she courts mischief and adventure with her ragtag playmates and bonds with her rebellious but caring mother, all while living in the shadows of Walt Disney World.",92.0,Sean Baker,"['Brooklynn Prince', 'Bria Vinaite', 'Willem Dafoe', 'Christopher Rivera']",95181,2022-04-17 15:11:04.601,2022-04-17 15:11:04.601
625c2d43f0a5bc6c426c0ae6,Hiroshima mon amour,1959,90 min,"Drama, Romance",7.9,4.632575580587485,A French actress filming an anti-war film in Hiroshima has an affair with a married Japanese architect as they share their differing perspectives on war.,,Alain Resnais,"['Emmanuelle Riva', 'Eiji Okada', 'Stella Dassas', 'Pierre Barbaud']",28421,2022-04-17 15:07:47.779,2022-04-17 15:07:47.779
625c2dc7f0a5bc6c426c0c56,Kai po che!,2013,130 min,"Drama, Sport",7.7,3.8790823635362437,Three friends growing up in India at the turn of the millennium set out to open a training academy to produce the country's next cricket stars.,40.0,Abhishek Kapoor,"['Amit Sadh', 'Sushant Singh Rajput', 'Rajkummar Rao', 'Amrita Puri']",32628,2022-04-17 15:09:59.570,2022-04-17 15:09:59.570
