_id,title,release,duration,gerne,IMDB_Rating,rating,overview,metaScore,director,stars,noOfVotes,createdAt,updatedAt
625c2cc6f0a5bc6c426c097a,Kill Bill: Vol. 2,2004,137 min,"Action, Crime, Thriller",8.0,4.270117286540593,"The Bride continues her quest of vengeance against her former boss and lover Bill, the reclusive bouncer Budd, and the treacherous, one-eyed Elle.",83.0,Quentin Tarantino,"['Uma Thurman', 'David Carradine', 'Michael Madsen', 'Daryl Hannah']",683900,2022-04-17 15:05:42.548,2022-04-17 15:05:42.548
625c2c7df0a5bc6c426c0924,Baby,2015,159 min,"Action, Crime, Thriller",8.0,0.176076261442617,"An elite counter-intelligence unit learns of a plot, masterminded by a maniacal madman. With the clock ticking, it's up to them to track the terrorists' international tentacles and prevent them from striking at the heart of India.",,Neeraj Pandey,"['Akshay Kumar', 'Danny Denzongpa', 'Rana Daggubati', 'Taapsee Pannu']",52848,2022-04-17 15:04:29.383,2022-04-17 15:04:29.383
625c2d62f0a5bc6c426c0b58,Chugyeokja,2008,125 min,"Action, Crime, Thriller",7.8,4.564022626044695,A disgraced ex-policeman who runs a small ring of prostitutes finds himself in a race against time when one of his women goes missing.,64.0,Hong-jin Na,"['Kim Yoon-seok', 'Jung-woo Ha', 'Yeong-hie Seo', 'Yoo-Jeong Kim']",58468,2022-04-17 15:08:18.396,2022-04-17 15:08:18.396
625c2e35f0a5bc6c426c0e3e,Lethal Weapon,1987,109 min,"Action, Crime, Thriller",7.6,4.045014003507644,Two newly paired cops who are complete opposites must put aside their differences in order to catch a gang of drug smugglers.,68.0,Richard Donner,"['Mel Gibson', 'Danny Glover', 'Gary Busey', 'Mitchell Ryan']",236894,2022-04-17 15:11:49.291,2022-04-17 15:11:49.291
625c2d93f0a5bc6c426c0bcc,Lat sau san taam,1992,128 min,"Action, Crime, Thriller",7.8,0.974785003648081,A tough-as-nails cop teams up with an undercover agent to shut down a sinister mobster and his crew.,,John Woo,"['Yun-Fat Chow', 'Tony Chiu-Wai Leung', 'Teresa Mo', 'Philip Chan']",46700,2022-04-17 15:09:07.764,2022-04-17 15:09:07.764
625c2d8af0a5bc6c426c0ba8,The Boondock Saints,1999,108 min,"Action, Crime, Thriller",7.8,0.4136619232518324,Two Irish Catholic brothers become vigilantes and wipe out Boston's criminal underworld in the name of God.,44.0,Troy Duffy,"['Willem Dafoe', 'Sean Patrick Flanery', 'Norman Reedus', 'David Della Rocco']",227143,2022-04-17 15:08:58.294,2022-04-17 15:08:58.294
625c2dfaf0a5bc6c426c0d36,The Taking of Pelham One Two Three,1974,104 min,"Action, Crime, Thriller",7.7,4.702787265796664,"In New York, armed men hijack a subway car and demand a ransom for the passengers. Even if it's paid, how could they get away?",68.0,Joseph Sargent,"['Walter Matthau', 'Robert Shaw', 'Martin Balsam', 'Hector Elizondo']",26729,2022-04-17 15:10:50.264,2022-04-17 15:10:50.264
625c2dfcf0a5bc6c426c0d42,Dirty Harry,1971,102 min,"Action, Crime, Thriller",7.7,2.891500040832317,"When a madman calling himself ""the Scorpio Killer"" menaces the city, tough-as-nails San Francisco Police Inspector ""Dirty"" Harry Callahan is assigned to track down and ferret out the crazed psychopath.",90.0,Don Siegel,"['Clint Eastwood', 'Andrew Robinson', 'Harry Guardino', 'Reni Santoni']",143292,2022-04-17 15:10:52.527,2022-04-17 15:10:52.527
625c2c42f0a5bc6c426c087a,Kill Bill: Vol. 1,2003,111 min,"Action, Crime, Drama",8.1,3.452438236538349,"After awakening from a four-year coma, a former assassin wreaks vengeance on the team of assassins who betrayed her.",69.0,Quentin Tarantino,"['Uma Thurman', 'David Carradine', 'Daryl Hannah', 'Michael Madsen']",1000639,2022-04-17 15:03:30.525,2022-04-17 15:03:30.525
625c2e36f0a5bc6c426c0e46,The Warriors,1979,92 min,"Action, Crime, Thriller",7.6,0.855571287475233,"In the near future, a charismatic leader summons the street gangs of New York City in a bid to take it over. When he is killed, The Warriors are falsely blamed and now must fight their way home while every other gang is hunting them down.",65.0,Walter Hill,"['Michael Beck', 'James Remar', 'Dorsey Wright', 'Brian Tyler']",93878,2022-04-17 15:11:50.658,2022-04-17 15:11:50.658
625c2e14f0a5bc6c426c0da0,Serbuan maut,2011,101 min,"Action, Thriller",7.6,3.727916097240711,A S.W.A.T. team becomes trapped in a tenement run by a ruthless mobster and his army of killers and thugs.,73.0,Gareth Evans,"['Iko Uwais', 'Ananda George', 'Ray Sahetapy', 'Donny Alamsyah']",190531,2022-04-17 15:11:16.467,2022-04-17 15:11:16.467
625c2e0df0a5bc6c426c0d92,Sicario,2015,121 min,"Action, Crime, Drama",7.6,1.2943894086814034,An idealistic FBI agent is enlisted by a government task force to aid in the escalating war against drugs at the border area between the U.S. and Mexico.,82.0,Denis Villeneuve,"['Emily Blunt', 'Josh Brolin', 'Benicio Del Toro', 'Jon Bernthal']",371291,2022-04-17 15:11:09.256,2022-04-17 15:11:09.256
625c2c08f0a5bc6c426c0802,Yôjinbô,1961,110 min,"Action, Drama, Thriller",8.2,4.337841290326461,A crafty ronin comes to a town divided by two criminal gangs and decides to play them against each other to free the town.,,Akira Kurosawa,"['Toshirô Mifune', 'Eijirô Tôno', 'Tatsuya Nakadai', 'Yôko Tsukasa']",111244,2022-04-17 15:02:32.715,2022-04-17 15:02:32.715
625c2d13f0a5bc6c426c0a68,District 9,2009,112 min,"Action, Sci-Fi, Thriller",7.9,1.2188541888019433,Violence ensues after an extraterrestrial race forced to live in slum-like conditions on Earth finds a kindred spirit in a government agent exposed to their biotechnology.,81.0,Neill Blomkamp,"['Sharlto Copley', 'David James', 'Jason Cope', 'Nathalie Boltt']",638202,2022-04-17 15:06:59.159,2022-04-17 15:06:59.159
625c2c6cf0a5bc6c426c08e4,Sanjuro,1962,96 min,"Action, Comedy, Crime",8.1,0.7360385032867023,"A crafty samurai helps a young man and his fellow clansmen save his uncle, who has been framed and imprisoned by a corrupt superintendent.",,Akira Kurosawa,"['Toshirô Mifune', 'Tatsuya Nakadai', 'Keiju Kobayashi', 'Yûnosuke Itô']",33044,2022-04-17 15:04:12.706,2022-04-17 15:04:12.706
625c2c33f0a5bc6c426c0858,A Wednesday,2008,104 min,"Action, Crime, Drama",8.1,2.147031931172887,A retiring police officer reminisces about the most astounding day of his career. About a case that was never filed but continues to haunt him in his memories - the case of a man and a Wednesday.,,Neeraj Pandey,"['Anupam Kher', 'Naseeruddin Shah', 'Jimmy Sheirgill', 'Aamir Bashir']",73891,2022-04-17 15:03:15.189,2022-04-17 15:03:15.189
625c2e17f0a5bc6c426c0db2,Celda 211,2009,113 min,"Action, Adventure, Crime",7.6,0.25223527590741424,"The story of two men on different sides of a prison riot -- the inmate leading the rebellion and the young guard trapped in the revolt, who poses as a prisoner in a desperate attempt to survive the ordeal.",,Daniel Monzón,"['Luis Tosar', 'Alberto Ammann', 'Antonio Resines', 'Manuel Morón']",63882,2022-04-17 15:11:19.066,2022-04-17 15:11:19.066
625c2db6f0a5bc6c426c0c34,Scarface: The Shame of the Nation,1932,93 min,"Action, Crime, Drama",7.8,1.0122598425791884,"An ambitious and nearly insane violent gangster climbs the ladder of success in the mob, but his weaknesses prove to be his downfall.",87.0,Howard Hawks,"['Richard Rosson', 'Paul Muni', 'Ann Dvorak', 'Karen Morley']",25312,2022-04-17 15:09:42.671,2022-04-17 15:09:42.671
625c2d61f0a5bc6c426c0b52,Ajeossi,2010,119 min,"Action, Crime, Drama",7.8,4.377903297457262,A quiet pawnshop keeper with a violent past takes on a drug-and-organ trafficking ring in hope of saving the child who is his only friend.,,Jeong-beom Lee,"['Won Bin', 'Sae-ron Kim', 'Tae-hoon Kim', 'Hee-won Kim']",62848,2022-04-17 15:08:17.680,2022-04-17 15:08:17.680
625c2cb7f0a5bc6c426c094a,Tropa de Elite 2: O Inimigo Agora é Outro,2010,115 min,"Action, Crime, Drama",8.0,3.0995381918906837,"After a prison riot, former-Captain Nascimento, now a high ranking security officer in Rio de Janeiro, is swept into a bloody political dispute that involves government officials and paramilitary groups.",71.0,José Padilha,"['Wagner Moura', 'Irandhir Santos', 'André Ramiro', 'Milhem Cortaz']",79200,2022-04-17 15:05:27.121,2022-04-17 15:05:27.121
