_id,title,release,duration,gerne,IMDB_Rating,rating,overview,metaScore,director,stars,noOfVotes,createdAt,updatedAt
625c2e0ef0a5bc6c426c0d9a,Philomena,2013,98 min,"Biography, Comedy, Drama",7.6,4.020541062522661,"A world-weary political journalist picks up the story of a woman's search for her son, who was taken away from her decades ago after she became pregnant and was forced to live in a convent.",77.0,Stephen Frears,"['Judi Dench', 'Steve Coogan', 'Sophie Kennedy Clark', 'Mare Winningham']",94212,2022-04-17 15:11:10.655,2022-04-17 15:11:10.655
625c2deaf0a5bc6c426c0cf6,Il postino,1994,108 min,"Biography, Comedy, Drama",7.7,4.044201471345559,"A simple Italian postman learns to love poetry while delivering mail to a famous poet, and then uses this to woo local beauty Beatrice.",81.0,Michael Radford,"['Massimo Troisi', 'Massimo Troisi', 'Philippe Noiret', 'Maria Grazia Cucinotta']",33600,2022-04-17 15:10:34.177,2022-04-17 15:10:34.177
625c2bdff0a5bc6c426c079e,Green Book,2018,130 min,"Biography, Comedy, Drama",8.2,3.3991154144454114,A working-class Italian-American bouncer becomes the driver of an African-American classical pianist on a tour of venues through the 1960s American South.,69.0,Peter Farrelly,"['Viggo Mortensen', 'Mahershala Ali', 'Linda Cardellini', 'Sebastian Maniscalco']",377884,2022-04-17 15:01:51.756,2022-04-17 15:01:51.756
625c2d8ef0a5bc6c426c0bba,Ed Wood,1994,127 min,"Biography, Comedy, Drama",7.8,3.8699283643050544,"Ambitious but troubled movie director Edward D. Wood Jr. tries his best to fulfill his dreams, despite his lack of talent.",70.0,Tim Burton,"['Johnny Depp', 'Martin Landau', 'Sarah Jessica Parker', 'Patricia Arquette']",164937,2022-04-17 15:09:02.711,2022-04-17 15:09:02.711
625c2d5ff0a5bc6c426c0b48,The Big Short,2015,130 min,"Biography, Comedy, Drama",7.8,2.5633051372083413,In 2006-2007 a group of investors bet against the US mortgage market. In their research they discover how flawed and corrupt the market is.,81.0,Adam McKay,"['Christian Bale', 'Steve Carell', 'Ryan Gosling', 'Brad Pitt']",362942,2022-04-17 15:08:15.397,2022-04-17 15:08:15.397
625c2b6bf0a5bc6c426c06de,The Intouchables,2011,112 min,"Biography, Comedy, Drama",8.5,2.3490517401214794,"After he becomes a quadriplegic from a paragliding accident, an aristocrat hires a young man from the projects to be his caregiver.",57.0,Olivier Nakache,"['Éric Toledano', 'François Cluzet', 'Omar Sy', 'Anne Le Ny']",760360,2022-04-17 14:59:55.866,2022-04-17 14:59:55.866
625c2dd7f0a5bc6c426c0c9c,Control,2007,122 min,"Biography, Drama, Music",7.7,4.19866778976083,"A profile of Ian Curtis, the enigmatic singer of Joy Division whose personal, professional, and romantic troubles led him to commit suicide at the age of 23.",78.0,Anton Corbijn,"['Sam Riley', 'Samantha Morton', 'Craig Parkinson', 'Alexandra Maria Lara']",61609,2022-04-17 15:10:15.004,2022-04-17 15:10:15.004
625c2bc6f0a5bc6c426c0764,Braveheart,1995,178 min,"Biography, Drama, History",8.3,1.3338501328663621,Scottish warrior William Wallace leads his countrymen in a rebellion to free his homeland from the tyranny of King Edward I of England.,68.0,Mel Gibson,"['Mel Gibson', 'Sophie Marceau', 'Patrick McGoohan', 'Angus Macfadyen']",959181,2022-04-17 15:01:26.677,2022-04-17 15:01:26.677
625c2dcef0a5bc6c426c0c7a,Argo,2012,120 min,"Biography, Drama, Thriller",7.7,2.7662923509444717,"Acting under the cover of a Hollywood producer scouting a location for a science fiction film, a CIA agent launches a dangerous operation to rescue six Americans in Tehran during the U.S. hostage crisis in Iran in 1979.",86.0,Ben Affleck,"['Ben Affleck', 'Bryan Cranston', 'John Goodman', 'Alan Arkin']",572581,2022-04-17 15:10:06.018,2022-04-17 15:10:06.018
625c2c2cf0a5bc6c426c084c,Spotlight,2015,129 min,"Biography, Crime, Drama",8.1,3.2704524436781335,"The true story of how the Boston Globe uncovered the massive scandal of child molestation and cover-up within the local Catholic Archdiocese, shaking the entire Catholic Church to its core.",93.0,Tom McCarthy,"['Mark Ruffalo', 'Michael Keaton', 'Rachel McAdams', 'Liev Schreiber']",420316,2022-04-17 15:03:08.199,2022-04-17 15:03:08.199
625c2be5f0a5bc6c426c07aa,Queen,2013,146 min,"Adventure, Comedy, Drama",8.2,1.739595894614402,A Delhi girl from a traditional family sets out on a solo honeymoon after her marriage gets cancelled.,,Vikas Bahl,"['Kangana Ranaut', 'Rajkummar Rao', 'Lisa Haydon', 'Jeffrey Ho']",60701,2022-04-17 15:01:57.517,2022-04-17 15:01:57.517
625c2d3af0a5bc6c426c0ad4,Patton,1970,172 min,"Biography, Drama, War",7.9,0.9093605227461832,The World War II phase of the career of controversial American general George S. Patton.,91.0,Franklin J. Schaffner,"['George C. Scott', 'Karl Malden', 'Stephen Young', 'Michael Strong']",93741,2022-04-17 15:07:38.292,2022-04-17 15:07:38.292
625c2ce2f0a5bc6c426c09dc,Papillon,1973,151 min,"Biography, Crime, Drama",8.0,4.79559527106749,"A man befriends a fellow criminal as the two of them begin serving their sentence on a dreadful prison island, which inspires the man to plot his escape.",58.0,Franklin J. Schaffner,"['Steve McQueen', 'Dustin Hoffman', 'Victor Jory', 'Don Gordon']",121627,2022-04-17 15:06:10.018,2022-04-17 15:06:10.018
625c2ddaf0a5bc6c426c0cae,Ray,2004,152 min,"Biography, Drama, Music",7.7,2.359722815799458,"The story of the life and career of the legendary rhythm and blues musician Ray Charles, from his humble beginnings in the South, where he went blind at age seven, to his meteoric rise to stardom during the 1950s and 1960s.",73.0,Taylor Hackford,"['Jamie Foxx', 'Regina King', 'Kerry Washington', 'Clifton Powell']",138356,2022-04-17 15:10:18.589,2022-04-17 15:10:18.589
625c2dfaf0a5bc6c426c0d3a,Serpico,1973,130 min,"Biography, Crime, Drama",7.7,1.064349282245547,An honest New York cop named Frank Serpico blows the whistle on rampant corruption in the force only to have his comrades turn against him.,87.0,Sidney Lumet,"['Al Pacino', 'John Randolph', 'Jack Kehoe', 'Biff McGuire']",109941,2022-04-17 15:10:50.613,2022-04-17 15:10:50.613
625c2b5af0a5bc6c426c06bc,Hamilton,2020,160 min,"Biography, Drama, History",8.6,2.2094065692805422,"The real life of one of America's foremost founding fathers and first Secretary of the Treasury, Alexander Hamilton. Captured live on Broadway from the Richard Rodgers Theater with the original Broadway cast.",90.0,Thomas Kail,"['Lin-Manuel Miranda', 'Phillipa Soo', 'Leslie Odom Jr.', 'Renée Elise Goldsberry']",55291,2022-04-17 14:59:38.228,2022-04-17 14:59:38.228
625c2c60f0a5bc6c426c08cc,Zerkalo,1975,107 min,"Biography, Drama",8.1,0.0963309044992211,"A dying man in his forties remembers his past. His childhood, his mother, the war, personal moments and things that tell of the recent history of all the Russian nation.",,Andrei Tarkovsky,"['Margarita Terekhova', 'Filipp Yankovskiy', 'Ignat Daniltsev', 'Oleg Yankovskiy']",40081,2022-04-17 15:04:00.443,2022-04-17 15:04:00.443
625c2b57f0a5bc6c426c06b6,Goodfellas,1990,146 min,"Biography, Crime, Drama",8.7,0.9320208590213308,"The story of Henry Hill and his life in the mob, covering his relationship with his wife Karen Hill and his mob partners Jimmy Conway and Tommy DeVito in the Italian-American crime syndicate.",90.0,Martin Scorsese,"['Robert De Niro', 'Ray Liotta', 'Joe Pesci', 'Lorraine Bracco']",1020727,2022-04-17 14:59:35.256,2022-04-17 14:59:35.256
625c2cd9f0a5bc6c426c09ce,Gandhi,1982,191 min,"Biography, Drama, History",8.0,2.7066713981185577,The life of the lawyer who became the famed leader of the Indian revolts against the British rule through his philosophy of nonviolent protest.,79.0,Richard Attenborough,"['Ben Kingsley', 'John Gielgud', 'Rohini Hattangadi', 'Roshan Seth']",217664,2022-04-17 15:06:01.180,2022-04-17 15:06:01.180
625c2d96f0a5bc6c426c0bda,Glory,1989,122 min,"Biography, Drama, History",7.8,1.724455022660084,"Robert Gould Shaw leads the U.S. Civil War's first all-black volunteer company, fighting prejudices from both his own Union Army, and the Confederates.",78.0,Edward Zwick,"['Matthew Broderick', 'Denzel Washington', 'Cary Elwes', 'Morgan Freeman']",122779,2022-04-17 15:09:10.830,2022-04-17 15:09:10.830
