_id,title,release,duration,gerne,IMDB_Rating,rating,overview,metaScore,director,stars,noOfVotes,createdAt,updatedAt
625c2da1f0a5bc6c426c0bf6,The King of Comedy,1982,109 min,"Comedy, Crime, Drama",7.8,3.61142330620709,"Rupert Pupkin is a passionate yet unsuccessful comic who craves nothing more than to be in the spotlight and to achieve this, he stalks and kidnaps his idol to take the spotlight for himself.",73.0,Martin Scorsese,"['Robert De Niro', 'Jerry Lewis', 'Diahnne Abbott', 'Sandra Bernhard']",88511,2022-04-17 15:09:21.120,2022-04-17 15:09:21.120
625c2bf4f0a5bc6c426c07ca,Rang De Basanti,2006,167 min,"Comedy, Crime, Drama",8.2,3.0051668426589027,"The story of six young Indians who assist an English woman to film a documentary on the freedom fighters from their past, and the events that lead them to relive the long-forgotten saga of freedom.",,Rakeysh Omprakash Mehra,"['Aamir Khan', 'Soha Ali Khan', 'Siddharth', 'Sharman Joshi']",111937,2022-04-17 15:02:12.934,2022-04-17 15:02:12.934
625c2c66f0a5bc6c426c08d0,Paper Moon,1973,102 min,"Comedy, Crime, Drama",8.1,1.82303303162495,"During the Great Depression, a con man finds himself saddled with a young girl who may or may not be his daughter, and the two forge an unlikely partnership.",77.0,Peter Bogdanovich,"[""Ryan O'Neal"", ""Tatum O'Neal"", 'Madeline Kahn', 'John Hillerman']",42285,2022-04-17 15:04:06.720,2022-04-17 15:04:06.720
625c2e2cf0a5bc6c426c0e0a,American Psycho,2000,101 min,"Comedy, Crime, Drama",7.6,1.5025679943931158,"A wealthy New York City investment banking executive, Patrick Bateman, hides his alternate psychopathic ego from his co-workers and friends as he delves deeper into his violent, hedonistic fantasies.",64.0,Mary Harron,"['Christian Bale', 'Justin Theroux', 'Josh Lucas', 'Bill Sage']",490062,2022-04-17 15:11:40.437,2022-04-17 15:11:40.437
625c2e38f0a5bc6c426c0e52,The Long Goodbye,1973,112 min,"Comedy, Crime, Drama",7.6,1.2231987057301263,"Private investigator Philip Marlowe helps a friend out of a jam, but in doing so gets implicated in his wife's murder.",87.0,Robert Altman,"['Elliott Gould', 'Nina van Pallandt', 'Sterling Hayden', 'Mark Rydell']",26337,2022-04-17 15:11:52.719,2022-04-17 15:11:52.719
625c2c52f0a5bc6c426c08a2,Chung Hing sam lam,1994,102 min,"Comedy, Crime, Drama",8.1,4.7931157129214155,"Two melancholy Hong Kong policemen fall in love: one with a mysterious female underworld figure, the other with a beautiful and ethereal server at a late-night restaurant he frequents.",77.0,Kar-Wai Wong,"['Brigitte Lin', 'Takeshi Kaneshiro', 'Tony Chiu-Wai Leung', 'Faye Wong']",63122,2022-04-17 15:03:46.968,2022-04-17 15:03:46.968
625c2df4f0a5bc6c426c0d20,After Hours,1985,97 min,"Comedy, Crime, Drama",7.7,3.6818512258075184,An ordinary word processor has the worst night of his life after he agrees to visit a girl in Soho who he met that evening at a coffee shop.,90.0,Martin Scorsese,"['Griffin Dunne', 'Rosanna Arquette', 'Verna Bloom', 'Tommy Chong']",59635,2022-04-17 15:10:44.278,2022-04-17 15:10:44.278
625c2c00f0a5bc6c426c07ea,Dom za vesanje,1988,142 min,"Comedy, Crime, Drama",8.2,1.8844619925821637,"In this luminous tale set in the area around Sarajevo and in Italy, Perhan, an engaging young Romany (gypsy) with telekinetic powers, is seduced by the quick-cash world of petty crime, which threatens to destroy him and those he loves.",,Emir Kusturica,"['Davor Dujmovic', 'Bora Todorovic', 'Ljubica Adzovic', 'Husnija Hasimovic']",26402,2022-04-17 15:02:24.901,2022-04-17 15:02:24.901
625c2d98f0a5bc6c426c0be8,Down by Law,1986,107 min,"Comedy, Crime, Drama",7.8,2.0810577232944882,"Two men are framed and sent to jail, where they meet a murderer who helps them escape and leave the state.",75.0,Jim Jarmusch,"['Tom Waits', 'John Lurie', 'Roberto Benigni', 'Nicoletta Braschi']",47834,2022-04-17 15:09:12.801,2022-04-17 15:09:12.801
625c2de6f0a5bc6c426c0cf4,Do lok tin si,1995,99 min,"Comedy, Crime, Drama",7.7,4.0601891351292805,"This Hong Kong-set crime drama follows the lives of a hitman, hoping to get out of the business, and his elusive female partner.",71.0,Kar-Wai Wong,"['Leon Lai', 'Michelle Reis', 'Takeshi Kaneshiro', 'Charlie Yeung']",26429,2022-04-17 15:10:30.809,2022-04-17 15:10:30.809
625c2cf4f0a5bc6c426c0a36,Knives Out,2019,130 min,"Comedy, Crime, Drama",7.9,3.34868093095418,"A detective investigates the death of a patriarch of an eccentric, combative family.",82.0,Rian Johnson,"['Daniel Craig', 'Chris Evans', 'Ana de Armas', 'Jamie Lee Curtis']",454203,2022-04-17 15:06:28.899,2022-04-17 15:06:28.899
625c2bcdf0a5bc6c426c0778,The Sting,1973,129 min,"Comedy, Crime, Drama",8.3,1.5816141416145746,Two grifters team up to pull off the ultimate con.,83.0,George Roy Hill,"['Paul Newman', 'Robert Redford', 'Robert Shaw', 'Charles Durning']",241513,2022-04-17 15:01:33.942,2022-04-17 15:01:33.942
625c2cfbf0a5bc6c426c0a46,Captain Fantastic,2016,118 min,"Comedy, Drama",7.9,3.5701799330001927,"In the forests of the Pacific Northwest, a father devoted to raising his six kids with a rigorous physical and intellectual education is forced to leave his paradise and enter the world, challenging his idea of what it means to be a parent.",72.0,Matt Ross,"['Viggo Mortensen', 'George MacKay', 'Samantha Isler', 'Annalise Basso']",189400,2022-04-17 15:06:35.672,2022-04-17 15:06:35.672
625c2d7ff0a5bc6c426c0b84,Adams æbler,2005,94 min,"Comedy, Crime, Drama",7.8,0.9877452106620987,A neo-nazi sentenced to community service at a church clashes with the blindly devotional priest.,51.0,Anders Thomas Jensen,"['Ulrich Thomsen', 'Mads Mikkelsen', 'Nicolas Bro', 'Paprika Steen']",45717,2022-04-17 15:08:47.570,2022-04-17 15:08:47.570
625c2d1df0a5bc6c426c0a74,In Bruges,2008,107 min,"Comedy, Crime, Drama",7.9,1.3691181686996412,"Guilt-stricken after a job gone wrong, hitman Ray and his partner await orders from their ruthless boss in Bruges, Belgium, the last place in the world Ray wants to be.",67.0,Martin McDonagh,"['Colin Farrell', 'Brendan Gleeson', 'Ciarán Hinds', 'Elizabeth Berrington']",390334,2022-04-17 15:07:09.636,2022-04-17 15:07:09.636
625c2c79f0a5bc6c426c090a,Mr. Smith Goes to Washington,1939,129 min,"Comedy, Drama",8.1,3.2016330807813667,"A naive man is appointed to fill a vacancy in the United States Senate. His plans promptly collide with political corruption, but he doesn't back down.",73.0,Frank Capra,"['James Stewart', 'Jean Arthur', 'Claude Rains', 'Edward Arnold']",107017,2022-04-17 15:04:25.537,2022-04-17 15:04:25.537
625c2e26f0a5bc6c426c0dde,Lord of War,2005,122 min,"Action, Crime, Drama",7.6,1.4554998908461159,An arms dealer confronts the morality of his work as he is being chased by an INTERPOL Agent.,62.0,Andrew Niccol,"['Nicolas Cage', 'Ethan Hawke', 'Jared Leto', 'Bridget Moynahan']",294140,2022-04-17 15:11:34.438,2022-04-17 15:11:34.438
625c2b76f0a5bc6c426c0700,City Lights,1931,87 min,"Comedy, Drama, Romance",8.5,0.4001693336818479,"With the aid of a wealthy erratic tippler, a dewy-eyed tramp who has fallen in love with a sightless flower girl accumulates money to be able to help her medically.",99.0,Charles Chaplin,"['Charles Chaplin', 'Virginia Cherrill', 'Florence Lee', 'Harry Myers']",167839,2022-04-17 15:00:06.195,2022-04-17 15:00:06.195
625c2d5ff0a5bc6c426c0b44,Moonrise Kingdom,2012,94 min,"Comedy, Drama, Romance",7.8,0.4394409345655559,"A pair of young lovers flee their New England town, which causes a local search party to fan out to find them.",84.0,Wes Anderson,"['Jared Gilman', 'Kara Hayward', 'Bruce Willis', 'Bill Murray']",318789,2022-04-17 15:08:15.015,2022-04-17 15:08:15.015
625c2e28f0a5bc6c426c0dea,The Station Agent,2003,89 min,"Comedy, Drama",7.6,1.6071186781185098,"When his only friend dies, a man born with dwarfism moves to rural New Jersey to live a life of solitude, only to meet a chatty hot dog vendor and a woman dealing with her own personal loss.",81.0,Tom McCarthy,"['Peter Dinklage', 'Patricia Clarkson', 'Bobby Cannavale', 'Paul Benjamin']",67370,2022-04-17 15:11:36.717,2022-04-17 15:11:36.717
