_id,title,release,duration,gerne,IMDB_Rating,rating,overview,metaScore,director,stars,noOfVotes,createdAt,updatedAt
625c2c08f0a5bc6c426c07fe,The Great Escape,1963,172 min,"Adventure, Drama, History",8.2,4.298792008488299,Allied prisoners of war plan for several hundred of their number to escape from a German camp during World War II.,86.0,John Sturges,"['Steve McQueen', 'James Garner', 'Richard Attenborough', 'Charles Bronson']",224730,2022-04-17 15:02:32.303,2022-04-17 15:02:32.303
625c2c71f0a5bc6c426c08f8,The Bridge on the River Kwai,1957,161 min,"Adventure, Drama, War",8.1,3.1055210732228424,"British POWs are forced to build a railway bridge across the river Kwai for their Japanese captors, not knowing that the allied forces are planning to destroy it.",87.0,David Lean,"['William Holden', 'Alec Guinness', 'Jack Hawkins', 'Sessue Hayakawa']",203463,2022-04-17 15:04:17.274,2022-04-17 15:04:17.274
625c2dddf0a5bc6c426c0cc4,Black Hawk Down,2001,144 min,"Drama, History, War",7.7,0.43834779700151816,160 elite U.S. soldiers drop into Somalia to capture two top lieutenants of a renegade warlord and find themselves in a desperate battle with a large force of heavily-armed Somalis.,74.0,Ridley Scott,"['Josh Hartnett', 'Ewan McGregor', 'Tom Sizemore', 'Eric Bana']",364254,2022-04-17 15:10:21.928,2022-04-17 15:10:21.928
625c2d67f0a5bc6c426c0b68,The Boy in the Striped Pyjamas,2008,94 min,"Drama, History, War",7.8,3.099492184772561,"Through the innocent eyes of Bruno, the eight-year-old son of the commandant at a German concentration camp, a forbidden friendship with a Jewish boy on the other side of the camp fence has startling and unexpected consequences.",55.0,Mark Herman,"['Asa Butterfield', 'David Thewlis', 'Rupert Friend', ""Zac Mattoon O'Brien""]",190748,2022-04-17 15:08:23.116,2022-04-17 15:08:23.116
625c2d55f0a5bc6c426c0b22,Under sandet,2015,100 min,"Drama, History, War",7.8,0.700044174762553,"In post-World War II Denmark, a group of young German POWs are forced to clear a beach of thousands of land mines under the watch of a Danish Sergeant who slowly learns to appreciate their plight.",75.0,Martin Zandvliet,"['Roland Møller', 'Louis Hofmann', 'Joel Basman', 'Mikkel Boe Følsgaard']",35539,2022-04-17 15:08:05.517,2022-04-17 15:08:05.517
625c2c5ef0a5bc6c426c08ca,Barry Lyndon,1975,185 min,"Adventure, Drama, History",8.1,1.811410823150179,An Irish rogue wins the heart of a rich widow and assumes her dead husband's aristocratic position in 18th-century England.,89.0,Stanley Kubrick,"[""Ryan O'Neal"", 'Marisa Berenson', 'Patrick Magee', 'Hardy Krüger']",149843,2022-04-17 15:03:58.713,2022-04-17 15:03:58.713
625c2bc3f0a5bc6c426c0752,Inglourious Basterds,2009,153 min,"Adventure, Drama, War",8.3,1.0761554042386345,"In Nazi-occupied France during World War II, a plan to assassinate Nazi leaders by a group of Jewish U.S. soldiers coincides with a theatre owner's vengeful plans for the same.",69.0,Quentin Tarantino,"['Brad Pitt', 'Diane Kruger', 'Eli Roth', 'Mélanie Laurent']",1267869,2022-04-17 15:01:23.148,2022-04-17 15:01:23.148
625c2e31f0a5bc6c426c0e24,Apollo 13,PG,140 min,"Adventure, Drama, History",7.6,3.3259619087699877,NASA must devise a strategy to return Apollo 13 to Earth safely after the spacecraft undergoes massive internal damage putting the lives of the three astronauts on board in jeopardy.,77.0,Ron Howard,"['Tom Hanks', 'Bill Paxton', 'Kevin Bacon', 'Gary Sinise']",269197,2022-04-17 15:11:45.010,2022-04-17 15:11:45.010
625c2e39f0a5bc6c426c0e56,Kelly's Heroes,1970,144 min,"Adventure, Comedy, War",7.6,2.5542835891852755,A group of U.S. soldiers sneaks across enemy lines to get their hands on a secret stash of Nazi treasure.,50.0,Brian G. Hutton,"['Clint Eastwood', 'Telly Savalas', 'Don Rickles', ""Carroll O'Connor""]",45338,2022-04-17 15:11:53.151,2022-04-17 15:11:53.151
625c2cdbf0a5bc6c426c09d0,Kagemusha,1980,180 min,"Drama, History, War",8.0,2.575765341504679,A petty thief with an utter resemblance to a samurai warlord is hired as the lord's double. When the warlord later dies the thief is forced to take up arms in his place.,84.0,Akira Kurosawa,"['Tatsuya Nakadai', 'Tsutomu Yamazaki', ""Ken'ichi Hagiwara"", 'Jinpachi Nezu']",32195,2022-04-17 15:06:03.123,2022-04-17 15:06:03.123
625c2dfff0a5bc6c426c0d50,Zulu,1964,138 min,"Drama, History, War",7.7,3.5541304311649027,Outnumbered British soldiers do battle with Zulu warriors at Rorke's Drift.,77.0,Cy Endfield,"['Stanley Baker', 'Jack Hawkins', 'Ulla Jacobsson', 'James Booth']",35999,2022-04-17 15:10:55.567,2022-04-17 15:10:55.567
625c2e2bf0a5bc6c426c0e04,Enemy at the Gates,2001,131 min,"Drama, History, War",7.6,1.3612616347626427,A Russian and a German sniper play a game of cat-and-mouse during the Battle of Stalingrad.,53.0,Jean-Jacques Annaud,"['Jude Law', 'Ed Harris', 'Joseph Fiennes', 'Rachel Weisz']",243729,2022-04-17 15:11:39.394,2022-04-17 15:11:39.394
625c2c5cf0a5bc6c426c08c4,The Deer Hunter,1978,183 min,"Drama, War",8.1,3.6124131829337225,An in-depth examination of the ways in which the U.S. Vietnam War impacts and disrupts the lives of people in a small industrial town in Pennsylvania.,86.0,Michael Cimino,"['Robert De Niro', 'Christopher Walken', 'John Cazale', 'John Savage']",311361,2022-04-17 15:03:56.431,2022-04-17 15:03:56.431
625c2d67f0a5bc6c426c0b6c,The Hobbit: An Unexpected Journey,2012,169 min,"Adventure, Fantasy",7.8,0.09753728796126016,"A reluctant Hobbit, Bilbo Baggins, sets out to the Lonely Mountain with a spirited group of dwarves to reclaim their mountain home, and the gold within it from the dragon Smaug.",58.0,Peter Jackson,"['Martin Freeman', 'Ian McKellen', 'Richard Armitage', 'Andy Serkis']",757377,2022-04-17 15:08:23.618,2022-04-17 15:08:23.618
625c2dfdf0a5bc6c426c0d48,The Dirty Dozen,1967,150 min,"Action, Adventure, War",7.7,3.629014784293446,"During World War II, a rebellious U.S. Army Major is assigned a dozen convicted murderers to train and lead them into a mass assassination mission of German officers.",73.0,Robert Aldrich,"['Lee Marvin', 'Ernest Borgnine', 'Charles Bronson', 'John Cassavetes']",67183,2022-04-17 15:10:53.733,2022-04-17 15:10:53.733
625c2c6ef0a5bc6c426c08f0,Ben-Hur,1959,212 min,"Adventure, Drama, History",8.1,0.4081309851680537,"After a Jewish prince is betrayed and sent into slavery by a Roman friend, he regains his freedom and comes back for revenge.",90.0,William Wyler,"['Charlton Heston', 'Jack Hawkins', 'Stephen Boyd', 'Haya Harareet']",219466,2022-04-17 15:04:14.961,2022-04-17 15:04:14.961
625c2d63f0a5bc6c426c0b5a,The Hobbit: The Desolation of Smaug,2013,161 min,"Adventure, Fantasy",7.8,2.3199206160037344,"The dwarves, along with Bilbo Baggins and Gandalf the Grey, continue their quest to reclaim Erebor, their homeland, from Smaug. Bilbo Baggins is in possession of a mysterious and magical ring.",66.0,Peter Jackson,"['Ian McKellen', 'Martin Freeman', 'Richard Armitage', 'Ken Stott']",601408,2022-04-17 15:08:19.168,2022-04-17 15:08:19.168
625c2bc9f0a5bc6c426c0768,Full Metal Jacket,1987,116 min,"Drama, War",8.3,3.5406088506166844,A pragmatic U.S. Marine observes the dehumanizing effects the Vietnam War has on his fellow recruits from their brutal boot camp training to the bloody street fighting in Hue.,76.0,Stanley Kubrick,"['Matthew Modine', 'R. Lee Ermey', ""Vincent D'Onofrio"", 'Adam Baldwin']",675146,2022-04-17 15:01:29.583,2022-04-17 15:01:29.583
625c2e36f0a5bc6c426c0e48,The Muppet Movie,1979,95 min,"Adventure, Comedy, Family",7.6,4.7545949059237795,"Kermit and his newfound friends trek across America to find success in Hollywood, but a frog legs merchant is after Kermit.",74.0,James Frawley,"['Jim Henson', 'Frank Oz', 'Jerry Nelson', 'Richard Hunt']",32802,2022-04-17 15:11:50.865,2022-04-17 15:11:50.865
625c2c06f0a5bc6c426c07f8,The Message,1976,177 min,"Biography, Drama, History",8.2,1.5515552131239019,This epic historical drama chronicles the life and times of Prophet Muhammad and serves as an introduction to early Islamic history.,,Moustapha Akkad,"['Anthony Quinn', 'Irene Papas', 'Michael Ansara', 'Johnny Sekka']",43885,2022-04-17 15:02:30.468,2022-04-17 15:02:30.468
