_id,title,release,duration,gerne,IMDB_Rating,rating,overview,metaScore,director,stars,noOfVotes,createdAt,updatedAt
625c2beff0a5bc6c426c07ba,Shutter Island,2010,138 min,"Mystery, Thriller",8.2,3.8719875706026787,"In 1954, a U.S. Marshal investigates the disappearance of a murderer who escaped from a hospital for the criminally insane.",63.0,Martin Scorsese,"['Leonardo DiCaprio', 'Emily Mortimer', 'Mark Ruffalo', 'Ben Kingsley']",1129894,2022-04-17 15:02:07.507,2022-04-17 15:02:07.507
625c2e14f0a5bc6c426c0d9e,El cuerpo,2012,112 min,"Mystery, Thriller",7.6,1.0798158723484574,A detective searches for the body of a femme fatale which has gone missing from a morgue.,,Oriol Paulo,"['Jose Coronado', 'Hugo Silva', 'Belén Rueda', 'Aura Garrido']",57549,2022-04-17 15:11:16.159,2022-04-17 15:11:16.159
625c2e2ff0a5bc6c426c0e16,Dark City,1998,100 min,"Mystery, Sci-Fi, Thriller",7.6,1.5999137168804722,"A man struggles with memories of his past, which include a wife he cannot remember and a nightmarish world no one else ever seems to wake up from.",66.0,Alex Proyas,"['Rufus Sewell', 'Kiefer Sutherland', 'Jennifer Connelly', 'William Hurt']",187927,2022-04-17 15:11:43.114,2022-04-17 15:11:43.114
625c2cd0f0a5bc6c426c09aa,Twelve Monkeys,1995,129 min,"Mystery, Sci-Fi, Thriller",8.0,3.4040948318837594,"In a future world devastated by disease, a convict is sent back in time to gather information about the man-made virus that wiped out most of the human population on the planet.",74.0,Terry Gilliam,"['Bruce Willis', 'Madeleine Stowe', 'Brad Pitt', 'Joseph Melito']",578443,2022-04-17 15:05:52.605,2022-04-17 15:05:52.605
625c2bbbf0a5bc6c426c073a,Rear Window,1954,112 min,"Mystery, Thriller",8.4,4.339334821863256,A wheelchair-bound photographer spies on his neighbors from his apartment window and becomes convinced one of them has committed murder.,100.0,Alfred Hitchcock,"['James Stewart', 'Grace Kelly', 'Wendell Corey', 'Thelma Ritter']",444074,2022-04-17 15:01:15.688,2022-04-17 15:01:15.688
625c2e2ff0a5bc6c426c0e1a,Lost Highway,1997,134 min,"Mystery, Thriller",7.6,4.769542722312776,"Anonymous videotapes presage a musician's murder conviction, and a gangster's girlfriend leads a mechanic astray.",52.0,David Lynch,"['Bill Pullman', 'Patricia Arquette', 'John Roselius', 'Louis Eppolito']",131101,2022-04-17 15:11:43.530,2022-04-17 15:11:43.530
625c2d3cf0a5bc6c426c0ae0,The Manchurian Candidate,1962,126 min,"Drama, Thriller",7.9,4.913912769025664,A former prisoner of war is brainwashed as an unwitting assassin for an international Communist conspiracy.,94.0,John Frankenheimer,"['Frank Sinatra', 'Laurence Harvey', 'Janet Leigh', 'Angela Lansbury']",71122,2022-04-17 15:07:40.671,2022-04-17 15:07:40.671
625c2df0f0a5bc6c426c0d12,Spoorloos,1988,107 min,"Mystery, Thriller",7.7,4.356334989812678,"Rex and Saskia, a young couple in love, are on vacation. They stop at a busy service station and Saskia is abducted. After three years and no sign of Saskia, Rex begins receiving letters from the abductor.",,George Sluizer,"['Bernard-Pierre Donnadieu', 'Gene Bervoets', 'Johanna ter Steege', 'Gwen Eckhaus']",33982,2022-04-17 15:10:40.655,2022-04-17 15:10:40.655
625c2bb1f0a5bc6c426c0722,Memento,2000,113 min,"Mystery, Thriller",8.4,0.14164255254410785,A man with short-term memory loss attempts to track down his wife's murderer.,80.0,Christopher Nolan,"['Guy Pearce', 'Carrie-Anne Moss', 'Joe Pantoliano', 'Mark Boone Junior']",1125712,2022-04-17 15:01:05.860,2022-04-17 15:01:05.860
625c2bd2f0a5bc6c426c0786,Vertigo,1958,128 min,"Mystery, Romance, Thriller",8.3,1.3052767496449813,A former police detective juggles wrestling with his personal demons and becoming obsessed with a hauntingly beautiful woman.,100.0,Alfred Hitchcock,"['James Stewart', 'Kim Novak', 'Barbara Bel Geddes', 'Tom Helmore']",364368,2022-04-17 15:01:38.464,2022-04-17 15:01:38.464
625c2cc2f0a5bc6c426c096c,The Bourne Ultimatum,2007,115 min,"Action, Mystery, Thriller",8.0,4.986239548051403,Jason Bourne dodges a ruthless C.I.A. official and his Agents from a new assassination program while searching for the origins of his life as a trained killer.,85.0,Paul Greengrass,"['Matt Damon', 'Edgar Ramírez', 'Joan Allen', 'Julia Stiles']",604694,2022-04-17 15:05:38.941,2022-04-17 15:05:38.941
625c2b6ef0a5bc6c426c06ea,The Usual Suspects,1995,106 min,"Crime, Mystery, Thriller",8.5,0.5506738739146932,"A sole survivor tells of the twisty events leading up to a horrific gun battle on a boat, which began when five criminals met at a seemingly random police lineup.",77.0,Bryan Singer,"['Kevin Spacey', 'Gabriel Byrne', 'Chazz Palminteri', 'Stephen Baldwin']",991208,2022-04-17 14:59:58.362,2022-04-17 14:59:58.362
625c2ce2f0a5bc6c426c09e0,Sleuth,1972,138 min,"Mystery, Thriller",8.0,1.398047129831388,"A man who loves games and theater invites his wife's lover to meet him, setting up a battle of wits with potentially deadly results.",,Joseph L. Mankiewicz,"['Laurence Olivier', 'Michael Caine', 'Alec Cawthorne', 'John Matthews']",44748,2022-04-17 15:06:10.438,2022-04-17 15:06:10.438
625c2c30f0a5bc6c426c0850,Kahaani,2012,122 min,"Mystery, Thriller",8.1,1.393437173359302,"A pregnant woman's search for her missing husband takes her from London to Kolkata, but everyone she questions denies having ever met him.",,Sujoy Ghosh,"['Vidya Balan', 'Parambrata Chattopadhyay', 'Indraneil Sengupta', 'Nawazuddin Siddiqui']",57806,2022-04-17 15:03:12.089,2022-04-17 15:03:12.089
625c2e29f0a5bc6c426c0df4,The Butterfly Effect,2004,113 min,"Drama, Sci-Fi, Thriller",7.6,3.6054422187657753,"Evan Treborn suffers blackouts during significant events of his life. As he grows up, he finds a way to remember these lost memories and a supernatural way to alter his life by reading his journal.",30.0,Eric Bress,"['J. Mackye Gruber', 'Ashton Kutcher', 'Amy Smart', 'Melora Walters']",451479,2022-04-17 15:11:37.772,2022-04-17 15:11:37.772
625c2c83f0a5bc6c426c093c,The Imitation Game,2014,114 min,"Biography, Drama, Thriller",8.0,0.7751004826228669,"During World War II, the English mathematical genius Alan Turing tries to crack the German Enigma code with help from fellow mathematicians.",73.0,Morten Tyldum,"['Benedict Cumberbatch', 'Keira Knightley', 'Matthew Goode', 'Allen Leech']",685201,2022-04-17 15:04:35.756,2022-04-17 15:04:35.756
625c2ddaf0a5bc6c426c0caa,The Bourne Supremacy,2004,108 min,"Action, Mystery, Thriller",7.7,0.9087410608416424,"When Jason Bourne is framed for a CIA operation gone awry, he is forced to resume his former life as a trained assassin to survive.",73.0,Paul Greengrass,"['Matt Damon', 'Franka Potente', 'Joan Allen', 'Brian Cox']",434841,2022-04-17 15:10:18.195,2022-04-17 15:10:18.195
625c2ddaf0a5bc6c426c0cac,The Machinist,2004,101 min,"Drama, Thriller",7.7,3.195913213283813,An industrial worker who hasn't slept in a year begins to doubt his own sanity.,61.0,Brad Anderson,"['Christian Bale', 'Jennifer Jason Leigh', 'Aitana Sánchez-Gijón', 'John Sharian']",358432,2022-04-17 15:10:18.395,2022-04-17 15:10:18.395
625c2c75f0a5bc6c426c0902,The Third Man,1949,104 min,"Film-Noir, Mystery, Thriller",8.1,3.517676385577837,"Pulp novelist Holly Martins travels to shadowy, postwar Vienna, only to find himself investigating the mysterious death of an old friend, Harry Lime.",97.0,Carol Reed,"['Orson Welles', 'Joseph Cotten', 'Alida Valli', 'Trevor Howard']",158731,2022-04-17 15:04:21.670,2022-04-17 15:04:21.670
625c2e36f0a5bc6c426c0e46,The Warriors,1979,92 min,"Action, Crime, Thriller",7.6,0.855571287475233,"In the near future, a charismatic leader summons the street gangs of New York City in a bid to take it over. When he is killed, The Warriors are falsely blamed and now must fight their way home while every other gang is hunting them down.",65.0,Walter Hill,"['Michael Beck', 'James Remar', 'Dorsey Wright', 'Brian Tyler']",93878,2022-04-17 15:11:50.658,2022-04-17 15:11:50.658
