_id,title,release,duration,gerne,IMDB_Rating,rating,overview,metaScore,director,stars,noOfVotes,createdAt,updatedAt
625c2e13f0a5bc6c426c0d9c,Dawn of the Planet of the Apes,2014,130 min,"Action, Adventure, Drama",7.6,3.3555286529170116,A growing nation of genetically evolved apes led by Caesar is threatened by a band of human survivors of the devastating virus unleashed a decade earlier.,79.0,Matt Reeves,"['Gary Oldman', 'Keri Russell', 'Andy Serkis', 'Kodi Smit-McPhee']",411599,2022-04-17 15:11:15.260,2022-04-17 15:11:15.260
625c2ccbf0a5bc6c426c0988,Pirates of the Caribbean: The Curse of the Black Pearl,2003,143 min,"Action, Adventure, Fantasy",8.0,3.117927893239969,"Blacksmith Will Turner teams up with eccentric pirate ""Captain"" Jack Sparrow to save his love, the governor's daughter, from Jack's former pirate allies, who are now undead.",63.0,Gore Verbinski,"['Johnny Depp', 'Geoffrey Rush', 'Orlando Bloom', 'Keira Knightley']",1015122,2022-04-17 15:05:47.068,2022-04-17 15:05:47.068
625c2dedf0a5bc6c426c0d02,The Last of the Mohicans,1992,112 min,"Action, Adventure, Drama",7.7,1.667639548980523,Three trappers protect the daughters of a British Colonel in the midst of the French and Indian War.,76.0,Michael Mann,"['Daniel Day-Lewis', 'Madeleine Stowe', 'Russell Means', 'Eric Schweig']",150409,2022-04-17 15:10:37.840,2022-04-17 15:10:37.840
625c2dcbf0a5bc6c426c0c6c,Star Trek Into Darkness,2013,132 min,"Action, Adventure, Sci-Fi",7.7,4.597755901762404,"After the crew of the Enterprise find an unstoppable force of terror from within their own organization, Captain Kirk leads a manhunt to a war-zone world to capture a one-man weapon of mass destruction.",72.0,J.J. Abrams,"['Chris Pine', 'Zachary Quinto', 'Zoe Saldana', 'Benedict Cumberbatch']",463188,2022-04-17 15:10:03.478,2022-04-17 15:10:03.478
625c2df5f0a5bc6c426c0d26,Star Trek II: The Wrath of Khan,1982,113 min,"Action, Adventure, Sci-Fi",7.7,0.5026481135816119,"With the assistance of the Enterprise crew, Admiral Kirk must stop an old nemesis, Khan Noonien Singh, from using the life-generating Genesis Device as the ultimate weapon.",67.0,Nicholas Meyer,"['William Shatner', 'Leonard Nimoy', 'DeForest Kelley', 'James Doohan']",112704,2022-04-17 15:10:45.133,2022-04-17 15:10:45.133
625c2bb3f0a5bc6c426c0728,Raiders of the Lost Ark,1981,115 min,"Action, Adventure",8.4,3.5816080796553718,"In 1936, archaeologist and adventurer Indiana Jones is hired by the U.S. government to find the Ark of the Covenant before Adolf Hitler's Nazis can obtain its awesome powers.",85.0,Steven Spielberg,"['Harrison Ford', 'Karen Allen', 'Paul Freeman', 'John Rhys-Davies']",884112,2022-04-17 15:01:07.083,2022-04-17 15:01:07.083
625c2b51f0a5bc6c426c06ac,The Lord of the Rings: The Fellowship of the Ring,2001,178 min,"Action, Adventure, Drama",8.8,2.4774114995908123,A meek Hobbit from the Shire and eight companions set out on a journey to destroy the powerful One Ring and save Middle-earth from the Dark Lord Sauron.,92.0,Peter Jackson,"['Elijah Wood', 'Ian McKellen', 'Orlando Bloom', 'Sean Bean']",1661481,2022-04-17 14:59:29.234,2022-04-17 14:59:29.234
625c2dc1f0a5bc6c426c0c4c,Kingsman: The Secret Service,2014,129 min,"Action, Adventure, Comedy",7.7,2.5981185253792383,"A spy organisation recruits a promising street kid into the agency's training program, while a global threat emerges from a twisted tech genius.",60.0,Matthew Vaughn,"['Colin Firth', 'Taron Egerton', 'Samuel L. Jackson', 'Michael Caine']",590440,2022-04-17 15:09:53.456,2022-04-17 15:09:53.456
625c2d4af0a5bc6c426c0b00,The Adventures of Robin Hood,1938,102 min,"Action, Adventure, Romance",7.9,3.9900284626982465,"When Prince John and the Norman Lords begin oppressing the Saxon masses in King Richard's absence, a Saxon lord fights back as the outlaw leader of a rebel guerrilla army.",97.0,Michael Curtiz,"['William Keighley', 'Errol Flynn', 'Olivia de Havilland', 'Basil Rathbone']",47175,2022-04-17 15:07:54.336,2022-04-17 15:07:54.336
625c2bacf0a5bc6c426c0716,The Dark Knight Rises,2012,164 min,"Action, Adventure",8.4,4.7587097916708245,"Eight years after the Joker's reign of anarchy, Batman, with the help of the enigmatic Catwoman, is forced from his exile to save Gotham City from the brutal guerrilla terrorist Bane.",78.0,Christopher Nolan,"['Christian Bale', 'Tom Hardy', 'Anne Hathaway', 'Gary Oldman']",1516346,2022-04-17 15:01:00.313,2022-04-17 15:01:00.313
625c2c84f0a5bc6c426c093e,Guardians of the Galaxy,2014,121 min,"Action, Adventure, Comedy",8.0,3.1728653236542117,A group of intergalactic criminals must pull together to stop a fanatical warrior with plans to purge the universe.,76.0,James Gunn,"['Chris Pratt', 'Vin Diesel', 'Bradley Cooper', 'Zoe Saldana']",1043455,2022-04-17 15:04:36.055,2022-04-17 15:04:36.055
625c2e0bf0a5bc6c426c0d86,Guardians of the Galaxy Vol. 2,2017,136 min,"Action, Adventure, Comedy",7.6,2.858875804528218,"The Guardians struggle to keep together as a team while dealing with their personal family issues, notably Star-Lord's encounter with his father the ambitious celestial being Ego.",67.0,James Gunn,"['Chris Pratt', 'Zoe Saldana', 'Dave Bautista', 'Vin Diesel']",569974,2022-04-17 15:11:07.575,2022-04-17 15:11:07.575
625c2b4df0a5bc6c426c06a2,The Lord of the Rings: The Return of the King,2003,201 min,"Action, Adventure, Drama",8.9,0.7605487349431206,Gandalf and Aragorn lead the World of Men against Sauron's army to draw his gaze from Frodo and Sam as they approach Mount Doom with the One Ring.,94.0,Peter Jackson,"['Elijah Wood', 'Viggo Mortensen', 'Ian McKellen', 'Orlando Bloom']",1642758,2022-04-17 14:59:25.991,2022-04-17 14:59:25.991
625c2b55f0a5bc6c426c06b2,The Lord of the Rings: The Two Towers,2002,179 min,"Action, Adventure, Drama",8.7,4.581141589278673,"While Frodo and Sam edge closer to Mordor with the help of the shifty Gollum, the divided fellowship makes a stand against Sauron's new ally, Saruman, and his hordes of Isengard.",87.0,Peter Jackson,"['Elijah Wood', 'Ian McKellen', 'Viggo Mortensen', 'Orlando Bloom']",1485555,2022-04-17 14:59:33.779,2022-04-17 14:59:33.779
625c2de4f0a5bc6c426c0ce6,The Fifth Element,1997,126 min,"Action, Adventure, Sci-Fi",7.7,2.433415548516822,"In the colorful future, a cab driver unwittingly becomes the central figure in the search for a legendary cosmic weapon to keep Evil and Mr. Zorg at bay.",52.0,Luc Besson,"['Bruce Willis', 'Milla Jovovich', 'Gary Oldman', 'Ian Holm']",434125,2022-04-17 15:10:28.716,2022-04-17 15:10:28.716
625c2e25f0a5bc6c426c0dd6,Harry Potter and the Half-Blood Prince,2009,153 min,"Action, Adventure, Family",7.6,4.468813635443772,"As Harry Potter begins his sixth year at Hogwarts, he discovers an old book marked as ""the property of the Half-Blood Prince"" and begins to learn more about Lord Voldemort's dark past.",78.0,David Yates,"['Daniel Radcliffe', 'Emma Watson', 'Rupert Grint', 'Michael Gambon']",474827,2022-04-17 15:11:33.131,2022-04-17 15:11:33.131
625c2dc8f0a5bc6c426c0c5a,Captain America: The Winter Soldier,2014,136 min,"Action, Adventure, Sci-Fi",7.7,2.0318290997880184,"As Steve Rogers struggles to embrace his role in the modern world, he teams up with a fellow Avenger and S.H.I.E.L.D agent, Black Widow, to battle a new threat from history: an assassin known as the Winter Soldier.",70.0,Anthony Russo,"['Joe Russo', 'Chris Evans', 'Samuel L. Jackson', 'Scarlett Johansson']",736182,2022-04-17 15:10:00.342,2022-04-17 15:10:00.342
625c2cc6f0a5bc6c426c0978,Casino Royale,2006,144 min,"Action, Adventure, Thriller",8.0,3.7507263564760818,"After earning 00 status and a licence to kill, Secret Agent James Bond sets out on his first mission as 007. Bond must defeat a private banker funding terrorists in a high-stakes game of poker at Casino Royale, Montenegro.",80.0,Martin Campbell,"['Daniel Craig', 'Eva Green', 'Judi Dench', 'Jeffrey Wright']",582239,2022-04-17 15:05:42.357,2022-04-17 15:05:42.357
625c2d20f0a5bc6c426c0a78,Letters from Iwo Jima,2006,141 min,"Action, Adventure, Drama",7.9,1.2592399680617916,"The story of the battle of Iwo Jima between the United States and Imperial Japan during World War II, as told from the perspective of the Japanese who fought it.",89.0,Clint Eastwood,"['Ken Watanabe', 'Kazunari Ninomiya', 'Tsuyoshi Ihara', 'Ryô Kase']",154011,2022-04-17 15:07:12.238,2022-04-17 15:07:12.238
625c2cb6f0a5bc6c426c0946,The Revenant,2015,156 min,"Action, Adventure, Drama",8.0,1.0066501383954096,A frontiersman on a fur trading expedition in the 1820s fights for survival after being mauled by a bear and left for dead by members of his own hunting team.,76.0,Alejandro G. Iñárritu,"['Leonardo DiCaprio', 'Tom Hardy', 'Will Poulter', 'Domhnall Gleeson']",705589,2022-04-17 15:05:26.747,2022-04-17 15:05:26.747
