_id,title,release,duration,gerne,IMDB_Rating,rating,overview,metaScore,director,stars,noOfVotes,createdAt,updatedAt
625c2d49f0a5bc6c426c0afa,The Lost Weekend,1945,101 min,"Drama, Film-Noir",7.9,4.3549087251654495,The desperate life of a chronic alcoholic is followed through a four-day drinking bout.,,Billy Wilder,"['Ray Milland', 'Jane Wyman', 'Phillip Terry', 'Howard Da Silva']",33549,2022-04-17 15:07:53.759,2022-04-17 15:07:53.759
625c2ceef0a5bc6c426c0a08,Sweet Smell of Success,1957,96 min,"Drama, Film-Noir",8.0,3.4429306438556893,Powerful but unethical Broadway columnist J.J. Hunsecker coerces unscrupulous press agent Sidney Falco into breaking up his sister's romance with a jazz musician.,100.0,Alexander Mackendrick,"['Burt Lancaster', 'Tony Curtis', 'Susan Harrison', 'Martin Milner']",28137,2022-04-17 15:06:22.424,2022-04-17 15:06:22.424
625c2cf0f0a5bc6c426c0a18,In a Lonely Place,1950,94 min,"Drama, Film-Noir, Mystery",8.0,3.254007532307134,"A potentially violent screenwriter is a murder suspect until his lovely neighbor clears him. However, she soon starts to have her doubts.",,Nicholas Ray,"['Humphrey Bogart', 'Gloria Grahame', 'Frank Lovejoy', 'Carl Benton Reid']",26784,2022-04-17 15:06:24.431,2022-04-17 15:06:24.431
625c2bbdf0a5bc6c426c073c,Sunset Blvd.,1950,110 min,"Drama, Film-Noir",8.4,2.4851408637275707,A screenwriter develops a dangerous relationship with a faded film star determined to make a triumphant return.,,Billy Wilder,"['William Holden', 'Gloria Swanson', 'Erich von Stroheim', 'Nancy Olson']",201632,2022-04-17 15:01:17.844,2022-04-17 15:01:17.844
625c2e03f0a5bc6c426c0d6c,Gilda,1946,110 min,"Drama, Film-Noir, Romance",7.7,1.6665187617327104,A small-time gambler hired to work in a Buenos Aires casino discovers his employer's new wife is his former lover.,,Charles Vidor,"['Rita Hayworth', 'Glenn Ford', 'George Macready', 'Joseph Calleia']",27991,2022-04-17 15:10:59.995,2022-04-17 15:10:59.995
625c2d54f0a5bc6c426c0b20,Manchester by the Sea,2016,137 min,Drama,7.8,3.4604231350642323,A depressed uncle is asked to take care of his teenage nephew after the boy's father dies.,96.0,Kenneth Lonergan,"['Casey Affleck', 'Michelle Williams', 'Kyle Chandler', 'Lucas Hedges']",246963,2022-04-17 15:08:04.754,2022-04-17 15:08:04.754
625c2d67f0a5bc6c426c0b68,The Boy in the Striped Pyjamas,2008,94 min,"Drama, History, War",7.8,3.099492184772561,"Through the innocent eyes of Bruno, the eight-year-old son of the commandant at a German concentration camp, a forbidden friendship with a Jewish boy on the other side of the camp fence has startling and unexpected consequences.",55.0,Mark Herman,"['Asa Butterfield', 'David Thewlis', 'Rupert Friend', ""Zac Mattoon O'Brien""]",190748,2022-04-17 15:08:23.116,2022-04-17 15:08:23.116
625c2cd2f0a5bc6c426c09b4,Scent of a Woman,1992,156 min,Drama,8.0,2.0804653603725978,"A prep school student needing money agrees to ""babysit"" a blind man, but the job is not at all what he anticipated.",59.0,Martin Brest,"['Al Pacino', ""Chris O'Donnell"", 'James Rebhorn', 'Gabrielle Anwar']",263918,2022-04-17 15:05:54.148,2022-04-17 15:05:54.148
625c2e01f0a5bc6c426c0d60,Rebel Without a Cause,1955,111 min,Drama,7.7,2.975204927412171,"A rebellious young man with a troubled past comes to a new town, finding friends and enemies.",89.0,Nicholas Ray,"['James Dean', 'Natalie Wood', 'Sal Mineo', 'Jim Backus']",83363,2022-04-17 15:10:57.334,2022-04-17 15:10:57.334
625c2e36f0a5bc6c426c0e42,On Golden Pond,1981,109 min,Drama,7.6,0.766619410123125,"Norman is a curmudgeon with an estranged relationship with his daughter Chelsea. At Golden Pond, he and his wife nevertheless agree to care for Billy, the son of Chelsea's new boyfriend, and a most unexpected relationship blooms.",68.0,Mark Rydell,"['Katharine Hepburn', 'Henry Fonda', 'Jane Fonda', 'Doug McKeon']",27650,2022-04-17 15:11:50.237,2022-04-17 15:11:50.237
625c2cf1f0a5bc6c426c0a22,Laura,1944,88 min,"Drama, Film-Noir, Mystery",8.0,1.8554926281634043,A police detective falls in love with the woman whose murder he is investigating.,,Otto Preminger,"['Gene Tierney', 'Dana Andrews', 'Clifton Webb', 'Vincent Price']",42725,2022-04-17 15:06:25.405,2022-04-17 15:06:25.405
625c2dcbf0a5bc6c426c0c6e,Beasts of No Nation,2015,137 min,"Drama, War",7.7,0.9984286312933366,"A drama based on the experiences of Agu, a child soldier fighting in the civil war of an unnamed African country.",79.0,Cary Joji Fukunaga,"['Abraham Attah', 'Emmanuel Affadzi', 'Ricky Adelayitor', 'Andrew Adote']",73964,2022-04-17 15:10:03.684,2022-04-17 15:10:03.684
625c2dc1f0a5bc6c426c0c4e,The Fault in Our Stars,2014,126 min,"Drama, Romance",7.7,1.8846504309046053,Two teenage cancer patients begin a life-affirming journey to visit a reclusive author in Amsterdam.,69.0,Josh Boone,"['Shailene Woodley', 'Ansel Elgort', 'Nat Wolff', 'Laura Dern']",344312,2022-04-17 15:09:53.667,2022-04-17 15:09:53.667
625c2e2bf0a5bc6c426c0e04,Enemy at the Gates,2001,131 min,"Drama, History, War",7.6,1.3612616347626427,A Russian and a German sniper play a game of cat-and-mouse during the Battle of Stalingrad.,53.0,Jean-Jacques Annaud,"['Jude Law', 'Ed Harris', 'Joseph Fiennes', 'Rachel Weisz']",243729,2022-04-17 15:11:39.394,2022-04-17 15:11:39.394
625c2e08f0a5bc6c426c0d7a,The Florida Project,2017,111 min,Drama,7.6,4.2017898791249255,"Set over one summer, the film follows precocious six-year-old Moonee as she courts mischief and adventure with her ragtag playmates and bonds with her rebellious but caring mother, all while living in the shadows of Walt Disney World.",92.0,Sean Baker,"['Brooklynn Prince', 'Bria Vinaite', 'Willem Dafoe', 'Christopher Rivera']",95181,2022-04-17 15:11:04.601,2022-04-17 15:11:04.601
625c2ddcf0a5bc6c426c0cbe,In America,2002,105 min,Drama,7.7,3.8852672599202243,A family of Irish immigrants adjust to life on the mean streets of Hell's Kitchen while also grieving the death of a child.,76.0,Jim Sheridan,"['Paddy Considine', 'Samantha Morton', 'Djimon Hounsou', 'Sarah Bolger']",40403,2022-04-17 15:10:20.812,2022-04-17 15:10:20.812
625c2bc5f0a5bc6c426c075c,American Beauty,1999,122 min,Drama,8.3,3.079981612315301,A sexually frustrated suburban father has a mid-life crisis after becoming infatuated with his daughter's best friend.,84.0,Sam Mendes,"['Kevin Spacey', 'Annette Bening', 'Thora Birch', 'Wes Bentley']",1069738,2022-04-17 15:01:25.820,2022-04-17 15:01:25.820
625c2e19f0a5bc6c426c0dc0,The Visitor,2007,104 min,Drama,7.6,4.329784793972047,A college professor travels to New York City to attend a conference and finds a young couple living in his apartment.,79.0,Tom McCarthy,"['Richard Jenkins', 'Haaz Sleiman', 'Danai Gurira', 'Hiam Abbass']",41544,2022-04-17 15:11:21.308,2022-04-17 15:11:21.308
625c2df4f0a5bc6c426c0d24,The Verdict,1982,129 min,Drama,7.7,0.4791998803837616,A lawyer sees the chance to salvage his career and self-respect by taking a medical malpractice case to trial rather than settling.,77.0,Sidney Lumet,"['Paul Newman', 'Charlotte Rampling', 'Jack Warden', 'James Mason']",36096,2022-04-17 15:10:44.688,2022-04-17 15:10:44.688
625c2ce2f0a5bc6c426c09e4,Fiddler on the Roof,1971,181 min,"Drama, Family, Musical",8.0,4.54970495417777,"In prerevolutionary Russia, a Jewish peasant contends with marrying off three of his daughters while growing anti-Semitic sentiment threatens his village.",67.0,Norman Jewison,"['Topol', 'Norma Crane', 'Leonard Frey', 'Molly Picon']",39491,2022-04-17 15:06:10.911,2022-04-17 15:06:10.911
