_id,title,release,duration,gerne,IMDB_Rating,rating,overview,metaScore,director,stars,noOfVotes,createdAt,updatedAt
625c2c7cf0a5bc6c426c091e,Togo,2019,113 min,"Adventure, Biography, Drama",8.0,3.8819420842253405,"The story of Togo, the sled dog who led the 1925 serum run yet was considered by most to be too small and weak to lead such an intense race.",69.0,Ericson Core,"['Willem Dafoe', 'Julianne Nicholson', 'Christopher Heyerdahl', 'Richard Dormer']",37556,2022-04-17 15:04:28.769,2022-04-17 15:04:28.769
625c2d3cf0a5bc6c426c0ae2,Spartacus,1960,197 min,"Adventure, Biography, Drama",7.9,4.6226128435299305,The slave Spartacus leads a violent revolt against the decadent Roman Republic.,87.0,Stanley Kubrick,"['Kirk Douglas', 'Laurence Olivier', 'Jean Simmons', 'Charles Laughton']",124339,2022-04-17 15:07:40.889,2022-04-17 15:07:40.889
625c2b5df0a5bc6c426c06c2,Interstellar,2014,169 min,"Adventure, Drama, Sci-Fi",8.6,3.318975522120321,A team of explorers travel through a wormhole in space in an attempt to ensure humanity's survival.,74.0,Christopher Nolan,"['Matthew McConaughey', 'Anne Hathaway', 'Jessica Chastain', 'Mackenzie Foy']",1512360,2022-04-17 14:59:41.354,2022-04-17 14:59:41.354
625c2dc9f0a5bc6c426c0c5e,Nebraska,2013,115 min,"Adventure, Comedy, Drama",7.7,4.255920613717246,"An aging, booze-addled father makes the trip from Montana to Nebraska with his estranged son in order to claim a million-dollar Mega Sweepstakes Marketing prize.",87.0,Alexander Payne,"['Bruce Dern', 'Will Forte', 'June Squibb', 'Bob Odenkirk']",112298,2022-04-17 15:10:01.379,2022-04-17 15:10:01.379
625c2bc3f0a5bc6c426c0752,Inglourious Basterds,2009,153 min,"Adventure, Drama, War",8.3,1.0761554042386345,"In Nazi-occupied France during World War II, a plan to assassinate Nazi leaders by a group of Jewish U.S. soldiers coincides with a theatre owner's vengeful plans for the same.",69.0,Quentin Tarantino,"['Brad Pitt', 'Diane Kruger', 'Eli Roth', 'Mélanie Laurent']",1267869,2022-04-17 15:01:23.148,2022-04-17 15:01:23.148
625c2be5f0a5bc6c426c07aa,Queen,2013,146 min,"Adventure, Comedy, Drama",8.2,1.739595894614402,A Delhi girl from a traditional family sets out on a solo honeymoon after her marriage gets cancelled.,,Vikas Bahl,"['Kangana Ranaut', 'Rajkummar Rao', 'Lisa Haydon', 'Jeffrey Ho']",60701,2022-04-17 15:01:57.517,2022-04-17 15:01:57.517
625c2db3f0a5bc6c426c0c2a,Stagecoach,1939,96 min,"Adventure, Drama, Western",7.8,1.5247080383662404,A group of people traveling on a stagecoach find their journey complicated by the threat of Geronimo and learn something about each other in the process.,93.0,John Ford,"['John Wayne', 'Claire Trevor', 'Andy Devine', 'John Carradine']",43621,2022-04-17 15:09:39.574,2022-04-17 15:09:39.574
625c2e30f0a5bc6c426c0e20,Dead Man,1995,121 min,"Adventure, Drama, Fantasy",7.6,2.8623587792487095,"On the run after murdering a man, accountant William Blake encounters a strange aboriginal American man named Nobody who prepares him for his journey into the spiritual world.",62.0,Jim Jarmusch,"['Johnny Depp', 'Gary Farmer', 'Crispin Glover', 'Lance Henriksen']",90442,2022-04-17 15:11:44.114,2022-04-17 15:11:44.114
625c2ccbf0a5bc6c426c098a,Big Fish,2003,125 min,"Adventure, Drama, Fantasy",8.0,3.6834999545863223,A frustrated son tries to determine the fact from fiction in his dying father's life.,58.0,Tim Burton,"['Ewan McGregor', 'Albert Finney', 'Billy Crudup', 'Jessica Lange']",415218,2022-04-17 15:05:47.714,2022-04-17 15:05:47.714
625c2dfbf0a5bc6c426c0d3e,Deliverance,1972,109 min,"Adventure, Drama, Thriller",7.7,4.638408248721717,"Intent on seeing the Cahulawassee River before it's dammed and turned into a lake, outdoor fanatic Lewis Medlock takes his friends on a canoeing trip they'll never forget into the dangerous American back-country.",80.0,John Boorman,"['Jon Voight', 'Burt Reynolds', 'Ned Beatty', 'Ronny Cox']",98740,2022-04-17 15:10:51.590,2022-04-17 15:10:51.590
625c2c5ef0a5bc6c426c08ca,Barry Lyndon,1975,185 min,"Adventure, Drama, History",8.1,1.811410823150179,An Irish rogue wins the heart of a rich widow and assumes her dead husband's aristocratic position in 18th-century England.,89.0,Stanley Kubrick,"[""Ryan O'Neal"", 'Marisa Berenson', 'Patrick Magee', 'Hardy Krüger']",149843,2022-04-17 15:03:58.713,2022-04-17 15:03:58.713
625c2cc2f0a5bc6c426c096a,Blood Diamond,2006,143 min,"Adventure, Drama, Thriller",8.0,4.614017206212029,"A fisherman, a smuggler, and a syndicate of businessmen match wits over the possession of a priceless diamond.",64.0,Edward Zwick,"['Leonardo DiCaprio', 'Djimon Hounsou', 'Jennifer Connelly', 'Kagiso Kuypers']",499439,2022-04-17 15:05:38.749,2022-04-17 15:05:38.749
625c2c35f0a5bc6c426c085c,Harry Potter and the Deathly Hallows: Part 2,2011,130 min,"Adventure, Drama, Fantasy",8.1,3.5987871565392346,"Harry, Ron, and Hermione search for Voldemort's remaining Horcruxes in their effort to destroy the Dark Lord as the final battle rages on at Hogwarts.",85.0,David Yates,"['Daniel Radcliffe', 'Emma Watson', 'Rupert Grint', 'Michael Gambon']",764493,2022-04-17 15:03:17.139,2022-04-17 15:03:17.139
625c2e2ef0a5bc6c426c0e12,Fear and Loathing in Las Vegas,1998,118 min,"Adventure, Comedy, Drama",7.6,1.8306311624978389,An oddball journalist and his psychopathic lawyer travel to Las Vegas for a series of psychedelic escapades.,41.0,Terry Gilliam,"['Johnny Depp', 'Benicio Del Toro', 'Tobey Maguire', 'Michael Lee Gogin']",259753,2022-04-17 15:11:42.689,2022-04-17 15:11:42.689
625c2e31f0a5bc6c426c0e24,Apollo 13,PG,140 min,"Adventure, Drama, History",7.6,3.3259619087699877,NASA must devise a strategy to return Apollo 13 to Earth safely after the spacecraft undergoes massive internal damage putting the lives of the three astronauts on board in jeopardy.,77.0,Ron Howard,"['Tom Hanks', 'Bill Paxton', 'Kevin Bacon', 'Gary Sinise']",269197,2022-04-17 15:11:45.010,2022-04-17 15:11:45.010
625c2c48f0a5bc6c426c0886,Lagaan: Once Upon a Time in India,2001,224 min,"Adventure, Drama, Musical",8.1,1.5804432764643428,The people of a small village in Victorian India stake their future on a game of cricket against their ruthless British rulers.,84.0,Ashutosh Gowariker,"['Aamir Khan', 'Raghuvir Yadav', 'Gracy Singh', 'Rachel Shelley']",105036,2022-04-17 15:03:36.869,2022-04-17 15:03:36.869
625c2d44f0a5bc6c426c0ae8,The Ten Commandments,1956,220 min,"Adventure, Drama",7.9,4.876003666433251,"Moses, an Egyptian Prince, learns of his true heritage as a Hebrew and his divine mission as the deliverer of his people.",,Cecil B. DeMille,"['Charlton Heston', 'Yul Brynner', 'Anne Baxter', 'Edward G. Robinson']",63560,2022-04-17 15:07:48.544,2022-04-17 15:07:48.544
625c2d20f0a5bc6c426c0a7c,Life of Pi,2012,127 min,"Adventure, Drama, Fantasy",7.9,1.6113241614736495,"A young man who survives a disaster at sea is hurtled into an epic journey of adventure and discovery. While cast away, he forms an unexpected connection with another survivor: a fearsome Bengal tiger.",79.0,Ang Lee,"['Suraj Sharma', 'Irrfan Khan', 'Adil Hussain', 'Tabu']",580708,2022-04-17 15:07:12.758,2022-04-17 15:07:12.758
625c2d39f0a5bc6c426c0aca,La montaña sagrada,1973,114 min,"Adventure, Drama, Fantasy",7.9,3.7951437233856167,"In a corrupt, greed-fueled world, a powerful alchemist leads a messianic character and seven materialistic figures to the Holy Mountain, where they hope to achieve enlightenment.",76.0,Alejandro Jodorowsky,"['Alejandro Jodorowsky', 'Horacio Salinas', 'Zamira Saunders', 'Juan Ferrara']",37183,2022-04-17 15:07:37.256,2022-04-17 15:07:37.256
625c2bcdf0a5bc6c426c0774,Das Boot,1981,149 min,"Adventure, Drama, Thriller",8.3,3.467463510445814,"The claustrophobic world of a WWII German U-boat; boredom, filth and sheer terror.",86.0,Wolfgang Petersen,"['Jürgen Prochnow', 'Herbert Grönemeyer', 'Klaus Wennemann', 'Hubertus Bengsch']",231855,2022-04-17 15:01:33.017,2022-04-17 15:01:33.017
