_id,title,release,duration,gerne,IMDB_Rating,rating,overview,metaScore,director,stars,noOfVotes,createdAt,updatedAt
625c2c1ef0a5bc6c426c0838,OMG: Oh My God!,2012,125 min,"Comedy, Drama, Fantasy",8.1,4.746396469217041,A shopkeeper takes God to court when his shop is destroyed by an earthquake.,,Umesh Shukla,"['Paresh Rawal', 'Akshay Kumar', 'Mithun Chakraborty', 'Mahesh Manjrekar']",51739,2022-04-17 15:02:54.034,2022-04-17 15:02:54.034
625c2d5df0a5bc6c426c0b3a,About Time,2013,123 min,"Comedy, Drama, Fantasy",7.8,1.0398391396640638,"At the age of 21, Tim discovers he can travel in time and change what happens and has happened in his own life. His decision to make his world a better place by getting a girlfriend turns out not to be as easy as you might think.",55.0,Richard Curtis,"['Domhnall Gleeson', 'Rachel McAdams', 'Bill Nighy', 'Lydia Wilson']",303032,2022-04-17 15:08:13.182,2022-04-17 15:08:13.182
625c2de4f0a5bc6c426c0ce2,Being John Malkovich,1999,113 min,"Comedy, Drama, Fantasy",7.7,3.614905349001077,A puppeteer discovers a portal that leads literally into the head of movie star John Malkovich.,90.0,Spike Jonze,"['John Cusack', 'Cameron Diaz', 'Catherine Keener', 'John Malkovich']",312542,2022-04-17 15:10:28.330,2022-04-17 15:10:28.330
625c2bdbf0a5bc6c426c0798,Chhichhore,2019,143 min,"Comedy, Drama",8.2,4.55227716993183,"A tragic incident forces Anirudh, a middle-aged man, to take a trip down memory lane and reminisce his college days along with his friends, who were labelled as losers.",,Nitesh Tiwari,"['Sushant Singh Rajput', 'Shraddha Kapoor', 'Varun Sharma', 'Prateik']",33893,2022-04-17 15:01:47.492,2022-04-17 15:01:47.492
625c2de1f0a5bc6c426c0cda,Happiness,1998,134 min,"Comedy, Drama",7.7,2.1681064599251734,"The lives of several individuals intertwine as they go about their lives in their own unique ways, engaging in acts society as a whole might find disturbing in a desperate search for human connection.",81.0,Todd Solondz,"['Jane Adams', 'Jon Lovitz', 'Philip Seymour Hoffman', 'Dylan Baker']",66408,2022-04-17 15:10:25.629,2022-04-17 15:10:25.629
625c2e03f0a5bc6c426c0d64,Sabrina,1954,113 min,"Comedy, Drama, Romance",7.7,3.493505109688775,"A playboy becomes interested in the daughter of his family's chauffeur, but it's his more serious brother who would be the better man for her.",72.0,Billy Wilder,"['Humphrey Bogart', 'Audrey Hepburn', 'William Holden', 'Walter Hampden']",59415,2022-04-17 15:10:59.169,2022-04-17 15:10:59.169
625c2d38f0a5bc6c426c0ac2,Manhattan,1979,96 min,"Comedy, Drama, Romance",7.9,1.2750438494021743,The life of a divorced television writer dating a teenage girl is further complicated when he falls in love with his best friend's mistress.,83.0,Woody Allen,"['Woody Allen', 'Diane Keaton', 'Mariel Hemingway', 'Michael Murphy']",131436,2022-04-17 15:07:36.029,2022-04-17 15:07:36.029
625c2de2f0a5bc6c426c0cde,Rushmore,1998,93 min,"Comedy, Drama, Romance",7.7,2.853612588618496,The extracurricular king of Rushmore Preparatory School is put on academic probation.,86.0,Wes Anderson,"['Jason Schwartzman', 'Bill Murray', 'Olivia Williams', 'Seymour Cassel']",169229,2022-04-17 15:10:26.671,2022-04-17 15:10:26.671
625c2cfbf0a5bc6c426c0a46,Captain Fantastic,2016,118 min,"Comedy, Drama",7.9,3.5701799330001927,"In the forests of the Pacific Northwest, a father devoted to raising his six kids with a rigorous physical and intellectual education is forced to leave his paradise and enter the world, challenging his idea of what it means to be a parent.",72.0,Matt Ross,"['Viggo Mortensen', 'George MacKay', 'Samantha Isler', 'Annalise Basso']",189400,2022-04-17 15:06:35.672,2022-04-17 15:06:35.672
625c2ccdf0a5bc6c426c0992,Vizontele,2001,110 min,"Comedy, Drama",8.0,1.4120134484560687,Lives of residents in a small Anatolian village change when television is introduced to them,,Yilmaz Erdogan,"['Ömer Faruk Sorak', 'Yilmaz Erdogan', 'Demet Akbag', 'Altan Erkekli']",33592,2022-04-17 15:05:49.380,2022-04-17 15:05:49.380
625c2e28f0a5bc6c426c0dea,The Station Agent,2003,89 min,"Comedy, Drama",7.6,1.6071186781185098,"When his only friend dies, a man born with dwarfism moves to rural New Jersey to live a life of solitude, only to meet a chatty hot dog vendor and a woman dealing with her own personal loss.",81.0,Tom McCarthy,"['Peter Dinklage', 'Patricia Clarkson', 'Bobby Cannavale', 'Paul Benjamin']",67370,2022-04-17 15:11:36.717,2022-04-17 15:11:36.717
625c2d20f0a5bc6c426c0a7a,The Fall,2006,117 min,"Adventure, Drama, Fantasy",7.9,1.4508468121286944,"In a hospital on the outskirts of 1920s Los Angeles, an injured stuntman begins to tell a fellow patient, a little girl with a broken arm, a fantastic story of five mythical heroes. Thanks to his fractured state of mind and her vivid imagination, the line between fiction and reality blurs as the tale advances.",64.0,Tarsem Singh,"['Lee Pace', 'Catinca Untaru', 'Justine Waddell', 'Kim Uylenbroek']",107290,2022-04-17 15:07:12.454,2022-04-17 15:07:12.454
625c2d18f0a5bc6c426c0a6c,Jab We Met,2007,138 min,"Comedy, Drama, Romance",7.9,2.9322087409630204,A depressed wealthy businessman finds his life changing after he meets a spunky and care-free young woman.,,Imtiaz Ali,"['Shahid Kapoor', 'Kareena Kapoor', 'Tarun Arora', 'Dara Singh']",47720,2022-04-17 15:07:04.859,2022-04-17 15:07:04.859
625c2d22f0a5bc6c426c0a80,C.R.A.Z.Y.,2005,129 min,"Comedy, Drama",7.9,4.813812645866239,"A young French-Canadian, growing up in the 1960s and 1970s, struggles to reconcile his emerging homosexuality with his father's conservative values and his own Catholic beliefs.",81.0,Jean-Marc Vallée,"['Michel Côté', 'Marc-André Grondin', 'Danielle Proulx', 'Émile Vallée']",31476,2022-04-17 15:07:14.361,2022-04-17 15:07:14.361
625c2d39f0a5bc6c426c0acc,Amarcord,1973,123 min,"Comedy, Drama, Family",7.9,4.943002010792977,A series of comedic and nostalgic vignettes set in a 1930s Italian coastal town.,,Federico Fellini,"['Magali Noël', 'Bruno Zanin', 'Pupella Maggio', 'Armando Brancia']",39897,2022-04-17 15:07:37.467,2022-04-17 15:07:37.467
625c2c4af0a5bc6c426c088c,The Truman Show,1998,103 min,"Comedy, Drama",8.1,4.568644947204023,An insurance salesman discovers his whole life is actually a reality TV show.,90.0,Peter Weir,"['Jim Carrey', 'Ed Harris', 'Laura Linney', 'Noah Emmerich']",939631,2022-04-17 15:03:38.781,2022-04-17 15:03:38.781
625c2c1df0a5bc6c426c0836,PK,2014,153 min,"Comedy, Drama, Musical",8.1,4.847240080608138,An alien on Earth loses the only device he can use to communicate with his spaceship. His innocent nature and child-like questions force the country to evaluate the impact of religion on its people.,,Rajkumar Hirani,"['Aamir Khan', 'Anushka Sharma', 'Sanjay Dutt', 'Boman Irani']",163061,2022-04-17 15:02:53.827,2022-04-17 15:02:53.827
625c2c66f0a5bc6c426c08d0,Paper Moon,1973,102 min,"Comedy, Crime, Drama",8.1,1.82303303162495,"During the Great Depression, a con man finds himself saddled with a young girl who may or may not be his daughter, and the two forge an unlikely partnership.",77.0,Peter Bogdanovich,"[""Ryan O'Neal"", ""Tatum O'Neal"", 'Madeline Kahn', 'John Hillerman']",42285,2022-04-17 15:04:06.720,2022-04-17 15:04:06.720
625c2d06f0a5bc6c426c0a4e,Jojo Rabbit,2019,108 min,"Comedy, Drama, War",7.9,3.136792486596881,A young boy in Hitler's army finds out his mother is hiding a Jewish girl in their home.,58.0,Taika Waititi,"['Roman Griffin Davis', 'Thomasin McKenzie', 'Scarlett Johansson', 'Taika Waititi']",297918,2022-04-17 15:06:46.367,2022-04-17 15:06:46.367
625c2d0cf0a5bc6c426c0a5a,The Artist,2011,100 min,"Comedy, Drama, Romance",7.9,2.8538249510576232,An egomaniacal film star develops a relationship with a young dancer against the backdrop of Hollywood's silent era.,89.0,Michel Hazanavicius,"['Jean Dujardin', 'Bérénice Bejo', 'John Goodman', 'James Cromwell']",230624,2022-04-17 15:06:52.073,2022-04-17 15:06:52.073
