_id,title,release,duration,gerne,IMDB_Rating,rating,overview,metaScore,director,stars,noOfVotes,createdAt,updatedAt
625c2b62f0a5bc6c426c06d0,The Silence of the Lambs,1991,118 min,"Crime, Drama, Thriller",8.6,0.6873090839614726,"A young F.B.I. cadet must receive the help of an incarcerated and manipulative cannibal killer to help catch another serial killer, a madman who skins his victims.",85.0,Jonathan Demme,"['Jodie Foster', 'Anthony Hopkins', 'Lawrence A. Bonney', 'Kasi Lemmons']",1270197,2022-04-17 14:59:46.727,2022-04-17 14:59:46.727
625c2d36f0a5bc6c426c0ab6,The Untouchables,1987,119 min,"Crime, Drama, Thriller",7.9,3.6233287456192875,"During the era of Prohibition in the United States, Federal Agent Eliot Ness sets out to stop ruthless Chicago gangster Al Capone and, because of rampant corruption, assembles a small, hand-picked team to help him.",79.0,Brian De Palma,"['Kevin Costner', 'Sean Connery', 'Robert De Niro', 'Charles Martin Smith']",281842,2022-04-17 15:07:34.378,2022-04-17 15:07:34.378
625c2b6cf0a5bc6c426c06e2,The Departed,2006,151 min,"Crime, Drama, Thriller",8.5,4.516432964673011,An undercover cop and a mole in the police attempt to identify each other while infiltrating an Irish gang in South Boston.,85.0,Martin Scorsese,"['Leonardo DiCaprio', 'Matt Damon', 'Jack Nicholson', 'Mark Wahlberg']",1189773,2022-04-17 14:59:56.308,2022-04-17 14:59:56.308
625c2c72f0a5bc6c426c08fa,On the Waterfront,1954,108 min,"Crime, Drama, Thriller",8.1,1.8318265745719575,An ex-prize fighter turned longshoreman struggles to stand up to his corrupt union bosses.,91.0,Elia Kazan,"['Marlon Brando', 'Karl Malden', 'Lee J. Cobb', 'Rod Steiger']",142107,2022-04-17 15:04:18.681,2022-04-17 15:04:18.681
625c2d04f0a5bc6c426c0a4c,Nightcrawler,2014,117 min,"Crime, Drama, Thriller",7.9,3.6778174734497315,"When Louis Bloom, a con man desperate for work, muscles into the world of L.A. crime journalism, he blurs the line between observer and participant to become the star of his own story.",76.0,Dan Gilroy,"['Jake Gyllenhaal', 'Rene Russo', 'Bill Paxton', 'Riz Ahmed']",466134,2022-04-17 15:06:44.267,2022-04-17 15:06:44.267
625c2c3ff0a5bc6c426c0868,No Country for Old Men,2007,122 min,"Crime, Drama, Thriller",8.1,0.47881730820227175,Violence and mayhem ensue after a hunter stumbles upon a drug deal gone wrong and more than two million dollars in cash near the Rio Grande.,91.0,Ethan Coen,"['Joel Coen', 'Tommy Lee Jones', 'Javier Bardem', 'Josh Brolin']",856916,2022-04-17 15:03:27.379,2022-04-17 15:03:27.379
625c2e36f0a5bc6c426c0e40,Blood Simple,1984,99 min,"Crime, Drama, Thriller",7.6,1.7240105246019743,"The owner of a seedy small-town Texas bar discovers that one of his employees is having an affair with his wife. A chaotic chain of misunderstandings, lies and mischief ensues after he devises a plot to have them murdered.",82.0,Joel Coen,"['Ethan Coen', 'John Getz', 'Frances McDormand', 'Dan Hedaya']",87745,2022-04-17 15:11:50.032,2022-04-17 15:11:50.032
625c2bfbf0a5bc6c426c07de,Eskiya,1996,128 min,"Crime, Drama, Thriller",8.2,0.8914701664221669,"Baran the Bandit, released from prison after 35 years, searches for vengeance and his lover.",,Yavuz Turgul,"['Sener Sen', 'Ugur Yücel', 'Sermin Hürmeriç', 'Yesim Salkim']",64118,2022-04-17 15:02:19.626,2022-04-17 15:02:19.626
625c2e2ef0a5bc6c426c0e14,Funny Games,1997,108 min,"Crime, Drama, Thriller",7.6,3.508905575267931,"Two violent young men take a mother, father, and son hostage in their vacation cabin and force them to play sadistic ""games"" with one another for their own amusement.",69.0,Michael Haneke,"['Susanne Lothar', 'Ulrich Mühe', 'Arno Frisch', 'Frank Giering']",65058,2022-04-17 15:11:42.896,2022-04-17 15:11:42.896
625c2deff0a5bc6c426c0d0e,Miller's Crossing,1990,115 min,"Crime, Drama, Thriller",7.7,1.5684417300213727,"Tom Reagan, an advisor to a Prohibition-era crime boss, tries to keep the peace between warring mobs but gets caught in divided loyalties.",66.0,Joel Coen,"['Ethan Coen', 'Gabriel Byrne', 'Albert Finney', 'John Turturro']",125822,2022-04-17 15:10:39.684,2022-04-17 15:10:39.684
625c2de1f0a5bc6c426c0cdc,Training Day,2001,122 min,"Crime, Drama, Thriller",7.7,3.34310148709294,A rookie cop spends his first day as a Los Angeles narcotics officer with a rogue detective who isn't what he appears to be.,69.0,Antoine Fuqua,"['Denzel Washington', 'Ethan Hawke', 'Scott Glenn', 'Tom Berenger']",390247,2022-04-17 15:10:25.837,2022-04-17 15:10:25.837
625c2b6af0a5bc6c426c06da,Joker,2019,122 min,"Crime, Drama, Thriller",8.5,3.556252174246244,"In Gotham City, mentally troubled comedian Arthur Fleck is disregarded and mistreated by society. He then embarks on a downward spiral of revolution and bloody crime. This path brings him face-to-face with his alter-ego: the Joker.",59.0,Todd Phillips,"['Joaquin Phoenix', 'Robert De Niro', 'Zazie Beetz', 'Frances Conroy']",939252,2022-04-17 14:59:54.304,2022-04-17 14:59:54.304
625c2e29f0a5bc6c426c0dee,Boksuneun naui geot,2002,129 min,"Crime, Drama, Thriller",7.6,3.179737002803803,"A recently laid off factory worker kidnaps his former boss' friend's daughter, hoping to use the ransom money to pay for his sister's kidney transplant.",56.0,Chan-wook Park,"['Kang-ho Song', 'Shin Ha-kyun', 'Bae Doona', 'Ji-Eun Lim']",62659,2022-04-17 15:11:37.126,2022-04-17 15:11:37.126
625c2e24f0a5bc6c426c0dd4,Dead Man's Shoes,2004,90 min,"Crime, Drama, Thriller",7.6,0.7263329807445851,A disaffected soldier returns to his hometown to get even with the thugs who brutalized his mentally-challenged brother years ago.,52.0,Shane Meadows,"['Paddy Considine', 'Gary Stretch', 'Toby Kebbell', 'Stuart Wolfenden']",49728,2022-04-17 15:11:32.934,2022-04-17 15:11:32.934
625c2c4ef0a5bc6c426c0896,Fargo,1996,98 min,"Crime, Drama, Thriller",8.1,0.012431709853817363,Jerry Lundegaard's inept crime falls apart due to his and his henchmen's bungling and the persistent police work of the quite pregnant Marge Gunderson.,85.0,Joel Coen,"['Ethan Coen', 'William H. Macy', 'Frances McDormand', 'Steve Buscemi']",617444,2022-04-17 15:03:42.295,2022-04-17 15:03:42.295
625c2d34f0a5bc6c426c0aae,Carlito's Way,1993,144 min,"Crime, Drama, Thriller",7.9,2.64443459622321,"A Puerto Rican former convict, just released from prison, pledges to stay away from drugs and violence despite the pressure around him and lead on to a better life outside of N.Y.C.",65.0,Brian De Palma,"['Al Pacino', 'Sean Penn', 'Penelope Ann Miller', 'John Leguizamo']",201000,2022-04-17 15:07:32.422,2022-04-17 15:07:32.422
625c2ddef0a5bc6c426c0cc6,Road to Perdition,2002,117 min,"Crime, Drama, Thriller",7.7,3.097118581499317,"A mob enforcer's son witnesses a murder, forcing him and his father to take to the road, and his father down a path of redemption and revenge.",72.0,Sam Mendes,"['Tom Hanks', 'Tyler Hoechlin', 'Rob Maxey', 'Liam Aiken']",246840,2022-04-17 15:10:22.140,2022-04-17 15:10:22.140
625c2c82f0a5bc6c426c0936,Special Chabbis,2013,144 min,"Crime, Drama, Thriller",8.0,0.7821489988074626,A gang of con-men rob prominent rich businessmen and politicians by posing as C.B.I and income tax officers.,,Neeraj Pandey,"['Akshay Kumar', 'Anupam Kher', 'Manoj Bajpayee', 'Jimmy Sheirgill']",51069,2022-04-17 15:04:34.238,2022-04-17 15:04:34.238
625c2d2cf0a5bc6c426c0a98,Nueve reinas,2000,114 min,"Crime, Drama, Thriller",7.9,3.0704524015778567,"Two con artists try to swindle a stamp collector by selling him a sheet of counterfeit rare stamps (the ""nine queens"").",80.0,Fabián Bielinsky,"['Ricardo Darín', 'Gastón Pauls', 'Graciela Tenenbaum', 'María Mercedes Villagra']",49721,2022-04-17 15:07:24.337,2022-04-17 15:07:24.337
625c2bc8f0a5bc6c426c0766,Reservoir Dogs,1992,99 min,"Crime, Drama, Thriller",8.3,2.54028073683074,"When a simple jewelry heist goes horribly wrong, the surviving criminals begin to suspect that one of them is a police informant.",79.0,Quentin Tarantino,"['Harvey Keitel', 'Tim Roth', 'Michael Madsen', 'Chris Penn']",918562,2022-04-17 15:01:28.908,2022-04-17 15:01:28.908
