_id,title,release,duration,gerne,IMDB_Rating,rating,overview,metaScore,director,stars,noOfVotes,createdAt,updatedAt
625c2d13f0a5bc6c426c0a6a,The Wrestler,2008,109 min,"Drama, Sport",7.9,2.0020007514035254,"A faded professional wrestler must retire, but finds his quest for a new life outside the ring a dispiriting struggle.",80.0,Darren Aronofsky,"['Mickey Rourke', 'Marisa Tomei', 'Evan Rachel Wood', 'Mark Margolis']",289415,2022-04-17 15:06:59.369,2022-04-17 15:06:59.369
625c2dc7f0a5bc6c426c0c56,Kai po che!,2013,130 min,"Drama, Sport",7.7,3.8790823635362437,Three friends growing up in India at the turn of the millennium set out to open a training academy to produce the country's next cricket stars.,40.0,Abhishek Kapoor,"['Amit Sadh', 'Sushant Singh Rajput', 'Rajkummar Rao', 'Amrita Puri']",32628,2022-04-17 15:09:59.570,2022-04-17 15:09:59.570
625c2ceaf0a5bc6c426c09fc,The Hustler,1961,134 min,"Drama, Sport",8.0,0.8957244893575744,An up-and-coming pool player plays a long-time champion in a single high-stakes match.,90.0,Robert Rossen,"['Paul Newman', 'Jackie Gleason', 'Piper Laurie', 'George C. Scott']",75067,2022-04-17 15:06:18.441,2022-04-17 15:06:18.441
625c2c5cf0a5bc6c426c08c6,Rocky,1976,120 min,"Drama, Sport",8.1,4.334345380352095,A small-time boxer gets a supremely rare chance to fight a heavy-weight champion in a bout in which he strives to go the distance for his self-respect.,70.0,John G. Avildsen,"['Sylvester Stallone', 'Talia Shire', 'Burt Young', 'Carl Weathers']",518546,2022-04-17 15:03:56.729,2022-04-17 15:03:56.729
625c2bc6f0a5bc6c426c0760,Bacheha-Ye aseman,1997,89 min,"Drama, Family, Sport",8.3,2.422594114012775,"After a boy loses his sister's pair of shoes, he goes on a series of adventures in order to find them. When he can't, he tries a new way to ""win"" a new pair.",77.0,Majid Majidi,"['Mohammad Amir Naji', 'Amir Farrokh Hashemian', 'Bahare Seddiqi', 'Nafise Jafar-Mohammadi']",65341,2022-04-17 15:01:26.245,2022-04-17 15:01:26.245
625c2bf0f0a5bc6c426c07c0,Chak De! India,2007,153 min,"Drama, Family, Sport",8.2,4.106584173440938,Kabir Khan is the coach of the Indian Women's National Hockey Team and his dream is to make his all girls team emerge victorious against all odds.,68.0,Shimit Amin,"['Shah Rukh Khan', 'Vidya Malvade', 'Sagarika Ghatge', 'Shilpa Shukla']",74129,2022-04-17 15:02:08.676,2022-04-17 15:02:08.676
625c2d2ff0a5bc6c426c0aa2,Boogie Nights,1997,155 min,Drama,7.9,0.7826049515791789,"Back when sex was safe, pleasure was a business and business was booming, an idealistic porn producer aspires to elevate his craft to an art when he discovers a hot young talent.",85.0,Paul Thomas Anderson,"['Mark Wahlberg', 'Julianne Moore', 'Burt Reynolds', 'Luis Guzmán']",239473,2022-04-17 15:07:27.785,2022-04-17 15:07:27.785
625c2d3cf0a5bc6c426c0ae0,The Manchurian Candidate,1962,126 min,"Drama, Thriller",7.9,4.913912769025664,A former prisoner of war is brainwashed as an unwitting assassin for an international Communist conspiracy.,94.0,John Frankenheimer,"['Frank Sinatra', 'Laurence Harvey', 'Janet Leigh', 'Angela Lansbury']",71122,2022-04-17 15:07:40.671,2022-04-17 15:07:40.671
625c2e22f0a5bc6c426c0dc2,Seven Pounds,2008,123 min,Drama,7.6,1.4987215153544209,A man with a fateful secret embarks on an extraordinary journey of redemption by forever changing the lives of seven strangers.,36.0,Gabriele Muccino,"['Will Smith', 'Rosario Dawson', 'Woody Harrelson', 'Michael Ealy']",286770,2022-04-17 15:11:30.692,2022-04-17 15:11:30.692
625c2cc6f0a5bc6c426c097e,Bom Yeoareum Gaeul Gyeoul Geurigo Bom,2003,103 min,"Drama, Romance",8.0,3.7262320306777355,A boy is raised by a Buddhist monk in an isolated floating temple where the years pass like the seasons.,85.0,Ki-duk Kim,"['Ki-duk Kim', 'Yeong-su Oh', 'Jong-ho Kim', 'Kim Young-Min']",77520,2022-04-17 15:05:42.946,2022-04-17 15:05:42.946
625c2d43f0a5bc6c426c0ae6,Hiroshima mon amour,1959,90 min,"Drama, Romance",7.9,4.632575580587485,A French actress filming an anti-war film in Hiroshima has an affair with a married Japanese architect as they share their differing perspectives on war.,,Alain Resnais,"['Emmanuelle Riva', 'Eiji Okada', 'Stella Dassas', 'Pierre Barbaud']",28421,2022-04-17 15:07:47.779,2022-04-17 15:07:47.779
625c2b6df0a5bc6c426c06e8,American History X,1998,119 min,Drama,8.5,1.2834472896333238,A former neo-nazi skinhead tries to prevent his younger brother from going down the same wrong path that he did.,62.0,Tony Kaye,"['Edward Norton', 'Edward Furlong', ""Beverly D'Angelo"", 'Jennifer Lien']",1034705,2022-04-17 14:59:57.054,2022-04-17 14:59:57.054
625c2c6cf0a5bc6c426c08e6,The Man Who Shot Liberty Valance,1962,123 min,"Drama, Western",8.1,3.631922167237761,A senator returns to a western town for the funeral of an old friend and tells the story of his origins.,94.0,John Ford,"['James Stewart', 'John Wayne', 'Vera Miles', 'Lee Marvin']",68827,2022-04-17 15:04:12.918,2022-04-17 15:04:12.918
625c2daef0a5bc6c426c0c0e,Midnight Cowboy,1969,113 min,Drama,7.8,4.224138388021959,"A naive hustler travels from Texas to New York City to seek personal fortune, finding a new friend in the process.",79.0,John Schlesinger,"['Dustin Hoffman', 'Jon Voight', 'Sylvia Miles', 'John McGiver']",101124,2022-04-17 15:09:34.643,2022-04-17 15:09:34.643
625c2cd0f0a5bc6c426c09a6,Sling Blade,1996,135 min,Drama,8.0,0.21053433873782001,"Karl Childers, a simple man hospitalized since his childhood murder of his mother and her lover, is released to start a new life in a small town.",84.0,Billy Bob Thornton,"['Billy Bob Thornton', 'Dwight Yoakam', 'J.T. Walsh', 'John Ritter']",86838,2022-04-17 15:05:52.184,2022-04-17 15:05:52.184
625c2d49f0a5bc6c426c0afa,The Lost Weekend,1945,101 min,"Drama, Film-Noir",7.9,4.3549087251654495,The desperate life of a chronic alcoholic is followed through a four-day drinking bout.,,Billy Wilder,"['Ray Milland', 'Jane Wyman', 'Phillip Terry', 'Howard Da Silva']",33549,2022-04-17 15:07:53.759,2022-04-17 15:07:53.759
625c2bbdf0a5bc6c426c073c,Sunset Blvd.,1950,110 min,"Drama, Film-Noir",8.4,2.4851408637275707,A screenwriter develops a dangerous relationship with a faded film star determined to make a triumphant return.,,Billy Wilder,"['William Holden', 'Gloria Swanson', 'Erich von Stroheim', 'Nancy Olson']",201632,2022-04-17 15:01:17.844,2022-04-17 15:01:17.844
625c2bc9f0a5bc6c426c0768,Full Metal Jacket,1987,116 min,"Drama, War",8.3,3.5406088506166844,A pragmatic U.S. Marine observes the dehumanizing effects the Vietnam War has on his fellow recruits from their brutal boot camp training to the bloody street fighting in Hue.,76.0,Stanley Kubrick,"['Matthew Modine', 'R. Lee Ermey', ""Vincent D'Onofrio"", 'Adam Baldwin']",675146,2022-04-17 15:01:29.583,2022-04-17 15:01:29.583
625c2ddff0a5bc6c426c0cca,Billy Elliot,2000,110 min,"Drama, Music",7.7,4.639187099643237,A talented young boy becomes torn between his unexpected love of dance and the disintegration of his family.,74.0,Stephen Daldry,"['Jamie Bell', 'Julie Walters', 'Jean Heywood', 'Jamie Draven']",126770,2022-04-17 15:10:23.031,2022-04-17 15:10:23.031
625c2e0df0a5bc6c426c0d94,Creed,2015,133 min,"Drama, Sport",7.6,4.7797999990697875,"The former World Heavyweight Champion Rocky Balboa serves as a trainer and mentor to Adonis Johnson, the son of his late friend and former rival Apollo Creed.",82.0,Ryan Coogler,"['Michael B. Jordan', 'Sylvester Stallone', 'Tessa Thompson', 'Phylicia Rashad']",247666,2022-04-17 15:11:09.458,2022-04-17 15:11:09.458
