_id,title,release,duration,gerne,IMDB_Rating,rating,overview,metaScore,director,stars,noOfVotes,createdAt,updatedAt
625c2cd0f0a5bc6c426c09a6,Sling Blade,1996,135 min,Drama,8.0,0.21053433873782001,"Karl Childers, a simple man hospitalized since his childhood murder of his mother and her lover, is released to start a new life in a small town.",84.0,Billy Bob Thornton,"['Billy Bob Thornton', 'Dwight Yoakam', 'J.T. Walsh', 'John Ritter']",86838,2022-04-17 15:05:52.184,2022-04-17 15:05:52.184
625c2d67f0a5bc6c426c0b6e,Auf der anderen Seite,2007,122 min,Drama,7.8,0.2628071466856041,A Turkish man travels to Istanbul to find the daughter of his father's former girlfriend.,85.0,Fatih Akin,"['Baki Davrak', 'Nurgül Yesilçay', 'Tuncel Kurtiz', 'Nursel Köse']",30827,2022-04-17 15:08:23.926,2022-04-17 15:08:23.926
625c2ceaf0a5bc6c426c09fa,Vivre sa vie: Film en douze tableaux,1962,80 min,Drama,8.0,3.2085803844982683,Twelve episodic tales in the life of a Parisian woman and her slow descent into prostitution.,,Jean-Luc Godard,"['Anna Karina', 'Sady Rebbot', 'André S. Labarthe', 'Guylaine Schlumberger']",28057,2022-04-17 15:06:18.237,2022-04-17 15:06:18.237
625c2c5cf0a5bc6c426c08c8,Network,1976,121 min,Drama,8.1,3.852851228576771,A television network cynically exploits a deranged former anchor's ravings and revelations about the news media for its own profit.,83.0,Sidney Lumet,"['Faye Dunaway', 'William Holden', 'Peter Finch', 'Robert Duvall']",144911,2022-04-17 15:03:56.937,2022-04-17 15:03:56.937
625c2b5cf0a5bc6c426c06c0,Soorarai Pottru,2020,153 min,Drama,8.6,4.333727614180858,"Nedumaaran Rajangam ""Maara"" sets out to make the common man fly and in the process takes on the world's most capital intensive industry and several enemies who stand in his way.",,Sudha Kongara,"['Suriya', 'Madhavan', 'Paresh Rawal', 'Aparna Balamurali']",54995,2022-04-17 14:59:40.370,2022-04-17 14:59:40.370
625c2c6df0a5bc6c426c08e8,Ivanovo detstvo,1962,95 min,"Drama, War",8.1,2.9519195919980126,"In WW2, twelve year old Soviet orphan Ivan Bondarev works for the Soviet army as a scout behind the German lines and strikes a friendship with three sympathetic Soviet officers.",,Andrei Tarkovsky,"['Eduard Abalov', 'Nikolay Burlyaev', 'Valentin Zubkov', 'Evgeniy Zharikov']",31728,2022-04-17 15:04:13.622,2022-04-17 15:04:13.622
625c2e2af0a5bc6c426c0dfc,Y tu mamá también,2001,106 min,Drama,7.6,4.671089049033586,"In Mexico, two teenage boys and an attractive older woman embark on a road trip and learn a thing or two about life, friendship, sex, and each other.",88.0,Alfonso Cuarón,"['Maribel Verdú', 'Gael García Bernal', 'Daniel Giménez Cacho', 'Ana López Mercado']",115827,2022-04-17 15:11:38.600,2022-04-17 15:11:38.600
625c2cd4f0a5bc6c426c09c0,Rain Man,1988,133 min,Drama,8.0,1.7469463745237956,Selfish yuppie Charlie Babbitt's father left a fortune to his savant brother Raymond and a pittance to Charlie; they travel cross-country.,65.0,Barry Levinson,"['Dustin Hoffman', 'Tom Cruise', 'Valeria Golino', 'Gerald R. Molen']",473064,2022-04-17 15:05:56.706,2022-04-17 15:05:56.706
625c2ce3f0a5bc6c426c09e6,Il conformista,1970,113 min,Drama,8.0,1.65756471323934,"A weak-willed Italian man becomes a fascist flunky who goes abroad to arrange the assassination of his old teacher, now a political dissident.",100.0,Bernardo Bertolucci,"['Jean-Louis Trintignant', 'Stefania Sandrelli', 'Gastone Moschin', 'Enzo Tarascio']",27067,2022-04-17 15:06:11.142,2022-04-17 15:06:11.142
625c2c34f0a5bc6c426c085a,Gran Torino,2008,116 min,Drama,8.1,0.9276259140771848,"Disgruntled Korean War veteran Walt Kowalski sets out to reform his neighbor, Thao Lor, a Hmong teenager who tried to steal Kowalski's prized possession: a 1972 Gran Torino.",72.0,Clint Eastwood,"['Clint Eastwood', 'Bee Vang', 'Christopher Carley', 'Ahney Her']",720450,2022-04-17 15:03:16.928,2022-04-17 15:03:16.928
625c2e01f0a5bc6c426c0d60,Rebel Without a Cause,1955,111 min,Drama,7.7,2.975204927412171,"A rebellious young man with a troubled past comes to a new town, finding friends and enemies.",89.0,Nicholas Ray,"['James Dean', 'Natalie Wood', 'Sal Mineo', 'Jim Backus']",83363,2022-04-17 15:10:57.334,2022-04-17 15:10:57.334
625c2cedf0a5bc6c426c0a06,Cat on a Hot Tin Roof,1958,108 min,Drama,8.0,2.822216147247852,Brick is an alcoholic ex-football player who drinks his days away and resists the affections of his wife. A reunion with his terminal father jogs a host of memories and revelations for both father and son.,84.0,Richard Brooks,"['Elizabeth Taylor', 'Paul Newman', 'Burl Ives', 'Jack Carson']",45062,2022-04-17 15:06:21.724,2022-04-17 15:06:21.724
625c2c6cf0a5bc6c426c08e6,The Man Who Shot Liberty Valance,1962,123 min,"Drama, Western",8.1,3.631922167237761,A senator returns to a western town for the funeral of an old friend and tells the story of his origins.,94.0,John Ford,"['James Stewart', 'John Wayne', 'Vera Miles', 'Lee Marvin']",68827,2022-04-17 15:04:12.918,2022-04-17 15:04:12.918
625c2df5f0a5bc6c426c0d2a,Ordinary People,1980,124 min,Drama,7.7,3.4760837368322015,"The accidental death of the older son of an affluent family deeply strains the relationships among the bitter mother, the good-natured father, and the guilt-ridden younger son.",86.0,Robert Redford,"['Donald Sutherland', 'Mary Tyler Moore', 'Judd Hirsch', 'Timothy Hutton']",47099,2022-04-17 15:10:45.524,2022-04-17 15:10:45.524
625c2c56f0a5bc6c426c08b0,Platoon,1986,120 min,"Drama, War",8.1,3.588588846916434,"Chris Taylor, a neophyte recruit in Vietnam, finds himself caught in a battle of wills between two sergeants, one good and the other evil. A shrewd examination of the brutality of war and the duality of man in conflict.",92.0,Oliver Stone,"['Charlie Sheen', 'Tom Berenger', 'Willem Dafoe', 'Keith David']",381222,2022-04-17 15:03:50.003,2022-04-17 15:03:50.003
625c2c66f0a5bc6c426c08d2,Viskningar och rop,1972,91 min,Drama,8.1,0.08466549344274821,"When a woman dying of cancer in early twentieth-century Sweden is visited by her two sisters, long-repressed feelings between the siblings rise to the surface.",,Ingmar Bergman,"['Harriet Andersson', 'Liv Ullmann', 'Kari Sylwan', 'Ingrid Thulin']",30206,2022-04-17 15:04:06.943,2022-04-17 15:04:06.943
625c2bc9f0a5bc6c426c0768,Full Metal Jacket,1987,116 min,"Drama, War",8.3,3.5406088506166844,A pragmatic U.S. Marine observes the dehumanizing effects the Vietnam War has on his fellow recruits from their brutal boot camp training to the bloody street fighting in Hue.,76.0,Stanley Kubrick,"['Matthew Modine', 'R. Lee Ermey', ""Vincent D'Onofrio"", 'Adam Baldwin']",675146,2022-04-17 15:01:29.583,2022-04-17 15:01:29.583
625c2b54f0a5bc6c426c06ae,Forrest Gump,1994,142 min,"Drama, Romance",8.8,4.476678813544045,"The presidencies of Kennedy and Johnson, the events of Vietnam, Watergate and other historical events unfold through the perspective of an Alabama man with an IQ of 75, whose only desire is to be reunited with his childhood sweetheart.",82.0,Robert Zemeckis,"['Tom Hanks', 'Robin Wright', 'Gary Sinise', 'Sally Field']",1809221,2022-04-17 14:59:32.773,2022-04-17 14:59:32.773
625c2e08f0a5bc6c426c0d7a,The Florida Project,2017,111 min,Drama,7.6,4.2017898791249255,"Set over one summer, the film follows precocious six-year-old Moonee as she courts mischief and adventure with her ragtag playmates and bonds with her rebellious but caring mother, all while living in the shadows of Walt Disney World.",92.0,Sean Baker,"['Brooklynn Prince', 'Bria Vinaite', 'Willem Dafoe', 'Christopher Rivera']",95181,2022-04-17 15:11:04.601,2022-04-17 15:11:04.601
625c2db1f0a5bc6c426c0c1c,Jules et Jim,1962,105 min,"Drama, Romance",7.8,3.9598925815221886,Decades of a love triangle concerning two friends and an impulsive woman.,97.0,François Truffaut,"['Jeanne Moreau', 'Oskar Werner', 'Henri Serre', 'Vanna Urbino']",37605,2022-04-17 15:09:37.584,2022-04-17 15:09:37.584
