_id,title,release,duration,gerne,IMDB_Rating,rating,overview,metaScore,director,stars,noOfVotes,createdAt,updatedAt
625c2dc8f0a5bc6c426c0c58,The Broken Circle Breakdown,2012,111 min,"Drama, Music, Romance",7.7,3.4938023251678842,"Elise and Didier fall in love at first sight, in spite of their differences. He talks, she listens. He's a romantic atheist, she's a religious realist. When their daughter becomes seriously ill, their love is put on trial.",70.0,Felix van Groeningen,"['Veerle Baetens', 'Johan Heldenbergh', 'Nell Cattrysse', 'Geert Van Rampelberg']",39379,2022-04-17 15:10:00.129,2022-04-17 15:10:00.129
625c2e15f0a5bc6c426c0da6,A Star Is Born,2018,136 min,"Drama, Music, Romance",7.6,4.5475557190476925,A musician helps a young singer find fame as age and alcoholism send his own career into a downward spiral.,88.0,Bradley Cooper,"['Lady Gaga', 'Bradley Cooper', 'Sam Elliott', 'Greg Grunberg']",334312,2022-04-17 15:11:17.081,2022-04-17 15:11:17.081
625c2c49f0a5bc6c426c088a,La leggenda del pianista sull'oceano,1998,169 min,"Drama, Music, Romance",8.1,0.11396065477455974,"A baby boy, discovered in 1900 on an ocean liner, grows into a musical prodigy, never setting foot on land.",58.0,Giuseppe Tornatore,"['Tim Roth', 'Pruitt Taylor Vince', 'Mélanie Thierry', 'Bill Nunn']",59020,2022-04-17 15:03:37.932,2022-04-17 15:03:37.932
625c2c54f0a5bc6c426c08a8,Ba wang bie ji,1993,171 min,"Drama, Music, Romance",8.1,2.746375539692807,Two boys meet at an opera training school in Peking in 1924. Their resulting friendship will span nearly 70 years and will endure some of the most troublesome times in China's history.,,Kaige Chen,"['Leslie Cheung', 'Fengyi Zhang', 'Gong Li', 'You Ge']",25088,2022-04-17 15:03:48.672,2022-04-17 15:03:48.672
625c2d5cf0a5bc6c426c0b34,The Lunchbox,2013,104 min,"Drama, Romance",7.8,0.3264388998341605,A mistaken delivery in Mumbai's famously efficient lunchbox delivery system connects a young housewife to an older man in the dusk of his life as they build a fantasy world together through notes in the lunchbox.,76.0,Ritesh Batra,"['Irrfan Khan', 'Nimrat Kaur', 'Nawazuddin Siddiqui', 'Lillete Dubey']",50523,2022-04-17 15:08:12.492,2022-04-17 15:08:12.492
625c2cb6f0a5bc6c426c0948,The Perks of Being a Wallflower,2012,103 min,"Drama, Romance",8.0,4.12409085836103,An introvert freshman is taken under the wings of two seniors who welcome him to the real world,67.0,Stephen Chbosky,"['Logan Lerman', 'Emma Watson', 'Ezra Miller', 'Paul Rudd']",462252,2022-04-17 15:05:26.938,2022-04-17 15:05:26.938
625c2b71f0a5bc6c426c06f2,Nuovo Cinema Paradiso,1988,155 min,"Drama, Romance",8.5,2.6788782327982164,A filmmaker recalls his childhood when falling in love with the pictures at the cinema of his home village and forms a deep friendship with the cinema's projectionist.,80.0,Giuseppe Tornatore,"['Philippe Noiret', 'Enzo Cannavale', 'Antonella Attili', 'Isa Danieli']",230763,2022-04-17 15:00:01.104,2022-04-17 15:00:01.104
625c2cc6f0a5bc6c426c097e,Bom Yeoareum Gaeul Gyeoul Geurigo Bom,2003,103 min,"Drama, Romance",8.0,3.7262320306777355,A boy is raised by a Buddhist monk in an isolated floating temple where the years pass like the seasons.,85.0,Ki-duk Kim,"['Ki-duk Kim', 'Yeong-su Oh', 'Jong-ho Kim', 'Kim Young-Min']",77520,2022-04-17 15:05:42.946,2022-04-17 15:05:42.946
625c2d67f0a5bc6c426c0b6a,Once,2007,86 min,"Drama, Music, Romance",7.8,4.601642050325693,"A modern-day musical about a busker and an immigrant and their eventful week in Dublin, as they write, rehearse and record songs that tell their love story.",88.0,John Carney,"['Glen Hansard', 'Markéta Irglová', 'Hugh Walsh', 'Gerard Hendrick']",110656,2022-04-17 15:08:23.323,2022-04-17 15:08:23.323
625c2c82f0a5bc6c426c0934,Gully Boy,2019,154 min,"Drama, Music, Romance",8.0,3.31353091501003,A coming-of-age story based on the lives of street rappers in Mumbai.,65.0,Zoya Akhtar,"['Vijay Varma', 'Nakul Roshan Sahdev', 'Ranveer Singh', 'Vijay Raaz']",31886,2022-04-17 15:04:34.019,2022-04-17 15:04:34.019
625c2db7f0a5bc6c426c0c3a,God's Own Country,2017,104 min,"Drama, Romance",7.7,0.8823427683595797,"Spring. Yorkshire. Young farmer Johnny Saxby numbs his daily frustrations with binge drinking and casual sex, until the arrival of a Romanian migrant worker for lambing season ignites an intense relationship that sets Johnny on a new path.",85.0,Francis Lee,"[""Josh O'Connor"", 'Alec Secareanu', 'Gemma Jones', 'Ian Hart']",25198,2022-04-17 15:09:43.696,2022-04-17 15:09:43.696
625c2c7bf0a5bc6c426c0916,Sunrise: A Song of Two Humans,1927,94 min,"Drama, Romance",8.1,1.8260501833694132,An allegorical tale about a man fighting the good and evil within him. Both sides are made flesh - one a sophisticated woman he is attracted to and the other his wife.,,F.W. Murnau,"[""George O'Brien"", 'Janet Gaynor', 'Margaret Livingston', 'Bodil Rosing']",46865,2022-04-17 15:04:27.282,2022-04-17 15:04:27.282
625c2d84f0a5bc6c426c0b92,The Notebook,2004,123 min,"Drama, Romance",7.8,4.811816390170578,"A poor yet passionate young man falls in love with a rich young woman, giving her a sense of freedom, but they are soon separated because of their social differences.",53.0,Nick Cassavetes,"['Gena Rowlands', 'James Garner', 'Rachel McAdams', 'Ryan Gosling']",520284,2022-04-17 15:08:52.563,2022-04-17 15:08:52.563
625c2b54f0a5bc6c426c06ae,Forrest Gump,1994,142 min,"Drama, Romance",8.8,4.476678813544045,"The presidencies of Kennedy and Johnson, the events of Vietnam, Watergate and other historical events unfold through the perspective of an Alabama man with an IQ of 75, whose only desire is to be reunited with his childhood sweetheart.",82.0,Robert Zemeckis,"['Tom Hanks', 'Robin Wright', 'Gary Sinise', 'Sally Field']",1809221,2022-04-17 14:59:32.773,2022-04-17 14:59:32.773
625c2dc1f0a5bc6c426c0c4e,The Fault in Our Stars,2014,126 min,"Drama, Romance",7.7,1.8846504309046053,Two teenage cancer patients begin a life-affirming journey to visit a reclusive author in Amsterdam.,69.0,Josh Boone,"['Shailene Woodley', 'Ansel Elgort', 'Nat Wolff', 'Laura Dern']",344312,2022-04-17 15:09:53.667,2022-04-17 15:09:53.667
625c2bc3f0a5bc6c426c0754,Eternal Sunshine of the Spotless Mind,2004,108 min,"Drama, Romance, Sci-Fi",8.3,0.00921502275041508,"When their relationship turns sour, a couple undergoes a medical procedure to have each other erased from their memories.",89.0,Michel Gondry,"['Jim Carrey', 'Kate Winslet', 'Tom Wilkinson', 'Gerry Robert Byrne']",911664,2022-04-17 15:01:23.822,2022-04-17 15:01:23.822
625c2c13f0a5bc6c426c081e,Portrait de la jeune fille en feu,2019,122 min,"Drama, Romance",8.1,4.587971402846379,"On an isolated island in Brittany at the end of the eighteenth century, a female painter is obliged to paint a wedding portrait of a young woman.",95.0,Céline Sciamma,"['Noémie Merlant', 'Adèle Haenel', 'Luàna Bajrami', 'Valeria Golino']",63134,2022-04-17 15:02:43.005,2022-04-17 15:02:43.005
625c2ddff0a5bc6c426c0cca,Billy Elliot,2000,110 min,"Drama, Music",7.7,4.639187099643237,A talented young boy becomes torn between his unexpected love of dance and the disintegration of his family.,74.0,Stephen Daldry,"['Jamie Bell', 'Julie Walters', 'Jean Heywood', 'Jamie Draven']",126770,2022-04-17 15:10:23.031,2022-04-17 15:10:23.031
625c2d7ef0a5bc6c426c0b80,The Curious Case of Benjamin Button,2008,166 min,"Drama, Fantasy, Romance",7.8,1.0792730632497038,"Tells the story of Benjamin Button, a man who starts aging backwards with consequences.",70.0,David Fincher,"['Brad Pitt', 'Cate Blanchett', 'Tilda Swinton', 'Julia Ormond']",589160,2022-04-17 15:08:46.147,2022-04-17 15:08:46.147
625c2c04f0a5bc6c426c07f6,Höstsonaten,1978,99 min,"Drama, Music",8.2,4.085435837347583,"A married daughter who longs for her mother's love is visited by the latter, a successful concert pianist.",,Ingmar Bergman,"['Ingrid Bergman', 'Liv Ullmann', 'Lena Nyman', 'Halvar Björk']",26875,2022-04-17 15:02:28.995,2022-04-17 15:02:28.995
