_id,title,release,duration,gerne,IMDB_Rating,rating,overview,metaScore,director,stars,noOfVotes,createdAt,updatedAt
625c2c00f0a5bc6c426c07ea,Dom za vesanje,1988,142 min,"Comedy, Crime, Drama",8.2,1.8844619925821637,"In this luminous tale set in the area around Sarajevo and in Italy, Perhan, an engaging young Romany (gypsy) with telekinetic powers, is seduced by the quick-cash world of petty crime, which threatens to destroy him and those he loves.",,Emir Kusturica,"['Davor Dujmovic', 'Bora Todorovic', 'Ljubica Adzovic', 'Husnija Hasimovic']",26402,2022-04-17 15:02:24.901,2022-04-17 15:02:24.901
625c2c52f0a5bc6c426c08a2,Chung Hing sam lam,1994,102 min,"Comedy, Crime, Drama",8.1,4.7931157129214155,"Two melancholy Hong Kong policemen fall in love: one with a mysterious female underworld figure, the other with a beautiful and ethereal server at a late-night restaurant he frequents.",77.0,Kar-Wai Wong,"['Brigitte Lin', 'Takeshi Kaneshiro', 'Tony Chiu-Wai Leung', 'Faye Wong']",63122,2022-04-17 15:03:46.968,2022-04-17 15:03:46.968
625c2de6f0a5bc6c426c0cf4,Do lok tin si,1995,99 min,"Comedy, Crime, Drama",7.7,4.0601891351292805,"This Hong Kong-set crime drama follows the lives of a hitman, hoping to get out of the business, and his elusive female partner.",71.0,Kar-Wai Wong,"['Leon Lai', 'Michelle Reis', 'Takeshi Kaneshiro', 'Charlie Yeung']",26429,2022-04-17 15:10:30.809,2022-04-17 15:10:30.809
625c2c66f0a5bc6c426c08d0,Paper Moon,1973,102 min,"Comedy, Crime, Drama",8.1,1.82303303162495,"During the Great Depression, a con man finds himself saddled with a young girl who may or may not be his daughter, and the two forge an unlikely partnership.",77.0,Peter Bogdanovich,"[""Ryan O'Neal"", ""Tatum O'Neal"", 'Madeline Kahn', 'John Hillerman']",42285,2022-04-17 15:04:06.720,2022-04-17 15:04:06.720
625c2da1f0a5bc6c426c0bf6,The King of Comedy,1982,109 min,"Comedy, Crime, Drama",7.8,3.61142330620709,"Rupert Pupkin is a passionate yet unsuccessful comic who craves nothing more than to be in the spotlight and to achieve this, he stalks and kidnaps his idol to take the spotlight for himself.",73.0,Martin Scorsese,"['Robert De Niro', 'Jerry Lewis', 'Diahnne Abbott', 'Sandra Bernhard']",88511,2022-04-17 15:09:21.120,2022-04-17 15:09:21.120
625c2e38f0a5bc6c426c0e52,The Long Goodbye,1973,112 min,"Comedy, Crime, Drama",7.6,1.2231987057301263,"Private investigator Philip Marlowe helps a friend out of a jam, but in doing so gets implicated in his wife's murder.",87.0,Robert Altman,"['Elliott Gould', 'Nina van Pallandt', 'Sterling Hayden', 'Mark Rydell']",26337,2022-04-17 15:11:52.719,2022-04-17 15:11:52.719
625c2be0f0a5bc6c426c07a0,"Three Billboards Outside Ebbing, Missouri",2017,115 min,"Comedy, Crime, Drama",8.2,3.6723246719935334,A mother personally challenges the local authorities to solve her daughter's murder when they fail to catch the culprit.,88.0,Martin McDonagh,"['Frances McDormand', 'Woody Harrelson', 'Sam Rockwell', 'Caleb Landry Jones']",432610,2022-04-17 15:01:52.409,2022-04-17 15:01:52.409
625c2e2cf0a5bc6c426c0e0a,American Psycho,2000,101 min,"Comedy, Crime, Drama",7.6,1.5025679943931158,"A wealthy New York City investment banking executive, Patrick Bateman, hides his alternate psychopathic ego from his co-workers and friends as he delves deeper into his violent, hedonistic fantasies.",64.0,Mary Harron,"['Christian Bale', 'Justin Theroux', 'Josh Lucas', 'Bill Sage']",490062,2022-04-17 15:11:40.437,2022-04-17 15:11:40.437
625c2cf4f0a5bc6c426c0a36,Knives Out,2019,130 min,"Comedy, Crime, Drama",7.9,3.34868093095418,"A detective investigates the death of a patriarch of an eccentric, combative family.",82.0,Rian Johnson,"['Daniel Craig', 'Chris Evans', 'Ana de Armas', 'Jamie Lee Curtis']",454203,2022-04-17 15:06:28.899,2022-04-17 15:06:28.899
625c2d7df0a5bc6c426c0b7c,Little Miss Sunshine,2006,101 min,"Comedy, Drama",7.8,3.547795617340049,A family determined to get their young daughter into the finals of a beauty pageant take a cross-country trip in their VW bus.,80.0,Jonathan Dayton,"['Valerie Faris', 'Steve Carell', 'Toni Collette', 'Greg Kinnear']",439856,2022-04-17 15:08:45.694,2022-04-17 15:08:45.694
625c2df4f0a5bc6c426c0d20,After Hours,1985,97 min,"Comedy, Crime, Drama",7.7,3.6818512258075184,An ordinary word processor has the worst night of his life after he agrees to visit a girl in Soho who he met that evening at a coffee shop.,90.0,Martin Scorsese,"['Griffin Dunne', 'Rosanna Arquette', 'Verna Bloom', 'Tommy Chong']",59635,2022-04-17 15:10:44.278,2022-04-17 15:10:44.278
625c2cfbf0a5bc6c426c0a46,Captain Fantastic,2016,118 min,"Comedy, Drama",7.9,3.5701799330001927,"In the forests of the Pacific Northwest, a father devoted to raising his six kids with a rigorous physical and intellectual education is forced to leave his paradise and enter the world, challenging his idea of what it means to be a parent.",72.0,Matt Ross,"['Viggo Mortensen', 'George MacKay', 'Samantha Isler', 'Annalise Basso']",189400,2022-04-17 15:06:35.672,2022-04-17 15:06:35.672
625c2de5f0a5bc6c426c0cea,Donnie Brasco,1997,127 min,"Biography, Crime, Drama",7.7,4.580466867972184,"An FBI undercover agent infiltrates the mob and finds himself identifying more with the mafia life, at the expense of his regular one.",76.0,Mike Newell,"['Al Pacino', 'Johnny Depp', 'Michael Madsen', 'Bruno Kirby']",279318,2022-04-17 15:10:29.698,2022-04-17 15:10:29.698
625c2d7ff0a5bc6c426c0b84,Adams æbler,2005,94 min,"Comedy, Crime, Drama",7.8,0.9877452106620987,A neo-nazi sentenced to community service at a church clashes with the blindly devotional priest.,51.0,Anders Thomas Jensen,"['Ulrich Thomsen', 'Mads Mikkelsen', 'Nicolas Bro', 'Paprika Steen']",45717,2022-04-17 15:08:47.570,2022-04-17 15:08:47.570
625c2c74f0a5bc6c426c0900,White Heat,1949,114 min,"Action, Crime, Drama",8.1,0.7181003180845069,A psychopathic criminal with a mother complex makes a daring break from prison and leads his old gang in a chemical plant payroll heist.,,Raoul Walsh,"['James Cagney', 'Virginia Mayo', ""Edmond O'Brien"", 'Margaret Wycherly']",29807,2022-04-17 15:04:20.429,2022-04-17 15:04:20.429
625c2bf0f0a5bc6c426c07be,The Wolf of Wall Street,2013,180 min,"Biography, Crime, Drama",8.2,3.7408662442265115,"Based on the true story of Jordan Belfort, from his rise to a wealthy stock-broker living the high life to his fall involving crime, corruption and the federal government.",75.0,Martin Scorsese,"['Leonardo DiCaprio', 'Jonah Hill', 'Margot Robbie', 'Matthew McConaughey']",1187498,2022-04-17 15:02:08.465,2022-04-17 15:02:08.465
625c2b48f0a5bc6c426c069c,The Dark Knight,2008,152 min,"Action, Crime, Drama",9.0,1.169399698222372,"When the menace known as the Joker wreaks havoc and chaos on the people of Gotham, Batman must accept one of the greatest psychological and physical tests of his ability to fight injustice.",84.0,Christopher Nolan,"['Christian Bale', 'Heath Ledger', 'Aaron Eckhart', 'Michael Caine']",2303232,2022-04-17 14:59:20.618,2022-04-17 14:59:20.618
625c2c7df0a5bc6c426c0926,La La Land,2016,128 min,"Comedy, Drama, Music",8.0,2.762712765898799,"While navigating their careers in Los Angeles, a pianist and an actress fall in love while attempting to reconcile their aspirations for the future.",94.0,Damien Chazelle,"['Ryan Gosling', 'Emma Stone', 'Rosemarie DeWitt', 'J.K. Simmons']",505918,2022-04-17 15:04:29.583,2022-04-17 15:04:29.583
625c2d54f0a5bc6c426c0b1a,Udta Punjab,2016,148 min,"Action, Crime, Drama",7.8,3.6522573054091767,A story that revolves around drug abuse in the affluent north Indian State of Punjab and how the youth there have succumbed to it en-masse resulting in a socio-economic decline.,,Abhishek Chaubey,"['Shahid Kapoor', 'Alia Bhatt', 'Kareena Kapoor', 'Diljit Dosanjh']",27175,2022-04-17 15:08:04.060,2022-04-17 15:08:04.060
625c2e28f0a5bc6c426c0dea,The Station Agent,2003,89 min,"Comedy, Drama",7.6,1.6071186781185098,"When his only friend dies, a man born with dwarfism moves to rural New Jersey to live a life of solitude, only to meet a chatty hot dog vendor and a woman dealing with her own personal loss.",81.0,Tom McCarthy,"['Peter Dinklage', 'Patricia Clarkson', 'Bobby Cannavale', 'Paul Benjamin']",67370,2022-04-17 15:11:36.717,2022-04-17 15:11:36.717
