_id,title,release,duration,gerne,IMDB_Rating,rating,overview,metaScore,director,stars,noOfVotes,createdAt,updatedAt
625c2c13f0a5bc6c426c081e,Portrait de la jeune fille en feu,2019,122 min,"Drama, Romance",8.1,4.587971402846379,"On an isolated island in Brittany at the end of the eighteenth century, a female painter is obliged to paint a wedding portrait of a young woman.",95.0,Céline Sciamma,"['Noémie Merlant', 'Adèle Haenel', 'Luàna Bajrami', 'Valeria Golino']",63134,2022-04-17 15:02:43.005,2022-04-17 15:02:43.005
625c2d43f0a5bc6c426c0ae6,Hiroshima mon amour,1959,90 min,"Drama, Romance",7.9,4.632575580587485,A French actress filming an anti-war film in Hiroshima has an affair with a married Japanese architect as they share their differing perspectives on war.,,Alain Resnais,"['Emmanuelle Riva', 'Eiji Okada', 'Stella Dassas', 'Pierre Barbaud']",28421,2022-04-17 15:07:47.779,2022-04-17 15:07:47.779
625c2c09f0a5bc6c426c0808,Smultronstället,1957,91 min,"Drama, Romance",8.2,4.8093598415686785,"After living a life marked by coldness, an aging professor is forced to confront the emptiness of his existence.",88.0,Ingmar Bergman,"['Victor Sjöström', 'Bibi Andersson', 'Ingrid Thulin', 'Gunnar Björnstrand']",96381,2022-04-17 15:02:33.294,2022-04-17 15:02:33.294
625c2b54f0a5bc6c426c06ae,Forrest Gump,1994,142 min,"Drama, Romance",8.8,4.476678813544045,"The presidencies of Kennedy and Johnson, the events of Vietnam, Watergate and other historical events unfold through the perspective of an Alabama man with an IQ of 75, whose only desire is to be reunited with his childhood sweetheart.",82.0,Robert Zemeckis,"['Tom Hanks', 'Robin Wright', 'Gary Sinise', 'Sally Field']",1809221,2022-04-17 14:59:32.773,2022-04-17 14:59:32.773
625c2cbbf0a5bc6c426c095c,Slumdog Millionaire,2008,120 min,"Drama, Romance",8.0,2.9813310248270373,"A Mumbai teenager reflects on his life after being accused of cheating on the Indian version of ""Who Wants to be a Millionaire?"".",84.0,Danny Boyle,"['Loveleen Tandan', 'Dev Patel', 'Freida Pinto', 'Saurabh Shukla']",798882,2022-04-17 15:05:31.460,2022-04-17 15:05:31.460
625c2be9f0a5bc6c426c07b6,El secreto de sus ojos,2009,129 min,"Drama, Mystery, Romance",8.2,2.234094293029915,A retired legal counselor writes a novel hoping to find closure for one of his past unresolved homicide cases and for his unreciprocated love with his superior - both of which still haunt him decades later.,80.0,Juan José Campanella,"['Ricardo Darín', 'Soledad Villamil', 'Pablo Rago', 'Carla Quevedo']",193217,2022-04-17 15:02:01.547,2022-04-17 15:02:01.547
625c2cc6f0a5bc6c426c097e,Bom Yeoareum Gaeul Gyeoul Geurigo Bom,2003,103 min,"Drama, Romance",8.0,3.7262320306777355,A boy is raised by a Buddhist monk in an isolated floating temple where the years pass like the seasons.,85.0,Ki-duk Kim,"['Ki-duk Kim', 'Yeong-su Oh', 'Jong-ho Kim', 'Kim Young-Min']",77520,2022-04-17 15:05:42.946,2022-04-17 15:05:42.946
625c2cf1f0a5bc6c426c0a20,Brief Encounter,1945,86 min,"Drama, Romance",8.0,4.237002622780704,"Meeting a stranger in a railway station, a woman is tempted to cheat on her husband.",92.0,David Lean,"['Celia Johnson', 'Trevor Howard', 'Stanley Holloway', 'Joyce Carey']",35601,2022-04-17 15:06:25.209,2022-04-17 15:06:25.209
625c2dfdf0a5bc6c426c0d4a,Belle de jour,1967,100 min,"Drama, Romance",7.7,4.22587405202126,A frigid young housewife decides to spend her midweek afternoons as a prostitute.,,Luis Buñuel,"['Catherine Deneuve', 'Jean Sorel', 'Michel Piccoli', 'Geneviève Page']",40274,2022-04-17 15:10:53.932,2022-04-17 15:10:53.932
625c2c4cf0a5bc6c426c0892,Fa yeung nin wah,2000,98 min,"Drama, Romance",8.1,2.390005178737753,"Two neighbors, a woman and a man, form a strong bond after both suspect extramarital activities of their spouses. However, they agree to keep their bond platonic so as not to commit similar wrongs.",85.0,Kar-Wai Wong,"['Tony Chiu-Wai Leung', 'Maggie Cheung', 'Ping Lam Siu', ""Tung Cho 'Joe' Cheung""]",124383,2022-04-17 15:03:40.631,2022-04-17 15:03:40.631
625c2db7f0a5bc6c426c0c3a,God's Own Country,2017,104 min,"Drama, Romance",7.7,0.8823427683595797,"Spring. Yorkshire. Young farmer Johnny Saxby numbs his daily frustrations with binge drinking and casual sex, until the arrival of a Romanian migrant worker for lambing season ignites an intense relationship that sets Johnny on a new path.",85.0,Francis Lee,"[""Josh O'Connor"", 'Alec Secareanu', 'Gemma Jones', 'Ian Hart']",25198,2022-04-17 15:09:43.696,2022-04-17 15:09:43.696
625c2d5cf0a5bc6c426c0b34,The Lunchbox,2013,104 min,"Drama, Romance",7.8,0.3264388998341605,A mistaken delivery in Mumbai's famously efficient lunchbox delivery system connects a young housewife to an older man in the dusk of his life as they build a fantasy world together through notes in the lunchbox.,76.0,Ritesh Batra,"['Irrfan Khan', 'Nimrat Kaur', 'Nawazuddin Siddiqui', 'Lillete Dubey']",50523,2022-04-17 15:08:12.492,2022-04-17 15:08:12.492
625c2e25f0a5bc6c426c0dda,Match Point,2005,124 min,"Drama, Romance, Thriller",7.6,4.856093837254995,"At a turning point in his life, a former tennis pro falls for an actress who happens to be dating his friend and soon-to-be brother-in-law.",72.0,Woody Allen,"['Scarlett Johansson', 'Jonathan Rhys Meyers', 'Emily Mortimer', 'Matthew Goode']",206294,2022-04-17 15:11:33.548,2022-04-17 15:11:33.548
625c2cf6f0a5bc6c426c0a3e,Call Me by Your Name,2017,132 min,"Drama, Romance",7.9,4.383570961554296,"In 1980s Italy, romance blossoms between a seventeen-year-old student and the older man hired as his father's research assistant.",93.0,Luca Guadagnino,"['Armie Hammer', 'Timothée Chalamet', 'Michael Stuhlbarg', 'Amira Casar']",212651,2022-04-17 15:06:30.262,2022-04-17 15:06:30.262
625c2c76f0a5bc6c426c0908,Rebecca,1940,130 min,"Drama, Mystery, Romance",8.1,0.9190577288286628,A self-conscious woman juggles adjusting to her new role as an aristocrat's wife and avoiding being intimidated by his first wife's spectral presence.,86.0,Alfred Hitchcock,"['Laurence Olivier', 'Joan Fontaine', 'George Sanders', 'Judith Anderson']",123942,2022-04-17 15:04:22.313,2022-04-17 15:04:22.313
625c2c54f0a5bc6c426c08aa,Dà hóng denglong gaogao guà,1991,125 min,"Drama, History, Romance",8.1,3.1489540737698754,"A young woman becomes the fourth wife of a wealthy lord, and must learn to live with the strict rules and tensions within the household.",,Yimou Zhang,"['Gong Li', 'Jingwu Ma', 'Saifei He', 'Cuifen Cao']",29662,2022-04-17 15:03:48.881,2022-04-17 15:03:48.881
625c2dd8f0a5bc6c426c0ca2,Brokeback Mountain,2005,134 min,"Drama, Romance",7.7,1.3978929170308418,"The story of a forbidden and secretive relationship between two cowboys, and their lives over the years.",87.0,Ang Lee,"['Jake Gyllenhaal', 'Heath Ledger', 'Michelle Williams', 'Randy Quaid']",323103,2022-04-17 15:10:16.680,2022-04-17 15:10:16.680
625c2d68f0a5bc6c426c0b70,Atonement,2007,123 min,"Drama, Mystery, Romance",7.8,4.5654126115894575,Thirteen-year-old fledgling writer Briony Tallis irrevocably changes the course of several lives when she accuses her older sister's lover of a crime he did not commit.,85.0,Joe Wright,"['Keira Knightley', 'James McAvoy', 'Brenda Blethyn', 'Saoirse Ronan']",251370,2022-04-17 15:08:24.571,2022-04-17 15:08:24.571
625c2dc1f0a5bc6c426c0c4e,The Fault in Our Stars,2014,126 min,"Drama, Romance",7.7,1.8846504309046053,Two teenage cancer patients begin a life-affirming journey to visit a reclusive author in Amsterdam.,69.0,Josh Boone,"['Shailene Woodley', 'Ansel Elgort', 'Nat Wolff', 'Laura Dern']",344312,2022-04-17 15:09:53.667,2022-04-17 15:09:53.667
625c2db1f0a5bc6c426c0c1c,Jules et Jim,1962,105 min,"Drama, Romance",7.8,3.9598925815221886,Decades of a love triangle concerning two friends and an impulsive woman.,97.0,François Truffaut,"['Jeanne Moreau', 'Oskar Werner', 'Henri Serre', 'Vanna Urbino']",37605,2022-04-17 15:09:37.584,2022-04-17 15:09:37.584
