_id,title,release,duration,gerne,IMDB_Rating,rating,overview,metaScore,director,stars,noOfVotes,createdAt,updatedAt
625c2df3f0a5bc6c426c0d18,Empire of the Sun,1987,153 min,"Action, Drama, History",7.7,3.5161882606089745,A young English boy struggles to survive under Japanese occupation during World War II.,62.0,Steven Spielberg,"['Christian Bale', 'John Malkovich', 'Miranda Richardson', 'Nigel Havers']",115677,2022-04-17 15:10:43.117,2022-04-17 15:10:43.117
625c2d4ef0a5bc6c426c0b12,Dunkirk,2017,106 min,"Action, Drama, History",7.8,4.707970590766717,"Allied soldiers from Belgium, the British Empire, and France are surrounded by the German Army and evacuated during a fierce battle in World War II.",94.0,Christopher Nolan,"['Fionn Whitehead', 'Barry Keoghan', 'Mark Rylance', 'Tom Hardy']",555092,2022-04-17 15:07:58.173,2022-04-17 15:07:58.173
625c2b48f0a5bc6c426c069c,The Dark Knight,2008,152 min,"Action, Crime, Drama",9.0,1.169399698222372,"When the menace known as the Joker wreaks havoc and chaos on the people of Gotham, Batman must accept one of the greatest psychological and physical tests of his ability to fight injustice.",84.0,Christopher Nolan,"['Christian Bale', 'Heath Ledger', 'Aaron Eckhart', 'Michael Caine']",2303232,2022-04-17 14:59:20.618,2022-04-17 14:59:20.618
625c2df1f0a5bc6c426c0d16,The Last Emperor,1987,163 min,"Biography, Drama, History",7.7,3.949423553048427,The story of the final Emperor of China.,76.0,Bernardo Bertolucci,"['John Lone', 'Joan Chen', ""Peter O'Toole"", 'Ruocheng Ying']",94326,2022-04-17 15:10:41.667,2022-04-17 15:10:41.667
625c2c08f0a5bc6c426c07fe,The Great Escape,1963,172 min,"Adventure, Drama, History",8.2,4.298792008488299,Allied prisoners of war plan for several hundred of their number to escape from a German camp during World War II.,86.0,John Sturges,"['Steve McQueen', 'James Garner', 'Richard Attenborough', 'Charles Bronson']",224730,2022-04-17 15:02:32.303,2022-04-17 15:02:32.303
625c2dfbf0a5bc6c426c0d40,The French Connection,1971,104 min,"Action, Crime, Drama",7.7,2.245755905528295,A pair of NYC cops in the Narcotics Bureau stumble onto a drug smuggling job with a French connection.,94.0,William Friedkin,"['Gene Hackman', 'Roy Scheider', 'Fernando Rey', 'Tony Lo Bianco']",110075,2022-04-17 15:10:51.801,2022-04-17 15:10:51.801
625c2c06f0a5bc6c426c07f8,The Message,1976,177 min,"Biography, Drama, History",8.2,1.5515552131239019,This epic historical drama chronicles the life and times of Prophet Muhammad and serves as an introduction to early Islamic history.,,Moustapha Akkad,"['Anthony Quinn', 'Irene Papas', 'Michael Ansara', 'Johnny Sekka']",43885,2022-04-17 15:02:30.468,2022-04-17 15:02:30.468
625c2cecf0a5bc6c426c0a00,Rio Bravo,1959,141 min,"Action, Drama, Western",8.0,3.646574887681707,"A small-town sheriff in the American West enlists the help of a cripple, a drunk, and a young gunfighter in his efforts to hold in jail the brother of the local bad guy.",93.0,Howard Hawks,"['John Wayne', 'Dean Martin', 'Ricky Nelson', 'Angie Dickinson']",56305,2022-04-17 15:06:20.013,2022-04-17 15:06:20.013
625c2d92f0a5bc6c426c0bc6,The Fugitive,1993,130 min,"Action, Crime, Drama",7.8,4.058623089063243,"Dr. Richard Kimble, unjustly accused of murdering his wife, must find the real killer while being the target of a nationwide manhunt led by a seasoned U.S. Marshal.",87.0,Andrew Davis,"['Harrison Ford', 'Tommy Lee Jones', 'Sela Ward', 'Julianne Moore']",267684,2022-04-17 15:09:06.523,2022-04-17 15:09:06.523
625c2b55f0a5bc6c426c06b2,The Lord of the Rings: The Two Towers,2002,179 min,"Action, Adventure, Drama",8.7,4.581141589278673,"While Frodo and Sam edge closer to Mordor with the help of the shifty Gollum, the divided fellowship makes a stand against Sauron's new ally, Saruman, and his hordes of Isengard.",87.0,Peter Jackson,"['Elijah Wood', 'Ian McKellen', 'Viggo Mortensen', 'Orlando Bloom']",1485555,2022-04-17 14:59:33.779,2022-04-17 14:59:33.779
625c2dedf0a5bc6c426c0d02,The Last of the Mohicans,1992,112 min,"Action, Adventure, Drama",7.7,1.667639548980523,Three trappers protect the daughters of a British Colonel in the midst of the French and Indian War.,76.0,Michael Mann,"['Daniel Day-Lewis', 'Madeleine Stowe', 'Russell Means', 'Eric Schweig']",150409,2022-04-17 15:10:37.840,2022-04-17 15:10:37.840
625c2bdef0a5bc6c426c079a,Uri: The Surgical Strike,2018,138 min,"Action, Drama, War",8.2,1.945032388442085,"Indian army special forces execute a covert operation, avenging the killing of fellow army men at their base by a terrorist group.",,Aditya Dhar,"['Vicky Kaushal', 'Paresh Rawal', 'Mohit Raina', 'Yami Gautam']",43444,2022-04-17 15:01:50.445,2022-04-17 15:01:50.445
625c2db2f0a5bc6c426c0c22,Red River,1948,133 min,"Action, Adventure, Drama",7.8,0.0056356934111223556,"Dunson leads a cattle drive, the culmination of over 14 years of work, to its destination in Missouri. But his tyrannical behavior along the way causes a mutiny, led by his adopted son.",,Howard Hawks,"['Arthur Rosson', 'John Wayne', 'Montgomery Clift', 'Joanne Dru']",28167,2022-04-17 15:09:38.194,2022-04-17 15:09:38.194
625c2d52f0a5bc6c426c0b16,Hidden Figures,2016,127 min,"Biography, Drama, History",7.8,3.712635787972105,The story of a team of female African-American mathematicians who served a vital role in NASA during the early years of the U.S. space program.,74.0,Theodore Melfi,"['Taraji P. Henson', 'Octavia Spencer', 'Janelle Monáe', 'Kevin Costner']",200876,2022-04-17 15:08:02.060,2022-04-17 15:08:02.060
625c2cb6f0a5bc6c426c0946,The Revenant,2015,156 min,"Action, Adventure, Drama",8.0,1.0066501383954096,A frontiersman on a fur trading expedition in the 1820s fights for survival after being mauled by a bear and left for dead by members of his own hunting team.,76.0,Alejandro G. Iñárritu,"['Leonardo DiCaprio', 'Tom Hardy', 'Will Poulter', 'Domhnall Gleeson']",705589,2022-04-17 15:05:26.747,2022-04-17 15:05:26.747
625c2dd5f0a5bc6c426c0c94,The Last King of Scotland,2006,123 min,"Biography, Drama, History",7.7,3.2373955299212764,Based on the events of the brutal Ugandan dictator Idi Amin's regime as seen by his personal physician during the 1970s.,74.0,Kevin Macdonald,"['James McAvoy', 'Forest Whitaker', 'Gillian Anderson', 'Kerry Washington']",175355,2022-04-17 15:10:13.673,2022-04-17 15:10:13.673
625c2d61f0a5bc6c426c0b54,Straight Outta Compton,2015,147 min,"Biography, Drama, History",7.8,3.9561889449815366,"The rap group NWA emerges from the mean streets of Compton in Los Angeles, California, in the mid-1980s and revolutionizes Hip Hop culture with their music and tales about life in the hood.",72.0,F. Gary Gray,"[""O'Shea Jackson Jr."", 'Corey Hawkins', 'Jason Mitchell', 'Neil Brown Jr.']",179264,2022-04-17 15:08:17.891,2022-04-17 15:08:17.891
625c2b51f0a5bc6c426c06ac,The Lord of the Rings: The Fellowship of the Ring,2001,178 min,"Action, Adventure, Drama",8.8,2.4774114995908123,A meek Hobbit from the Shire and eight companions set out on a journey to destroy the powerful One Ring and save Middle-earth from the Dark Lord Sauron.,92.0,Peter Jackson,"['Elijah Wood', 'Ian McKellen', 'Orlando Bloom', 'Sean Bean']",1661481,2022-04-17 14:59:29.234,2022-04-17 14:59:29.234
625c2ddcf0a5bc6c426c0cb8,The Last Samurai,2003,154 min,"Action, Drama",7.7,0.22702538624516655,An American military advisor embraces the Samurai culture he was hired to destroy after he is captured in battle.,55.0,Edward Zwick,"['Tom Cruise', 'Ken Watanabe', 'Billy Connolly', 'William Atherton']",400049,2022-04-17 15:10:20.083,2022-04-17 15:10:20.083
625c2bf9f0a5bc6c426c07d2,Der Untergang,2004,156 min,"Biography, Drama, History",8.2,4.218486384050134,"Traudl Junge, the final secretary for Adolf Hitler, tells of the Nazi dictator's final days in his Berlin bunker at the end of WWII.",82.0,Oliver Hirschbiegel,"['Bruno Ganz', 'Alexandra Maria Lara', 'Ulrich Matthes', 'Juliane Köhler']",331308,2022-04-17 15:02:17.041,2022-04-17 15:02:17.041
