_id,title,release,duration,gerne,IMDB_Rating,rating,overview,metaScore,director,stars,noOfVotes,createdAt,updatedAt
625c2bf0f0a5bc6c426c07be,The Wolf of Wall Street,2013,180 min,"Biography, Crime, Drama",8.2,3.7408662442265115,"Based on the true story of Jordan Belfort, from his rise to a wealthy stock-broker living the high life to his fall involving crime, corruption and the federal government.",75.0,Martin Scorsese,"['Leonardo DiCaprio', 'Jonah Hill', 'Margot Robbie', 'Matthew McConaughey']",1187498,2022-04-17 15:02:08.465,2022-04-17 15:02:08.465
625c2de5f0a5bc6c426c0cea,Donnie Brasco,1997,127 min,"Biography, Crime, Drama",7.7,4.580466867972184,"An FBI undercover agent infiltrates the mob and finds himself identifying more with the mafia life, at the expense of his regular one.",76.0,Mike Newell,"['Al Pacino', 'Johnny Depp', 'Michael Madsen', 'Bruno Kirby']",279318,2022-04-17 15:10:29.698,2022-04-17 15:10:29.698
625c2c53f0a5bc6c426c08a6,In the Name of the Father,1993,133 min,"Biography, Crime, Drama",8.1,2.3257092398550547,A man's coerced confession to an I.R.A. bombing he did not commit results in the imprisonment of his father as well. An English lawyer fights to free them.,84.0,Jim Sheridan,"['Daniel Day-Lewis', 'Pete Postlethwaite', 'Alison Crosbie', 'Philip King']",156842,2022-04-17 15:03:47.946,2022-04-17 15:03:47.946
625c2e37f0a5bc6c426c0e4e,Midnight Express,1978,121 min,"Biography, Crime, Drama",7.6,2.508495387332138,"Billy Hayes, an American college student, is caught smuggling drugs out of Turkey and thrown into prison.",59.0,Alan Parker,"['Brad Davis', 'Irene Miracle', 'Bo Hopkins', 'Paolo Bonacelli']",73662,2022-04-17 15:11:51.736,2022-04-17 15:11:51.736
625c2cdff0a5bc6c426c09d8,Dog Day Afternoon,1975,125 min,"Biography, Crime, Drama",8.0,0.0152864562452526,"Three amateur bank robbers plan to hold up a bank. A nice simple robbery: Walk in, take the money, and run. Unfortunately, the supposedly uncomplicated heist suddenly becomes a bizarre nightmare as everything that could go wrong does.",86.0,Sidney Lumet,"['Al Pacino', 'John Cazale', 'Penelope Allen', 'Sully Boyar']",235652,2022-04-17 15:06:07.690,2022-04-17 15:06:07.690
625c2d77f0a5bc6c426c0b74,American Gangster,2007,157 min,"Biography, Crime, Drama",7.8,1.1277604495050264,"An outcast New York City cop is charged with bringing down Harlem drug lord Frank Lucas, whose real life inspired this partly biographical film.",76.0,Ridley Scott,"['Denzel Washington', 'Russell Crowe', 'Chiwetel Ejiofor', 'Josh Brolin']",392449,2022-04-17 15:08:39.184,2022-04-17 15:08:39.184
625c2d10f0a5bc6c426c0a60,The Irishman,2019,209 min,"Biography, Crime, Drama",7.9,1.376115076036012,"An old man recalls his time painting houses for his friend, Jimmy Hoffa, through the 1950-70s.",94.0,Martin Scorsese,"['Robert De Niro', 'Al Pacino', 'Joe Pesci', 'Harvey Keitel']",324720,2022-04-17 15:06:56.689,2022-04-17 15:06:56.689
625c2dfaf0a5bc6c426c0d3a,Serpico,1973,130 min,"Biography, Crime, Drama",7.7,1.064349282245547,An honest New York cop named Frank Serpico blows the whistle on rampant corruption in the force only to have his comrades turn against him.,87.0,Sidney Lumet,"['Al Pacino', 'John Randolph', 'Jack Kehoe', 'Biff McGuire']",109941,2022-04-17 15:10:50.613,2022-04-17 15:10:50.613
625c2b57f0a5bc6c426c06b6,Goodfellas,1990,146 min,"Biography, Crime, Drama",8.7,0.9320208590213308,"The story of Henry Hill and his life in the mob, covering his relationship with his wife Karen Hill and his mob partners Jimmy Conway and Tommy DeVito in the Italian-American crime syndicate.",90.0,Martin Scorsese,"['Robert De Niro', 'Ray Liotta', 'Joe Pesci', 'Lorraine Bracco']",1020727,2022-04-17 14:59:35.256,2022-04-17 14:59:35.256
625c2c2cf0a5bc6c426c084c,Spotlight,2015,129 min,"Biography, Crime, Drama",8.1,3.2704524436781335,"The true story of how the Boston Globe uncovered the massive scandal of child molestation and cover-up within the local Catholic Archdiocese, shaking the entire Catholic Church to its core.",93.0,Tom McCarthy,"['Mark Ruffalo', 'Michael Keaton', 'Rachel McAdams', 'Liev Schreiber']",420316,2022-04-17 15:03:08.199,2022-04-17 15:03:08.199
625c2dcbf0a5bc6c426c0c70,The Social Network,2010,120 min,"Biography, Drama",7.7,4.395263656276355,"As Harvard student Mark Zuckerberg creates the social networking site that would become known as Facebook, he is sued by the twins who claimed he stole their idea, and by the co-founder who was later squeezed out of the business.",95.0,David Fincher,"['Jesse Eisenberg', 'Andrew Garfield', 'Justin Timberlake', 'Rooney Mara']",624982,2022-04-17 15:10:03.900,2022-04-17 15:10:03.900
625c2d61f0a5bc6c426c0b54,Straight Outta Compton,2015,147 min,"Biography, Drama, History",7.8,3.9561889449815366,"The rap group NWA emerges from the mean streets of Compton in Los Angeles, California, in the mid-1980s and revolutionizes Hip Hop culture with their music and tales about life in the hood.",72.0,F. Gary Gray,"[""O'Shea Jackson Jr."", 'Corey Hawkins', 'Jason Mitchell', 'Neil Brown Jr.']",179264,2022-04-17 15:08:17.891,2022-04-17 15:08:17.891
625c2e24f0a5bc6c426c0dce,La Vie En Rose,2007,140 min,"Biography, Drama, Music",7.6,1.4344738995326378,"Biopic of the iconic French singer Édith Piaf. Raised by her grandmother in a brothel, she was discovered while singing on a street corner at the age of 19. Despite her success, Piaf's life was filled with tragedy.",66.0,Olivier Dahan,"['Marion Cotillard', 'Sylvie Testud', 'Pascal Greggory', 'Emmanuelle Seigner']",82781,2022-04-17 15:11:32.339,2022-04-17 15:11:32.339
625c2c45f0a5bc6c426c087e,Catch Me If You Can,2002,141 min,"Biography, Crime, Drama",8.1,2.890379134405502,"Barely 21 yet, Frank is a skilled forger who has passed as a doctor, lawyer and pilot. FBI agent Carl becomes obsessed with tracking down the con man, who only revels in the pursuit.",75.0,Steven Spielberg,"['Leonardo DiCaprio', 'Tom Hanks', 'Christopher Walken', 'Martin Sheen']",832846,2022-04-17 15:03:33.282,2022-04-17 15:03:33.282
625c2d34f0a5bc6c426c0ab2,My Left Foot: The Story of Christy Brown,1989,103 min,"Biography, Drama",7.9,1.424539878025325,"Christy Brown, born with cerebral palsy, learns to paint and write with his only controllable limb - his left foot.",97.0,Jim Sheridan,"['Daniel Day-Lewis', 'Brenda Fricker', 'Alison Whelan', 'Kirsten Sheridan']",68076,2022-04-17 15:07:32.808,2022-04-17 15:07:32.808
625c2c59f0a5bc6c426c08c0,The Elephant Man,1980,124 min,"Biography, Drama",8.1,2.1047841672380105,"A Victorian surgeon rescues a heavily disfigured man who is mistreated while scraping a living as a side-show freak. Behind his monstrous façade, there is revealed a person of kindness, intelligence and sophistication.",78.0,David Lynch,"['Anthony Hopkins', 'John Hurt', 'Anne Bancroft', 'John Gielgud']",220078,2022-04-17 15:03:53.231,2022-04-17 15:03:53.231
625c2dd6f0a5bc6c426c0c98,Lucky Number Slevin,2006,110 min,"Action, Crime, Drama",7.7,0.6850494718156053,"A case of mistaken identity lands Slevin into the middle of a war being plotted by two of the city's most rival crime bosses. Under constant surveillance by Detective Brikowski and assassin Goodkat, he must get them before they get him.",53.0,Paul McGuigan,"['Josh Hartnett', 'Ben Kingsley', 'Morgan Freeman', 'Lucy Liu']",299524,2022-04-17 15:10:14.074,2022-04-17 15:10:14.074
625c2d5ff0a5bc6c426c0b48,The Big Short,2015,130 min,"Biography, Comedy, Drama",7.8,2.5633051372083413,In 2006-2007 a group of investors bet against the US mortgage market. In their research they discover how flawed and corrupt the market is.,81.0,Adam McKay,"['Christian Bale', 'Steve Carell', 'Ryan Gosling', 'Brad Pitt']",362942,2022-04-17 15:08:15.397,2022-04-17 15:08:15.397
625c2ce2f0a5bc6c426c09dc,Papillon,1973,151 min,"Biography, Crime, Drama",8.0,4.79559527106749,"A man befriends a fellow criminal as the two of them begin serving their sentence on a dreadful prison island, which inspires the man to plot his escape.",58.0,Franklin J. Schaffner,"['Steve McQueen', 'Dustin Hoffman', 'Victor Jory', 'Don Gordon']",121627,2022-04-17 15:06:10.018,2022-04-17 15:06:10.018
625c2ccef0a5bc6c426c099a,The Straight Story,1999,112 min,"Biography, Drama",8.0,1.6968238998981777,An old man makes a long journey by lawnmower to mend his relationship with an ill brother.,86.0,David Lynch,"['Richard Farnsworth', 'Sissy Spacek', 'Jane Galloway Heitz', 'Joseph A. Carpenter']",82002,2022-04-17 15:05:50.833,2022-04-17 15:05:50.833
