_id,title,release,duration,gerne,IMDB_Rating,rating,overview,metaScore,director,stars,noOfVotes,createdAt,updatedAt
625c2c75f0a5bc6c426c0902,The Third Man,1949,104 min,"Film-Noir, Mystery, Thriller",8.1,3.517676385577837,"Pulp novelist Holly Martins travels to shadowy, postwar Vienna, only to find himself investigating the mysterious death of an old friend, Harry Lime.",97.0,Carol Reed,"['Orson Welles', 'Joseph Cotten', 'Alida Valli', 'Trevor Howard']",158731,2022-04-17 15:04:21.670,2022-04-17 15:04:21.670
625c2c49f0a5bc6c426c0888,The Sixth Sense,1999,107 min,"Drama, Mystery, Thriller",8.1,0.29274374703442185,A boy who communicates with spirits seeks the help of a disheartened child psychologist.,64.0,M. Night Shyamalan,"['Bruce Willis', 'Haley Joel Osment', 'Toni Collette', 'Olivia Williams']",911573,2022-04-17 15:03:37.072,2022-04-17 15:03:37.072
625c2b6ef0a5bc6c426c06ea,The Usual Suspects,1995,106 min,"Crime, Mystery, Thriller",8.5,0.5506738739146932,"A sole survivor tells of the twisty events leading up to a horrific gun battle on a boat, which began when five criminals met at a seemingly random police lineup.",77.0,Bryan Singer,"['Kevin Spacey', 'Gabriel Byrne', 'Chazz Palminteri', 'Stephen Baldwin']",991208,2022-04-17 14:59:58.362,2022-04-17 14:59:58.362
625c2cc2f0a5bc6c426c096c,The Bourne Ultimatum,2007,115 min,"Action, Mystery, Thriller",8.0,4.986239548051403,Jason Bourne dodges a ruthless C.I.A. official and his Agents from a new assassination program while searching for the origins of his life as a trained killer.,85.0,Paul Greengrass,"['Matt Damon', 'Edgar Ramírez', 'Joan Allen', 'Julia Stiles']",604694,2022-04-17 15:05:38.941,2022-04-17 15:05:38.941
625c2b6cf0a5bc6c426c06e0,The Prestige,2006,130 min,"Drama, Mystery, Sci-Fi",8.5,0.1261262535588925,"After a tragic accident, two stage magicians engage in a battle to create the ultimate illusion while sacrificing everything they have to outwit each other.",66.0,Christopher Nolan,"['Christian Bale', 'Hugh Jackman', 'Scarlett Johansson', 'Michael Caine']",1190259,2022-04-17 14:59:56.091,2022-04-17 14:59:56.091
625c2d57f0a5bc6c426c0b28,The Hateful Eight,2015,168 min,"Crime, Drama, Mystery",7.8,1.5927685431898764,"In the dead of a Wyoming winter, a bounty hunter and his prisoner find shelter in a cabin currently inhabited by a collection of nefarious characters.",68.0,Quentin Tarantino,"['Samuel L. Jackson', 'Kurt Russell', 'Jennifer Jason Leigh', 'Walton Goggins']",517059,2022-04-17 15:08:07.632,2022-04-17 15:08:07.632
625c2e24f0a5bc6c426c0dd2,The Illusionist,2006,110 min,"Drama, Fantasy, Mystery",7.6,2.1588815784828306,"In turn-of-the-century Vienna, a magician uses his abilities to secure the love of a woman far above his social standing.",68.0,Neil Burger,"['Edward Norton', 'Jessica Biel', 'Paul Giamatti', 'Rufus Sewell']",354728,2022-04-17 15:11:32.744,2022-04-17 15:11:32.744
625c2d8ef0a5bc6c426c0bb6,The Game,1997,129 min,"Action, Drama, Mystery",7.8,2.68388931315097,"After a wealthy banker is given an opportunity to participate in a mysterious game, his life is turned upside down when he becomes unable to distinguish between the game and reality.",61.0,David Fincher,"['Michael Douglas', 'Deborah Kara Unger', 'Sean Penn', 'James Rebhorn']",345096,2022-04-17 15:09:02.279,2022-04-17 15:09:02.279
625c2df3f0a5bc6c426c0d1c,Blue Velvet,1986,120 min,"Drama, Mystery, Thriller",7.7,1.4546634168008121,"The discovery of a severed human ear found in a field leads a young man on an investigation related to a beautiful, mysterious nightclub singer and a group of psychopathic criminals who have kidnapped her child.",76.0,David Lynch,"['Isabella Rossellini', 'Kyle MacLachlan', 'Dennis Hopper', 'Laura Dern']",181285,2022-04-17 15:10:43.527,2022-04-17 15:10:43.527
625c2df3f0a5bc6c426c0d1a,Der Name der Rose,1986,130 min,"Crime, Drama, Mystery",7.7,4.433988159634847,An intellectually nonconformist friar investigates a series of mysterious deaths in an isolated abbey.,54.0,Jean-Jacques Annaud,"['Sean Connery', 'Christian Slater', 'Helmut Qualtinger', 'Elya Baskin']",102031,2022-04-17 15:10:43.316,2022-04-17 15:10:43.316
625c2cf3f0a5bc6c426c0a30,The Thin Man,1934,91 min,"Comedy, Crime, Mystery",8.0,2.6256588020968454,"Former detective Nick Charles and his wealthy wife Nora investigate a murder case, mostly for the fun of it.",86.0,W.S. Van Dyke,"['William Powell', 'Myrna Loy', ""Maureen O'Sullivan"", 'Nat Pendleton']",26642,2022-04-17 15:06:27.272,2022-04-17 15:06:27.272
625c2c57f0a5bc6c426c08b6,The Thing,1982,109 min,"Horror, Mystery, Sci-Fi",8.1,1.4454344869499203,A research team in Antarctica is hunted by a shape-shifting alien that assumes the appearance of its victims.,57.0,John Carpenter,"['Kurt Russell', 'Wilford Brimley', 'Keith David', 'Richard Masur']",371271,2022-04-17 15:03:51.130,2022-04-17 15:03:51.130
625c2e2af0a5bc6c426c0e00,The Others,2001,101 min,"Horror, Mystery, Thriller",7.6,0.6620977419123497,A woman who lives in her darkened old family house with her two photosensitive children becomes convinced that the home is haunted.,74.0,Alejandro Amenábar,"['Nicole Kidman', 'Christopher Eccleston', 'Fionnula Flanagan', 'Alakina Mann']",337651,2022-04-17 15:11:38.995,2022-04-17 15:11:38.995
625c2e00f0a5bc6c426c0d54,The Birds,1963,119 min,"Drama, Horror, Mystery",7.7,4.449730160793268,A wealthy San Francisco socialite pursues a potential boyfriend to a small Northern California town that slowly takes a turn for the bizarre when birds of all kinds suddenly begin to attack people.,90.0,Alfred Hitchcock,"['Rod Taylor', 'Tippi Hedren', 'Jessica Tandy', 'Suzanne Pleshette']",171739,2022-04-17 15:10:56.053,2022-04-17 15:10:56.053
625c2da4f0a5bc6c426c0c02,The Conversation,1974,113 min,"Drama, Mystery, Thriller",7.8,1.7054814445563382,"A paranoid, secretive surveillance expert has a crisis of conscience when he suspects that the couple he is spying on will be murdered.",85.0,Francis Ford Coppola,"['Gene Hackman', 'John Cazale', 'Allen Garfield', 'Frederic Forrest']",98611,2022-04-17 15:09:24.759,2022-04-17 15:09:24.759
625c2deef0a5bc6c426c0d06,Glengarry Glen Ross,1992,100 min,"Crime, Drama, Mystery",7.7,0.002808918853294262,An examination of the machinations behind the scenes at a real estate office.,82.0,James Foley,"['Al Pacino', 'Jack Lemmon', 'Alec Baldwin', 'Alan Arkin']",95826,2022-04-17 15:10:38.259,2022-04-17 15:10:38.259
625c2ddaf0a5bc6c426c0caa,The Bourne Supremacy,2004,108 min,"Action, Mystery, Thriller",7.7,0.9087410608416424,"When Jason Bourne is framed for a CIA operation gone awry, he is forced to resume his former life as a trained assassin to survive.",73.0,Paul Greengrass,"['Matt Damon', 'Franka Potente', 'Joan Allen', 'Brian Cox']",434841,2022-04-17 15:10:18.195,2022-04-17 15:10:18.195
625c2d5cf0a5bc6c426c0b30,Le passé,2013,130 min,"Drama, Mystery",7.8,3.300216530511256,"An Iranian man deserts his French wife and her two children to return to his homeland. Meanwhile, his wife starts up a new relationship, a reality her husband confronts upon his wife's request for a divorce.",85.0,Asghar Farhadi,"['Bérénice Bejo', 'Tahar Rahim', 'Ali Mosaffa', 'Pauline Burlet']",45002,2022-04-17 15:08:12.070,2022-04-17 15:08:12.070
625c2bd7f0a5bc6c426c0790,Citizen Kane,1941,119 min,"Drama, Mystery",8.3,0.710381138172278,"Following the death of publishing tycoon Charles Foster Kane, reporters scramble to uncover the meaning of his final utterance; 'Rosebud'.",100.0,Orson Welles,"['Orson Welles', 'Joseph Cotten', 'Dorothy Comingore', 'Agnes Moorehead']",403351,2022-04-17 15:01:43.824,2022-04-17 15:01:43.824
625c2d49f0a5bc6c426c0af8,The Big Sleep,1946,114 min,"Crime, Film-Noir, Mystery",7.9,1.3577296863825428,"Private detective Philip Marlowe is hired by a wealthy family. Before the complex case is over, he's seen murder, blackmail, and what might be love.",,Howard Hawks,"['Humphrey Bogart', 'Lauren Bacall', 'John Ridgely', 'Martha Vickers']",78796,2022-04-17 15:07:53.557,2022-04-17 15:07:53.557
