_id,title,release,duration,gerne,IMDB_Rating,rating,overview,metaScore,director,stars,noOfVotes,createdAt,updatedAt
625c2ddcf0a5bc6c426c0cbe,In America,2002,105 min,Drama,7.7,3.8852672599202243,A family of Irish immigrants adjust to life on the mean streets of Hell's Kitchen while also grieving the death of a child.,76.0,Jim Sheridan,"['Paddy Considine', 'Samantha Morton', 'Djimon Hounsou', 'Sarah Bolger']",40403,2022-04-17 15:10:20.812,2022-04-17 15:10:20.812
625c2cedf0a5bc6c426c0a06,Cat on a Hot Tin Roof,1958,108 min,Drama,8.0,2.822216147247852,Brick is an alcoholic ex-football player who drinks his days away and resists the affections of his wife. A reunion with his terminal father jogs a host of memories and revelations for both father and son.,84.0,Richard Brooks,"['Elizabeth Taylor', 'Paul Newman', 'Burl Ives', 'Jack Carson']",45062,2022-04-17 15:06:21.724,2022-04-17 15:06:21.724
625c2c1df0a5bc6c426c0834,Kis Uykusu,2014,196 min,Drama,8.1,3.657784455182517,A hotel owner and landlord in a remote Turkish village deals with conflicts within his family and a tenant behind on his rent.,88.0,Nuri Bilge Ceylan,"['Haluk Bilginer', 'Melisa Sözen', 'Demet Akbag', 'Ayberk Pekcan']",46547,2022-04-17 15:02:53.621,2022-04-17 15:02:53.621
625c2cd0f0a5bc6c426c09a6,Sling Blade,1996,135 min,Drama,8.0,0.21053433873782001,"Karl Childers, a simple man hospitalized since his childhood murder of his mother and her lover, is released to start a new life in a small town.",84.0,Billy Bob Thornton,"['Billy Bob Thornton', 'Dwight Yoakam', 'J.T. Walsh', 'John Ritter']",86838,2022-04-17 15:05:52.184,2022-04-17 15:05:52.184
625c2d54f0a5bc6c426c0b20,Manchester by the Sea,2016,137 min,Drama,7.8,3.4604231350642323,A depressed uncle is asked to take care of his teenage nephew after the boy's father dies.,96.0,Kenneth Lonergan,"['Casey Affleck', 'Michelle Williams', 'Kyle Chandler', 'Lucas Hedges']",246963,2022-04-17 15:08:04.754,2022-04-17 15:08:04.754
625c2b5cf0a5bc6c426c06c0,Soorarai Pottru,2020,153 min,Drama,8.6,4.333727614180858,"Nedumaaran Rajangam ""Maara"" sets out to make the common man fly and in the process takes on the world's most capital intensive industry and several enemies who stand in his way.",,Sudha Kongara,"['Suriya', 'Madhavan', 'Paresh Rawal', 'Aparna Balamurali']",54995,2022-04-17 14:59:40.370,2022-04-17 14:59:40.370
625c2e08f0a5bc6c426c0d7a,The Florida Project,2017,111 min,Drama,7.6,4.2017898791249255,"Set over one summer, the film follows precocious six-year-old Moonee as she courts mischief and adventure with her ragtag playmates and bonds with her rebellious but caring mother, all while living in the shadows of Walt Disney World.",92.0,Sean Baker,"['Brooklynn Prince', 'Bria Vinaite', 'Willem Dafoe', 'Christopher Rivera']",95181,2022-04-17 15:11:04.601,2022-04-17 15:11:04.601
625c2bc9f0a5bc6c426c0768,Full Metal Jacket,1987,116 min,"Drama, War",8.3,3.5406088506166844,A pragmatic U.S. Marine observes the dehumanizing effects the Vietnam War has on his fellow recruits from their brutal boot camp training to the bloody street fighting in Hue.,76.0,Stanley Kubrick,"['Matthew Modine', 'R. Lee Ermey', ""Vincent D'Onofrio"", 'Adam Baldwin']",675146,2022-04-17 15:01:29.583,2022-04-17 15:01:29.583
625c2c74f0a5bc6c426c08fe,Ace in the Hole,1951,111 min,"Drama, Film-Noir",8.1,0.516348350253335,"A frustrated former big-city journalist now stuck working for an Albuquerque newspaper exploits a story about a man trapped in a cave to rekindle his career, but the situation quickly escalates into an out-of-control circus.",72.0,Billy Wilder,"['Kirk Douglas', 'Jan Sterling', 'Robert Arthur', 'Porter Hall']",31568,2022-04-17 15:04:20.214,2022-04-17 15:04:20.214
625c2d67f0a5bc6c426c0b68,The Boy in the Striped Pyjamas,2008,94 min,"Drama, History, War",7.8,3.099492184772561,"Through the innocent eyes of Bruno, the eight-year-old son of the commandant at a German concentration camp, a forbidden friendship with a Jewish boy on the other side of the camp fence has startling and unexpected consequences.",55.0,Mark Herman,"['Asa Butterfield', 'David Thewlis', 'Rupert Friend', ""Zac Mattoon O'Brien""]",190748,2022-04-17 15:08:23.116,2022-04-17 15:08:23.116
625c2b54f0a5bc6c426c06ae,Forrest Gump,1994,142 min,"Drama, Romance",8.8,4.476678813544045,"The presidencies of Kennedy and Johnson, the events of Vietnam, Watergate and other historical events unfold through the perspective of an Alabama man with an IQ of 75, whose only desire is to be reunited with his childhood sweetheart.",82.0,Robert Zemeckis,"['Tom Hanks', 'Robin Wright', 'Gary Sinise', 'Sally Field']",1809221,2022-04-17 14:59:32.773,2022-04-17 14:59:32.773
625c2cd4f0a5bc6c426c09c0,Rain Man,1988,133 min,Drama,8.0,1.7469463745237956,Selfish yuppie Charlie Babbitt's father left a fortune to his savant brother Raymond and a pittance to Charlie; they travel cross-country.,65.0,Barry Levinson,"['Dustin Hoffman', 'Tom Cruise', 'Valeria Golino', 'Gerald R. Molen']",473064,2022-04-17 15:05:56.706,2022-04-17 15:05:56.706
625c2bc5f0a5bc6c426c075c,American Beauty,1999,122 min,Drama,8.3,3.079981612315301,A sexually frustrated suburban father has a mid-life crisis after becoming infatuated with his daughter's best friend.,84.0,Sam Mendes,"['Kevin Spacey', 'Annette Bening', 'Thora Birch', 'Wes Bentley']",1069738,2022-04-17 15:01:25.820,2022-04-17 15:01:25.820
625c2daef0a5bc6c426c0c0e,Midnight Cowboy,1969,113 min,Drama,7.8,4.224138388021959,"A naive hustler travels from Texas to New York City to seek personal fortune, finding a new friend in the process.",79.0,John Schlesinger,"['Dustin Hoffman', 'Jon Voight', 'Sylvia Miles', 'John McGiver']",101124,2022-04-17 15:09:34.643,2022-04-17 15:09:34.643
625c2d3cf0a5bc6c426c0ae0,The Manchurian Candidate,1962,126 min,"Drama, Thriller",7.9,4.913912769025664,A former prisoner of war is brainwashed as an unwitting assassin for an international Communist conspiracy.,94.0,John Frankenheimer,"['Frank Sinatra', 'Laurence Harvey', 'Janet Leigh', 'Angela Lansbury']",71122,2022-04-17 15:07:40.671,2022-04-17 15:07:40.671
625c2e38f0a5bc6c426c0e50,Close Encounters of the Third Kind,1977,138 min,"Drama, Sci-Fi",7.6,3.8491081058614585,"Roy Neary, an electric lineman, watches how his quiet and ordinary daily life turns upside down after a close encounter with a UFO.",90.0,Steven Spielberg,"['Richard Dreyfuss', 'François Truffaut', 'Teri Garr', 'Melinda Dillon']",184966,2022-04-17 15:11:52.513,2022-04-17 15:11:52.513
625c2df5f0a5bc6c426c0d2a,Ordinary People,1980,124 min,Drama,7.7,3.4760837368322015,"The accidental death of the older son of an affluent family deeply strains the relationships among the bitter mother, the good-natured father, and the guilt-ridden younger son.",86.0,Robert Redford,"['Donald Sutherland', 'Mary Tyler Moore', 'Judd Hirsch', 'Timothy Hutton']",47099,2022-04-17 15:10:45.524,2022-04-17 15:10:45.524
625c2ddff0a5bc6c426c0cca,Billy Elliot,2000,110 min,"Drama, Music",7.7,4.639187099643237,A talented young boy becomes torn between his unexpected love of dance and the disintegration of his family.,74.0,Stephen Daldry,"['Jamie Bell', 'Julie Walters', 'Jean Heywood', 'Jamie Draven']",126770,2022-04-17 15:10:23.031,2022-04-17 15:10:23.031
625c2c34f0a5bc6c426c085a,Gran Torino,2008,116 min,Drama,8.1,0.9276259140771848,"Disgruntled Korean War veteran Walt Kowalski sets out to reform his neighbor, Thao Lor, a Hmong teenager who tried to steal Kowalski's prized possession: a 1972 Gran Torino.",72.0,Clint Eastwood,"['Clint Eastwood', 'Bee Vang', 'Christopher Carley', 'Ahney Her']",720450,2022-04-17 15:03:16.928,2022-04-17 15:03:16.928
625c2cf3f0a5bc6c426c0a32,All Quiet on the Western Front,1930,152 min,"Drama, War",8.0,1.6417383769874638,"A German youth eagerly enters World War I, but his enthusiasm wanes as he gets a firsthand view of the horror.",91.0,Lewis Milestone,"['Lew Ayres', 'Louis Wolheim', 'John Wray', 'Arnold Lucy']",57318,2022-04-17 15:06:27.885,2022-04-17 15:06:27.885
