_id,title,release,duration,gerne,IMDB_Rating,rating,overview,metaScore,director,stars,noOfVotes,createdAt,updatedAt
625c2d60f0a5bc6c426c0b4a,Kokuhaku,2010,106 min,"Drama, Thriller",7.8,0.43141034546324675,A psychological thriller of a grieving mother turned cold-blooded avenger with a twisty master plan to pay back those who were responsible for her daughter's death.,,Tetsuya Nakashima,"['Takako Matsu', 'Yoshino Kimura', 'Masaki Okada', 'Yukito Nishii']",35713,2022-04-17 15:08:16.190,2022-04-17 15:08:16.190
625c2d95f0a5bc6c426c0bd4,Misery,1990,107 min,"Drama, Thriller",7.8,1.598151357874239,"After a famous author is rescued from a car crash by a fan of his novels, he comes to realize that the care he is receiving is only the beginning of a nightmare of captivity and abuse.",75.0,Rob Reiner,"['James Caan', 'Kathy Bates', 'Richard Farnsworth', 'Frances Sternhagen']",184740,2022-04-17 15:09:09.722,2022-04-17 15:09:09.722
625c2c14f0a5bc6c426c0820,Pink,2016,136 min,"Drama, Thriller",8.1,1.2628514215356423,"When three young women are implicated in a crime, a retired lawyer steps forward to help them clear their names.",,Aniruddha Roy Chowdhury,"['Taapsee Pannu', 'Amitabh Bachchan', 'Kirti Kulhari', 'Andrea Tariang']",39216,2022-04-17 15:02:44.439,2022-04-17 15:02:44.439
625c2d8df0a5bc6c426c0bb4,Gattaca,1997,106 min,"Drama, Sci-Fi, Thriller",7.8,2.311791246259214,A genetically inferior man assumes the identity of a superior one in order to pursue his lifelong dream of space travel.,64.0,Andrew Niccol,"['Ethan Hawke', 'Uma Thurman', 'Jude Law', 'Gore Vidal']",280845,2022-04-17 15:09:01.127,2022-04-17 15:09:01.127
625c2c69f0a5bc6c426c08da,Persona,1966,85 min,"Drama, Thriller",8.1,4.735803559644992,A nurse is put in charge of a mute actress and finds that their personae are melding together.,86.0,Ingmar Bergman,"['Bibi Andersson', 'Liv Ullmann', 'Margaretha Krook', 'Gunnar Björnstrand']",103191,2022-04-17 15:04:09.608,2022-04-17 15:04:09.608
625c2dfff0a5bc6c426c0d4e,Repulsion,1965,105 min,"Drama, Horror, Thriller",7.7,3.282629877129941,A sex-repulsed woman who disapproves of her sister's boyfriend sinks into depression and has horrific visions of rape and violence.,91.0,Roman Polanski,"['Catherine Deneuve', 'Ian Hendry', 'John Fraser', 'Yvonne Furneaux']",48883,2022-04-17 15:10:55.374,2022-04-17 15:10:55.374
625c2cbff0a5bc6c426c095e,Black Swan,2010,108 min,"Drama, Thriller",8.0,3.4936288956322725,"A committed dancer struggles to maintain her sanity after winning the lead role in a production of Tchaikovsky's ""Swan Lake"".",79.0,Darren Aronofsky,"['Natalie Portman', 'Mila Kunis', 'Vincent Cassel', 'Winona Ryder']",699673,2022-04-17 15:05:35.684,2022-04-17 15:05:35.684
625c2c61f0a5bc6c426c08ce,Chinatown,1974,130 min,"Drama, Mystery, Thriller",8.1,0.7281021825703771,"A private detective hired to expose an adulterer finds himself caught up in a web of deceit, corruption, and murder.",92.0,Roman Polanski,"['Jack Nicholson', 'Faye Dunaway', 'John Huston', 'Perry Lopez']",294230,2022-04-17 15:04:01.280,2022-04-17 15:04:01.280
625c2d2df0a5bc6c426c0a9e,Mulholland Dr.,2001,147 min,"Drama, Mystery, Thriller",7.9,2.783593158371893,"After a car wreck on the winding Mulholland Drive renders a woman amnesiac, she and a perky Hollywood-hopeful search for clues and answers across Los Angeles in a twisting venture beyond dreams and reality.",85.0,David Lynch,"['Naomi Watts', 'Laura Harring', 'Justin Theroux', 'Jeanne Bates']",322031,2022-04-17 15:07:25.559,2022-04-17 15:07:25.559
625c2c1ff0a5bc6c426c083c,Gone Girl,2014,149 min,"Drama, Mystery, Thriller",8.1,1.7483286389528752,"With his wife's disappearance having become the focus of an intense media circus, a man sees the spotlight turned on him when it's suspected that he may not be innocent.",79.0,David Fincher,"['Ben Affleck', 'Rosamund Pike', 'Neil Patrick Harris', 'Tyler Perry']",859695,2022-04-17 15:02:55.897,2022-04-17 15:02:55.897
625c2e18f0a5bc6c426c0dba,Die Welle,2008,107 min,"Drama, Thriller",7.6,3.100002143130325,A high school teacher's experiment to demonstrate to his students what life is like under a dictatorship spins horribly out of control when he forms a social unit with a life of its own.,,Dennis Gansel,"['Jürgen Vogel', 'Frederick Lau', 'Max Riemelt', 'Jennifer Ulrich']",102742,2022-04-17 15:11:20.064,2022-04-17 15:11:20.064
625c2d46f0a5bc6c426c0aee,High Noon,1952,85 min,"Drama, Thriller, Western",7.9,1.2780236168447923,"A town Marshal, despite the disagreements of his newlywed bride and the townspeople around him, must face a gang of deadly killers alone at high noon when the gang leader, an outlaw he sent up years ago, arrives on the noon train.",89.0,Fred Zinnemann,"['Gary Cooper', 'Grace Kelly', 'Thomas Mitchell', 'Lloyd Bridges']",97222,2022-04-17 15:07:50.527,2022-04-17 15:07:50.527
625c2cf4f0a5bc6c426c0a34,Bronenosets Potemkin,1925,75 min,"Drama, History, Thriller",8.0,2.1443964747789557,"In the midst of the Russian Revolution of 1905, the crew of the battleship Potemkin mutiny against the brutal, tyrannical regime of the vessel's officers. The resulting street demonstration in Odessa brings on a police massacre.",97.0,Sergei M. Eisenstein,"['Aleksandr Antonov', 'Vladimir Barskiy', 'Grigoriy Aleksandrov', 'Ivan Bobrov']",53054,2022-04-17 15:06:28.685,2022-04-17 15:06:28.685
625c2bcaf0a5bc6c426c076a,Idi i smotri,1985,142 min,"Drama, Thriller, War",8.3,0.8470361270378635,"After finding an old rifle, a young boy joins the Soviet resistance movement against ruthless German forces and experiences the horrors of World War II.",,Elem Klimov,"['Aleksey Kravchenko', 'Olga Mironova', 'Liubomiras Laucevicius', 'Vladas Bagdonas']",59056,2022-04-17 15:01:30.340,2022-04-17 15:01:30.340
625c2df3f0a5bc6c426c0d1c,Blue Velvet,1986,120 min,"Drama, Mystery, Thriller",7.7,1.4546634168008121,"The discovery of a severed human ear found in a field leads a young man on an investigation related to a beautiful, mysterious nightclub singer and a group of psychopathic criminals who have kidnapped her child.",76.0,David Lynch,"['Isabella Rossellini', 'Kyle MacLachlan', 'Dennis Hopper', 'Laura Dern']",181285,2022-04-17 15:10:43.527,2022-04-17 15:10:43.527
625c2df7f0a5bc6c426c0d32,Le locataire,1976,126 min,"Drama, Thriller",7.7,2.5955015768692933,A bureaucrat rents a Paris apartment where he finds himself drawn into a rabbit hole of dangerous paranoia.,71.0,Roman Polanski,"['Roman Polanski', 'Isabelle Adjani', 'Melvyn Douglas', 'Jo Van Fleet']",39889,2022-04-17 15:10:47.554,2022-04-17 15:10:47.554
625c2dd4f0a5bc6c426c0c90,Ex Machina,2014,108 min,"Drama, Sci-Fi, Thriller",7.7,1.7764413311231964,A young programmer is selected to participate in a ground-breaking experiment in synthetic intelligence by evaluating the human qualities of a highly advanced humanoid A.I.,78.0,Alex Garland,"['Alicia Vikander', 'Domhnall Gleeson', 'Oscar Isaac', 'Sonoya Mizuno']",474141,2022-04-17 15:10:12.681,2022-04-17 15:10:12.681
625c2e07f0a5bc6c426c0d74,Searching,2018,102 min,"Drama, Mystery, Thriller",7.6,0.7811960992095257,"After his teenage daughter goes missing, a desperate father tries to find clues on her laptop.",71.0,Aneesh Chaganty,"['John Cho', 'Debra Messing', 'Joseph Lee', 'Michelle La']",140840,2022-04-17 15:11:03.567,2022-04-17 15:11:03.567
625c2dcbf0a5bc6c426c0c6a,Gravity,2013,91 min,"Drama, Sci-Fi, Thriller",7.7,3.7862962570043326,Two astronauts work together to survive after an accident leaves them stranded in space.,96.0,Alfonso Cuarón,"['Sandra Bullock', 'George Clooney', 'Ed Harris', 'Orto Ignatiussen']",769145,2022-04-17 15:10:03.267,2022-04-17 15:10:03.267
625c2d3cf0a5bc6c426c0ae0,The Manchurian Candidate,1962,126 min,"Drama, Thriller",7.9,4.913912769025664,A former prisoner of war is brainwashed as an unwitting assassin for an international Communist conspiracy.,94.0,John Frankenheimer,"['Frank Sinatra', 'Laurence Harvey', 'Janet Leigh', 'Angela Lansbury']",71122,2022-04-17 15:07:40.671,2022-04-17 15:07:40.671
