_id,title,release,duration,gerne,IMDB_Rating,rating,overview,metaScore,director,stars,noOfVotes,createdAt,updatedAt
625c2b5af0a5bc6c426c06be,Gisaengchung,2019,132 min,"Comedy, Drama, Thriller",8.6,3.560072324027954,Greed and class discrimination threaten the newly formed symbiotic relationship between the wealthy Park family and the destitute Kim clan.,96.0,Bong Joon Ho,"['Kang-ho Song', 'Lee Sun-kyun', 'Cho Yeo-jeong', 'Choi Woo-sik']",552778,2022-04-17 14:59:38.461,2022-04-17 14:59:38.461
625c2deef0a5bc6c426c0d0c,Barton Fink,1991,116 min,"Comedy, Drama, Thriller",7.7,4.833752045658408,A renowned New York playwright is enticed to California to write for the movies and discovers the hellish truth of Hollywood.,69.0,Joel Coen,"['Ethan Coen', 'John Turturro', 'John Goodman', 'Judy Davis']",113240,2022-04-17 15:10:38.872,2022-04-17 15:10:38.872
625c2d51f0a5bc6c426c0b14,Perfetti sconosciuti,2016,96 min,"Comedy, Drama",7.8,1.357510889281348,"Seven long-time friends get together for a dinner. When they decide to share with each other the content of every text message, email and phone call they receive, many secrets start to unveil and the equilibrium trembles.",,Paolo Genovese,"['Giuseppe Battiston', 'Anna Foglietta', 'Marco Giallini', 'Edoardo Leo']",57168,2022-04-17 15:08:01.851,2022-04-17 15:08:01.851
625c2d65f0a5bc6c426c0b62,Druk,2020,117 min,"Comedy, Drama",7.8,2.5716716518311244,"Four friends, all high school teachers, test a theory that they will improve their lives by maintaining a constant level of alcohol in their blood.",81.0,Thomas Vinterberg,"['Mads Mikkelsen', 'Thomas Bo Larsen', 'Magnus Millang', 'Lars Ranthe']",33931,2022-04-17 15:08:21.845,2022-04-17 15:08:21.845
625c2ceaf0a5bc6c426c09fe,La dolce vita,1960,174 min,"Comedy, Drama",8.0,2.5968532759262377,A series of stories following a week in the life of a philandering paparazzo journalist living in Rome.,95.0,Federico Fellini,"['Marcello Mastroianni', 'Anita Ekberg', 'Anouk Aimée', 'Yvonne Furneaux']",66621,2022-04-17 15:06:18.642,2022-04-17 15:06:18.642
625c2de1f0a5bc6c426c0cda,Happiness,1998,134 min,"Comedy, Drama",7.7,2.1681064599251734,"The lives of several individuals intertwine as they go about their lives in their own unique ways, engaging in acts society as a whole might find disturbing in a desperate search for human connection.",81.0,Todd Solondz,"['Jane Adams', 'Jon Lovitz', 'Philip Seymour Hoffman', 'Dylan Baker']",66408,2022-04-17 15:10:25.629,2022-04-17 15:10:25.629
625c2e28f0a5bc6c426c0dea,The Station Agent,2003,89 min,"Comedy, Drama",7.6,1.6071186781185098,"When his only friend dies, a man born with dwarfism moves to rural New Jersey to live a life of solitude, only to meet a chatty hot dog vendor and a woman dealing with her own personal loss.",81.0,Tom McCarthy,"['Peter Dinklage', 'Patricia Clarkson', 'Bobby Cannavale', 'Paul Benjamin']",67370,2022-04-17 15:11:36.717,2022-04-17 15:11:36.717
625c2e2af0a5bc6c426c0dfa,The Royal Tenenbaums,2001,110 min,"Comedy, Drama",7.6,4.470595798673232,The eccentric members of a dysfunctional family reluctantly gather under the same roof for various reasons.,76.0,Wes Anderson,"['Gene Hackman', 'Gwyneth Paltrow', 'Anjelica Huston', 'Ben Stiller']",266842,2022-04-17 15:11:38.383,2022-04-17 15:11:38.383
625c2bfbf0a5bc6c426c07e0,Heat,1995,170 min,"Crime, Drama, Thriller",8.2,3.958137797978565,A group of professional bank robbers start to feel the heat from police when they unknowingly leave a clue at their latest heist.,76.0,Michael Mann,"['Al Pacino', 'Robert De Niro', 'Val Kilmer', 'Jon Voight']",577113,2022-04-17 15:02:19.834,2022-04-17 15:02:19.834
625c2dd9f0a5bc6c426c0ca6,Crash,2004,112 min,"Crime, Drama, Thriller",7.7,4.227004676767216,"Los Angeles citizens with vastly separate lives collide in interweaving stories of race, loss and redemption.",66.0,Paul Haggis,"['Don Cheadle', 'Sandra Bullock', 'Thandie Newton', 'Karina Arroyave']",419483,2022-04-17 15:10:17.793,2022-04-17 15:10:17.793
625c2c4ef0a5bc6c426c0898,Underground,1995,170 min,"Comedy, Drama, War",8.1,0.6946024045715204,"A group of Serbian socialists prepares for the war in a surreal underground filled by parties, tragedies, love and hate.",,Emir Kusturica,"[""Predrag 'Miki' Manojlovic"", 'Lazar Ristovski', 'Mirjana Jokovic', 'Slavko Stimac']",55220,2022-04-17 15:03:42.590,2022-04-17 15:03:42.590
625c2d2cf0a5bc6c426c0a98,Nueve reinas,2000,114 min,"Crime, Drama, Thriller",7.9,3.0704524015778567,"Two con artists try to swindle a stamp collector by selling him a sheet of counterfeit rare stamps (the ""nine queens"").",80.0,Fabián Bielinsky,"['Ricardo Darín', 'Gastón Pauls', 'Graciela Tenenbaum', 'María Mercedes Villagra']",49721,2022-04-17 15:07:24.337,2022-04-17 15:07:24.337
625c2b75f0a5bc6c426c06fe,Modern Times,1936,87 min,"Comedy, Drama, Family",8.5,1.8900338552463936,The Tramp struggles to live in modern industrial society with the help of a young homeless woman.,96.0,Charles Chaplin,"['Charles Chaplin', 'Paulette Goddard', 'Henry Bergman', 'Tiny Sandford']",217881,2022-04-17 15:00:05.978,2022-04-17 15:00:05.978
625c2cd0f0a5bc6c426c09a8,Secrets & Lies,1996,136 min,"Comedy, Drama",8.0,0.0995103028620925,"Following the death of her adoptive parents, a successful young black optometrist establishes contact with her biological mother -- a lonely white factory worker living in poverty in East London.",91.0,Mike Leigh,"['Timothy Spall', 'Brenda Blethyn', 'Phyllis Logan', 'Claire Rushbrook']",37564,2022-04-17 15:05:52.396,2022-04-17 15:05:52.396
625c2bdbf0a5bc6c426c0798,Chhichhore,2019,143 min,"Comedy, Drama",8.2,4.55227716993183,"A tragic incident forces Anirudh, a middle-aged man, to take a trip down memory lane and reminisce his college days along with his friends, who were labelled as losers.",,Nitesh Tiwari,"['Sushant Singh Rajput', 'Shraddha Kapoor', 'Varun Sharma', 'Prateik']",33893,2022-04-17 15:01:47.492,2022-04-17 15:01:47.492
625c2d92f0a5bc6c426c0bc4,Naked,1993,132 min,"Comedy, Drama",7.8,1.3151762345723084,"Parallel tales of two sexually obsessed men, one hurting and annoying women physically and mentally, one wandering around the city talking to strangers and experiencing dimensions of life.",84.0,Mike Leigh,"['David Thewlis', 'Lesley Sharp', 'Katrin Cartlidge', 'Greg Cruttwell']",34635,2022-04-17 15:09:06.318,2022-04-17 15:09:06.318
625c2cccf0a5bc6c426c098e,Yeopgijeogin geunyeo,2001,137 min,"Comedy, Drama, Romance",8.0,4.538894738124434,"A young man sees a drunk, cute woman standing too close to the tracks at a metro station in Seoul and pulls her back. She ends up getting him into trouble repeatedly after that, starting on the train.",,Jae-young Kwak,"['Tae-Hyun Cha', 'Jun Ji-Hyun', 'In-mun Kim', 'Song Wok-suk']",45403,2022-04-17 15:05:48.984,2022-04-17 15:05:48.984
625c2ccdf0a5bc6c426c0992,Vizontele,2001,110 min,"Comedy, Drama",8.0,1.4120134484560687,Lives of residents in a small Anatolian village change when television is introduced to them,,Yilmaz Erdogan,"['Ömer Faruk Sorak', 'Yilmaz Erdogan', 'Demet Akbag', 'Altan Erkekli']",33592,2022-04-17 15:05:49.380,2022-04-17 15:05:49.380
625c2c82f0a5bc6c426c0936,Special Chabbis,2013,144 min,"Crime, Drama, Thriller",8.0,0.7821489988074626,A gang of con-men rob prominent rich businessmen and politicians by posing as C.B.I and income tax officers.,,Neeraj Pandey,"['Akshay Kumar', 'Anupam Kher', 'Manoj Bajpayee', 'Jimmy Sheirgill']",51069,2022-04-17 15:04:34.238,2022-04-17 15:04:34.238
625c2badf0a5bc6c426c0718,3 Idiots,2009,170 min,"Comedy, Drama",8.4,0.035680101700276134,"Two friends are searching for their long lost companion. They revisit their college days and recall the memories of their friend who inspired them to think differently, even as the rest of the world called them ""idiots"".",67.0,Rajkumar Hirani,"['Aamir Khan', 'Madhavan', 'Mona Singh', 'Sharman Joshi']",344445,2022-04-17 15:01:01.232,2022-04-17 15:01:01.232
