_id,title,release,duration,gerne,IMDB_Rating,rating,overview,metaScore,director,stars,noOfVotes,createdAt,updatedAt
625c2df3f0a5bc6c426c0d1c,Blue Velvet,1986,120 min,"Drama, Mystery, Thriller",7.7,1.4546634168008121,"The discovery of a severed human ear found in a field leads a young man on an investigation related to a beautiful, mysterious nightclub singer and a group of psychopathic criminals who have kidnapped her child.",76.0,David Lynch,"['Isabella Rossellini', 'Kyle MacLachlan', 'Dennis Hopper', 'Laura Dern']",181285,2022-04-17 15:10:43.527,2022-04-17 15:10:43.527
625c2da4f0a5bc6c426c0c02,The Conversation,1974,113 min,"Drama, Mystery, Thriller",7.8,1.7054814445563382,"A paranoid, secretive surveillance expert has a crisis of conscience when he suspects that the couple he is spying on will be murdered.",85.0,Francis Ford Coppola,"['Gene Hackman', 'John Cazale', 'Allen Garfield', 'Frederic Forrest']",98611,2022-04-17 15:09:24.759,2022-04-17 15:09:24.759
625c2c61f0a5bc6c426c08ce,Chinatown,1974,130 min,"Drama, Mystery, Thriller",8.1,0.7281021825703771,"A private detective hired to expose an adulterer finds himself caught up in a web of deceit, corruption, and murder.",92.0,Roman Polanski,"['Jack Nicholson', 'Faye Dunaway', 'John Huston', 'Perry Lopez']",294230,2022-04-17 15:04:01.280,2022-04-17 15:04:01.280
625c2d2df0a5bc6c426c0a9e,Mulholland Dr.,2001,147 min,"Drama, Mystery, Thriller",7.9,2.783593158371893,"After a car wreck on the winding Mulholland Drive renders a woman amnesiac, she and a perky Hollywood-hopeful search for clues and answers across Los Angeles in a twisting venture beyond dreams and reality.",85.0,David Lynch,"['Naomi Watts', 'Laura Harring', 'Justin Theroux', 'Jeanne Bates']",322031,2022-04-17 15:07:25.559,2022-04-17 15:07:25.559
625c2e07f0a5bc6c426c0d74,Searching,2018,102 min,"Drama, Mystery, Thriller",7.6,0.7811960992095257,"After his teenage daughter goes missing, a desperate father tries to find clues on her laptop.",71.0,Aneesh Chaganty,"['John Cho', 'Debra Messing', 'Joseph Lee', 'Michelle La']",140840,2022-04-17 15:11:03.567,2022-04-17 15:11:03.567
625c2c49f0a5bc6c426c0888,The Sixth Sense,1999,107 min,"Drama, Mystery, Thriller",8.1,0.29274374703442185,A boy who communicates with spirits seeks the help of a disheartened child psychologist.,64.0,M. Night Shyamalan,"['Bruce Willis', 'Haley Joel Osment', 'Toni Collette', 'Olivia Williams']",911573,2022-04-17 15:03:37.072,2022-04-17 15:03:37.072
625c2e18f0a5bc6c426c0dba,Die Welle,2008,107 min,"Drama, Thriller",7.6,3.100002143130325,A high school teacher's experiment to demonstrate to his students what life is like under a dictatorship spins horribly out of control when he forms a social unit with a life of its own.,,Dennis Gansel,"['Jürgen Vogel', 'Frederick Lau', 'Max Riemelt', 'Jennifer Ulrich']",102742,2022-04-17 15:11:20.064,2022-04-17 15:11:20.064
625c2e3af0a5bc6c426c0e5a,Blowup,1966,111 min,"Drama, Mystery, Thriller",7.6,0.20147217464361988,A fashion photographer unknowingly captures a death on film after following two lovers in a park.,82.0,Michelangelo Antonioni,"['David Hemmings', 'Vanessa Redgrave', 'Sarah Miles', 'John Castle']",56513,2022-04-17 15:11:54.125,2022-04-17 15:11:54.125
625c2bb1f0a5bc6c426c071e,The Lives of Others,2006,137 min,"Drama, Mystery, Thriller",8.4,4.854147988341575,"In 1984 East Berlin, an agent of the secret police, conducting surveillance on a writer and his lover, finds himself becoming increasingly absorbed by their lives.",89.0,Florian Henckel von Donnersmarck,"['Ulrich Mühe', 'Martina Gedeck', 'Sebastian Koch', 'Ulrich Tukur']",358685,2022-04-17 15:01:05.425,2022-04-17 15:01:05.425
625c2e00f0a5bc6c426c0d56,Cape Fear,1962,106 min,"Drama, Thriller",7.7,3.4616819260258347,A lawyer's family is stalked by a man he once helped put in jail.,76.0,J. Lee Thompson,"['Gregory Peck', 'Robert Mitchum', 'Polly Bergen', 'Lori Martin']",26457,2022-04-17 15:10:56.272,2022-04-17 15:10:56.272
625c2d95f0a5bc6c426c0bd4,Misery,1990,107 min,"Drama, Thriller",7.8,1.598151357874239,"After a famous author is rescued from a car crash by a fan of his novels, he comes to realize that the care he is receiving is only the beginning of a nightmare of captivity and abuse.",75.0,Rob Reiner,"['James Caan', 'Kathy Bates', 'Richard Farnsworth', 'Frances Sternhagen']",184740,2022-04-17 15:09:09.722,2022-04-17 15:09:09.722
625c2c1af0a5bc6c426c082e,Room,2015,118 min,"Drama, Thriller",8.1,1.8917269608571097,"Held captive for 7 years in an enclosed space, a woman and her young son finally gain their freedom, allowing the boy to experience the outside world for the first time.",86.0,Lenny Abrahamson,"['Brie Larson', 'Jacob Tremblay', 'Sean Bridgers', 'Wendy Crewson']",371538,2022-04-17 15:02:50.074,2022-04-17 15:02:50.074
625c2c69f0a5bc6c426c08da,Persona,1966,85 min,"Drama, Thriller",8.1,4.735803559644992,A nurse is put in charge of a mute actress and finds that their personae are melding together.,86.0,Ingmar Bergman,"['Bibi Andersson', 'Liv Ullmann', 'Margaretha Krook', 'Gunnar Björnstrand']",103191,2022-04-17 15:04:09.608,2022-04-17 15:04:09.608
625c2cbff0a5bc6c426c095e,Black Swan,2010,108 min,"Drama, Thriller",8.0,3.4936288956322725,"A committed dancer struggles to maintain her sanity after winning the lead role in a production of Tchaikovsky's ""Swan Lake"".",79.0,Darren Aronofsky,"['Natalie Portman', 'Mila Kunis', 'Vincent Cassel', 'Winona Ryder']",699673,2022-04-17 15:05:35.684,2022-04-17 15:05:35.684
625c2cb9f0a5bc6c426c0952,Darbareye Elly,2009,119 min,"Drama, Mystery",8.0,1.3430809095774465,The mysterious disappearance of a kindergarten teacher during a picnic in the north of Iran is followed by a series of misadventures for her fellow travelers.,87.0,Asghar Farhadi,"['Golshifteh Farahani', 'Shahab Hosseini', 'Taraneh Alidoosti', ""Merila Zare'i""]",45803,2022-04-17 15:05:29.244,2022-04-17 15:05:29.244
625c2d60f0a5bc6c426c0b4a,Kokuhaku,2010,106 min,"Drama, Thriller",7.8,0.43141034546324675,A psychological thriller of a grieving mother turned cold-blooded avenger with a twisty master plan to pay back those who were responsible for her daughter's death.,,Tetsuya Nakashima,"['Takako Matsu', 'Yoshino Kimura', 'Masaki Okada', 'Yukito Nishii']",35713,2022-04-17 15:08:16.190,2022-04-17 15:08:16.190
625c2c14f0a5bc6c426c0820,Pink,2016,136 min,"Drama, Thriller",8.1,1.2628514215356423,"When three young women are implicated in a crime, a retired lawyer steps forward to help them clear their names.",,Aniruddha Roy Chowdhury,"['Taapsee Pannu', 'Amitabh Bachchan', 'Kirti Kulhari', 'Andrea Tariang']",39216,2022-04-17 15:02:44.439,2022-04-17 15:02:44.439
625c2d46f0a5bc6c426c0aee,High Noon,1952,85 min,"Drama, Thriller, Western",7.9,1.2780236168447923,"A town Marshal, despite the disagreements of his newlywed bride and the townspeople around him, must face a gang of deadly killers alone at high noon when the gang leader, an outlaw he sent up years ago, arrives on the noon train.",89.0,Fred Zinnemann,"['Gary Cooper', 'Grace Kelly', 'Thomas Mitchell', 'Lloyd Bridges']",97222,2022-04-17 15:07:50.527,2022-04-17 15:07:50.527
625c2c67f0a5bc6c426c08d4,Solaris,1972,167 min,"Drama, Mystery, Sci-Fi",8.1,0.4436238523485625,A psychologist is sent to a station orbiting a distant planet in order to discover what has caused the crew to go insane.,90.0,Andrei Tarkovsky,"['Natalya Bondarchuk', 'Donatas Banionis', 'Jüri Järvet', 'Vladislav Dvorzhetskiy']",81021,2022-04-17 15:04:07.159,2022-04-17 15:04:07.159
625c2ccdf0a5bc6c426c0994,Donnie Darko,2001,113 min,"Drama, Mystery, Sci-Fi",8.0,0.9312626851443451,"After narrowly escaping a bizarre accident, a troubled teenager is plagued by visions of a man in a large rabbit suit who manipulates him to commit a series of crimes.",88.0,Richard Kelly,"['Jake Gyllenhaal', 'Jena Malone', 'Mary McDonnell', 'Holmes Osborne']",740086,2022-04-17 15:05:49.583,2022-04-17 15:05:49.583
