_id,title,release,duration,gerne,IMDB_Rating,rating,overview,metaScore,director,stars,noOfVotes,createdAt,updatedAt
625c2cfbf0a5bc6c426c0a46,Captain Fantastic,2016,118 min,"Comedy, Drama",7.9,3.5701799330001927,"In the forests of the Pacific Northwest, a father devoted to raising his six kids with a rigorous physical and intellectual education is forced to leave his paradise and enter the world, challenging his idea of what it means to be a parent.",72.0,Matt Ross,"['Viggo Mortensen', 'George MacKay', 'Samantha Isler', 'Annalise Basso']",189400,2022-04-17 15:06:35.672,2022-04-17 15:06:35.672
625c2dcdf0a5bc6c426c0c78,Silver Linings Playbook,2012,122 min,"Comedy, Drama, Romance",7.7,1.2132343614610053,"After a stint in a mental institution, former teacher Pat Solitano moves back in with his parents and tries to reconcile with his ex-wife. Things get more challenging when Pat meets Tiffany, a mysterious girl with problems of her own.",81.0,David O. Russell,"['Bradley Cooper', 'Jennifer Lawrence', 'Robert De Niro', 'Jacki Weaver']",661871,2022-04-17 15:10:05.742,2022-04-17 15:10:05.742
625c2d06f0a5bc6c426c0a4e,Jojo Rabbit,2019,108 min,"Comedy, Drama, War",7.9,3.136792486596881,A young boy in Hitler's army finds out his mother is hiding a Jewish girl in their home.,58.0,Taika Waititi,"['Roman Griffin Davis', 'Thomasin McKenzie', 'Scarlett Johansson', 'Taika Waititi']",297918,2022-04-17 15:06:46.367,2022-04-17 15:06:46.367
625c2e28f0a5bc6c426c0dea,The Station Agent,2003,89 min,"Comedy, Drama",7.6,1.6071186781185098,"When his only friend dies, a man born with dwarfism moves to rural New Jersey to live a life of solitude, only to meet a chatty hot dog vendor and a woman dealing with her own personal loss.",81.0,Tom McCarthy,"['Peter Dinklage', 'Patricia Clarkson', 'Bobby Cannavale', 'Paul Benjamin']",67370,2022-04-17 15:11:36.717,2022-04-17 15:11:36.717
625c2c55f0a5bc6c426c08ac,Dead Poets Society,1989,128 min,"Comedy, Drama",8.1,0.7805170389942628,Maverick teacher John Keating uses poetry to embolden his boarding school students to new heights of self-expression.,79.0,Peter Weir,"['Robin Williams', 'Robert Sean Leonard', 'Ethan Hawke', 'Josh Charles']",425457,2022-04-17 15:03:49.587,2022-04-17 15:03:49.587
625c2bf4f0a5bc6c426c07ca,Rang De Basanti,2006,167 min,"Comedy, Crime, Drama",8.2,3.0051668426589027,"The story of six young Indians who assist an English woman to film a documentary on the freedom fighters from their past, and the events that lead them to relive the long-forgotten saga of freedom.",,Rakeysh Omprakash Mehra,"['Aamir Khan', 'Soha Ali Khan', 'Siddharth', 'Sharman Joshi']",111937,2022-04-17 15:02:12.934,2022-04-17 15:02:12.934
625c2c30f0a5bc6c426c0852,Zindagi Na Milegi Dobara,2011,155 min,"Comedy, Drama",8.1,0.7234510822379614,Three friends decide to turn their fantasy vacation into reality after one of their friends gets engaged.,,Zoya Akhtar,"['Hrithik Roshan', 'Farhan Akhtar', 'Abhay Deol', 'Katrina Kaif']",67927,2022-04-17 15:03:12.403,2022-04-17 15:03:12.403
625c2c4af0a5bc6c426c088c,The Truman Show,1998,103 min,"Comedy, Drama",8.1,4.568644947204023,An insurance salesman discovers his whole life is actually a reality TV show.,90.0,Peter Weir,"['Jim Carrey', 'Ed Harris', 'Laura Linney', 'Noah Emmerich']",939631,2022-04-17 15:03:38.781,2022-04-17 15:03:38.781
625c2b75f0a5bc6c426c06fe,Modern Times,1936,87 min,"Comedy, Drama, Family",8.5,1.8900338552463936,The Tramp struggles to live in modern industrial society with the help of a young homeless woman.,96.0,Charles Chaplin,"['Charles Chaplin', 'Paulette Goddard', 'Henry Bergman', 'Tiny Sandford']",217881,2022-04-17 15:00:05.978,2022-04-17 15:00:05.978
625c2d5ff0a5bc6c426c0b44,Moonrise Kingdom,2012,94 min,"Comedy, Drama, Romance",7.8,0.4394409345655559,"A pair of young lovers flee their New England town, which causes a local search party to fan out to find them.",84.0,Wes Anderson,"['Jared Gilman', 'Kara Hayward', 'Bruce Willis', 'Bill Murray']",318789,2022-04-17 15:08:15.015,2022-04-17 15:08:15.015
625c2b76f0a5bc6c426c0700,City Lights,1931,87 min,"Comedy, Drama, Romance",8.5,0.4001693336818479,"With the aid of a wealthy erratic tippler, a dewy-eyed tramp who has fallen in love with a sightless flower girl accumulates money to be able to help her medically.",99.0,Charles Chaplin,"['Charles Chaplin', 'Virginia Cherrill', 'Florence Lee', 'Harry Myers']",167839,2022-04-17 15:00:06.195,2022-04-17 15:00:06.195
625c2e2af0a5bc6c426c0dfa,The Royal Tenenbaums,2001,110 min,"Comedy, Drama",7.6,4.470595798673232,The eccentric members of a dysfunctional family reluctantly gather under the same roof for various reasons.,76.0,Wes Anderson,"['Gene Hackman', 'Gwyneth Paltrow', 'Anjelica Huston', 'Ben Stiller']",266842,2022-04-17 15:11:38.383,2022-04-17 15:11:38.383
625c2decf0a5bc6c426c0cfe,The Muppet Christmas Carol,1992,85 min,"Comedy, Drama, Family",7.7,4.436602821247333,The Muppet characters tell their version of the classic tale of an old and bitter miser's redemption on Christmas Eve.,64.0,Brian Henson,"['Michael Caine', 'Kermit the Frog', 'Dave Goelz', 'Miss Piggy']",50298,2022-04-17 15:10:36.560,2022-04-17 15:10:36.560
625c2e03f0a5bc6c426c0d66,The Quiet Man,1952,129 min,"Comedy, Drama, Romance",7.7,1.0785021289128671,"A retired American boxer returns to the village of his birth in Ireland, where he falls for a spirited redhead whose brother is contemptuous of their union.",,John Ford,"['John Wayne', ""Maureen O'Hara"", 'Barry Fitzgerald', 'Ward Bond']",34677,2022-04-17 15:10:59.371,2022-04-17 15:10:59.371
625c2d0cf0a5bc6c426c0a5a,The Artist,2011,100 min,"Comedy, Drama, Romance",7.9,2.8538249510576232,An egomaniacal film star develops a relationship with a young dancer against the backdrop of Hollywood's silent era.,89.0,Michel Hazanavicius,"['Jean Dujardin', 'Bérénice Bejo', 'John Goodman', 'James Cromwell']",230624,2022-04-17 15:06:52.073,2022-04-17 15:06:52.073
625c2d5df0a5bc6c426c0b3c,English Vinglish,2012,134 min,"Comedy, Drama, Family",7.8,2.8157440152225712,"A quiet, sweet tempered housewife endures small slights from her well-educated husband and daughter every day because of her inability to speak and understand English.",,Gauri Shinde,"['Sridevi', 'Adil Hussain', 'Mehdi Nebbou', 'Priya Anand']",33618,2022-04-17 15:08:13.394,2022-04-17 15:08:13.394
625c2c7df0a5bc6c426c0926,La La Land,2016,128 min,"Comedy, Drama, Music",8.0,2.762712765898799,"While navigating their careers in Los Angeles, a pianist and an actress fall in love while attempting to reconcile their aspirations for the future.",94.0,Damien Chazelle,"['Ryan Gosling', 'Emma Stone', 'Rosemarie DeWitt', 'J.K. Simmons']",505918,2022-04-17 15:04:29.583,2022-04-17 15:04:29.583
625c2e2cf0a5bc6c426c0e0a,American Psycho,2000,101 min,"Comedy, Crime, Drama",7.6,1.5025679943931158,"A wealthy New York City investment banking executive, Patrick Bateman, hides his alternate psychopathic ego from his co-workers and friends as he delves deeper into his violent, hedonistic fantasies.",64.0,Mary Harron,"['Christian Bale', 'Justin Theroux', 'Josh Lucas', 'Bill Sage']",490062,2022-04-17 15:11:40.437,2022-04-17 15:11:40.437
625c2ddcf0a5bc6c426c0cbc,Good Bye Lenin!,2003,121 min,"Comedy, Drama, Romance",7.7,1.5246790747908878,"In 1990, to protect his fragile mother from a fatal shock after a long coma, a young man must keep her from learning that her beloved nation of East Germany as she knew it has disappeared.",68.0,Wolfgang Becker,"['Daniel Brühl', 'Katrin Saß', 'Chulpan Khamatova', 'Florian Lukas']",137981,2022-04-17 15:10:20.492,2022-04-17 15:10:20.492
625c2c41f0a5bc6c426c0874,Munna Bhai M.B.B.S.,2003,156 min,"Comedy, Drama, Musical",8.1,1.7532626607554902,A gangster sets out to fulfill his father's dream of becoming a doctor.,,Rajkumar Hirani,"['Sanjay Dutt', 'Arshad Warsi', 'Gracy Singh', 'Sunil Dutt']",73992,2022-04-17 15:03:29.341,2022-04-17 15:03:29.341
