_id,title,release,duration,gerne,IMDB_Rating,rating,overview,metaScore,director,stars,noOfVotes,createdAt,updatedAt
625c2cd0f0a5bc6c426c09a8,Secrets & Lies,1996,136 min,"Comedy, Drama",8.0,0.0995103028620925,"Following the death of her adoptive parents, a successful young black optometrist establishes contact with her biological mother -- a lonely white factory worker living in poverty in East London.",91.0,Mike Leigh,"['Timothy Spall', 'Brenda Blethyn', 'Phyllis Logan', 'Claire Rushbrook']",37564,2022-04-17 15:05:52.396,2022-04-17 15:05:52.396
625c2d36f0a5bc6c426c0ab4,Crimes and Misdemeanors,1989,104 min,"Comedy, Drama",7.9,4.249972624003453,An ophthalmologist's mistress threatens to reveal their affair to his wife while a married documentary filmmaker is infatuated with another woman.,77.0,Woody Allen,"['Martin Landau', 'Woody Allen', 'Bill Bernstein', 'Claire Bloom']",54670,2022-04-17 15:07:34.158,2022-04-17 15:07:34.158
625c2ceaf0a5bc6c426c09fe,La dolce vita,1960,174 min,"Comedy, Drama",8.0,2.5968532759262377,A series of stories following a week in the life of a philandering paparazzo journalist living in Rome.,95.0,Federico Fellini,"['Marcello Mastroianni', 'Anita Ekberg', 'Anouk Aimée', 'Yvonne Furneaux']",66621,2022-04-17 15:06:18.642,2022-04-17 15:06:18.642
625c2df0f0a5bc6c426c0d14,Withnail & I,1987,107 min,"Comedy, Drama",7.7,1.92257452757706,"In 1969, two substance-abusing, unemployed actors retreat to the countryside for a holiday that proves disastrous.",84.0,Bruce Robinson,"['Richard E. Grant', 'Paul McGann', 'Richard Griffiths', 'Ralph Brown']",40396,2022-04-17 15:10:40.872,2022-04-17 15:10:40.872
625c2dc2f0a5bc6c426c0c52,Birdman or (The Unexpected Virtue of Ignorance),2014,119 min,"Comedy, Drama",7.7,4.553679555103512,"A washed-up superhero actor attempts to revive his fading career by writing, directing, and starring in a Broadway production.",87.0,Alejandro G. Iñárritu,"['Michael Keaton', 'Zach Galifianakis', 'Edward Norton', 'Andrea Riseborough']",580291,2022-04-17 15:09:54.052,2022-04-17 15:09:54.052
625c2b75f0a5bc6c426c06fe,Modern Times,1936,87 min,"Comedy, Drama, Family",8.5,1.8900338552463936,The Tramp struggles to live in modern industrial society with the help of a young homeless woman.,96.0,Charles Chaplin,"['Charles Chaplin', 'Paulette Goddard', 'Henry Bergman', 'Tiny Sandford']",217881,2022-04-17 15:00:05.978,2022-04-17 15:00:05.978
625c2d36f0a5bc6c426c0ab8,Hannah and Her Sisters,1986,107 min,"Comedy, Drama",7.9,4.642597871772004,"Between two Thanksgivings two years apart, Hannah's husband falls in love with her sister Lee, while her hypochondriac ex-husband rekindles his relationship with her sister Holly.",90.0,Woody Allen,"['Mia Farrow', 'Dianne Wiest', 'Michael Caine', 'Barbara Hershey']",67176,2022-04-17 15:07:34.584,2022-04-17 15:07:34.584
625c2d7df0a5bc6c426c0b7c,Little Miss Sunshine,2006,101 min,"Comedy, Drama",7.8,3.547795617340049,A family determined to get their young daughter into the finals of a beauty pageant take a cross-country trip in their VW bus.,80.0,Jonathan Dayton,"['Valerie Faris', 'Steve Carell', 'Toni Collette', 'Greg Kinnear']",439856,2022-04-17 15:08:45.694,2022-04-17 15:08:45.694
625c2dc1f0a5bc6c426c0c50,Me and Earl and the Dying Girl,2015,105 min,"Comedy, Drama",7.7,2.728453884274172,"High schooler Greg, who spends most of his time making parodies of classic movies with his co-worker Earl, finds his outlook forever altered after befriending a classmate who has just been diagnosed with cancer.",74.0,Alfonso Gomez-Rejon,"['Thomas Mann', 'RJ Cyler', 'Olivia Cooke', 'Nick Offerman']",123210,2022-04-17 15:09:53.862,2022-04-17 15:09:53.862
625c2b76f0a5bc6c426c0700,City Lights,1931,87 min,"Comedy, Drama, Romance",8.5,0.4001693336818479,"With the aid of a wealthy erratic tippler, a dewy-eyed tramp who has fallen in love with a sightless flower girl accumulates money to be able to help her medically.",99.0,Charles Chaplin,"['Charles Chaplin', 'Virginia Cherrill', 'Florence Lee', 'Harry Myers']",167839,2022-04-17 15:00:06.195,2022-04-17 15:00:06.195
625c2cfbf0a5bc6c426c0a46,Captain Fantastic,2016,118 min,"Comedy, Drama",7.9,3.5701799330001927,"In the forests of the Pacific Northwest, a father devoted to raising his six kids with a rigorous physical and intellectual education is forced to leave his paradise and enter the world, challenging his idea of what it means to be a parent.",72.0,Matt Ross,"['Viggo Mortensen', 'George MacKay', 'Samantha Isler', 'Annalise Basso']",189400,2022-04-17 15:06:35.672,2022-04-17 15:06:35.672
625c2e2af0a5bc6c426c0dfa,The Royal Tenenbaums,2001,110 min,"Comedy, Drama",7.6,4.470595798673232,The eccentric members of a dysfunctional family reluctantly gather under the same roof for various reasons.,76.0,Wes Anderson,"['Gene Hackman', 'Gwyneth Paltrow', 'Anjelica Huston', 'Ben Stiller']",266842,2022-04-17 15:11:38.383,2022-04-17 15:11:38.383
625c2cf0f0a5bc6c426c0a1a,Kind Hearts and Coronets,1949,106 min,"Comedy, Crime",8.0,0.3183557833483963,A distant poor relative of the Duke D'Ascoyne plots to inherit the title by murdering the eight other heirs who stand ahead of him in the line of succession.,,Robert Hamer,"['Dennis Price', 'Alec Guinness', 'Valerie Hobson', 'Joan Greenwood']",34485,2022-04-17 15:06:24.624,2022-04-17 15:06:24.624
625c2ccdf0a5bc6c426c0992,Vizontele,2001,110 min,"Comedy, Drama",8.0,1.4120134484560687,Lives of residents in a small Anatolian village change when television is introduced to them,,Yilmaz Erdogan,"['Ömer Faruk Sorak', 'Yilmaz Erdogan', 'Demet Akbag', 'Altan Erkekli']",33592,2022-04-17 15:05:49.380,2022-04-17 15:05:49.380
625c2e3af0a5bc6c426c0e5e,Breakfast at Tiffany's,1961,115 min,"Comedy, Drama, Romance",7.6,4.500083626690996,"A young New York socialite becomes interested in a young man who has moved into her apartment building, but her past threatens to get in the way.",76.0,Blake Edwards,"['Audrey Hepburn', 'George Peppard', 'Patricia Neal', 'Buddy Ebsen']",166544,2022-04-17 15:11:54.560,2022-04-17 15:11:54.560
625c2d38f0a5bc6c426c0ac2,Manhattan,1979,96 min,"Comedy, Drama, Romance",7.9,1.2750438494021743,The life of a divorced television writer dating a teenage girl is further complicated when he falls in love with his best friend's mistress.,83.0,Woody Allen,"['Woody Allen', 'Diane Keaton', 'Mariel Hemingway', 'Michael Murphy']",131436,2022-04-17 15:07:36.029,2022-04-17 15:07:36.029
625c2c76f0a5bc6c426c0906,The Shop Around the Corner,1940,99 min,"Comedy, Drama, Romance",8.1,0.32116668203771903,"Two employees at a gift shop can barely stand each other, without realizing that they are falling in love through the post as each other's anonymous pen pal.",96.0,Ernst Lubitsch,"['Margaret Sullavan', 'James Stewart', 'Frank Morgan', 'Joseph Schildkraut']",28450,2022-04-17 15:04:22.101,2022-04-17 15:04:22.101
625c2c3ff0a5bc6c426c086a,Lage Raho Munna Bhai,2006,144 min,"Comedy, Drama, Romance",8.1,0.28100454809317554,Munna Bhai embarks on a journey with Mahatma Gandhi in order to fight against a corrupt property dealer.,,Rajkumar Hirani,"['Sanjay Dutt', 'Arshad Warsi', 'Vidya Balan', 'Boman Irani']",43137,2022-04-17 15:03:27.594,2022-04-17 15:03:27.594
625c2c55f0a5bc6c426c08ac,Dead Poets Society,1989,128 min,"Comedy, Drama",8.1,0.7805170389942628,Maverick teacher John Keating uses poetry to embolden his boarding school students to new heights of self-expression.,79.0,Peter Weir,"['Robin Williams', 'Robert Sean Leonard', 'Ethan Hawke', 'Josh Charles']",425457,2022-04-17 15:03:49.587,2022-04-17 15:03:49.587
625c2df4f0a5bc6c426c0d20,After Hours,1985,97 min,"Comedy, Crime, Drama",7.7,3.6818512258075184,An ordinary word processor has the worst night of his life after he agrees to visit a girl in Soho who he met that evening at a coffee shop.,90.0,Martin Scorsese,"['Griffin Dunne', 'Rosanna Arquette', 'Verna Bloom', 'Tommy Chong']",59635,2022-04-17 15:10:44.278,2022-04-17 15:10:44.278
