_id,title,release,duration,gerne,IMDB_Rating,rating,overview,metaScore,director,stars,noOfVotes,createdAt,updatedAt
625c2e00f0a5bc6c426c0d5a,The Magnificent Seven,1960,128 min,"Action, Adventure, Western",7.7,4.446067795752865,Seven gunfighters are hired by Mexican peasants to liberate their village from oppressive bandits.,74.0,John Sturges,"['Yul Brynner', 'Steve McQueen', 'Charles Bronson', 'Eli Wallach']",87719,2022-04-17 15:10:56.703,2022-04-17 15:10:56.703
625c2de4f0a5bc6c426c0ce6,The Fifth Element,1997,126 min,"Action, Adventure, Sci-Fi",7.7,2.433415548516822,"In the colorful future, a cab driver unwittingly becomes the central figure in the search for a legendary cosmic weapon to keep Evil and Mr. Zorg at bay.",52.0,Luc Besson,"['Bruce Willis', 'Milla Jovovich', 'Gary Oldman', 'Ian Holm']",434125,2022-04-17 15:10:28.716,2022-04-17 15:10:28.716
625c2bacf0a5bc6c426c0716,The Dark Knight Rises,2012,164 min,"Action, Adventure",8.4,4.7587097916708245,"Eight years after the Joker's reign of anarchy, Batman, with the help of the enigmatic Catwoman, is forced from his exile to save Gotham City from the brutal guerrilla terrorist Bane.",78.0,Christopher Nolan,"['Christian Bale', 'Tom Hardy', 'Anne Hathaway', 'Gary Oldman']",1516346,2022-04-17 15:01:00.313,2022-04-17 15:01:00.313
625c2dc1f0a5bc6c426c0c4c,Kingsman: The Secret Service,2014,129 min,"Action, Adventure, Comedy",7.7,2.5981185253792383,"A spy organisation recruits a promising street kid into the agency's training program, while a global threat emerges from a twisted tech genius.",60.0,Matthew Vaughn,"['Colin Firth', 'Taron Egerton', 'Samuel L. Jackson', 'Michael Caine']",590440,2022-04-17 15:09:53.456,2022-04-17 15:09:53.456
625c2dfdf0a5bc6c426c0d48,The Dirty Dozen,1967,150 min,"Action, Adventure, War",7.7,3.629014784293446,"During World War II, a rebellious U.S. Army Major is assigned a dozen convicted murderers to train and lead them into a mass assassination mission of German officers.",73.0,Robert Aldrich,"['Lee Marvin', 'Ernest Borgnine', 'Charles Bronson', 'John Cassavetes']",67183,2022-04-17 15:10:53.733,2022-04-17 15:10:53.733
625c2dc8f0a5bc6c426c0c5a,Captain America: The Winter Soldier,2014,136 min,"Action, Adventure, Sci-Fi",7.7,2.0318290997880184,"As Steve Rogers struggles to embrace his role in the modern world, he teams up with a fellow Avenger and S.H.I.E.L.D agent, Black Widow, to battle a new threat from history: an assassin known as the Winter Soldier.",70.0,Anthony Russo,"['Joe Russo', 'Chris Evans', 'Samuel L. Jackson', 'Scarlett Johansson']",736182,2022-04-17 15:10:00.342,2022-04-17 15:10:00.342
625c2e25f0a5bc6c426c0dd6,Harry Potter and the Half-Blood Prince,2009,153 min,"Action, Adventure, Family",7.6,4.468813635443772,"As Harry Potter begins his sixth year at Hogwarts, he discovers an old book marked as ""the property of the Half-Blood Prince"" and begins to learn more about Lord Voldemort's dark past.",78.0,David Yates,"['Daniel Radcliffe', 'Emma Watson', 'Rupert Grint', 'Michael Gambon']",474827,2022-04-17 15:11:33.131,2022-04-17 15:11:33.131
625c2cecf0a5bc6c426c0a00,Rio Bravo,1959,141 min,"Action, Drama, Western",8.0,3.646574887681707,"A small-town sheriff in the American West enlists the help of a cripple, a drunk, and a young gunfighter in his efforts to hold in jail the brother of the local bad guy.",93.0,Howard Hawks,"['John Wayne', 'Dean Martin', 'Ricky Nelson', 'Angie Dickinson']",56305,2022-04-17 15:06:20.013,2022-04-17 15:06:20.013
625c2cc6f0a5bc6c426c0978,Casino Royale,2006,144 min,"Action, Adventure, Thriller",8.0,3.7507263564760818,"After earning 00 status and a licence to kill, Secret Agent James Bond sets out on his first mission as 007. Bond must defeat a private banker funding terrorists in a high-stakes game of poker at Casino Royale, Montenegro.",80.0,Martin Campbell,"['Daniel Craig', 'Eva Green', 'Judi Dench', 'Jeffrey Wright']",582239,2022-04-17 15:05:42.357,2022-04-17 15:05:42.357
625c2df5f0a5bc6c426c0d28,First Blood,1982,93 min,"Action, Adventure",7.7,1.6491267768528672,A veteran Green Beret is forced by a cruel Sheriff and his deputies to flee into the mountains and wage an escalating one-man war against his pursuers.,61.0,Ted Kotcheff,"['Sylvester Stallone', 'Brian Dennehy', 'Richard Crenna', 'Bill McKinney']",226541,2022-04-17 15:10:45.326,2022-04-17 15:10:45.326
625c2dcbf0a5bc6c426c0c6c,Star Trek Into Darkness,2013,132 min,"Action, Adventure, Sci-Fi",7.7,4.597755901762404,"After the crew of the Enterprise find an unstoppable force of terror from within their own organization, Captain Kirk leads a manhunt to a war-zone world to capture a one-man weapon of mass destruction.",72.0,J.J. Abrams,"['Chris Pine', 'Zachary Quinto', 'Zoe Saldana', 'Benedict Cumberbatch']",463188,2022-04-17 15:10:03.478,2022-04-17 15:10:03.478
625c2db2f0a5bc6c426c0c22,Red River,1948,133 min,"Action, Adventure, Drama",7.8,0.0056356934111223556,"Dunson leads a cattle drive, the culmination of over 14 years of work, to its destination in Missouri. But his tyrannical behavior along the way causes a mutiny, led by his adopted son.",,Howard Hawks,"['Arthur Rosson', 'John Wayne', 'Montgomery Clift', 'Joanne Dru']",28167,2022-04-17 15:09:38.194,2022-04-17 15:09:38.194
625c2d22f0a5bc6c426c0a84,Iron Man,2008,126 min,"Action, Adventure, Sci-Fi",7.9,0.33870228928470136,"After being held captive in an Afghan cave, billionaire engineer Tony Stark creates a unique weaponized suit of armor to fight evil.",79.0,Jon Favreau,"['Robert Downey Jr.', 'Gwyneth Paltrow', 'Terrence Howard', 'Jeff Bridges']",939644,2022-04-17 15:07:14.806,2022-04-17 15:07:14.806
625c2c7df0a5bc6c426c0922,Bajrangi Bhaijaan,2015,163 min,"Action, Adventure, Comedy",8.0,2.235017702076113,An Indian man with a magnanimous heart takes a young mute Pakistani girl back to her homeland to reunite her with her family.,,Kabir Khan,"['Salman Khan', 'Harshaali Malhotra', 'Nawazuddin Siddiqui', 'Kareena Kapoor']",72245,2022-04-17 15:04:29.180,2022-04-17 15:04:29.180
625c2cb6f0a5bc6c426c0946,The Revenant,2015,156 min,"Action, Adventure, Drama",8.0,1.0066501383954096,A frontiersman on a fur trading expedition in the 1820s fights for survival after being mauled by a bear and left for dead by members of his own hunting team.,76.0,Alejandro G. Iñárritu,"['Leonardo DiCaprio', 'Tom Hardy', 'Will Poulter', 'Domhnall Gleeson']",705589,2022-04-17 15:05:26.747,2022-04-17 15:05:26.747
625c2b55f0a5bc6c426c06b2,The Lord of the Rings: The Two Towers,2002,179 min,"Action, Adventure, Drama",8.7,4.581141589278673,"While Frodo and Sam edge closer to Mordor with the help of the shifty Gollum, the divided fellowship makes a stand against Sauron's new ally, Saruman, and his hordes of Isengard.",87.0,Peter Jackson,"['Elijah Wood', 'Ian McKellen', 'Viggo Mortensen', 'Orlando Bloom']",1485555,2022-04-17 14:59:33.779,2022-04-17 14:59:33.779
625c2c00f0a5bc6c426c07e8,Indiana Jones and the Last Crusade,1989,127 min,"Action, Adventure",8.2,0.4507835895999557,"In 1938, after his father Professor Henry Jones, Sr. goes missing while pursuing the Holy Grail, Professor Henry ""Indiana"" Jones, Jr. finds himself up against Adolf Hitler's Nazis again to stop them from obtaining its powers.",65.0,Steven Spielberg,"['Harrison Ford', 'Sean Connery', 'Alison Doody', 'Denholm Elliott']",692366,2022-04-17 15:02:24.691,2022-04-17 15:02:24.691
625c2d86f0a5bc6c426c0b9c,The Count of Monte Cristo,2002,131 min,"Action, Adventure, Drama",7.8,3.417150141293128,"A young man, falsely imprisoned by his jealous ""friend"", escapes and uses a hidden treasure to exact his revenge.",61.0,Kevin Reynolds,"['Jim Caviezel', 'Guy Pearce', 'Christopher Adamson', 'JB Blanc']",129022,2022-04-17 15:08:54.465,2022-04-17 15:08:54.465
625c2b51f0a5bc6c426c06ac,The Lord of the Rings: The Fellowship of the Ring,2001,178 min,"Action, Adventure, Drama",8.8,2.4774114995908123,A meek Hobbit from the Shire and eight companions set out on a journey to destroy the powerful One Ring and save Middle-earth from the Dark Lord Sauron.,92.0,Peter Jackson,"['Elijah Wood', 'Ian McKellen', 'Orlando Bloom', 'Sean Bean']",1661481,2022-04-17 14:59:29.234,2022-04-17 14:59:29.234
625c2df5f0a5bc6c426c0d26,Star Trek II: The Wrath of Khan,1982,113 min,"Action, Adventure, Sci-Fi",7.7,0.5026481135816119,"With the assistance of the Enterprise crew, Admiral Kirk must stop an old nemesis, Khan Noonien Singh, from using the life-generating Genesis Device as the ultimate weapon.",67.0,Nicholas Meyer,"['William Shatner', 'Leonard Nimoy', 'DeForest Kelley', 'James Doohan']",112704,2022-04-17 15:10:45.133,2022-04-17 15:10:45.133
