_id,title,release,duration,gerne,IMDB_Rating,rating,overview,metaScore,director,stars,noOfVotes,createdAt,updatedAt
625c2db7f0a5bc6c426c0c38,Roma,2018,135 min,Drama,7.7,4.479173475976166,A year in the life of a middle-class family's maid in Mexico City in the early 1970s.,96.0,Alfonso Cuarón,"['Yalitza Aparicio', 'Marina de Tavira', 'Diego Cortina Autrey', 'Carlos Peralta']",140375,2022-04-17 15:09:43.490,2022-04-17 15:09:43.490
625c2ceaf0a5bc6c426c09fa,Vivre sa vie: Film en douze tableaux,1962,80 min,Drama,8.0,3.2085803844982683,Twelve episodic tales in the life of a Parisian woman and her slow descent into prostitution.,,Jean-Luc Godard,"['Anna Karina', 'Sady Rebbot', 'André S. Labarthe', 'Guylaine Schlumberger']",28057,2022-04-17 15:06:18.237,2022-04-17 15:06:18.237
625c2d24f0a5bc6c426c0a88,Gegen die Wand,2004,121 min,"Drama, Romance",7.9,2.3465882439737893,"With the intention to break free from the strict familial restrictions, a suicidal young woman sets up a marriage of convenience with a forty-year-old addict, an act that will lead to an outburst of envious love.",78.0,Fatih Akin,"['Birol Ünel', 'Sibel Kekilli', 'Güven Kiraç', 'Zarah Jane McKenzie']",51325,2022-04-17 15:07:16.265,2022-04-17 15:07:16.265
625c2b77f0a5bc6c426c0702,Capharnaüm,2018,126 min,Drama,8.4,1.5905239703404994,"While serving a five-year sentence for a violent crime, a 12-year-old boy sues his parents for neglect.",75.0,Nadine Labaki,"['Zain Al Rafeea', 'Yordanos Shiferaw', 'Boluwatife Treasure Bankole', 'Kawsar Al Haddad']",62635,2022-04-17 15:00:07.726,2022-04-17 15:00:07.726
625c2dddf0a5bc6c426c0cc0,I Am Sam,2001,132 min,Drama,7.7,4.7726791573005425,A mentally handicapped man fights for custody of his 7-year-old daughter and in the process teaches his cold-hearted lawyer the value of love and family.,28.0,Jessie Nelson,"['Sean Penn', 'Michelle Pfeiffer', 'Dakota Fanning', 'Dianne Wiest']",142863,2022-04-17 15:10:21.500,2022-04-17 15:10:21.500
625c2bc2f0a5bc6c426c074a,Jodaeiye Nader az Simin,2011,123 min,Drama,8.3,1.283170311160965,A married couple are faced with a difficult decision - to improve the life of their child by moving to another country or to stay in Iran and look after a deteriorating parent who has Alzheimer's disease.,95.0,Asghar Farhadi,"['Payman Maadi', 'Leila Hatami', 'Sareh Bayat', 'Shahab Hosseini']",220002,2022-04-17 15:01:22.308,2022-04-17 15:01:22.308
625c2be9f0a5bc6c426c07b2,Udaan,2010,134 min,Drama,8.2,3.3079790437553855,"Expelled from his school, a 16-year old boy returns home to his abusive and oppressive father.",,Vikramaditya Motwane,"['Rajat Barmecha', 'Ronit Roy', 'Manjot Singh', 'Ram Kapoor']",42341,2022-04-17 15:02:01.137,2022-04-17 15:02:01.137
625c2d43f0a5bc6c426c0ae6,Hiroshima mon amour,1959,90 min,"Drama, Romance",7.9,4.632575580587485,A French actress filming an anti-war film in Hiroshima has an affair with a married Japanese architect as they share their differing perspectives on war.,,Alain Resnais,"['Emmanuelle Riva', 'Eiji Okada', 'Stella Dassas', 'Pierre Barbaud']",28421,2022-04-17 15:07:47.779,2022-04-17 15:07:47.779
625c2bc5f0a5bc6c426c075c,American Beauty,1999,122 min,Drama,8.3,3.079981612315301,A sexually frustrated suburban father has a mid-life crisis after becoming infatuated with his daughter's best friend.,84.0,Sam Mendes,"['Kevin Spacey', 'Annette Bening', 'Thora Birch', 'Wes Bentley']",1069738,2022-04-17 15:01:25.820,2022-04-17 15:01:25.820
625c2c6df0a5bc6c426c08e8,Ivanovo detstvo,1962,95 min,"Drama, War",8.1,2.9519195919980126,"In WW2, twelve year old Soviet orphan Ivan Bondarev works for the Soviet army as a scout behind the German lines and strikes a friendship with three sympathetic Soviet officers.",,Andrei Tarkovsky,"['Eduard Abalov', 'Nikolay Burlyaev', 'Valentin Zubkov', 'Evgeniy Zharikov']",31728,2022-04-17 15:04:13.622,2022-04-17 15:04:13.622
625c2b6df0a5bc6c426c06e8,American History X,1998,119 min,Drama,8.5,1.2834472896333238,A former neo-nazi skinhead tries to prevent his younger brother from going down the same wrong path that he did.,62.0,Tony Kaye,"['Edward Norton', 'Edward Furlong', ""Beverly D'Angelo"", 'Jennifer Lien']",1034705,2022-04-17 14:59:57.054,2022-04-17 14:59:57.054
625c2bc2f0a5bc6c426c0750,Babam ve Oglum,2005,112 min,"Drama, Family",8.3,3.3428923631898764,The family of a left-wing journalist is torn apart after the military coup of Turkey in 1980.,,Çagan Irmak,"['Çetin Tekindor', 'Fikret Kuskan', 'Hümeyra', 'Ege Tanman']",78925,2022-04-17 15:01:22.943,2022-04-17 15:01:22.943
625c2c58f0a5bc6c426c08bc,Fanny och Alexander,1982,188 min,Drama,8.1,0.42740801973614295,"Two young Swedish children experience the many comedies and tragedies of their family, the Ekdahls.",100.0,Ingmar Bergman,"['Bertil Guve', 'Pernilla Allwin', 'Kristina Adolphson', 'Börje Ahlstedt']",57784,2022-04-17 15:03:52.206,2022-04-17 15:03:52.206
625c2cb8f0a5bc6c426c094e,The Help,2011,146 min,Drama,8.0,2.27381697640177,"An aspiring author during the civil rights movement of the 1960s decides to write a book detailing the African American maids' point of view on the white families for which they work, and the hardships they go through on a daily basis.",62.0,Tate Taylor,"['Emma Stone', 'Viola Davis', 'Octavia Spencer', 'Bryce Dallas Howard']",428521,2022-04-17 15:05:28.898,2022-04-17 15:05:28.898
625c2c5cf0a5bc6c426c08c8,Network,1976,121 min,Drama,8.1,3.852851228576771,A television network cynically exploits a deranged former anchor's ravings and revelations about the news media for its own profit.,83.0,Sidney Lumet,"['Faye Dunaway', 'William Holden', 'Peter Finch', 'Robert Duvall']",144911,2022-04-17 15:03:56.937,2022-04-17 15:03:56.937
625c2c81f0a5bc6c426c0932,Wonder,2017,113 min,"Drama, Family",8.0,2.3099429825983964,"Based on the New York Times bestseller, this movie tells the incredibly inspiring and heartwarming story of August Pullman, a boy with facial differences who enters the fifth grade, attending a mainstream elementary school for the first time.",66.0,Stephen Chbosky,"['Jacob Tremblay', 'Owen Wilson', 'Izabela Vidovic', 'Julia Roberts']",141923,2022-04-17 15:04:33.812,2022-04-17 15:04:33.812
625c2d67f0a5bc6c426c0b6e,Auf der anderen Seite,2007,122 min,Drama,7.8,0.2628071466856041,A Turkish man travels to Istanbul to find the daughter of his father's former girlfriend.,85.0,Fatih Akin,"['Baki Davrak', 'Nurgül Yesilçay', 'Tuncel Kurtiz', 'Nursel Köse']",30827,2022-04-17 15:08:23.926,2022-04-17 15:08:23.926
625c2debf0a5bc6c426c0cfc,Philadelphia,1993,125 min,Drama,7.7,1.4984271079705747,"When a man with HIV is fired by his law firm because of his condition, he hires a homophobic small time lawyer as the only willing advocate for a wrongful dismissal suit.",66.0,Jonathan Demme,"['Tom Hanks', 'Denzel Washington', 'Roberta Maxwell', 'Buzz Kilman']",224169,2022-04-17 15:10:35.495,2022-04-17 15:10:35.495
625c2e3bf0a5bc6c426c0e64,Lifeboat,1944,97 min,"Drama, War",7.6,3.1802582533367563,Several survivors of a torpedoed merchant ship in World War II find themselves in the same lifeboat with one of the crew members of the U-boat that sank their ship.,78.0,Alfred Hitchcock,"['Tallulah Bankhead', 'John Hodiak', 'Walter Slezak', 'William Bendix']",26471,2022-04-17 15:11:55.530,2022-04-17 15:11:55.530
625c2dcaf0a5bc6c426c0c64,Detachment,2011,98 min,Drama,7.7,2.905118128670966,A substitute teacher who drifts from classroom to classroom finds a connection to the students and teachers during his latest assignment.,52.0,Tony Kaye,"['Adrien Brody', 'Christina Hendricks', 'Marcia Gay Harden', 'Lucy Liu']",77071,2022-04-17 15:10:02.007,2022-04-17 15:10:02.007
