_id,title,release,duration,gerne,IMDB_Rating,rating,overview,metaScore,director,stars,noOfVotes,createdAt,updatedAt
625c2bdef0a5bc6c426c079a,Uri: The Surgical Strike,2018,138 min,"Action, Drama, War",8.2,1.945032388442085,"Indian army special forces execute a covert operation, avenging the killing of fellow army men at their base by a terrorist group.",,Aditya Dhar,"['Vicky Kaushal', 'Paresh Rawal', 'Mohit Raina', 'Yami Gautam']",43444,2022-04-17 15:01:50.445,2022-04-17 15:01:50.445
625c2bdff0a5bc6c426c079c,K.G.F: Chapter 1,2018,156 min,"Action, Drama",8.2,2.031586741323016,"In the 1970s, a fierce rebel rises against brutal oppression and becomes the symbol of hope to legions of downtrodden people.",,Prashanth Neel,"['Yash', 'Srinidhi Shetty', 'Ramachandra Raju', 'Archana Jois']",36680,2022-04-17 15:01:51.549,2022-04-17 15:01:51.549
625c2b55f0a5bc6c426c06b2,The Lord of the Rings: The Two Towers,2002,179 min,"Action, Adventure, Drama",8.7,4.581141589278673,"While Frodo and Sam edge closer to Mordor with the help of the shifty Gollum, the divided fellowship makes a stand against Sauron's new ally, Saruman, and his hordes of Isengard.",87.0,Peter Jackson,"['Elijah Wood', 'Ian McKellen', 'Viggo Mortensen', 'Orlando Bloom']",1485555,2022-04-17 14:59:33.779,2022-04-17 14:59:33.779
625c2db6f0a5bc6c426c0c34,Scarface: The Shame of the Nation,1932,93 min,"Action, Crime, Drama",7.8,1.0122598425791884,"An ambitious and nearly insane violent gangster climbs the ladder of success in the mob, but his weaknesses prove to be his downfall.",87.0,Howard Hawks,"['Richard Rosson', 'Paul Muni', 'Ann Dvorak', 'Karen Morley']",25312,2022-04-17 15:09:42.671,2022-04-17 15:09:42.671
625c2d92f0a5bc6c426c0bc6,The Fugitive,1993,130 min,"Action, Crime, Drama",7.8,4.058623089063243,"Dr. Richard Kimble, unjustly accused of murdering his wife, must find the real killer while being the target of a nationwide manhunt led by a seasoned U.S. Marshal.",87.0,Andrew Davis,"['Harrison Ford', 'Tommy Lee Jones', 'Sela Ward', 'Julianne Moore']",267684,2022-04-17 15:09:06.523,2022-04-17 15:09:06.523
625c2cb6f0a5bc6c426c0946,The Revenant,2015,156 min,"Action, Adventure, Drama",8.0,1.0066501383954096,A frontiersman on a fur trading expedition in the 1820s fights for survival after being mauled by a bear and left for dead by members of his own hunting team.,76.0,Alejandro G. Iñárritu,"['Leonardo DiCaprio', 'Tom Hardy', 'Will Poulter', 'Domhnall Gleeson']",705589,2022-04-17 15:05:26.747,2022-04-17 15:05:26.747
625c2d54f0a5bc6c426c0b1a,Udta Punjab,2016,148 min,"Action, Crime, Drama",7.8,3.6522573054091767,A story that revolves around drug abuse in the affluent north Indian State of Punjab and how the youth there have succumbed to it en-masse resulting in a socio-economic decline.,,Abhishek Chaubey,"['Shahid Kapoor', 'Alia Bhatt', 'Kareena Kapoor', 'Diljit Dosanjh']",27175,2022-04-17 15:08:04.060,2022-04-17 15:08:04.060
625c2cb7f0a5bc6c426c094a,Tropa de Elite 2: O Inimigo Agora é Outro,2010,115 min,"Action, Crime, Drama",8.0,3.0995381918906837,"After a prison riot, former-Captain Nascimento, now a high ranking security officer in Rio de Janeiro, is swept into a bloody political dispute that involves government officials and paramilitary groups.",71.0,José Padilha,"['Wagner Moura', 'Irandhir Santos', 'André Ramiro', 'Milhem Cortaz']",79200,2022-04-17 15:05:27.121,2022-04-17 15:05:27.121
625c2be1f0a5bc6c426c07a4,Baahubali 2: The Conclusion,2017,167 min,"Action, Drama",8.2,2.4993116785348626,"When Shiva, the son of Bahubali, learns about his heritage, he begins to look for answers. His story is juxtaposed with past events that unfolded in the Mahishmati Kingdom.",,S.S. Rajamouli,"['Prabhas', 'Rana Daggubati', 'Anushka Shetty', 'Tamannaah Bhatia']",75348,2022-04-17 15:01:53.893,2022-04-17 15:01:53.893
625c2b48f0a5bc6c426c069c,The Dark Knight,2008,152 min,"Action, Crime, Drama",9.0,1.169399698222372,"When the menace known as the Joker wreaks havoc and chaos on the people of Gotham, Batman must accept one of the greatest psychological and physical tests of his ability to fight injustice.",84.0,Christopher Nolan,"['Christian Bale', 'Heath Ledger', 'Aaron Eckhart', 'Michael Caine']",2303232,2022-04-17 14:59:20.618,2022-04-17 14:59:20.618
625c2d61f0a5bc6c426c0b52,Ajeossi,2010,119 min,"Action, Crime, Drama",7.8,4.377903297457262,A quiet pawnshop keeper with a violent past takes on a drug-and-organ trafficking ring in hope of saving the child who is his only friend.,,Jeong-beom Lee,"['Won Bin', 'Sae-ron Kim', 'Tae-hoon Kim', 'Hee-won Kim']",62848,2022-04-17 15:08:17.680,2022-04-17 15:08:17.680
625c2b6ef0a5bc6c426c06ec,Léon,1994,110 min,"Action, Crime, Drama",8.5,4.259460920663958,"Mathilda, a 12-year-old girl, is reluctantly taken in by Léon, a professional assassin, after her family is murdered. An unusual relationship forms as she becomes his protégée and learns the assassin's trade.",64.0,Luc Besson,"['Jean Reno', 'Gary Oldman', 'Natalie Portman', 'Danny Aiello']",1035236,2022-04-17 14:59:58.591,2022-04-17 14:59:58.591
625c2db1f0a5bc6c426c0c1a,The Longest Day,1962,178 min,"Action, Drama, History",7.8,0.8609656713968294,"The events of D-Day, told on a grand scale from both the Allied and German points of view.",75.0,Ken Annakin,"['Andrew Marton', 'Gerd Oswald', 'Bernhard Wicki', 'Darryl F. Zanuck']",52141,2022-04-17 15:09:37.382,2022-04-17 15:09:37.382
625c2beef0a5bc6c426c07b8,Warrior,2011,140 min,"Action, Drama, Sport",8.2,2.1665358942157917,"The youngest son of an alcoholic former boxer returns home, where he's trained by his father for competition in a mixed martial arts tournament - a path that puts the fighter on a collision course with his estranged, older brother.",71.0,Gavin O'Connor,"['Tom Hardy', 'Nick Nolte', 'Joel Edgerton', 'Jennifer Morrison']",435950,2022-04-17 15:02:06.750,2022-04-17 15:02:06.750
625c2dadf0a5bc6c426c0c08,Badlands,1973,94 min,"Action, Crime, Drama",7.8,1.964025686202222,An impressionable teenage girl from a dead-end town and her older greaser boyfriend embark on a killing spree in the South Dakota badlands.,93.0,Terrence Malick,"['Martin Sheen', 'Sissy Spacek', 'Warren Oates', 'Ramon Bieri']",66009,2022-04-17 15:09:33.604,2022-04-17 15:09:33.604
625c2b51f0a5bc6c426c06ac,The Lord of the Rings: The Fellowship of the Ring,2001,178 min,"Action, Adventure, Drama",8.8,2.4774114995908123,A meek Hobbit from the Shire and eight companions set out on a journey to destroy the powerful One Ring and save Middle-earth from the Dark Lord Sauron.,92.0,Peter Jackson,"['Elijah Wood', 'Ian McKellen', 'Orlando Bloom', 'Sean Bean']",1661481,2022-04-17 14:59:29.234,2022-04-17 14:59:29.234
625c2cbbf0a5bc6c426c095a,Nefes: Vatan Sagolsun,2009,128 min,"Action, Drama, Thriller",8.0,3.6433251929306176,Story of 40-man Turkish task force who must defend a relay station.,,Levent Semerci,"['Erdem Can', 'Mete Horozoglu', 'Ilker Kizmaz', 'Baris Bagci']",31838,2022-04-17 15:05:31.252,2022-04-17 15:05:31.252
625c2c42f0a5bc6c426c087a,Kill Bill: Vol. 1,2003,111 min,"Action, Crime, Drama",8.1,3.452438236538349,"After awakening from a four-year coma, a former assassin wreaks vengeance on the team of assassins who betrayed her.",69.0,Quentin Tarantino,"['Uma Thurman', 'David Carradine', 'Daryl Hannah', 'Michael Madsen']",1000639,2022-04-17 15:03:30.525,2022-04-17 15:03:30.525
625c2dfbf0a5bc6c426c0d40,The French Connection,1971,104 min,"Action, Crime, Drama",7.7,2.245755905528295,A pair of NYC cops in the Narcotics Bureau stumble onto a drug smuggling job with a French connection.,94.0,William Friedkin,"['Gene Hackman', 'Roy Scheider', 'Fernando Rey', 'Tony Lo Bianco']",110075,2022-04-17 15:10:51.801,2022-04-17 15:10:51.801
625c2b7bf0a5bc6c426c070a,Dangal,2016,161 min,"Action, Biography, Drama",8.4,0.5855129463407616,Former wrestler Mahavir Singh Phogat and his two wrestler daughters struggle towards glory at the Commonwealth Games in the face of societal oppression.,,Nitesh Tiwari,"['Aamir Khan', 'Sakshi Tanwar', 'Fatima Sana Shaikh', 'Sanya Malhotra']",156479,2022-04-17 15:00:11.349,2022-04-17 15:00:11.349
