_id,title,release,duration,gerne,IMDB_Rating,rating,overview,metaScore,director,stars,noOfVotes,createdAt,updatedAt
625c2c5ef0a5bc6c426c08ca,Barry Lyndon,1975,185 min,"Adventure, Drama, History",8.1,1.811410823150179,An Irish rogue wins the heart of a rich widow and assumes her dead husband's aristocratic position in 18th-century England.,89.0,Stanley Kubrick,"[""Ryan O'Neal"", 'Marisa Berenson', 'Patrick Magee', 'Hardy Krüger']",149843,2022-04-17 15:03:58.713,2022-04-17 15:03:58.713
625c2d46f0a5bc6c426c0aea,The Searchers,1956,119 min,"Adventure, Drama, Western",7.9,2.877130297415611,An American Civil War veteran embarks on a journey to rescue his niece from the Comanches.,94.0,John Ford,"['John Wayne', 'Jeffrey Hunter', 'Vera Miles', 'Ward Bond']",80316,2022-04-17 15:07:50.084,2022-04-17 15:07:50.084
625c2e31f0a5bc6c426c0e24,Apollo 13,PG,140 min,"Adventure, Drama, History",7.6,3.3259619087699877,NASA must devise a strategy to return Apollo 13 to Earth safely after the spacecraft undergoes massive internal damage putting the lives of the three astronauts on board in jeopardy.,77.0,Ron Howard,"['Tom Hanks', 'Bill Paxton', 'Kevin Bacon', 'Gary Sinise']",269197,2022-04-17 15:11:45.010,2022-04-17 15:11:45.010
625c2c06f0a5bc6c426c07f8,The Message,1976,177 min,"Biography, Drama, History",8.2,1.5515552131239019,This epic historical drama chronicles the life and times of Prophet Muhammad and serves as an introduction to early Islamic history.,,Moustapha Akkad,"['Anthony Quinn', 'Irene Papas', 'Michael Ansara', 'Johnny Sekka']",43885,2022-04-17 15:02:30.468,2022-04-17 15:02:30.468
625c2d44f0a5bc6c426c0ae8,The Ten Commandments,1956,220 min,"Adventure, Drama",7.9,4.876003666433251,"Moses, an Egyptian Prince, learns of his true heritage as a Hebrew and his divine mission as the deliverer of his people.",,Cecil B. DeMille,"['Charlton Heston', 'Yul Brynner', 'Anne Baxter', 'Edward G. Robinson']",63560,2022-04-17 15:07:48.544,2022-04-17 15:07:48.544
625c2df1f0a5bc6c426c0d16,The Last Emperor,1987,163 min,"Biography, Drama, History",7.7,3.949423553048427,The story of the final Emperor of China.,76.0,Bernardo Bertolucci,"['John Lone', 'Joan Chen', ""Peter O'Toole"", 'Ruocheng Ying']",94326,2022-04-17 15:10:41.667,2022-04-17 15:10:41.667
625c2c0ef0a5bc6c426c0816,The Treasure of the Sierra Madre,1948,126 min,"Adventure, Drama, Western",8.2,1.3205746779947347,Two Americans searching for work in Mexico convince an old prospector to help them mine for gold in the Sierra Madre Mountains.,98.0,John Huston,"['Humphrey Bogart', 'Walter Huston', 'Tim Holt', 'Bruce Bennett']",114304,2022-04-17 15:02:38.957,2022-04-17 15:02:38.957
625c2db1f0a5bc6c426c0c1a,The Longest Day,1962,178 min,"Action, Drama, History",7.8,0.8609656713968294,"The events of D-Day, told on a grand scale from both the Allied and German points of view.",75.0,Ken Annakin,"['Andrew Marton', 'Gerd Oswald', 'Bernhard Wicki', 'Darryl F. Zanuck']",52141,2022-04-17 15:09:37.382,2022-04-17 15:09:37.382
625c2d20f0a5bc6c426c0a7a,The Fall,2006,117 min,"Adventure, Drama, Fantasy",7.9,1.4508468121286944,"In a hospital on the outskirts of 1920s Los Angeles, an injured stuntman begins to tell a fellow patient, a little girl with a broken arm, a fantastic story of five mythical heroes. Thanks to his fractured state of mind and her vivid imagination, the line between fiction and reality blurs as the tale advances.",64.0,Tarsem Singh,"['Lee Pace', 'Catinca Untaru', 'Justine Waddell', 'Kim Uylenbroek']",107290,2022-04-17 15:07:12.454,2022-04-17 15:07:12.454
625c2c6ef0a5bc6c426c08f0,Ben-Hur,1959,212 min,"Adventure, Drama, History",8.1,0.4081309851680537,"After a Jewish prince is betrayed and sent into slavery by a Roman friend, he regains his freedom and comes back for revenge.",90.0,William Wyler,"['Charlton Heston', 'Jack Hawkins', 'Stephen Boyd', 'Haya Harareet']",219466,2022-04-17 15:04:14.961,2022-04-17 15:04:14.961
625c2e03f0a5bc6c426c0d6a,The African Queen,1951,105 min,"Adventure, Drama, Romance",7.7,2.7685233387690724,"In WWI Africa, a gin-swilling riverboat captain is persuaded by a strait-laced missionary to use his boat to attack an enemy warship.",91.0,John Huston,"['Humphrey Bogart', 'Katharine Hepburn', 'Robert Morley', 'Peter Bull']",71481,2022-04-17 15:10:59.786,2022-04-17 15:10:59.786
625c2d52f0a5bc6c426c0b16,Hidden Figures,2016,127 min,"Biography, Drama, History",7.8,3.712635787972105,The story of a team of female African-American mathematicians who served a vital role in NASA during the early years of the U.S. space program.,74.0,Theodore Melfi,"['Taraji P. Henson', 'Octavia Spencer', 'Janelle Monáe', 'Kevin Costner']",200876,2022-04-17 15:08:02.060,2022-04-17 15:08:02.060
625c2bc3f0a5bc6c426c0752,Inglourious Basterds,2009,153 min,"Adventure, Drama, War",8.3,1.0761554042386345,"In Nazi-occupied France during World War II, a plan to assassinate Nazi leaders by a group of Jewish U.S. soldiers coincides with a theatre owner's vengeful plans for the same.",69.0,Quentin Tarantino,"['Brad Pitt', 'Diane Kruger', 'Eli Roth', 'Mélanie Laurent']",1267869,2022-04-17 15:01:23.148,2022-04-17 15:01:23.148
625c2c6ef0a5bc6c426c08ec,Inherit the Wind,1960,128 min,"Biography, Drama, History",8.1,3.0641823847857017,"Based on a real-life case in 1925, two great lawyers argue the case for and against a science teacher accused of the crime of teaching evolution.",75.0,Stanley Kramer,"['Spencer Tracy', 'Fredric March', 'Gene Kelly', 'Dick York']",27254,2022-04-17 15:04:14.072,2022-04-17 15:04:14.072
625c2cb7f0a5bc6c426c094c,The King's Speech,2010,118 min,"Biography, Drama, History",8.0,0.004753147470143437,"The story of King George VI, his impromptu ascension to the throne of the British Empire in 1936, and the speech therapist who helped the unsure monarch overcome his stammer.",88.0,Tom Hooper,"['Colin Firth', 'Geoffrey Rush', 'Helena Bonham Carter', 'Derek Jacobi']",639603,2022-04-17 15:05:27.308,2022-04-17 15:05:27.308
625c2dd5f0a5bc6c426c0c94,The Last King of Scotland,2006,123 min,"Biography, Drama, History",7.7,3.2373955299212764,Based on the events of the brutal Ugandan dictator Idi Amin's regime as seen by his personal physician during the 1970s.,74.0,Kevin Macdonald,"['James McAvoy', 'Forest Whitaker', 'Gillian Anderson', 'Kerry Washington']",175355,2022-04-17 15:10:13.673,2022-04-17 15:10:13.673
625c2ccbf0a5bc6c426c098a,Big Fish,2003,125 min,"Adventure, Drama, Fantasy",8.0,3.6834999545863223,A frustrated son tries to determine the fact from fiction in his dying father's life.,58.0,Tim Burton,"['Ewan McGregor', 'Albert Finney', 'Billy Crudup', 'Jessica Lange']",415218,2022-04-17 15:05:47.714,2022-04-17 15:05:47.714
625c2df3f0a5bc6c426c0d18,Empire of the Sun,1987,153 min,"Action, Drama, History",7.7,3.5161882606089745,A young English boy struggles to survive under Japanese occupation during World War II.,62.0,Steven Spielberg,"['Christian Bale', 'John Malkovich', 'Miranda Richardson', 'Nigel Havers']",115677,2022-04-17 15:10:43.117,2022-04-17 15:10:43.117
625c2c71f0a5bc6c426c08f8,The Bridge on the River Kwai,1957,161 min,"Adventure, Drama, War",8.1,3.1055210732228424,"British POWs are forced to build a railway bridge across the river Kwai for their Japanese captors, not knowing that the allied forces are planning to destroy it.",87.0,David Lean,"['William Holden', 'Alec Guinness', 'Jack Hawkins', 'Sessue Hayakawa']",203463,2022-04-17 15:04:17.274,2022-04-17 15:04:17.274
625c2c35f0a5bc6c426c085c,Harry Potter and the Deathly Hallows: Part 2,2011,130 min,"Adventure, Drama, Fantasy",8.1,3.5987871565392346,"Harry, Ron, and Hermione search for Voldemort's remaining Horcruxes in their effort to destroy the Dark Lord as the final battle rages on at Hogwarts.",85.0,David Yates,"['Daniel Radcliffe', 'Emma Watson', 'Rupert Grint', 'Michael Gambon']",764493,2022-04-17 15:03:17.139,2022-04-17 15:03:17.139
