_id,title,release,duration,gerne,IMDB_Rating,rating,overview,metaScore,director,stars,noOfVotes,createdAt,updatedAt
625c2c07f0a5bc6c426c07fa,Sholay,1975,204 min,"Action, Adventure, Comedy",8.2,0.8899052011239472,"After his family is murdered by a notorious and ruthless bandit, a former police officer enlists the services of two outlaws to capture the bandit.",,Ramesh Sippy,"['Sanjeev Kumar', 'Dharmendra', 'Amitabh Bachchan', 'Amjad Khan']",51284,2022-04-17 15:02:31.907,2022-04-17 15:02:31.907
625c2dc1f0a5bc6c426c0c4c,Kingsman: The Secret Service,2014,129 min,"Action, Adventure, Comedy",7.7,2.5981185253792383,"A spy organisation recruits a promising street kid into the agency's training program, while a global threat emerges from a twisted tech genius.",60.0,Matthew Vaughn,"['Colin Firth', 'Taron Egerton', 'Samuel L. Jackson', 'Michael Caine']",590440,2022-04-17 15:09:53.456,2022-04-17 15:09:53.456
625c2e0bf0a5bc6c426c0d86,Guardians of the Galaxy Vol. 2,2017,136 min,"Action, Adventure, Comedy",7.6,2.858875804528218,"The Guardians struggle to keep together as a team while dealing with their personal family issues, notably Star-Lord's encounter with his father the ambitious celestial being Ego.",67.0,James Gunn,"['Chris Pratt', 'Zoe Saldana', 'Dave Bautista', 'Vin Diesel']",569974,2022-04-17 15:11:07.575,2022-04-17 15:11:07.575
625c2cb9f0a5bc6c426c0950,Deadpool,2016,108 min,"Action, Adventure, Comedy",8.0,4.646334413776728,"A wisecracking mercenary gets experimented on and becomes immortal but ugly, and sets out to track down the man who ruined his looks.",65.0,Tim Miller,"['Ryan Reynolds', 'Morena Baccarin', 'T.J. Miller', 'Ed Skrein']",902669,2022-04-17 15:05:29.069,2022-04-17 15:05:29.069
625c2c84f0a5bc6c426c093e,Guardians of the Galaxy,2014,121 min,"Action, Adventure, Comedy",8.0,3.1728653236542117,A group of intergalactic criminals must pull together to stop a fanatical warrior with plans to purge the universe.,76.0,James Gunn,"['Chris Pratt', 'Vin Diesel', 'Bradley Cooper', 'Zoe Saldana']",1043455,2022-04-17 15:04:36.055,2022-04-17 15:04:36.055
625c2db8f0a5bc6c426c0c3c,Deadpool 2,2018,119 min,"Action, Adventure, Comedy",7.7,4.562841087898405,"Foul-mouthed mutant mercenary Wade Wilson (a.k.a. Deadpool), brings together a team of fellow mutant rogues to protect a young boy with supernatural abilities from the brutal, time-traveling cyborg Cable.",66.0,David Leitch,"['Ryan Reynolds', 'Josh Brolin', 'Morena Baccarin', 'Julian Dennison']",478586,2022-04-17 15:09:44.575,2022-04-17 15:09:44.575
625c2c7df0a5bc6c426c0922,Bajrangi Bhaijaan,2015,163 min,"Action, Adventure, Comedy",8.0,2.235017702076113,An Indian man with a magnanimous heart takes a young mute Pakistani girl back to her homeland to reunite her with her family.,,Kabir Khan,"['Salman Khan', 'Harshaali Malhotra', 'Nawazuddin Siddiqui', 'Kareena Kapoor']",72245,2022-04-17 15:04:29.180,2022-04-17 15:04:29.180
625c2d37f0a5bc6c426c0ac0,The Blues Brothers,1980,133 min,"Action, Adventure, Comedy",7.9,0.9349747490413451,"Jake Blues, just released from prison, puts together his old band to save the Catholic home where he and his brother Elwood were raised.",60.0,John Landis,"['John Belushi', 'Dan Aykroyd', 'Cab Calloway', 'John Candy']",183182,2022-04-17 15:07:35.816,2022-04-17 15:07:35.816
625c2ba9f0a5bc6c426c0710,Avengers: Infinity War,2018,149 min,"Action, Adventure, Sci-Fi",8.4,1.6284819178819432,The Avengers and their allies must be willing to sacrifice all in an attempt to defeat the powerful Thanos before his blitz of devastation and ruin puts an end to the universe.,68.0,Anthony Russo,"['Joe Russo', 'Robert Downey Jr.', 'Chris Hemsworth', 'Mark Ruffalo']",834477,2022-04-17 15:00:57.331,2022-04-17 15:00:57.331
625c2c1bf0a5bc6c426c0832,Soul,2020,100 min,"Animation, Adventure, Comedy",8.1,2.3014468675324515,"After landing the gig of a lifetime, a New York jazz pianist suddenly finds himself trapped in a strange land between Earth and the afterlife.",83.0,Pete Docter,"['Kemp Powers', 'Jamie Foxx', 'Tina Fey', 'Graham Norton']",159171,2022-04-17 15:02:51.545,2022-04-17 15:02:51.545
625c2b7cf0a5bc6c426c070e,Avengers: Endgame,2019,181 min,"Action, Adventure, Drama",8.4,4.237611668886724,"After the devastating events of Avengers: Infinity War (2018), the universe is in ruins. With the help of remaining allies, the Avengers assemble once more in order to reverse Thanos' actions and restore balance to the universe.",78.0,Anthony Russo,"['Joe Russo', 'Robert Downey Jr.', 'Chris Evans', 'Mark Ruffalo']",809955,2022-04-17 15:00:12.991,2022-04-17 15:00:12.991
625c2d98f0a5bc6c426c0be2,Predator,1987,107 min,"Action, Adventure, Sci-Fi",7.8,4.434946665068128,A team of commandos on a mission in a Central American jungle find themselves hunted by an extraterrestrial warrior.,45.0,John McTiernan,"['Arnold Schwarzenegger', 'Carl Weathers', 'Kevin Peter Hall', 'Elpidia Carrillo']",371387,2022-04-17 15:09:12.156,2022-04-17 15:09:12.156
625c2d09f0a5bc6c426c0a56,X-Men: Days of Future Past,2014,132 min,"Action, Adventure, Sci-Fi",7.9,3.1167413697546964,The X-Men send Wolverine to the past in a desperate effort to change history and prevent an event that results in doom for both humans and mutants.,75.0,Bryan Singer,"['Patrick Stewart', 'Ian McKellen', 'Hugh Jackman', 'James McAvoy']",659763,2022-04-17 15:06:49.097,2022-04-17 15:06:49.097
625c2d83f0a5bc6c426c0b8c,Serenity,2005,119 min,"Action, Adventure, Sci-Fi",7.8,3.203980562975448,The crew of the ship Serenity try to evade an assassin sent to recapture one of their members who is telepathic.,74.0,Joss Whedon,"['Nathan Fillion', 'Gina Torres', 'Chiwetel Ejiofor', 'Alan Tudyk']",283310,2022-04-17 15:08:51.664,2022-04-17 15:08:51.664
625c2dccf0a5bc6c426c0c72,X: First Class,2011,131 min,"Action, Adventure, Sci-Fi",7.7,4.994365316918015,"In the 1960s, superpowered humans Charles Xavier and Erik Lensherr work together to find others like them, but Erik's vengeful pursuit of an ambitious mutant who ruined his life causes a schism to divide them.",65.0,Matthew Vaughn,"['James McAvoy', 'Michael Fassbender', 'Jennifer Lawrence', 'Kevin Bacon']",645512,2022-04-17 15:10:04.102,2022-04-17 15:10:04.102
625c2c7bf0a5bc6c426c0918,The General,1926,67 min,"Action, Adventure, Comedy",8.1,3.5601434747058756,"When Union spies steal an engineer's beloved locomotive, he pursues it single-handedly and straight through enemy lines.",,Clyde Bruckman,"['Buster Keaton', 'Buster Keaton', 'Marion Mack', 'Glen Cavender']",81156,2022-04-17 15:04:27.485,2022-04-17 15:04:27.485
625c2b6cf0a5bc6c426c06e6,Gladiator,2000,155 min,"Action, Adventure, Drama",8.5,4.66248624777033,A former Roman General sets out to exact vengeance against the corrupt emperor who murdered his family and sent him into slavery.,67.0,Ridley Scott,"['Russell Crowe', 'Joaquin Phoenix', 'Connie Nielsen', 'Oliver Reed']",1341460,2022-04-17 14:59:56.830,2022-04-17 14:59:56.830
625c2dc8f0a5bc6c426c0c5a,Captain America: The Winter Soldier,2014,136 min,"Action, Adventure, Sci-Fi",7.7,2.0318290997880184,"As Steve Rogers struggles to embrace his role in the modern world, he teams up with a fellow Avenger and S.H.I.E.L.D agent, Black Widow, to battle a new threat from history: an assassin known as the Winter Soldier.",70.0,Anthony Russo,"['Joe Russo', 'Chris Evans', 'Samuel L. Jackson', 'Scarlett Johansson']",736182,2022-04-17 15:10:00.342,2022-04-17 15:10:00.342
625c2dbdf0a5bc6c426c0c42,Mission: Impossible - Fallout,2018,147 min,"Action, Adventure, Thriller",7.7,4.398169750263086,"Ethan Hunt and his IMF team, along with some familiar allies, race against time after a mission gone wrong.",86.0,Christopher McQuarrie,"['Tom Cruise', 'Henry Cavill', 'Ving Rhames', 'Simon Pegg']",291257,2022-04-17 15:09:49.041,2022-04-17 15:09:49.041
625c2d06f0a5bc6c426c0a52,Star Wars: Episode VII - The Force Awakens,2015,138 min,"Action, Adventure, Sci-Fi",7.9,0.3378700271753343,"As a new threat to the galaxy rises, Rey, a desert scavenger, and Finn, an ex-stormtrooper, must join Han Solo and Chewbacca to search for the one hope of restoring peace.",80.0,J.J. Abrams,"['Daisy Ridley', 'John Boyega', 'Oscar Isaac', 'Domhnall Gleeson']",860823,2022-04-17 15:06:46.779,2022-04-17 15:06:46.779
